,label,sent
2142,"[0.0, 0.0, 0.0, 0.0, 1.0, 0.0, 0.0, 0.0, 0.0, 0.0, 0.0]",People rather commute to far off places in metros and trains and have already started using their cars as mode of transportation to nearest station if they have such an option .
2143,"[0.0, 0.0, 0.0, 0.0, 1.0, 0.0, 0.0, 0.0, 0.0, 0.0, 0.0]","Secondly , with the arrival of Internet and Video Telecommunication most of the offices find it convenient for its staff to work from their home , eg . Software firms , Business offices and Corporations related with trading of Shares etc ."
2144,"[0.0, 0.0, 0.0, 0.0, 1.0, 0.0, 0.0, 0.0, 0.0, 0.0, 0.0]","With this trend on , it will take very few years when most of the people will be working from their homes ."
2145,"[0.0, 0.0, 0.0, 0.0, 1.0, 0.0, 0.0, 0.0, 0.0, 0.0, 0.0]",This will automatically reduce the usage of cars as most of the people use their cars to go to their respective offices .
2146,"[0.0, 0.0, 0.0, 0.0, 1.0, 0.0, 0.0, 0.0, 0.0, 0.0, 0.0]",Finally the most important factor which will determine the reduction in the usage of the car is the scarcity of the fuel .
2147,"[0.0, 0.0, 0.0, 0.0, 1.0, 0.0, 0.0, 0.0, 0.0, 0.0, 0.0]","In todays world the consumption of fuel is growing exponentially and it seems there are no means to replenish it , even though various efforts are being made world wide ."
2148,"[0.0, 0.0, 0.0, 0.0, 1.0, 0.0, 0.0, 0.0, 0.0, 0.0, 0.0]","With limited amount of fuel supply the world wont be able to sustain the demands of the market and finally , to come up with the solution so as to reduce the fuel consumption , people will be motivated not to use cars and other such vehicles ."
2149,"[0.0, 0.0, 0.0, 0.0, 1.0, 0.0, 0.0, 0.0, 0.0, 0.0, 0.0]",This will automatically determine less usage of cars in the future years .
2150,"[0.0, 0.0, 0.0, 0.0, 1.0, 0.0, 0.0, 0.0, 0.0, 0.0, 0.0]",It might be hard to digest but the way things are turning out to be it seems we will soon stop the usage of one of the most important inventions of human history .
2151,"[0.0, 0.0, 0.0, 0.0, 1.0, 0.0, 0.0, 0.0, 0.0, 0.0, 0.0]",And it can be very well assumed that this time duration will be not more than twenty years .
2152,"[0.0, 0.0, 0.0, 0.0, 0.0, 0.0, 0.0, 1.0, 0.0, 0.0, 0.0]",I do not agree with the statement because of the following three reasons .
2153,"[0.0, 0.0, 0.0, 0.0, 0.0, 0.0, 0.0, 1.0, 0.0, 0.0, 0.0]","The students will not have chance to confirm that what they know is true , and it might cause the decrease of the students interest towards the subject ."
2154,"[0.0, 0.0, 0.0, 0.0, 0.0, 0.0, 0.0, 1.0, 0.0, 0.0, 0.0]","Also , they will not have ability to adjust their own knowledge to perform in the actual world which is the main reason why students learn ."
2155,"[0.0, 0.0, 0.0, 0.0, 0.0, 0.0, 0.0, 1.0, 0.0, 0.0, 0.0]","Therefore , it is not more important for students to understand ideas and concepts than it is for them to learn facts ."
2156,"[0.0, 0.0, 0.0, 0.0, 0.0, 0.0, 0.0, 1.0, 0.0, 0.0, 0.0]","Understanding ideas and concepts are receiving informations from others who have already experienced , and by not being able to actually see how the ideas and concepts work , the students might not be able to have enough interest about the subject as they should be ."
2157,"[0.0, 0.0, 0.0, 0.0, 0.0, 0.0, 0.0, 1.0, 0.0, 0.0, 0.0]","If the students are not actively experiencing the facts on their own , they can easily doubt that if those ideas and concepts are true in real world ."
2158,"[0.0, 0.0, 0.0, 0.0, 0.0, 0.0, 0.0, 1.0, 0.0, 0.0, 0.0]","Lacking the ability to see how they actually work can cause the decrease of their interest , which brings negative affects on learning habits ."
2159,"[0.0, 0.0, 0.0, 0.0, 0.0, 0.0, 0.0, 1.0, 0.0, 0.0, 0.0]",Students without skills to perform correct actions in the real world often do not have enough experience which comes from learning facts of their own experiences .
2160,"[0.0, 0.0, 0.0, 0.0, 0.0, 0.0, 0.0, 1.0, 0.0, 0.0, 0.0]","As they grow up and prepare to play a important role in the society , it is required to have a lot of knowledge as well as enough experience to know how to adjust the knowledge for each specific situations ."
2161,"[0.0, 0.0, 0.0, 0.0, 0.0, 0.0, 0.0, 1.0, 0.0, 0.0, 0.0]",Students with only ideas and concepts which other people have introduced will lack the ability to gather specific informations of their own and place them into a correct consequences .
2162,"[0.0, 0.0, 0.0, 0.0, 0.0, 0.0, 0.0, 1.0, 0.0, 0.0, 0.0]",It is more important for students to learn facts because it increases the willingness for students to learn as well as the ability to perform better in various situations in the real world .
2163,"[0.0, 0.0, 0.0, 1.0, 0.0, 0.0, 0.0, 0.0, 0.0, 0.0, 0.0]","In my opinion , there is no general answer to the question whether or not new things and risks will lead to more success than sticking to old shoes ."
2164,"[0.0, 0.0, 0.0, 1.0, 0.0, 0.0, 0.0, 0.0, 0.0, 0.0, 0.0]",I think it highly depends on the character of a person .
2165,"[0.0, 0.0, 0.0, 1.0, 0.0, 0.0, 0.0, 0.0, 0.0, 0.0, 0.0]",People might be very successful in doing what they have done all their life .
2166,"[0.0, 0.0, 0.0, 1.0, 0.0, 0.0, 0.0, 0.0, 0.0, 0.0, 0.0]","Usually , they are very experienced in what they do and with their knowledge and their background they are able to make the right decisions which eventually might lead to a great success ."
2167,"[0.0, 0.0, 0.0, 1.0, 0.0, 0.0, 0.0, 0.0, 0.0, 0.0, 0.0]","On the other hand , people who take risks and who are willing to learn new things , new theories and new perspectives , can generally be characterized as more open - minded ."
2168,"[0.0, 0.0, 0.0, 1.0, 0.0, 0.0, 0.0, 0.0, 0.0, 0.0, 0.0]",They have to arrange with new situations and be more flexible .
2169,"[0.0, 0.0, 0.0, 1.0, 0.0, 0.0, 0.0, 0.0, 0.0, 0.0, 0.0]",They have to pay attention to the change of markets and change with their environment .
2170,"[0.0, 0.0, 0.0, 1.0, 0.0, 0.0, 0.0, 0.0, 0.0, 0.0, 0.0]","It can also be assumed that people who seek new challenges are more motivated than people who do the same things every day , because they will not get bored by a daily stupidity ."
2171,"[0.0, 0.0, 0.0, 1.0, 0.0, 0.0, 0.0, 0.0, 0.0, 0.0, 0.0]","Not only that new challenges lead to new opportunities for success , I also think that having and gaining knowledge in more than one field rather than being a specialist on one certain topic provides a lot more options for success ."
2172,"[0.0, 0.0, 0.0, 1.0, 0.0, 0.0, 0.0, 0.0, 0.0, 0.0, 0.0]",Being able to follow and take part in discussions on a variety of fields might earn the respect of other people .
2173,"[0.0, 0.0, 0.0, 1.0, 0.0, 0.0, 0.0, 0.0, 0.0, 0.0, 0.0]","It is a lot easier to give an objective opinion , if one can verify this opinion through solid experiences in a variety of fields ."
2174,"[0.0, 0.0, 0.0, 1.0, 0.0, 0.0, 0.0, 0.0, 0.0, 0.0, 0.0]",I think having a wide range of basic knowledge is a lot more impressive than just being able to lecture on one specific topic .
2175,"[0.0, 0.0, 0.0, 1.0, 0.0, 0.0, 0.0, 0.0, 0.0, 0.0, 0.0]",People with common sense and a variety of interests might more likely be employed by an employer than probably would be a specialist who has not ever looked beyond his narrow borderlines .
2176,"[0.0, 0.0, 0.0, 1.0, 0.0, 0.0, 0.0, 0.0, 0.0, 0.0, 0.0]","Although I can see situations , where experience in doing familiar things can lead to success , I , as to speak for myself , would prefer learning new things and according to that I would also be willing to take some risks ."
2177,"[0.0, 0.0, 0.0, 1.0, 0.0, 0.0, 0.0, 0.0, 0.0, 0.0, 0.0]","Despite all these arguments on success , I also think that life is a lot more worth living with the opportunity to face new challenges and learn new things ."
2178,"[0.0, 0.0, 0.0, 0.0, 0.0, 1.0, 0.0, 0.0, 0.0, 0.0, 0.0]",I m agree with the following statement : Young people enjoy life more than older people do .
2179,"[0.0, 0.0, 0.0, 0.0, 0.0, 1.0, 0.0, 0.0, 0.0, 0.0, 0.0]",I think that young people lives your life more attendment to old people .
2180,"[0.0, 0.0, 0.0, 0.0, 0.0, 1.0, 0.0, 0.0, 0.0, 0.0, 0.0]","they go to a party , disco , pub but also cinema , university , theatre , ecc ."
2181,"[0.0, 0.0, 0.0, 0.0, 0.0, 1.0, 0.0, 0.0, 0.0, 0.0, 0.0]",the young people loves travel and they visit all towns of Europa or Asia .
2182,"[0.0, 0.0, 0.0, 0.0, 0.0, 1.0, 0.0, 0.0, 0.0, 0.0, 0.0]",The older people must think at their family and at their children or also their parents .
2183,"[0.0, 0.0, 0.0, 0.0, 0.0, 1.0, 0.0, 0.0, 0.0, 0.0, 0.0]",they watch television or walk in the park .
2184,"[0.0, 0.0, 0.0, 0.0, 0.0, 1.0, 0.0, 0.0, 0.0, 0.0, 0.0]",they play at tre settle ( typical italian s play )
2185,"[0.0, 0.0, 0.0, 0.0, 0.0, 1.0, 0.0, 0.0, 0.0, 0.0, 0.0]",Young people havent not too problems and too responsibilities that older people have .
2186,"[0.0, 0.0, 0.0, 0.0, 0.0, 1.0, 0.0, 0.0, 0.0, 0.0, 0.0]","young people are the future , they must learn to older people s error ."
2187,"[0.0, 0.0, 0.0, 0.0, 0.0, 1.0, 0.0, 0.0, 0.0, 0.0, 0.0]",I study and i have not more time for my obey .
2188,"[0.0, 0.0, 0.0, 0.0, 0.0, 1.0, 0.0, 0.0, 0.0, 0.0, 0.0]",i do n't like to disco but if i have freetime i prefer go in a pub to drink few beers with my friends
2189,"[0.0, 0.0, 0.0, 1.0, 0.0, 0.0, 0.0, 0.0, 0.0, 0.0, 0.0]",Within the following essay I discuss if people trying new things and taking more risks are more succesful than people using well established practices .
2190,"[0.0, 0.0, 0.0, 1.0, 0.0, 0.0, 0.0, 0.0, 0.0, 0.0, 0.0]","For the beginning I give an principal definition of succes , because it is a question of perspective wether someone is succesful or not ."
2191,"[0.0, 0.0, 0.0, 1.0, 0.0, 0.0, 0.0, 0.0, 0.0, 0.0, 0.0]",Secondly I highlight several arguments on the topic before concluding with my own opinion on it .
2192,"[0.0, 0.0, 0.0, 1.0, 0.0, 0.0, 0.0, 0.0, 0.0, 0.0, 0.0]",Succes is within a society normally a well constructed and established value .
2193,"[0.0, 0.0, 0.0, 1.0, 0.0, 0.0, 0.0, 0.0, 0.0, 0.0, 0.0]",Every value consists normally of an imagination of distinctive goals .
2194,"[0.0, 0.0, 0.0, 1.0, 0.0, 0.0, 0.0, 0.0, 0.0, 0.0, 0.0]",Instead succes itself is not adequate to a constructed goal but needs to be constructed by each community of people .
2195,"[0.0, 0.0, 0.0, 1.0, 0.0, 0.0, 0.0, 0.0, 0.0, 0.0, 0.0]","Within Western countries who share the same principles of economy and society succes can be defined as earning a lot of money , having a family or simply being happy , whatever this would say ."
2196,"[0.0, 0.0, 0.0, 1.0, 0.0, 0.0, 0.0, 0.0, 0.0, 0.0, 0.0]",Now my perspective focusses on the economic perspective by earning a lot of money and therefore I definite succes by it .
2197,"[0.0, 0.0, 0.0, 1.0, 0.0, 0.0, 0.0, 0.0, 0.0, 0.0, 0.0]",By stretching the economic face of succes I need to differentiate between new products and well established products .
2198,"[0.0, 0.0, 0.0, 1.0, 0.0, 0.0, 0.0, 0.0, 0.0, 0.0, 0.0]",New products are normally accompanied by a bigger amount of risks and also by a larger scale of innovativity than established products are .
2199,"[0.0, 0.0, 0.0, 1.0, 0.0, 0.0, 0.0, 0.0, 0.0, 0.0, 0.0]",The example of franchising worked on earlier this TOEFL fits quite well .
2200,"[0.0, 0.0, 0.0, 1.0, 0.0, 0.0, 0.0, 0.0, 0.0, 0.0, 0.0]",It is relatively easy to buy the right of a huge company like Burger King and to produce its products but it also highlights the limitations of own freedom to establish something own .
2201,"[0.0, 0.0, 0.0, 1.0, 0.0, 0.0, 0.0, 0.0, 0.0, 0.0, 0.0]","While starting his proper business is relatively costly for oneself and is followed by the incertainty of acceptance of the product , it lets some room for creativity and personality ."
2202,"[0.0, 0.0, 0.0, 1.0, 0.0, 0.0, 0.0, 0.0, 0.0, 0.0, 0.0]",Additionally new innovative products could be sold for higher price .
2203,"[0.0, 0.0, 0.0, 1.0, 0.0, 0.0, 0.0, 0.0, 0.0, 0.0, 0.0]",Nevertheless it could n't be denied that you can earn money with both possibilities .
2204,"[0.0, 0.0, 0.0, 1.0, 0.0, 0.0, 0.0, 0.0, 0.0, 0.0, 0.0]","Perhaps it s not really a question of succes in this case , but of making it a special way ."
2205,"[0.0, 0.0, 0.0, 1.0, 0.0, 0.0, 0.0, 0.0, 0.0, 0.0, 0.0]",For my conclusion I emphasize on the hope of everyone to have succes that leads people to start something new and innovative against all odds .
2206,"[0.0, 0.0, 0.0, 1.0, 0.0, 0.0, 0.0, 0.0, 0.0, 0.0, 0.0]",This hope might be imaginative but leads researchers to new inventions and at all humanity to progress .
2207,"[0.0, 0.0, 0.0, 1.0, 0.0, 0.0, 0.0, 0.0, 0.0, 0.0, 0.0]",So it would be necessary for humanity but not for economic succes at a short range .
2208,"[0.0, 0.0, 0.0, 1.0, 0.0, 0.0, 0.0, 0.0, 0.0, 0.0, 0.0]",By using well established practices you can succeed too and by stretching on the example of new products you need an established name to sell products better .
2209,"[0.0, 0.0, 0.0, 1.0, 0.0, 0.0, 0.0, 0.0, 0.0, 0.0, 0.0]","Therefore it s the mixture of both , risk and new ways as well as well established ways that leads to overall success , for individuals , enterprises and humanity ."
2210,"[0.0, 0.0, 0.0, 0.0, 1.0, 0.0, 0.0, 0.0, 0.0, 0.0, 0.0]",Traveling is an important part of life .
2211,"[0.0, 0.0, 0.0, 0.0, 1.0, 0.0, 0.0, 0.0, 0.0, 0.0, 0.0]",rarely there is a person who does not travel or does not like to travel .
2212,"[0.0, 0.0, 0.0, 0.0, 1.0, 0.0, 0.0, 0.0, 0.0, 0.0, 0.0]","I think that a person should travel in group , by this a person can have more security ."
2213,"[0.0, 0.0, 0.0, 0.0, 1.0, 0.0, 0.0, 0.0, 0.0, 0.0, 0.0]",If a person travelling in a group of his friends or family members and they are visiting to some new place they will need a guide .
2214,"[0.0, 0.0, 0.0, 0.0, 1.0, 0.0, 0.0, 0.0, 0.0, 0.0, 0.0]",Guide can tells us the historical importance of the places we are visiting to .
2215,"[0.0, 0.0, 0.0, 0.0, 1.0, 0.0, 0.0, 0.0, 0.0, 0.0, 0.0]",As the guide knows all the areas and places of interest so he can guide us well .
2216,"[0.0, 0.0, 0.0, 0.0, 1.0, 0.0, 0.0, 0.0, 0.0, 0.0, 0.0]","Also if we are visiting to a place where there is different type of language used , guide can act as an interpreter ."
2217,"[0.0, 0.0, 0.0, 0.0, 1.0, 0.0, 0.0, 0.0, 0.0, 0.0, 0.0]",So I am fully agree with the idea of travelling in a group led by guide .
2218,"[0.0, 0.0, 0.0, 0.0, 1.0, 0.0, 0.0, 0.0, 0.0, 0.0, 0.0]","First reason that why I am in the favour of tour guide is that the guide can tell us the importance of that place in detail , which otherwise we cant get enough through other sources like books etc . for instance Last year me and my friends visited some historical places in India like Agra , Delhi and Jaipur but we people do n't think like hiring a guide , so v faced much problems over there ."
2219,"[0.0, 0.0, 0.0, 0.0, 1.0, 0.0, 0.0, 0.0, 0.0, 0.0, 0.0]",Second reason in favour of hiring a tourist guide is that the guide is well known to the area where we are visiting and he knows very well about the other places which we had not heard earlier .
2220,"[0.0, 0.0, 0.0, 0.0, 1.0, 0.0, 0.0, 0.0, 0.0, 0.0, 0.0]",So he can make our travel experience more interesting by introducing us to the new places .
2221,"[0.0, 0.0, 0.0, 0.0, 1.0, 0.0, 0.0, 0.0, 0.0, 0.0, 0.0]",Another important reason that I am in the favour of tour guide is that we can easily come over the language problem if we are visiting a place with different language .
2222,"[0.0, 0.0, 0.0, 0.0, 1.0, 0.0, 0.0, 0.0, 0.0, 0.0, 0.0]",For example if we are visiting european countries than we might encounter with the language problem over there .
2223,"[0.0, 0.0, 0.0, 0.0, 1.0, 0.0, 0.0, 0.0, 0.0, 0.0, 0.0]",And we can come across the difficulty of interacting with people .
2224,"[0.0, 0.0, 0.0, 0.0, 1.0, 0.0, 0.0, 0.0, 0.0, 0.0, 0.0]",A tour guide can act as an interpreter between us and the people of the other region we are visiting to .
2225,"[0.0, 0.0, 0.0, 0.0, 1.0, 0.0, 0.0, 0.0, 0.0, 0.0, 0.0]","To summarize , the best way to travel is in group led by tourist guide , so that we can come to know in details about the places we are visiting to , we can enhance our experience by introduction of new places and we can handle the situation of language problem and last but not the least by travelling in a group we can have a sense of security ."
2226,"[0.0, 0.0, 0.0, 0.0, 0.0, 0.0, 0.0, 0.0, 0.0, 1.0, 0.0]",Most advertisements make products seem better than they really are .
2227,"[0.0, 0.0, 0.0, 0.0, 0.0, 0.0, 0.0, 0.0, 0.0, 1.0, 0.0]",This reminds me of an incident which occurred only a few days ago .
2228,"[0.0, 0.0, 0.0, 0.0, 0.0, 0.0, 0.0, 0.0, 0.0, 1.0, 0.0]",I was out shopping with my friends and i was on the look out for a new mobile phone which i had fallen in love with as soon as i saw it on my television screen one fine morning .
2229,"[0.0, 0.0, 0.0, 0.0, 0.0, 0.0, 0.0, 0.0, 0.0, 1.0, 0.0]",I had vowed to buy that mobile phone whatever be the consequences .
2230,"[0.0, 0.0, 0.0, 0.0, 0.0, 0.0, 0.0, 0.0, 0.0, 1.0, 0.0]",This action can be appraised by the fact that the phone looked really cute in the advertisement and it boasted of many features as well .
2231,"[0.0, 0.0, 0.0, 0.0, 0.0, 0.0, 0.0, 0.0, 0.0, 1.0, 0.0]",This phone was the ultimate gadget for any teenager .
2232,"[0.0, 0.0, 0.0, 0.0, 0.0, 0.0, 0.0, 0.0, 0.0, 1.0, 0.0]",But i had the ultimate shock when i saw the same mobile phone in the mall .
2233,"[0.0, 0.0, 0.0, 0.0, 0.0, 0.0, 0.0, 0.0, 0.0, 1.0, 0.0]","It did not look as cute as it did in the ad , for one thing , and it did not seem to have as many features as it did in the ad ."
2234,"[0.0, 0.0, 0.0, 0.0, 0.0, 0.0, 0.0, 0.0, 0.0, 1.0, 0.0]",The ad was an illustration of what is defined as cheap publicity .
2235,"[0.0, 0.0, 0.0, 0.0, 0.0, 0.0, 0.0, 0.0, 0.0, 1.0, 0.0]","The phone had been wrongly displayed and if it were not for my trust - worthy friends , I would have bought it with all the love i previously had for it and then would have ended up as the loser , disappointed as well ."
2236,"[0.0, 0.0, 0.0, 0.0, 0.0, 0.0, 0.0, 0.0, 0.0, 1.0, 0.0]",Most advertisements seem to display products in such a way that the consumer would fall in love with the product just by viewing the advertisement .
2237,"[0.0, 0.0, 0.0, 0.0, 0.0, 0.0, 0.0, 0.0, 0.0, 1.0, 0.0]",This can result in serious damage of the customers trust in advertisements as well as in the manufacturers of that particular product .
2238,"[0.0, 0.0, 0.0, 0.0, 0.0, 0.0, 0.0, 0.0, 0.0, 1.0, 0.0]","The consumers will be heart - broken when they come home and realise that the product , with which they were previously so in love , has really let them down , quality - wise ."
2239,"[0.0, 0.0, 0.0, 0.0, 0.0, 0.0, 0.0, 0.0, 0.0, 1.0, 0.0]","The advertisers or the manufacturers are hood - winking the consumers into buying their products at high prices , ensuring profits for themselves , but breaking the trust of the consumers nonetheless ."
2240,"[0.0, 0.0, 0.0, 0.0, 0.0, 0.0, 0.0, 0.0, 0.0, 1.0, 0.0]",The advertisements should be more realistic and they should not display something which the consumer may not find in the product later .
2241,"[0.0, 0.0, 0.0, 0.0, 0.0, 0.0, 0.0, 0.0, 0.0, 1.0, 0.0]",The advertisers should only advertise those characteristics of the products which actually exist and serve a purpose .
2242,"[0.0, 0.0, 0.0, 0.0, 0.0, 0.0, 0.0, 0.0, 0.0, 1.0, 0.0]",Not the characteristics that ought to be in a product .
2243,"[0.0, 0.0, 0.0, 0.0, 0.0, 0.0, 0.0, 0.0, 0.0, 1.0, 0.0]","If the advertisers are so keen on advertising such characteristics they should suggest to the manufacturers to actually integrate these characteristics into the product and then advertise them so they would not be cheating the customers but actually showing a true , realistic picture ."
2244,"[0.0, 0.0, 0.0, 0.0, 0.0, 0.0, 0.0, 0.0, 1.0, 0.0, 0.0]","I agree with the fact that most advertisements make products seem much better than they really are , but the fact is that people is affected when is not aware of this ."
2245,"[0.0, 0.0, 0.0, 0.0, 0.0, 0.0, 0.0, 0.0, 1.0, 0.0, 0.0]",Also I understand that although there is some regulation about this topic the means to make it work are not as hard as they should .
2246,"[0.0, 0.0, 0.0, 0.0, 0.0, 0.0, 0.0, 0.0, 1.0, 0.0, 0.0]",Is truth that marketing uses strategies like give misinformation about a product or try to convince us that their product is what we need to solve our problems or just to make us happy .
2247,"[0.0, 0.0, 0.0, 0.0, 0.0, 0.0, 0.0, 0.0, 1.0, 0.0, 0.0]","But it could be a real problem like in a medical example , some vitamin supplements are announce to be all we need if we feel tired or weak , but the people who make the publicity do not care or inform consumers about the risk of do not go toa medical check when these synthons are present ."
2248,"[0.0, 0.0, 0.0, 0.0, 0.0, 0.0, 0.0, 0.0, 1.0, 0.0, 0.0]",Also there are docummentated cases of people who stop taking their medication or cutted their medical treatments because of using a new product seen on TV .
2249,"[0.0, 0.0, 0.0, 0.0, 0.0, 0.0, 0.0, 0.0, 1.0, 0.0, 0.0]","Another example could be the resistance of a ladder or a new kind tool , because the client could be expecting that this tool or appliance has a certain lasting , when the real thing is that it is going to break even putting in danger his life ."
2250,"[0.0, 0.0, 0.0, 0.0, 0.0, 0.0, 0.0, 0.0, 1.0, 0.0, 0.0]",As a final conclusion or a personal peace of advice .
2251,"[0.0, 0.0, 0.0, 0.0, 0.0, 0.0, 0.0, 0.0, 1.0, 0.0, 0.0]",I think that even though companies have the necessity to increase their profits they also should have a social conscience .
2252,"[0.0, 0.0, 0.0, 0.0, 0.0, 0.0, 0.0, 0.0, 1.0, 0.0, 0.0]",That is to say be more concerned about the responsibility of lie or misinformate about the features of a product .
2253,"[0.0, 0.0, 0.0, 0.0, 0.0, 0.0, 0.0, 0.0, 1.0, 0.0, 0.0]","And this does not mean that the client should leave everything in the hands of the enterprises , but be more concerned about the possibility of being buying something which is not what he is expecting ."
2254,"[0.0, 0.0, 0.0, 0.0, 0.0, 0.0, 1.0, 0.0, 0.0, 0.0, 0.0]","I agree , because people start to think car cost money and polite enviroment and their own health problem now ."
2255,"[0.0, 0.0, 0.0, 0.0, 0.0, 0.0, 1.0, 0.0, 0.0, 0.0, 0.0]","Cause of bad enviroment , a lot of people have disease , like cancerand especially lung disease ."
2256,"[0.0, 0.0, 0.0, 0.0, 0.0, 0.0, 1.0, 0.0, 0.0, 0.0, 0.0]",It came from not enough exercise and air solution .
2257,"[0.0, 0.0, 0.0, 0.0, 0.0, 0.0, 1.0, 0.0, 0.0, 0.0, 0.0]","Thesedays , more and more people take care about their health problem and they know that cars makes Thier health worse ."
2258,"[0.0, 0.0, 0.0, 0.0, 0.0, 0.0, 1.0, 0.0, 0.0, 0.0, 0.0]","Also people start to care protecting nature : ozone hall , air solution came from car emission ."
2259,"[0.0, 0.0, 0.0, 0.0, 0.0, 0.0, 1.0, 0.0, 0.0, 0.0, 0.0]","Car cost too much money , people keep gasoline in car , and prise of gasoline getting higher ."
2260,"[0.0, 0.0, 0.0, 0.0, 0.0, 0.0, 1.0, 0.0, 0.0, 0.0, 0.0]",They have to renew car insurance every few year .
2261,"[0.0, 0.0, 0.0, 0.0, 0.0, 0.0, 1.0, 0.0, 0.0, 0.0, 0.0]",They have to keep there own parking .
2262,"[0.0, 0.0, 0.0, 0.0, 0.0, 0.0, 1.0, 0.0, 0.0, 0.0, 0.0]",Having a car means costing money very day .
2263,"[0.0, 0.0, 0.0, 0.0, 0.0, 0.0, 1.0, 0.0, 0.0, 0.0, 0.0]","They want to save money , and it is easy to use train or bus or bicycle instead of car ."
2264,"[0.0, 0.0, 0.0, 0.0, 0.0, 0.0, 1.0, 0.0, 0.0, 0.0, 0.0]",Using a another transportation is much easier than car .
2265,"[0.0, 0.0, 0.0, 0.0, 0.0, 0.0, 1.0, 0.0, 0.0, 0.0, 0.0]",Especially train is more quick and cheapest .
2266,"[0.0, 0.0, 0.0, 0.0, 0.0, 0.0, 1.0, 0.0, 0.0, 0.0, 0.0]","About years ago , it was a states having own car ."
2267,"[0.0, 0.0, 0.0, 0.0, 0.0, 0.0, 1.0, 0.0, 0.0, 0.0, 0.0]","However , now being natural is one of trend ."
2268,"[0.0, 0.0, 0.0, 0.0, 0.0, 0.0, 1.0, 0.0, 0.0, 0.0, 0.0]",I t si thought Cool !
2269,"[0.0, 0.0, 0.0, 0.0, 0.0, 0.0, 1.0, 0.0, 0.0, 0.0, 0.0]",Also having a car that make people non - active person .
2270,"[0.0, 0.0, 0.0, 0.0, 0.0, 0.0, 1.0, 0.0, 0.0, 0.0, 0.0]","America is the best example , most of americans go to office or school by car ."
2271,"[0.0, 0.0, 0.0, 0.0, 0.0, 0.0, 1.0, 0.0, 0.0, 0.0, 0.0]",It makes American people fatter and fatter .
2272,"[0.0, 0.0, 0.0, 0.0, 0.0, 0.0, 1.0, 0.0, 0.0, 0.0, 0.0]",I know the best way to solve all of these problems .
2273,"[0.0, 0.0, 0.0, 0.0, 0.0, 0.0, 1.0, 0.0, 0.0, 0.0, 0.0]",We have to walk our own legs .
2274,"[0.0, 0.0, 0.0, 0.0, 0.0, 0.0, 1.0, 0.0, 0.0, 0.0, 0.0]",Do not rely on car so much .
2275,"[0.0, 1.0, 0.0, 0.0, 0.0, 0.0, 0.0, 0.0, 0.0, 0.0, 0.0]",It has been long discussed if it is more important for students to understand ideas AMD concepts than it is for them to learn facts .
2276,"[0.0, 1.0, 0.0, 0.0, 0.0, 0.0, 0.0, 0.0, 0.0, 0.0, 0.0]",I disagree with the statements that it is more important for students to understanding ideas and concepts than it is for them to learn facts .
2277,"[0.0, 1.0, 0.0, 0.0, 0.0, 0.0, 0.0, 0.0, 0.0, 0.0, 0.0]",Facts are the things that we seen that is virtue and used as the basic of the ideas and concept .
2278,"[0.0, 1.0, 0.0, 0.0, 0.0, 0.0, 0.0, 0.0, 0.0, 0.0, 0.0]","You can hardly tells weather the concepts and the ideals are true or false , because everyone had his or her owe observations ."
2279,"[0.0, 1.0, 0.0, 0.0, 0.0, 0.0, 0.0, 0.0, 0.0, 0.0, 0.0]","We know know that neither the Earth nor the Sun is the cereal of the universe , but most of the people believed that the concept that the Earth is the certain of the universe ."
