,label,sent
1083,"[0.0, 0.0, 0.0, 0.0, 0.0, 0.0, 0.0, 0.0, 0.0, 1.0, 0.0]",Now - a - days there is a whole lot of variety being offered wherein special additional features are built in it like conference room setting or bedroom setting .
1084,"[0.0, 0.0, 0.0, 0.0, 0.0, 0.0, 0.0, 0.0, 0.0, 1.0, 0.0]",With such offers it has lot of benefits for the people who are really busy and cant afford to waste times .
1085,"[0.0, 0.0, 0.0, 0.0, 0.0, 0.0, 0.0, 0.0, 0.0, 1.0, 0.0]",Well with so many benefits its really hard to think that there will be a decline in the number of cars in the near future .
1086,"[0.0, 0.0, 0.0, 0.0, 0.0, 0.0, 0.0, 0.0, 0.0, 1.0, 0.0]",With the benefits there are also certain disadvantages like the gas emitted from the exhaust of the cars is polluting the environment and that the fuel used for the functioning of the car is depleting the natural resources .
1087,"[0.0, 0.0, 0.0, 0.0, 0.0, 0.0, 0.0, 0.0, 0.0, 1.0, 0.0]",Well for the fact that cars are increasing the air pollution with the development in technology various models are being developed which dont emit any dangerous gases in the atmosphereand for the second disadvantage that they are using the energy resources new cars are being developed and some have already being developed which use solar energy as fuel or run on electrical energy .
1088,"[0.0, 0.0, 0.0, 0.0, 0.0, 0.0, 0.0, 0.0, 0.0, 1.0, 0.0]",Thus with so many advantages i think the demand for the increase in Caras will outnumber its decrease or there wont be any drastic change in the number of cars in the near future .
1089,"[0.0, 0.0, 0.0, 0.0, 0.0, 0.0, 0.0, 0.0, 0.0, 1.0, 0.0]",Thus i think that in the near future there will be an additional number of cars than there are today .
1090,"[0.0, 0.0, 0.0, 0.0, 0.0, 0.0, 0.0, 0.0, 0.0, 1.0, 0.0]",I agree that students should understand the ideas and concepts than spending time in learning facts .
1091,"[0.0, 0.0, 0.0, 0.0, 0.0, 0.0, 0.0, 0.0, 0.0, 1.0, 0.0]","I believe that the human civilization has come to the zenith of technology not because of learing the facts , but by understanding the ideas and concepts ."
1092,"[0.0, 0.0, 0.0, 0.0, 0.0, 0.0, 0.0, 0.0, 0.0, 1.0, 0.0]",There have been advancements in many areas .
1093,"[0.0, 0.0, 0.0, 0.0, 0.0, 0.0, 0.0, 0.0, 0.0, 1.0, 0.0]","If the humans spend all their time on facts , our lives could have been ended in understanding the history of our earlier generation ."
1094,"[0.0, 0.0, 0.0, 0.0, 0.0, 0.0, 0.0, 0.0, 0.0, 1.0, 0.0]",And we could not have seen the progress .
1095,"[0.0, 0.0, 0.0, 0.0, 0.0, 0.0, 0.0, 0.0, 0.0, 1.0, 0.0]",There could have been no progress of science .
1096,"[0.0, 0.0, 0.0, 0.0, 0.0, 0.0, 0.0, 0.0, 0.0, 1.0, 0.0]","So , applying the concepts of the facts will move the world to the next levels ."
1097,"[0.0, 0.0, 0.0, 0.0, 0.0, 0.0, 0.0, 0.0, 0.0, 1.0, 0.0]","I always liked science which make me a scientist not because I know the facts , but the way I understand ideas and concepts ."
1098,"[0.0, 0.0, 0.0, 0.0, 0.0, 0.0, 0.0, 0.0, 0.0, 1.0, 0.0]",I am taking a mathematics call I will use the concepts and idea to get to generate a solution to the problem .
1099,"[0.0, 0.0, 0.0, 0.0, 0.0, 0.0, 0.0, 0.0, 0.0, 1.0, 0.0]","If we use fact there will be times , they will not help get the solution ."
1100,"[0.0, 0.0, 0.0, 0.0, 0.0, 0.0, 0.0, 0.0, 0.0, 1.0, 0.0]","In our daily life , we live with ideas and concepts ."
1101,"[0.0, 0.0, 0.0, 0.0, 0.0, 0.0, 0.0, 0.0, 0.0, 1.0, 0.0]","A very basic example , If my parents want me to go buy vegetables form the vegetable market I will decide which way will be easier road ."
1102,"[0.0, 0.0, 0.0, 0.0, 0.0, 0.0, 0.0, 0.0, 0.0, 1.0, 0.0]",I will analyze by asking myself using my concepts and not go with the facts .
1103,"[0.0, 0.0, 0.0, 0.0, 0.0, 0.0, 0.0, 0.0, 0.0, 1.0, 0.0]",Our human mind can take only some facts and then we have to use the concepts to work towards succuss .
1104,"[0.0, 0.0, 0.0, 0.0, 0.0, 0.0, 0.0, 0.0, 0.0, 1.0, 0.0]",There are many facts in this world and it will not be in our human abilities to know all the facts .
1105,"[0.0, 0.0, 0.0, 0.0, 0.0, 0.0, 0.0, 0.0, 0.0, 1.0, 0.0]",so it is more important that to know how to apply the concepts and ideas .
1106,"[0.0, 0.0, 0.0, 0.0, 0.0, 0.0, 0.0, 0.0, 0.0, 1.0, 0.0]",To deal with the problem .
1107,"[0.0, 0.0, 0.0, 0.0, 0.0, 0.0, 0.0, 0.0, 0.0, 1.0, 0.0]","On a whole , I think that facts can only help to certain level but most importantly it is the ideas and concepts that will help us in dealing with daily lives , in our career and also in work ."
1108,"[0.0, 0.0, 0.0, 0.0, 1.0, 0.0, 0.0, 0.0, 0.0, 0.0, 0.0]",It is said that fortune favours the brave .
1109,"[0.0, 0.0, 0.0, 0.0, 1.0, 0.0, 0.0, 0.0, 0.0, 0.0, 0.0]","On the same lines , it can be said that success follows people who try new horizons , who extent their limit of vision and dare to take on new challenges in a world that is overhanging ."
1110,"[0.0, 0.0, 0.0, 0.0, 1.0, 0.0, 0.0, 0.0, 0.0, 0.0, 0.0]",I think that successful people keep trying new things and do not get stuck on any one thing .
1111,"[0.0, 0.0, 0.0, 0.0, 1.0, 0.0, 0.0, 0.0, 0.0, 0.0, 0.0]",The world has seen many industrialists who tried different businesses .
1112,"[0.0, 0.0, 0.0, 0.0, 1.0, 0.0, 0.0, 0.0, 0.0, 0.0, 0.0]","Though they succeeded on some and failed in others , on a whole they emerged as winners ."
1113,"[0.0, 0.0, 0.0, 0.0, 1.0, 0.0, 0.0, 0.0, 0.0, 0.0, 0.0]",One bright example that I would like to mention is that of an Indian businessman Data .
1114,"[0.0, 0.0, 0.0, 0.0, 1.0, 0.0, 0.0, 0.0, 0.0, 0.0, 0.0]",Data put his first foot in the world of business with an automobile manufacturing unit .
1115,"[0.0, 0.0, 0.0, 0.0, 1.0, 0.0, 0.0, 0.0, 0.0, 0.0, 0.0]",He collaborated with foreign companies to provide best available technologies to customers .
1116,"[0.0, 0.0, 0.0, 0.0, 1.0, 0.0, 0.0, 0.0, 0.0, 0.0, 0.0]",The business started with trucks but soon flourished to other class of vehicles .
1117,"[0.0, 0.0, 0.0, 0.0, 1.0, 0.0, 0.0, 0.0, 0.0, 0.0, 0.0]","Recently , Data introduced cheapest four wheeler on Indian roads for common man ."
1118,"[0.0, 0.0, 0.0, 0.0, 1.0, 0.0, 0.0, 0.0, 0.0, 0.0, 0.0]",This journey is amazing .
1119,"[0.0, 0.0, 0.0, 0.0, 1.0, 0.0, 0.0, 0.0, 0.0, 0.0, 0.0]",But this is not the only thing that Data did .
1120,"[0.0, 0.0, 0.0, 0.0, 1.0, 0.0, 0.0, 0.0, 0.0, 0.0, 0.0]",Data started different businesses apart from automobile .
1121,"[0.0, 0.0, 0.0, 0.0, 1.0, 0.0, 0.0, 0.0, 0.0, 0.0, 0.0]","Tea , salt , information technology , telecom he seems to be ubiquitous ."
1122,"[0.0, 0.0, 0.0, 0.0, 1.0, 0.0, 0.0, 0.0, 0.0, 0.0, 0.0]",He is also successful in these businesses .
1123,"[0.0, 0.0, 0.0, 0.0, 1.0, 0.0, 0.0, 0.0, 0.0, 0.0, 0.0]",Now he is planning to take over world famous brand Jaguar .
1124,"[0.0, 0.0, 0.0, 0.0, 1.0, 0.0, 0.0, 0.0, 0.0, 0.0, 0.0]","Certainly , Data took great risk when he started every new industry ."
1125,"[0.0, 0.0, 0.0, 0.0, 1.0, 0.0, 0.0, 0.0, 0.0, 0.0, 0.0]",But great returns demand great risks .
1126,"[0.0, 0.0, 0.0, 0.0, 1.0, 0.0, 0.0, 0.0, 0.0, 0.0, 0.0]",A man with vision can handle such risks and emerge out as a winner .
1127,"[0.0, 0.0, 0.0, 0.0, 1.0, 0.0, 0.0, 0.0, 0.0, 0.0, 0.0]",These are all qualities of a successful person .
1128,"[0.0, 0.0, 0.0, 0.0, 1.0, 0.0, 0.0, 0.0, 0.0, 0.0, 0.0]","Had Data been interested only with manufacturing of trucks , he never had had such a great impact on all other business areas ."
1129,"[0.0, 0.0, 0.0, 0.0, 1.0, 0.0, 0.0, 0.0, 0.0, 0.0, 0.0]",He tried out new things and his efforts paid off .
1130,"[0.0, 0.0, 0.0, 0.0, 1.0, 0.0, 0.0, 0.0, 0.0, 0.0, 0.0]",His success surely belongs to the way he conquered new opportunities of business .
1131,"[0.0, 0.0, 0.0, 0.0, 1.0, 0.0, 0.0, 0.0, 0.0, 0.0, 0.0]","Thus , it can surely be said that one who does same thing that he already know how to do well will have less chance to succeed than the one who try different things and takes calculated risks for greater rewards ."
1132,"[0.0, 0.0, 0.0, 0.0, 0.0, 0.0, 0.0, 0.0, 1.0, 0.0, 0.0]","For most people to travel is a important part of their life , but out there are people which is a little bit risky than others and they enjoy having adventures in their travel ."
1133,"[0.0, 0.0, 0.0, 0.0, 0.0, 0.0, 0.0, 0.0, 1.0, 0.0, 0.0]",Having a tour Gide is the most easy a safe way to travel .
1134,"[0.0, 0.0, 0.0, 0.0, 0.0, 0.0, 0.0, 0.0, 1.0, 0.0, 0.0]",Also travel with a guide means to travel on group .
1135,"[0.0, 0.0, 0.0, 0.0, 0.0, 0.0, 0.0, 0.0, 1.0, 0.0, 0.0]","With a tour Gide you have a schedule to do , and the places where you will go are already planned , also the places to visit will be the most traditional and save places for tourist ."
1136,"[0.0, 0.0, 0.0, 0.0, 0.0, 0.0, 0.0, 0.0, 1.0, 0.0, 0.0]","While you are traveling in group you can not risk neither to get lost in a place that you do not know , the fact of hanging around with many people make the tour funny and gives you the opportunity to meet new friend ."
1137,"[0.0, 0.0, 0.0, 0.0, 0.0, 0.0, 0.0, 0.0, 1.0, 0.0, 0.0]","In the other hand traveling without a tour guide , for most people , is a way to enjoy a great time with their family ."
1138,"[0.0, 0.0, 0.0, 0.0, 0.0, 0.0, 0.0, 0.0, 1.0, 0.0, 0.0]",Some people enjoy traveling without a guide because they are not under any schedule neither with a big group .
1139,"[0.0, 0.0, 0.0, 0.0, 0.0, 0.0, 0.0, 0.0, 1.0, 0.0, 0.0]","It means that this people do not have any planning place to visit , they just go to the first place they look ."
1140,"[0.0, 0.0, 0.0, 0.0, 0.0, 0.0, 0.0, 0.0, 1.0, 0.0, 0.0]","This kind of travel could be a little risky because you do not know the place where you are , but it does not matter for them , actually they enjoy it ."
1141,"[0.0, 0.0, 0.0, 0.0, 0.0, 0.0, 0.0, 0.0, 1.0, 0.0, 0.0]","Traveling is an important part of our life , and it does not matter which one you prefer o which one you enjoy most , but traveling without a tour guide without any schedule neither places planned is a nice experience that everyone should do at least once ."
1142,"[0.0, 0.0, 0.0, 0.0, 0.0, 0.0, 0.0, 1.0, 0.0, 0.0, 0.0]","Since World war was ended , Young generation has enjoyed their life more than olders ."
1143,"[0.0, 0.0, 0.0, 0.0, 0.0, 0.0, 0.0, 1.0, 0.0, 0.0, 0.0]","They , Would - be Baby - boom generation , were good at various entertainment , and were exposed splendid media such as Holly wood movies or Broadway musical shows ."
1144,"[0.0, 0.0, 0.0, 0.0, 0.0, 0.0, 0.0, 1.0, 0.0, 0.0, 0.0]",There are a few reasons why young people are better at having a great time than older people .
1145,"[0.0, 0.0, 0.0, 0.0, 0.0, 0.0, 0.0, 1.0, 0.0, 0.0, 0.0]","First , young people know well how to play whenever they want eagerly ."
1146,"[0.0, 0.0, 0.0, 0.0, 0.0, 0.0, 0.0, 1.0, 0.0, 0.0, 0.0]","They know well where is the best bar , what trend is going on , or who is the most famous actor in these days ."
1147,"[0.0, 0.0, 0.0, 0.0, 0.0, 0.0, 0.0, 1.0, 0.0, 0.0, 0.0]",Of course older people have no time to have a fun in order to get enough money for their family like a daughter who is interested in an expensive jewelry brand .
1148,"[0.0, 0.0, 0.0, 0.0, 0.0, 0.0, 0.0, 1.0, 0.0, 0.0, 0.0]",However young people do n't need too much money because they have no one to be preserved .
1149,"[0.0, 0.0, 0.0, 0.0, 0.0, 0.0, 0.0, 1.0, 0.0, 0.0, 0.0]",They just maintain Thier living cost that contains money to go the best club in Soho .
1150,"[0.0, 0.0, 0.0, 0.0, 0.0, 0.0, 0.0, 1.0, 0.0, 0.0, 0.0]","Second , young people are healthier than older people because they have young and strong body that older people do n't have ."
1151,"[0.0, 0.0, 0.0, 0.0, 0.0, 0.0, 0.0, 1.0, 0.0, 0.0, 0.0]","Old people have to pay for their medical cares , medicines in order to maintain the body ."
1152,"[0.0, 0.0, 0.0, 0.0, 0.0, 0.0, 0.0, 1.0, 0.0, 0.0, 0.0]","In contrast , young people are not needed to get any medical payment at all ."
1153,"[0.0, 0.0, 0.0, 0.0, 0.0, 0.0, 0.0, 1.0, 0.0, 0.0, 0.0]","Finally , young people tend to be curious toward all of the strange things what they have never seen before ."
1154,"[0.0, 0.0, 0.0, 0.0, 0.0, 0.0, 0.0, 1.0, 0.0, 0.0, 0.0]","When older people avoid a stranger from another country , young people try to be closer with positive activity ."
1155,"[0.0, 0.0, 0.0, 0.0, 0.0, 0.0, 0.0, 1.0, 0.0, 0.0, 0.0]","For example , in a small town , a tourist visit for his her academical research such as modern agriculture from a strange country , young people or children will try to talk to him her ."
1156,"[0.0, 0.0, 0.0, 0.0, 0.0, 0.0, 0.0, 1.0, 0.0, 0.0, 0.0]",These reasons are why I think that young people are more enjoyable than older people .
1157,"[0.0, 0.0, 0.0, 0.0, 0.0, 0.0, 1.0, 0.0, 0.0, 0.0, 0.0]","Traveling is very interesting for me , but there is a controversy how to travel ; going alone or in a group ."
1158,"[0.0, 0.0, 0.0, 0.0, 0.0, 0.0, 1.0, 0.0, 0.0, 0.0, 0.0]",I disagree with this theme and I raise four reasons for this .
1159,"[0.0, 0.0, 0.0, 0.0, 0.0, 0.0, 1.0, 0.0, 0.0, 0.0, 0.0]","First of all , I d like to go wherever I can go ."
1160,"[0.0, 0.0, 0.0, 0.0, 0.0, 0.0, 1.0, 0.0, 0.0, 0.0, 0.0]","It is very useful to go with a tour guide , specially to the place that I Ve never been to , because I have little knowledge of dangerous place to visit ."
1161,"[0.0, 0.0, 0.0, 0.0, 0.0, 0.0, 1.0, 0.0, 0.0, 0.0, 0.0]","But in guide tour , there are something that I do n't want to go to ."
1162,"[0.0, 0.0, 0.0, 0.0, 0.0, 0.0, 1.0, 0.0, 0.0, 0.0, 0.0]","Also , planning for the place that I want to go is also precious time ."
1163,"[0.0, 0.0, 0.0, 0.0, 0.0, 0.0, 1.0, 0.0, 0.0, 0.0, 0.0]","Time to travel is limited , and from planning to travel , it is a starting point !"
1164,"[0.0, 0.0, 0.0, 0.0, 0.0, 0.0, 1.0, 0.0, 0.0, 0.0, 0.0]","Secondly , traveling is expanding our eyes ."
1165,"[0.0, 0.0, 0.0, 0.0, 0.0, 0.0, 1.0, 0.0, 0.0, 0.0, 0.0]",I traveled Brazil a lot and I was capable of knowing foreign people .
1166,"[0.0, 0.0, 0.0, 0.0, 0.0, 0.0, 1.0, 0.0, 0.0, 0.0, 0.0]","To know what they do , think and like was an very interesting chance ."
1167,"[0.0, 0.0, 0.0, 0.0, 0.0, 0.0, 1.0, 0.0, 0.0, 0.0, 0.0]","I like foreigners , including Brazilians , and also want to communicate with foreign people ."
1168,"[0.0, 0.0, 0.0, 0.0, 0.0, 0.0, 1.0, 0.0, 0.0, 0.0, 0.0]","Traveling is knowing and expanding friends , but this will happen only when going abroad alone , and I would have never had such an experience with travailing by myself ."
1169,"[0.0, 0.0, 0.0, 0.0, 0.0, 0.0, 1.0, 0.0, 0.0, 0.0, 0.0]","At last , travailing is a chance of thinking what I am and what I am going to be ."
1170,"[0.0, 0.0, 0.0, 0.0, 0.0, 0.0, 1.0, 0.0, 0.0, 0.0, 0.0]","In a place where we live , I ca n't be stimulated and there are n't good for my health , but in a new place , I can be fresh in my mind , and I want to know about this ."
1171,"[0.0, 0.0, 0.0, 0.0, 0.0, 0.0, 1.0, 0.0, 0.0, 0.0, 0.0]","I know that traveling with a group , for example with friends , family , but it is not interesting largely because I ca n't see , think alone ."
1172,"[0.0, 0.0, 0.0, 0.0, 0.0, 0.0, 1.0, 0.0, 0.0, 0.0, 0.0]","It is a chance to go , think , enjoy by myself , not for others ."
1173,"[0.0, 0.0, 0.0, 0.0, 0.0, 0.0, 1.0, 0.0, 0.0, 0.0, 0.0]","I want to go every year alone travailing wherever I want , and expand my ability ."
1174,"[0.0, 0.0, 0.0, 1.0, 0.0, 0.0, 0.0, 0.0, 0.0, 0.0, 0.0]","Understanding ideas and concepts is very important for students , because it helps to remember processes easily , for example ."
1175,"[0.0, 0.0, 0.0, 1.0, 0.0, 0.0, 0.0, 0.0, 0.0, 0.0, 0.0]","In the subject biology , it is very hard to learn facts without knowing for what the facts are necessary in a biological system or process ."
1176,"[0.0, 0.0, 0.0, 1.0, 0.0, 0.0, 0.0, 0.0, 0.0, 0.0, 0.0]",In history class it is also important to know about the dates of events .
1177,"[0.0, 0.0, 0.0, 1.0, 0.0, 0.0, 0.0, 0.0, 0.0, 0.0, 0.0]","But if you understand the ideas and the development of an event , you can easier put the event in an chronological order ."
1178,"[0.0, 0.0, 0.0, 1.0, 0.0, 0.0, 0.0, 0.0, 0.0, 0.0, 0.0]",Learning facts is very important for students who educate a language for example .
1179,"[0.0, 0.0, 0.0, 1.0, 0.0, 0.0, 0.0, 0.0, 0.0, 0.0, 0.0]",They have to learn vocabularies to improve their new language .
1180,"[0.0, 0.0, 0.0, 1.0, 0.0, 0.0, 0.0, 0.0, 0.0, 0.0, 0.0]","Jura students have to learn facts , too , and they have no chance to let that out ."
1181,"[0.0, 0.0, 0.0, 1.0, 0.0, 0.0, 0.0, 0.0, 0.0, 0.0, 0.0]",Students who study medicine also have to learn a lot of vocabularies for anatomy .
1182,"[0.0, 0.0, 0.0, 1.0, 0.0, 0.0, 0.0, 0.0, 0.0, 0.0, 0.0]",Learning facts about a theme costs a lot of time and is not really helpful in your later work for an enterprise .
1183,"[0.0, 0.0, 0.0, 1.0, 0.0, 0.0, 0.0, 0.0, 0.0, 0.0, 0.0]",Understanding ideas and concepts is more likely .
1184,"[0.0, 0.0, 0.0, 1.0, 0.0, 0.0, 0.0, 0.0, 0.0, 0.0, 0.0]",It is easier to learn and to understand than facts .
1185,"[0.0, 0.0, 0.0, 1.0, 0.0, 0.0, 0.0, 0.0, 0.0, 0.0, 0.0]",Facts are just fictional and you often do not know how to use facts properly in an important situation .
1186,"[0.0, 0.0, 0.0, 1.0, 0.0, 0.0, 0.0, 0.0, 0.0, 0.0, 0.0]","For example : If there is a machine which does not work any more , it is very difficult to check every single fact of the machine ."
1187,"[0.0, 0.0, 0.0, 1.0, 0.0, 0.0, 0.0, 0.0, 0.0, 0.0, 0.0]",It is easier to think about the whole concept of the machine : How does it works and what does it produce ?
1188,"[0.0, 0.0, 0.0, 1.0, 0.0, 0.0, 0.0, 0.0, 0.0, 0.0, 0.0]",In this way it is more easier to find the problem of the defective machine .
1189,"[0.0, 0.0, 0.0, 1.0, 0.0, 0.0, 0.0, 0.0, 0.0, 0.0, 0.0]","So , I think , students who want to take a job in an enterprise which is in the trade business or in businesses with processes , have to know more about ideas and concepts ."
1190,"[0.0, 0.0, 0.0, 1.0, 0.0, 0.0, 0.0, 0.0, 0.0, 0.0, 0.0]",It is very important to know about the whole work of a process than to know about facts you can easily look up in a book .
1191,"[0.0, 0.0, 0.0, 1.0, 0.0, 0.0, 0.0, 0.0, 0.0, 0.0, 0.0]",Understanding ideas and concepts support the ability of thinking about a problem .
1192,"[0.0, 0.0, 0.0, 1.0, 0.0, 0.0, 0.0, 0.0, 0.0, 0.0, 0.0]",And the skill to be able of finding a solution for a problem is a skill that makes you desirable for a lot of employees .
1193,"[0.0, 0.0, 0.0, 1.0, 0.0, 0.0, 0.0, 0.0, 0.0, 0.0, 0.0]","In my opinion , it is supportable to declare that understanding ideas and concepts is the most important skill for business ."
1194,"[0.0, 0.0, 0.0, 1.0, 0.0, 0.0, 0.0, 0.0, 0.0, 0.0, 0.0]",And that is what students should learn at their university .
1195,"[0.0, 0.0, 1.0, 0.0, 0.0, 0.0, 0.0, 0.0, 0.0, 0.0, 0.0]",Advertising in the art of convincing customers to buy specific products .
1196,"[0.0, 0.0, 1.0, 0.0, 0.0, 0.0, 0.0, 0.0, 0.0, 0.0, 0.0]",It is obvious that advertisements do not provide a complete information to the customers .
1197,"[0.0, 0.0, 1.0, 0.0, 0.0, 0.0, 0.0, 0.0, 0.0, 0.0, 0.0]","That is not the original purpose , even if it provides sometimes useful information , and other ways exist for customers to get information about the products they want to buy ."
1198,"[0.0, 0.0, 1.0, 0.0, 0.0, 0.0, 0.0, 0.0, 0.0, 0.0, 0.0]","For example , a lot of independent websites compare all the models of the same product available in the market ."
1199,"[0.0, 0.0, 1.0, 0.0, 0.0, 0.0, 0.0, 0.0, 0.0, 0.0, 0.0]","But even if advertisements are not supposed to provide a complete information , they often describe some features of the product ."
1200,"[0.0, 0.0, 1.0, 0.0, 0.0, 0.0, 0.0, 0.0, 0.0, 0.0, 0.0]","Doing that , they can not lie about objective characteristics because it is not legal and the advertisement would be forbidden by the competent authority ."
1201,"[0.0, 0.0, 1.0, 0.0, 0.0, 0.0, 0.0, 0.0, 0.0, 0.0, 0.0]","Then , how advertisements can lie to the customers ?"
1202,"[0.0, 0.0, 1.0, 0.0, 0.0, 0.0, 0.0, 0.0, 0.0, 0.0, 0.0]",The way to describe a product can be very subjective and it is obviously the case for advertisement .
1203,"[0.0, 0.0, 1.0, 0.0, 0.0, 0.0, 0.0, 0.0, 0.0, 0.0, 0.0]","For example , if you present a car with very beautiful girl or boy driving it , you do n't lie but you give the illusion that the car is better than it would be with a normal driver ."
1204,"[0.0, 0.0, 1.0, 0.0, 0.0, 0.0, 0.0, 0.0, 0.0, 0.0, 0.0]",That is seduction .
1205,"[0.0, 0.0, 1.0, 0.0, 0.0, 0.0, 0.0, 0.0, 0.0, 0.0, 0.0]",A advertising is seduction .
1206,"[0.0, 0.0, 1.0, 0.0, 0.0, 0.0, 0.0, 0.0, 0.0, 0.0, 0.0]",When you are interested in someone and you have a date you do not wear every day s clothes .
1207,"[0.0, 0.0, 1.0, 0.0, 0.0, 0.0, 0.0, 0.0, 0.0, 0.0, 0.0]",You take more time to appear much better than you really are .
1208,"[0.0, 0.0, 1.0, 0.0, 0.0, 0.0, 0.0, 0.0, 0.0, 0.0, 0.0]",That is seduction too and nobody seems to be against this kind of subjective lies .
1209,"[0.0, 0.0, 1.0, 0.0, 0.0, 0.0, 0.0, 0.0, 0.0, 0.0, 0.0]","In my opinion , the statement most advertisements make products seem much better than they really are is true but that is not a problem because everybody know that advertisements are subjective ."
1210,"[0.0, 0.0, 1.0, 0.0, 0.0, 0.0, 0.0, 0.0, 0.0, 0.0, 0.0]",There is a game of seduction between companies and customers .
1211,"[0.0, 0.0, 1.0, 0.0, 0.0, 0.0, 0.0, 0.0, 0.0, 0.0, 0.0]",We have to know the rules and take part of the game .
1212,"[0.0, 0.0, 1.0, 0.0, 0.0, 0.0, 0.0, 0.0, 0.0, 0.0, 0.0]","I think that the life would be less interesting without this kind of subjective communication , beyond technical descriptions ."
1213,"[1.0, 0.0, 0.0, 0.0, 0.0, 0.0, 0.0, 0.0, 0.0, 0.0, 0.0]",I agree that most advertisements make products seem much better than they really are .
1214,"[1.0, 0.0, 0.0, 0.0, 0.0, 0.0, 0.0, 0.0, 0.0, 0.0, 0.0]","When advertising , companies tend to make their products sound like that they are the best by providing false informations and false results ."
1215,"[1.0, 0.0, 0.0, 0.0, 0.0, 0.0, 0.0, 0.0, 0.0, 0.0, 0.0]",An ad on the TV may tell you things that you usually want in a product .
1216,"[1.0, 0.0, 0.0, 0.0, 0.0, 0.0, 0.0, 0.0, 0.0, 0.0, 0.0]",These information may mislead you to build an idea about the product that usually terns out to be wrong .
1217,"[1.0, 0.0, 0.0, 0.0, 0.0, 0.0, 0.0, 0.0, 0.0, 0.0, 0.0]","For example , when you watch television , you see a commercial about a certain type of cleaners ."
1218,"[1.0, 0.0, 0.0, 0.0, 0.0, 0.0, 0.0, 0.0, 0.0, 0.0, 0.0]","On the commercial , they say that this cleaner can make old things look new ."
1219,"[1.0, 0.0, 0.0, 0.0, 0.0, 0.0, 0.0, 0.0, 0.0, 0.0, 0.0]",You immediately think that this cleaner will help you make your old dress made by your mother look like a new Valinteno .
1220,"[1.0, 0.0, 0.0, 0.0, 0.0, 0.0, 0.0, 0.0, 0.0, 0.0, 0.0]","But instead , it shrinks your dress ."
1221,"[1.0, 0.0, 0.0, 0.0, 0.0, 0.0, 0.0, 0.0, 0.0, 0.0, 0.0]","Other commercials , show what happened when other people actors used this product ."
1222,"[1.0, 0.0, 0.0, 0.0, 0.0, 0.0, 0.0, 0.0, 0.0, 0.0, 0.0]","For example , a company that sells a drug for weight loss will show images of people who used to be fat , but now they are in a good shape ."
1223,"[1.0, 0.0, 0.0, 0.0, 0.0, 0.0, 0.0, 0.0, 0.0, 0.0, 0.0]","Later , it turns that these images were either taken for different people , or were manipulated with by computers ."
1224,"[1.0, 0.0, 0.0, 0.0, 0.0, 0.0, 0.0, 0.0, 0.0, 0.0, 0.0]","When companies try to make their products seem much better than they really are , they fool people into buying their products ."
1225,"[1.0, 0.0, 0.0, 0.0, 0.0, 0.0, 0.0, 0.0, 0.0, 0.0, 0.0]",People will see later that this product is not like what they expected .
1226,"[1.0, 0.0, 0.0, 0.0, 0.0, 0.0, 0.0, 0.0, 0.0, 0.0, 0.0]","This will eventually leads the company to lose its creditability and honesty , which will lead to financial nose dive in the future ."
1227,"[0.0, 0.0, 0.0, 0.0, 0.0, 0.0, 0.0, 0.0, 1.0, 0.0, 0.0]","I think that if things are still in twenty years like theyre going today , its very likely to be much more cars in use then , than they re now , so i dont agree with the given statement ."
1228,"[0.0, 0.0, 0.0, 0.0, 0.0, 0.0, 0.0, 0.0, 1.0, 0.0, 0.0]","Although petroleum is likely to run up before those twenty years pass , i think there might be some other products or substances to be burnt to take the necessary energy that drives a car ."
1229,"[0.0, 0.0, 0.0, 0.0, 0.0, 0.0, 0.0, 0.0, 1.0, 0.0, 0.0]","Its not an illusion and even today there are appearing the first cars that use other substances , such as propane or any other gases , on the market ."
1230,"[0.0, 0.0, 0.0, 0.0, 0.0, 0.0, 0.0, 0.0, 1.0, 0.0, 0.0]","I think that when twenty years have passed by , this technologies will be enough developed to let cars move with no petroleum needing ."
1231,"[0.0, 0.0, 0.0, 0.0, 0.0, 0.0, 0.0, 0.0, 1.0, 0.0, 0.0]","This doesnt mean that they wont harm our environment , which might be really harmed by then , but i dont really think nooned going to change anything to prevent or solve the environmental problem , as long as none has untill today ."
1232,"[0.0, 0.0, 0.0, 0.0, 0.0, 0.0, 0.0, 0.0, 1.0, 0.0, 0.0]","People could maybe stop using their own cars when the earth gets so much neatened that living in it gets impossible , or at least very annoying , but i dont think that is going to happen between the next twenty years , and the car s commerce is so powerful that nobody is going to take care of preventing the use of cars before heat gets to be unstandable ."
