,label,sent
2954,"[0.0, 0.0, 0.0, 0.0, 1.0, 0.0, 0.0, 0.0, 0.0, 0.0, 0.0]",The question is very tricky as people across all walks of life and across all age groups like to enjoy and it is rather tough to quantify and compare their levels of enjoyment .
2955,"[0.0, 0.0, 0.0, 0.0, 1.0, 0.0, 0.0, 0.0, 0.0, 0.0, 0.0]",Besides there could be people who could derive a tremendous sense of enjoyment by the most trivial of acts such as the sight of smiling infant .
2956,"[0.0, 0.0, 0.0, 0.0, 1.0, 0.0, 0.0, 0.0, 0.0, 0.0, 0.0]",While there could be some who are never happy with the state of affairs in their lives despite having the best comforts in the world .
2957,"[0.0, 0.0, 0.0, 0.0, 1.0, 0.0, 0.0, 0.0, 0.0, 0.0, 0.0]","In comparing youngsters and adults on the mentioned statement , I personally feel that as youngsters we try to live life to the fullest ."
2958,"[0.0, 0.0, 0.0, 0.0, 1.0, 0.0, 0.0, 0.0, 0.0, 0.0, 0.0]",Though we realise the importance of making a career for ourselves we also make it a point to have a ball as and when time permits .
2959,"[0.0, 0.0, 0.0, 0.0, 1.0, 0.0, 0.0, 0.0, 0.0, 0.0, 0.0]",Older people generally tend to be more spiritually inclined and prefer to spend their time doing community work that brings them a sense of satisfaction more than the thrill of enjoyment .
2960,"[0.0, 0.0, 0.0, 0.0, 1.0, 0.0, 0.0, 0.0, 0.0, 0.0, 0.0]",Besides there might also be the feeling that they are beyond the ` age ' to enjoy life in a way as extravagant as we youngsters can .
2961,"[0.0, 0.0, 0.0, 0.0, 1.0, 0.0, 0.0, 0.0, 0.0, 0.0, 0.0]",Also the fact that compounds this belief is that as today 's youngsters we have more modes and sources of entertainment and enjoyment at our disposal than did the elders when they were in their prime .
2962,"[0.0, 0.0, 0.0, 0.0, 1.0, 0.0, 0.0, 0.0, 0.0, 0.0, 0.0]","Take for example Computers and Television , two of the commonest modes of entertainment today that were not even invented when our grandads and grand nannies were our age ."
2963,"[0.0, 0.0, 0.0, 0.0, 1.0, 0.0, 0.0, 0.0, 0.0, 0.0, 0.0]",This sheer availability of resources to us affects our ability to enjoy more .
2964,"[0.0, 0.0, 0.0, 0.0, 1.0, 0.0, 0.0, 0.0, 0.0, 0.0, 0.0]",Then again it is more a matter of personal choice or opinion as every person has his own definition of enjoyment .
2965,"[0.0, 0.0, 0.0, 0.0, 1.0, 0.0, 0.0, 0.0, 0.0, 0.0, 0.0]",As per the way I perceive it I believe that youngsters today enjoy life on a larger scale that older people do .
2966,"[0.0, 0.0, 0.0, 1.0, 0.0, 0.0, 0.0, 0.0, 0.0, 0.0, 0.0]",I believe that young people enjoy life more than older people do .
2967,"[0.0, 0.0, 0.0, 1.0, 0.0, 0.0, 0.0, 0.0, 0.0, 0.0, 0.0]",There are many reasons why young people enjoy their life more
2968,"[0.0, 0.0, 0.0, 1.0, 0.0, 0.0, 0.0, 0.0, 0.0, 0.0, 0.0]",One reason why young people enjoy life more than older people is that they do n't worry about everything .
2969,"[0.0, 0.0, 0.0, 1.0, 0.0, 0.0, 0.0, 0.0, 0.0, 0.0, 0.0]",Young people mostly only think from one day to the other and do n't make any future plans .
2970,"[0.0, 0.0, 0.0, 1.0, 0.0, 0.0, 0.0, 0.0, 0.0, 0.0, 0.0]",Like getting a stable job to feed a family .
2971,"[0.0, 0.0, 0.0, 1.0, 0.0, 0.0, 0.0, 0.0, 0.0, 0.0, 0.0]",Mostly they wo n't have a family until their mid thirties .
2972,"[0.0, 0.0, 0.0, 1.0, 0.0, 0.0, 0.0, 0.0, 0.0, 0.0, 0.0]",Another reason why young people enjoy life more than older people is because they are independent .
2973,"[0.0, 0.0, 0.0, 1.0, 0.0, 0.0, 0.0, 0.0, 0.0, 0.0, 0.0]",Their entire thinking is different from old people .
2974,"[0.0, 0.0, 0.0, 1.0, 0.0, 0.0, 0.0, 0.0, 0.0, 0.0, 0.0]",They do n't choose a job only because of the salary they also want to have a fulfilling job which is challenging .
2975,"[0.0, 0.0, 0.0, 1.0, 0.0, 0.0, 0.0, 0.0, 0.0, 0.0, 0.0]",A job which offers further options maybe to work in a different country .
2976,"[0.0, 0.0, 0.0, 1.0, 0.0, 0.0, 0.0, 0.0, 0.0, 0.0, 0.0]",Nowadays young people work to live on  -  older people live to work .
2977,"[0.0, 0.0, 0.0, 1.0, 0.0, 0.0, 0.0, 0.0, 0.0, 0.0, 0.0]",While older people think about security young people sometimes just quit their job if they are not satisfied anymore .
2978,"[0.0, 0.0, 0.0, 1.0, 0.0, 0.0, 0.0, 0.0, 0.0, 0.0, 0.0]",The third reason why young people enjoy life more than older people is because the have more options to enjoy themselves .
2979,"[0.0, 0.0, 0.0, 1.0, 0.0, 0.0, 0.0, 0.0, 0.0, 0.0, 0.0]",There are plenty of free time activities they can go to .
2980,"[0.0, 0.0, 0.0, 1.0, 0.0, 0.0, 0.0, 0.0, 0.0, 0.0, 0.0]","There many clubs , bars etc. which meet young people 's interests ."
2981,"[0.0, 0.0, 0.0, 1.0, 0.0, 0.0, 0.0, 0.0, 0.0, 0.0, 0.0]",Whereas there are only a few clubs or bars where old people can go to without getting stared at .
2982,"[0.0, 0.0, 0.0, 1.0, 0.0, 0.0, 0.0, 0.0, 0.0, 0.0, 0.0]",Young people are able to go almost anywhere they want to without any age limits .
2983,"[0.0, 0.0, 0.0, 1.0, 0.0, 0.0, 0.0, 0.0, 0.0, 0.0, 0.0]",All together young people have plenty of reasons to enjoy life more than older people .
2984,"[0.0, 0.0, 0.0, 0.0, 0.0, 0.0, 0.0, 1.0, 0.0, 0.0, 0.0]","In addressing whether younger people enjoy life more than older people , I can not state for certain ."
2985,"[0.0, 0.0, 0.0, 0.0, 0.0, 0.0, 0.0, 1.0, 0.0, 0.0, 0.0]","However , I think that enjoying life is not heavily dependent upon age , but rather on the different situations of each person ."
2986,"[0.0, 0.0, 0.0, 0.0, 0.0, 0.0, 0.0, 1.0, 0.0, 0.0, 0.0]","Admittedly , young people seem to enjoy life more than older people on the outside ."
2987,"[0.0, 0.0, 0.0, 0.0, 0.0, 0.0, 0.0, 1.0, 0.0, 0.0, 0.0]","This is because younger people are more vibrant , adventurous , and have more energy ."
2988,"[0.0, 0.0, 0.0, 0.0, 0.0, 0.0, 0.0, 1.0, 0.0, 0.0, 0.0]","They have less responsibilities than older people , giving them more freedom to explore and have fun ."
2989,"[0.0, 0.0, 0.0, 0.0, 0.0, 0.0, 0.0, 1.0, 0.0, 0.0, 0.0]",But I can not rule out the burdens that I have experienced growing up .
2990,"[0.0, 0.0, 0.0, 0.0, 0.0, 0.0, 0.0, 1.0, 0.0, 0.0, 0.0]","For example , the pressure of entering university , then graduating , and then acquiring a job ."
2991,"[0.0, 0.0, 0.0, 0.0, 0.0, 0.0, 0.0, 1.0, 0.0, 0.0, 0.0]",It seemed that overcoming a hill led to an even bigger mountain .
2992,"[0.0, 0.0, 0.0, 0.0, 0.0, 0.0, 0.0, 1.0, 0.0, 0.0, 0.0]","However , I can not ignore the fact that as people grow older , they have achieved many things along the way ."
2993,"[0.0, 0.0, 0.0, 0.0, 0.0, 0.0, 0.0, 1.0, 0.0, 0.0, 0.0]","For example , a stable job , leisure time to do hobbies , birth and nature of children are just some of the things that can lead to an enjoyable and fulfilling life ."
2994,"[0.0, 0.0, 0.0, 0.0, 0.0, 0.0, 0.0, 1.0, 0.0, 0.0, 0.0]","In addition , the period after retirement seems so liberating and enjoyable ."
2995,"[0.0, 0.0, 0.0, 0.0, 0.0, 0.0, 0.0, 1.0, 0.0, 0.0, 0.0]","But on the other hand , older people have more responsibilities , meaning less time to yourself to enjoy life ."
2996,"[0.0, 0.0, 0.0, 0.0, 0.0, 0.0, 0.0, 1.0, 0.0, 0.0, 0.0]","It seems that who enjoys life more , the younger or older , does not depend on age , but rather on how the individual grows up and becomes older ."
2997,"[0.0, 0.0, 0.0, 0.0, 0.0, 0.0, 0.0, 1.0, 0.0, 0.0, 0.0]","Some people may think that their childhood was a disaster , without many good memories , while being at there happiest at an older age ."
2998,"[0.0, 0.0, 0.0, 0.0, 0.0, 0.0, 0.0, 1.0, 0.0, 0.0, 0.0]","On the other hand , some people may miss their childhood and wish that they could go back to the innocent days when they were free to do whatever they wanted ."
2999,"[0.0, 0.0, 0.0, 0.0, 0.0, 0.0, 0.0, 1.0, 0.0, 0.0, 0.0]","In conclusion , I do not fully agree with this statement , as questioning happiness based on age does not produce a reliable answer ."
3000,"[0.0, 0.0, 0.0, 0.0, 0.0, 0.0, 0.0, 1.0, 0.0, 0.0, 0.0]","Rather happiness , whenever experienced depends on the individuals life"
3001,"[0.0, 0.0, 0.0, 0.0, 0.0, 0.0, 0.0, 0.0, 0.0, 1.0, 0.0]","young people now a days doing a lot of work for their communities by running OLD AGE HOMES , & CHILD HOMES ."
3002,"[0.0, 0.0, 0.0, 0.0, 0.0, 0.0, 0.0, 0.0, 0.0, 1.0, 0.0]",many old people in the community are send to the OLD AGE HOMES for their better life .
3003,"[0.0, 0.0, 0.0, 0.0, 0.0, 0.0, 0.0, 0.0, 0.0, 1.0, 0.0]",children in the street are send to their child homes .
3004,"[0.0, 0.0, 0.0, 0.0, 0.0, 0.0, 0.0, 0.0, 0.0, 1.0, 0.0]","practically people are busy in this year , but indirectly the young people are sending money for old age homes ."
3005,"[0.0, 0.0, 0.0, 0.0, 0.0, 0.0, 0.0, 0.0, 0.0, 1.0, 0.0]",they are contributing 10 % of their income to churches & charity trusts .
3006,"[0.0, 0.0, 0.0, 0.0, 0.0, 0.0, 0.0, 0.0, 0.0, 1.0, 0.0]",mainly people are engaged to earn money for their good lives .
3007,"[0.0, 0.0, 0.0, 0.0, 0.0, 0.0, 0.0, 0.0, 0.0, 1.0, 0.0]",i think contributing money to the poor is also a indirect help to the people .
3008,"[0.0, 0.0, 0.0, 0.0, 0.0, 0.0, 0.0, 0.0, 0.0, 1.0, 0.0]",which helps clot for their survival .
3009,"[0.0, 0.0, 0.0, 0.0, 0.0, 0.0, 0.0, 0.0, 0.0, 1.0, 0.0]","my own experience , my uncle 's old grand father used to serve their old parents in their home in olden days ."
3010,"[0.0, 0.0, 0.0, 0.0, 0.0, 0.0, 0.0, 0.0, 0.0, 1.0, 0.0]",and he used to serve the community .
3011,"[0.0, 0.0, 0.0, 0.0, 0.0, 0.0, 0.0, 0.0, 0.0, 1.0, 0.0]",but my uncle used to serve their own parents by sending them to old age home .
3012,"[0.0, 0.0, 0.0, 0.0, 0.0, 0.0, 0.0, 0.0, 0.0, 1.0, 0.0]",my uncle used to send money for their expenses to the hostel management .
3013,"[0.0, 0.0, 0.0, 0.0, 0.0, 0.0, 0.0, 0.0, 0.0, 1.0, 0.0]",they were given excellent medical treatment by the 24 hr doctor facility .
3014,"[0.0, 0.0, 0.0, 0.0, 0.0, 0.0, 0.0, 0.0, 0.0, 1.0, 0.0]",they were taken better care & good food
3015,"[0.0, 0.0, 0.0, 0.0, 0.0, 0.0, 0.0, 0.0, 0.0, 1.0, 0.0]",i think it is better because my uncle is a job holder. & aunty was expired .
3016,"[0.0, 0.0, 0.0, 0.0, 0.0, 0.0, 0.0, 0.0, 0.0, 1.0, 0.0]","he is not having time to see his parents , so i think it better way for the old people to stay in the hostel , where his son will meet them every day evening ."
3017,"[0.0, 0.0, 0.0, 0.0, 0.0, 0.0, 0.0, 0.0, 0.0, 1.0, 0.0]","coming to point my uncle is paying high amount for the hostel , that 6 people can survive with that amount in that hostel ."
3018,"[0.0, 0.0, 0.0, 0.0, 0.0, 0.0, 0.0, 0.0, 0.0, 1.0, 0.0]",i think he is indirectly helping community for the improvement .
3019,"[0.0, 0.0, 0.0, 0.0, 0.0, 0.0, 0.0, 0.0, 0.0, 1.0, 0.0]",in olden days many people not having proper jobs & mainly doing agriculture as main occupation in that time the people having more time to serve the community .
3020,"[0.0, 0.0, 0.0, 0.0, 0.0, 0.0, 0.0, 0.0, 0.0, 1.0, 0.0]",but in modern days people not having sufficient time to sleep also .
3021,"[0.0, 0.0, 0.0, 0.0, 0.0, 0.0, 0.0, 0.0, 0.0, 1.0, 0.0]",in this situation i think helping the community .
3022,"[0.0, 0.0, 0.0, 0.0, 0.0, 0.0, 0.0, 0.0, 0.0, 1.0, 0.0]",through practical approach is impossible .
3023,"[0.0, 0.0, 0.0, 0.0, 0.0, 0.0, 0.0, 0.0, 0.0, 1.0, 0.0]","so as STEAM COMPANY people are adopting several villages around their loyalty , they are providing water , health facilities , schools , etc to the ; people in the village ."
3024,"[0.0, 0.0, 0.0, 0.0, 0.0, 0.0, 0.0, 0.0, 0.0, 1.0, 0.0]","it is mainly succesful because by getting profits to that company , by doing hard work by its job holders ."
3025,"[0.0, 0.0, 0.0, 0.0, 0.0, 0.0, 0.0, 0.0, 0.0, 1.0, 0.0]","i think by doing their job perfectly they are doing service to the people arround the village , it is indirect help doing by steam company job holders"
3026,"[0.0, 0.0, 0.0, 0.0, 0.0, 0.0, 0.0, 0.0, 0.0, 1.0, 0.0]","finally i conclude , involuntary work can also led to service to the community like i stated above ."
3027,"[0.0, 0.0, 1.0, 0.0, 0.0, 0.0, 0.0, 0.0, 0.0, 0.0, 0.0]","In the current society , not having his drivers license means a none access to different things coming from places , foods and jobs ."
3028,"[0.0, 0.0, 1.0, 0.0, 0.0, 0.0, 0.0, 0.0, 0.0, 0.0, 0.0]",That shows the importance of cars in the society .
3029,"[0.0, 0.0, 1.0, 0.0, 0.0, 0.0, 0.0, 0.0, 0.0, 0.0, 0.0]",Car consume foul which emissions are the main cause of global warming .
3030,"[0.0, 0.0, 1.0, 0.0, 0.0, 0.0, 0.0, 0.0, 0.0, 0.0, 0.0]",Therefore the tendency is to limit the negative impact of our state of life on environment including car .
3031,"[0.0, 0.0, 1.0, 0.0, 0.0, 0.0, 0.0, 0.0, 0.0, 0.0, 0.0]",The aim of this say will be to discuss about the evolution of car number for the next 30 years .
3032,"[0.0, 0.0, 1.0, 0.0, 0.0, 0.0, 0.0, 0.0, 0.0, 0.0, 0.0]","Manufacturing car involves many different industries like steel , aluminium , flat glass and plastic production ."
3033,"[0.0, 0.0, 1.0, 0.0, 0.0, 0.0, 0.0, 0.0, 0.0, 0.0, 0.0]",Those massive industries take an important part in the economy of a country .
3034,"[0.0, 0.0, 1.0, 0.0, 0.0, 0.0, 0.0, 0.0, 0.0, 0.0, 0.0]","Then , the decrease of production of car will have an important impact om it until new orientation are made ."
3035,"[0.0, 0.0, 1.0, 0.0, 0.0, 0.0, 0.0, 0.0, 0.0, 0.0, 0.0]","Furthermore , may cars works with foul which leads the economy of many countries too ."
3036,"[0.0, 0.0, 1.0, 0.0, 0.0, 0.0, 0.0, 0.0, 0.0, 0.0, 0.0]","It must be say that car using alternative energy are emerging but as petrol will lead the market , producers will not have sufficient help and consideration ."
3037,"[0.0, 0.0, 1.0, 0.0, 0.0, 0.0, 0.0, 0.0, 0.0, 0.0, 0.0]","In addition to that , east countries like India and China faced to an important economic development ."
3038,"[0.0, 0.0, 1.0, 0.0, 0.0, 0.0, 0.0, 0.0, 0.0, 0.0, 0.0]",The demand of car will be very hight for the next few years .
3039,"[0.0, 0.0, 1.0, 0.0, 0.0, 0.0, 0.0, 0.0, 0.0, 0.0, 0.0]","Therefor I don , t think that the level of car will decrease ."
3040,"[0.0, 0.0, 1.0, 0.0, 0.0, 0.0, 0.0, 0.0, 0.0, 0.0, 0.0]",The solution is more to change the mind of drivers : they use car to often : money solution like driver tax entering a city like in london sociological orientation better use of common transport bus train
3041,"[0.0, 0.0, 1.0, 0.0, 0.0, 0.0, 0.0, 0.0, 0.0, 0.0, 0.0]","Change in the process of car consumption and so were one of the most part in economy of the country In some countries , statistics have showed that there are more car than people ."
3042,"[0.0, 0.0, 1.0, 0.0, 0.0, 0.0, 0.0, 0.0, 0.0, 0.0, 0.0]","Lay off against car 's manufactures like in california but no real impact Delocalisation in eastern country , growth of hint and india so more car will be constructed in this areas ."
3043,"[0.0, 0.0, 1.0, 0.0, 0.0, 0.0, 0.0, 0.0, 0.0, 0.0, 0.0]",So the real question is not to know if there will be fewer car in use in the future but if those car will be more against the environment .
3044,"[0.0, 0.0, 1.0, 0.0, 0.0, 0.0, 0.0, 0.0, 0.0, 0.0, 0.0]",Policy regarding the environment are becoming more and more present in European countries and so the industry has to suit to this laws .
3045,"[0.0, 0.0, 1.0, 0.0, 0.0, 0.0, 0.0, 0.0, 0.0, 0.0, 0.0]",N
3046,"[0.0, 0.0, 0.0, 0.0, 0.0, 0.0, 0.0, 0.0, 1.0, 0.0, 0.0]",Ideas and concepts prepare the base of something that wants to be learnt .
3047,"[0.0, 0.0, 0.0, 0.0, 0.0, 0.0, 0.0, 0.0, 1.0, 0.0, 0.0]",Learing from facts means to experience something and so it means to have a deep knowledge .
3048,"[0.0, 0.0, 0.0, 0.0, 0.0, 0.0, 0.0, 0.0, 1.0, 0.0, 0.0]","Thus , from my point of view it is more important to learn from facts rather than to understand ideas and concepts ."
3049,"[0.0, 0.0, 0.0, 0.0, 0.0, 0.0, 0.0, 0.0, 1.0, 0.0, 0.0]","If not , you do not really know what you have learnt ."
3050,"[0.0, 0.0, 0.0, 0.0, 0.0, 0.0, 0.0, 0.0, 1.0, 0.0, 0.0]","In order to learn something , the understanding of the ideas and concepts is an important thing ."
3051,"[0.0, 0.0, 0.0, 0.0, 0.0, 0.0, 0.0, 0.0, 1.0, 0.0, 0.0]","For instance , if you are learing about literature during a cert period of time , it is very important to understand the concepts that it involves such as the social context , the different author and the style of writing ."
3052,"[0.0, 0.0, 0.0, 0.0, 0.0, 0.0, 0.0, 0.0, 1.0, 0.0, 0.0]",This create an important background of knowledge about the literature but you do not learn everything because you do not read the literature .
3053,"[0.0, 0.0, 0.0, 0.0, 0.0, 0.0, 0.0, 0.0, 1.0, 0.0, 0.0]","In contrast to the above , if the facts are learnt a better understanding can be obtained ."
3054,"[0.0, 0.0, 0.0, 0.0, 0.0, 0.0, 0.0, 0.0, 1.0, 0.0, 0.0]","For example , instead of trying to understand the ideas and concepts of this literature century , the option of reading the main books of this century should be taken ."
3055,"[0.0, 0.0, 0.0, 0.0, 0.0, 0.0, 0.0, 0.0, 1.0, 0.0, 0.0]","If the books of the main writers are read , the students will be able to infer a great deal of things so that a better understanding is reached ."
3056,"[0.0, 0.0, 0.0, 0.0, 0.0, 0.0, 0.0, 0.0, 1.0, 0.0, 0.0]",Most of the things that are learnt by isolated concepts and ideas can be drawn by a carefully reading of the most important authors .
3057,"[0.0, 0.0, 0.0, 0.0, 0.0, 0.0, 0.0, 0.0, 1.0, 0.0, 0.0]","Therefore , if you try to learn facts you get the concepts and ideas that you would need to understand something while with the other way around is not possible ."
3058,"[0.0, 0.0, 0.0, 0.0, 0.0, 0.0, 0.0, 0.0, 1.0, 0.0, 0.0]","Thus , I think it is more important to learn from facts rather than ideas or concepts ."
3059,"[0.0, 0.0, 1.0, 0.0, 0.0, 0.0, 0.0, 0.0, 0.0, 0.0, 0.0]",I think that young people enjoy life more than older people do this maybe because of my personal experience .
3060,"[0.0, 0.0, 1.0, 0.0, 0.0, 0.0, 0.0, 0.0, 0.0, 0.0, 0.0]","Actually , I am a young student still in high school and think that I really do enjoy life more than my parents for example ."
3061,"[0.0, 0.0, 1.0, 0.0, 0.0, 0.0, 0.0, 0.0, 0.0, 0.0, 0.0]",I am saying this because being young means not a lot of responsibility and a lot more freedom .
3062,"[0.0, 0.0, 1.0, 0.0, 0.0, 0.0, 0.0, 0.0, 0.0, 0.0, 0.0]","First , I want to say that as a young student I am not responsible for a lot of things in my life ."
3063,"[0.0, 0.0, 1.0, 0.0, 0.0, 0.0, 0.0, 0.0, 0.0, 0.0, 0.0]","Of course , except the education success but this could also be my decision , to be successful or not ."
3064,"[0.0, 0.0, 1.0, 0.0, 0.0, 0.0, 0.0, 0.0, 0.0, 0.0, 0.0]","Nevertheless young people are not responsible for any criminal act : when a young boy is for example charged of something , the parents take full responsibility ."
3065,"[0.0, 0.0, 1.0, 0.0, 0.0, 0.0, 0.0, 0.0, 0.0, 0.0, 0.0]","In addition , young people have no job stress , they only have a school to worry about but no more and the work done at school could not be compared to the work of a real job ."
3066,"[0.0, 0.0, 1.0, 0.0, 0.0, 0.0, 0.0, 0.0, 0.0, 0.0, 0.0]",we have no responsibility of living as our parents cover all our personal needs .
3067,"[0.0, 0.0, 1.0, 0.0, 0.0, 0.0, 0.0, 0.0, 0.0, 0.0, 0.0]",We have then no responsibility of finding a job to be able to live .
3068,"[0.0, 0.0, 1.0, 0.0, 0.0, 0.0, 0.0, 0.0, 0.0, 0.0, 0.0]","Less responsibility , is more freedom ."
3069,"[0.0, 0.0, 1.0, 0.0, 0.0, 0.0, 0.0, 0.0, 0.0, 0.0, 0.0]",I think that young people have more time in every aspect of life .
3070,"[0.0, 0.0, 1.0, 0.0, 0.0, 0.0, 0.0, 0.0, 0.0, 0.0, 0.0]",An important aspect are mistakes ; in fact we have more time when young to make mistakes and correct them .
3071,"[0.0, 0.0, 1.0, 0.0, 0.0, 0.0, 0.0, 0.0, 0.0, 0.0, 0.0]","For example , I can make a bad decision choosing what I want to study , being young allows me to reconsider my decision and start another program or course on another field of study ."
3072,"[0.0, 0.0, 1.0, 0.0, 0.0, 0.0, 0.0, 0.0, 0.0, 0.0, 0.0]",I can see also from my situation that being old disadvantage you from doing a lot of activities .
3073,"[0.0, 0.0, 1.0, 0.0, 0.0, 0.0, 0.0, 0.0, 0.0, 0.0, 0.0]","My father , who was a grat tennis player in his younger life have now a back problem and ca n't even run for a long period of time ."
3074,"[0.0, 0.0, 1.0, 0.0, 0.0, 0.0, 0.0, 0.0, 0.0, 0.0, 0.0]",I can not imagine myself not playing soccer when I grow older .
3075,"[0.0, 0.0, 1.0, 0.0, 0.0, 0.0, 0.0, 0.0, 0.0, 0.0, 0.0]","Being young means doing things that a lot of older people would n't do , like partying frequently ."
3076,"[0.0, 0.0, 1.0, 0.0, 0.0, 0.0, 0.0, 0.0, 0.0, 0.0, 0.0]",young people have this caracter that pushes them to go dance and spend a lot of time with friends and do a lot of things at the same time .
3077,"[0.0, 0.0, 1.0, 0.0, 0.0, 0.0, 0.0, 0.0, 0.0, 0.0, 0.0]","With the reasons and examples stated before , I came to a conclusion that being young allows to enjoy life more than being old ."
3078,"[0.0, 0.0, 1.0, 0.0, 0.0, 0.0, 0.0, 0.0, 0.0, 0.0, 0.0]",this could be different for other people
3079,"[0.0, 0.0, 0.0, 0.0, 1.0, 0.0, 0.0, 0.0, 0.0, 0.0, 0.0]",`` It is the idea that create one 's interest in learning things conceptually and this eventually leads him know the facts related to the idea ''
3080,"[0.0, 0.0, 0.0, 0.0, 1.0, 0.0, 0.0, 0.0, 0.0, 0.0, 0.0]",As far as my opinion is concerned i agree with the statement `` It is important for student to understand ideas and concept than it is for them to learn the facts '' because unless i get an idea i will not know how to start with .
3081,"[0.0, 0.0, 0.0, 0.0, 1.0, 0.0, 0.0, 0.0, 0.0, 0.0, 0.0]","Once i get an idea i will try learning , learning needs the conceptual base for the skilled building ."
3082,"[0.0, 0.0, 0.0, 0.0, 1.0, 0.0, 0.0, 0.0, 0.0, 0.0, 0.0]",As soon as i start learning and i acquire concept i will try getting back to the history of that particular idea will will get me across the facts related to it .
3083,"[0.0, 0.0, 0.0, 0.0, 1.0, 0.0, 0.0, 0.0, 0.0, 0.0, 0.0]",On the contrary if i learn facts this will not helps me to be more creative .
3084,"[0.0, 0.0, 0.0, 0.0, 1.0, 0.0, 0.0, 0.0, 0.0, 0.0, 0.0]","For example , as a doctor if i have an idea of research in neuron and glial cells in brain i will first study the whole stuff related to the neurons , the glial cells and the things related to these two things ."
3085,"[0.0, 0.0, 0.0, 0.0, 1.0, 0.0, 0.0, 0.0, 0.0, 0.0, 0.0]",After understanding the concept of the research and having a clear idea i can get along with the research .
3086,"[0.0, 0.0, 0.0, 0.0, 1.0, 0.0, 0.0, 0.0, 0.0, 0.0, 0.0]",During the research i will come across the facts regarding the neurons and the glial cells .
3087,"[0.0, 0.0, 0.0, 0.0, 1.0, 0.0, 0.0, 0.0, 0.0, 0.0, 0.0]",On the other hand if i start with the facts my knowledge will be limited to an extent and i will not try learning more about it as i will be convinced by the the tag it has got that is `` FACT '' .
3088,"[0.0, 0.0, 0.0, 0.0, 1.0, 0.0, 0.0, 0.0, 0.0, 0.0, 0.0]",Once i know it is fact i will not try learning about it .
3089,"[0.0, 0.0, 0.0, 0.0, 1.0, 0.0, 0.0, 0.0, 0.0, 0.0, 0.0]",Thus i feel it is more important for students to understand ideas and concept than it is for them to learn facts .
3090,"[0.0, 0.0, 0.0, 0.0, 1.0, 0.0, 0.0, 0.0, 0.0, 0.0, 0.0]",This will make them more innovative and provides them with a wide scope of learning the subject .
3091,"[0.0, 0.0, 0.0, 0.0, 1.0, 0.0, 0.0, 0.0, 0.0, 0.0, 0.0]",when one understands the idea and concept definedly he will come across the facts related to the subject .
3092,"[0.0, 0.0, 0.0, 0.0, 1.0, 0.0, 0.0, 0.0, 0.0, 0.0, 0.0]","To conclude `` Ideas and concepts include facts , but not the vice versa ''"
3093,"[0.0, 1.0, 0.0, 0.0, 0.0, 0.0, 0.0, 0.0, 0.0, 0.0, 0.0]","every long holiday , we can see a lot of young people playing at parties , going shopping , traveling and taking parties with their friends ."
3094,"[0.0, 1.0, 0.0, 0.0, 0.0, 0.0, 0.0, 0.0, 0.0, 0.0, 0.0]",abd most of their parents stay at home .
3095,"[0.0, 1.0, 0.0, 0.0, 0.0, 0.0, 0.0, 0.0, 0.0, 0.0, 0.0]",that is a common phenomenon in many societies .
3096,"[0.0, 1.0, 0.0, 0.0, 0.0, 0.0, 0.0, 0.0, 0.0, 0.0, 0.0]","from this scene , we can see young people enjoy their life than the old people do ."
3097,"[0.0, 1.0, 0.0, 0.0, 0.0, 0.0, 0.0, 0.0, 0.0, 0.0, 0.0]","in my point of view , this situation may based on several reasons ."
3098,"[0.0, 1.0, 0.0, 0.0, 0.0, 0.0, 0.0, 0.0, 0.0, 0.0, 0.0]","the young love to try new thing , and they are easier to master a new technology ."
3099,"[0.0, 1.0, 0.0, 0.0, 0.0, 0.0, 0.0, 0.0, 0.0, 0.0, 0.0]",they tend to live in a stimulating life .
3100,"[0.0, 1.0, 0.0, 0.0, 0.0, 0.0, 0.0, 0.0, 0.0, 0.0, 0.0]","for example , during my travel , i have met a 19 - year - old boy , he told me that he made this travel for jumping ."
3101,"[0.0, 1.0, 0.0, 0.0, 0.0, 0.0, 0.0, 0.0, 0.0, 0.0, 0.0]",i am surprised and did n't know why he wanted to `` jumping '' .then he told me that is a kind of new sport item .
3102,"[0.0, 1.0, 0.0, 0.0, 0.0, 0.0, 0.0, 0.0, 0.0, 0.0, 0.0]",he would jump from a high mountain or a gliff !
3103,"[0.0, 1.0, 0.0, 0.0, 0.0, 0.0, 0.0, 0.0, 0.0, 0.0, 0.0]",the reason he was fascinated with this is just because he was trying new things .
3104,"[0.0, 1.0, 0.0, 0.0, 0.0, 0.0, 0.0, 0.0, 0.0, 0.0, 0.0]","he has enough courage to enjoy himself by this wat , but the old ca n't ."
3105,"[0.0, 1.0, 0.0, 0.0, 0.0, 0.0, 0.0, 0.0, 0.0, 0.0, 0.0]","we are young , we can meet challenge physically and mentally ."
3106,"[0.0, 1.0, 0.0, 0.0, 0.0, 0.0, 0.0, 0.0, 0.0, 0.0, 0.0]",the second reason is that the young spend money more generous .
