,label,sent
0,"[0.0, 0.0, 0.0, 0.0, 0.0, 0.0, 1.0, 0.0, 0.0, 0.0, 0.0]",I think to understand ideas and concepts is more important for students than it is for them to learn facts .
1,"[0.0, 0.0, 0.0, 0.0, 0.0, 0.0, 1.0, 0.0, 0.0, 0.0, 0.0]",The reason is that to understand ideas and concepts is more creative activities for students .
2,"[0.0, 0.0, 0.0, 0.0, 0.0, 0.0, 1.0, 0.0, 0.0, 0.0, 0.0]","When we try to understand the ideas and concepts , we must consider lots of factors of ideas and concepts ."
3,"[0.0, 0.0, 0.0, 0.0, 0.0, 0.0, 1.0, 0.0, 0.0, 0.0, 0.0]","At first we must confirm whose ideas or concepts they are , to add more information to them as the backgrounds ."
4,"[0.0, 0.0, 0.0, 0.0, 0.0, 0.0, 1.0, 0.0, 0.0, 0.0, 0.0]","Next , we make analyse why they have the ideas or the concepts using acquired background information ."
5,"[0.0, 0.0, 0.0, 0.0, 0.0, 0.0, 1.0, 0.0, 0.0, 0.0, 0.0]","After these processes , we can approach to the stage to make answers or own opinions ."
6,"[0.0, 0.0, 0.0, 0.0, 0.0, 0.0, 1.0, 0.0, 0.0, 0.0, 0.0]","To get answers or opinions , students can make discussion with friends , parent , and brothers ."
7,"[0.0, 0.0, 0.0, 0.0, 0.0, 0.0, 1.0, 0.0, 0.0, 0.0, 0.0]","In addition , they can get some suggestions from their teachers or they also can make investigation using books or internet to add more information ."
8,"[0.0, 0.0, 0.0, 0.0, 0.0, 0.0, 1.0, 0.0, 0.0, 0.0, 0.0]",I think that these consequent processes are very important for students to develop their way of thinking .
9,"[0.0, 0.0, 0.0, 0.0, 0.0, 0.0, 1.0, 0.0, 0.0, 0.0, 0.0]","In contrast , learning facts does not need such processes ."
10,"[0.0, 0.0, 0.0, 0.0, 0.0, 0.0, 1.0, 0.0, 0.0, 0.0, 0.0]",It is easy to access the fact without any kind of thinking .
11,"[0.0, 0.0, 0.0, 0.0, 0.0, 0.0, 1.0, 0.0, 0.0, 0.0, 0.0]","To learn facts , students just sit down on their seats in the class room and just listen to what their teacher says ."
12,"[0.0, 0.0, 0.0, 0.0, 0.0, 0.0, 1.0, 0.0, 0.0, 0.0, 0.0]","In this case , the information is only given form their teacher to students ."
13,"[0.0, 0.0, 0.0, 0.0, 0.0, 0.0, 1.0, 0.0, 0.0, 0.0, 0.0]","If students listen to what their teacher says and write down it on their notebook , they can get new knowledge ."
14,"[0.0, 0.0, 0.0, 0.0, 0.0, 0.0, 1.0, 0.0, 0.0, 0.0, 0.0]",But do they use their brain to consider anything during this behaviour ?
15,"[0.0, 0.0, 0.0, 0.0, 0.0, 0.0, 1.0, 0.0, 0.0, 0.0, 0.0]",The answer is no .
16,"[0.0, 0.0, 0.0, 0.0, 0.0, 0.0, 1.0, 0.0, 0.0, 0.0, 0.0]",They just listen and move their hand to write .
17,"[0.0, 0.0, 0.0, 0.0, 0.0, 0.0, 1.0, 0.0, 0.0, 0.0, 0.0]",These processes are not creative and maybe marines can do it completely .
18,"[0.0, 0.0, 0.0, 0.0, 0.0, 0.0, 1.0, 0.0, 0.0, 0.0, 0.0]","In conclusion , I strongly think to understand ideas and concepts is more important for students than it is for them to learn facts ."
19,"[0.0, 0.0, 0.0, 0.0, 1.0, 0.0, 0.0, 0.0, 0.0, 0.0, 0.0]",When we peek outside our houses the thing we can find in abundance outside our houses and on the roads is unrefutedly the Cars in different designs and colors .
20,"[0.0, 0.0, 0.0, 0.0, 1.0, 0.0, 0.0, 0.0, 0.0, 0.0, 0.0]",The cars have changed the way we travel .
21,"[0.0, 0.0, 0.0, 0.0, 1.0, 0.0, 0.0, 0.0, 0.0, 0.0, 0.0]",The invention of cars have brought a kind of a revolution in the times .
22,"[0.0, 0.0, 0.0, 0.0, 1.0, 0.0, 0.0, 0.0, 0.0, 0.0, 0.0]",In addition to making the conveyance easier to saving time to accessing the remote areas cars have done almost everything to make our life more comfortable .
23,"[0.0, 0.0, 0.0, 0.0, 1.0, 0.0, 0.0, 0.0, 0.0, 0.0, 0.0]",With the changing technologies and increasing economic growth i dont believe that the next twenty years in any way see a reduction in the cars .
24,"[0.0, 0.0, 0.0, 0.0, 1.0, 0.0, 0.0, 0.0, 0.0, 0.0, 0.0]","This will be mainly because of the demand , advancement and status these four wheeled wonder is going to bring about ."
25,"[0.0, 0.0, 0.0, 0.0, 1.0, 0.0, 0.0, 0.0, 0.0, 0.0, 0.0]",With the increase in the pocket income and incentives more and more people will be able to buy the cars .
26,"[0.0, 0.0, 0.0, 0.0, 1.0, 0.0, 0.0, 0.0, 0.0, 0.0, 0.0]",After all who wants to experience the overcrowding in the buses and trains and the waste of precious time these inconvenient travelling measures bring about .
27,"[0.0, 0.0, 0.0, 0.0, 1.0, 0.0, 0.0, 0.0, 0.0, 0.0, 0.0]",The another factor which will increase the demand is the population growth .
28,"[0.0, 0.0, 0.0, 0.0, 1.0, 0.0, 0.0, 0.0, 0.0, 0.0, 0.0]",With the population of the world sky rocketing the number of people who can avail the benefits of cars will increase and so do the cars .
29,"[0.0, 0.0, 0.0, 0.0, 1.0, 0.0, 0.0, 0.0, 0.0, 0.0, 0.0]",Also with the advancement in the technology we will witness a whole new genre of cars in the next twenty years .
30,"[0.0, 0.0, 0.0, 0.0, 1.0, 0.0, 0.0, 0.0, 0.0, 0.0, 0.0]",When people see something new and innovative they have a urge to buy it even though they may be having an absolute version of it .
31,"[0.0, 0.0, 0.0, 0.0, 1.0, 0.0, 0.0, 0.0, 0.0, 0.0, 0.0]",So there may be many people with two or three cars in the next coming years .
32,"[0.0, 0.0, 0.0, 0.0, 1.0, 0.0, 0.0, 0.0, 0.0, 0.0, 0.0]",Cars are frequently being associated with the social status of the people .
33,"[0.0, 0.0, 0.0, 0.0, 1.0, 0.0, 0.0, 0.0, 0.0, 0.0, 0.0]",The people try to get everything that will elevate their status .
34,"[0.0, 0.0, 0.0, 0.0, 1.0, 0.0, 0.0, 0.0, 0.0, 0.0, 0.0]",In many families we see people having many cars .
35,"[0.0, 0.0, 0.0, 0.0, 1.0, 0.0, 0.0, 0.0, 0.0, 0.0, 0.0]","One for going to office and other for social parties , other for children and hence enhancing their status with each car ."
36,"[0.0, 0.0, 0.0, 0.0, 1.0, 0.0, 0.0, 0.0, 0.0, 0.0, 0.0]",With these kind of social attitudes the sale of cars is definitely going to increase .
37,"[0.0, 0.0, 0.0, 0.0, 1.0, 0.0, 0.0, 0.0, 0.0, 0.0, 0.0]",So we dont see any reason why the sales of cars will decline and we will see fewer number of cars in the years to come .
38,"[0.0, 0.0, 0.0, 0.0, 1.0, 0.0, 0.0, 0.0, 0.0, 0.0, 0.0]","Though the excessive use of cars will create problems like traffic jams , chaos for parking , pollution and petroleum problems ."
39,"[0.0, 0.0, 0.0, 0.0, 1.0, 0.0, 0.0, 0.0, 0.0, 0.0, 0.0]",But these problems will find a suitable solution .
40,"[0.0, 0.0, 0.0, 0.0, 1.0, 0.0, 0.0, 0.0, 0.0, 0.0, 0.0]",It just only needs cooperative effort and thinking .
41,"[0.0, 0.0, 0.0, 0.0, 1.0, 0.0, 0.0, 0.0, 0.0, 0.0, 0.0]",So in the next twenty years we will witness more and also attractive cars down the road .
42,"[0.0, 0.0, 1.0, 0.0, 0.0, 0.0, 0.0, 0.0, 0.0, 0.0, 0.0]","Generally speaking , advertisements make products attractive and desirable ."
43,"[0.0, 0.0, 1.0, 0.0, 0.0, 0.0, 0.0, 0.0, 0.0, 0.0, 0.0]","Let me start from scratch , what is the point of an advertisement ?"
44,"[0.0, 0.0, 1.0, 0.0, 0.0, 0.0, 0.0, 0.0, 0.0, 0.0, 0.0]",It is of course to make sell .
45,"[0.0, 0.0, 1.0, 0.0, 0.0, 0.0, 0.0, 0.0, 0.0, 0.0, 0.0]",And why would someone buy an object if it seems useless and uneffective ?
46,"[0.0, 0.0, 1.0, 0.0, 0.0, 0.0, 0.0, 0.0, 0.0, 0.0, 0.0]","As a result , advertisement naturally tries to make a product look interesting ."
47,"[0.0, 0.0, 1.0, 0.0, 0.0, 0.0, 0.0, 0.0, 0.0, 0.0, 0.0]","It is true that consequently , advertisements sometimes make a product seem much better than it really is ."
48,"[0.0, 0.0, 1.0, 0.0, 0.0, 0.0, 0.0, 0.0, 0.0, 0.0, 0.0]",Sometimes advertisements lie .
49,"[0.0, 0.0, 1.0, 0.0, 0.0, 0.0, 0.0, 0.0, 0.0, 0.0, 0.0]","Yet it is not necessarily in its own interest to lie to consumers since they are not so stupid , and once a consumer finds out that he had been betrayed , he will not buy the product of the advertisement anymore ."
50,"[0.0, 0.0, 1.0, 0.0, 0.0, 0.0, 0.0, 0.0, 0.0, 0.0, 0.0]",It might get even worst : the betrayed consumer may not buy any other products of this company .
51,"[0.0, 0.0, 1.0, 0.0, 0.0, 0.0, 0.0, 0.0, 0.0, 0.0, 0.0]","That is why , advertisements must be careful about what they are claiming , and they ought to win the consumer 's trust by simply telling him what the true advantages of such or such product are ."
52,"[0.0, 0.0, 1.0, 0.0, 0.0, 0.0, 0.0, 0.0, 0.0, 0.0, 0.0]","Yet , it is also true that advertisements tends to emphasize the pros of an object and to hide its disadvantages ."
53,"[0.0, 0.0, 1.0, 0.0, 0.0, 0.0, 0.0, 0.0, 0.0, 0.0, 0.0]",This is the implicit rule of business .
54,"[0.0, 0.0, 1.0, 0.0, 0.0, 0.0, 0.0, 0.0, 0.0, 0.0, 0.0]","Unfortunately , in occidental societies this rule is a general principle ."
55,"[0.0, 0.0, 1.0, 0.0, 0.0, 0.0, 0.0, 0.0, 0.0, 0.0, 0.0]",One can not avoid it .
56,"[0.0, 0.0, 1.0, 0.0, 0.0, 0.0, 0.0, 0.0, 0.0, 0.0, 0.0]",So one must not be gullible .
57,"[0.0, 0.0, 1.0, 0.0, 0.0, 0.0, 0.0, 0.0, 0.0, 0.0, 0.0]","For these reasons , I am not shocked by advertisements even if they are false ."
58,"[0.0, 0.0, 1.0, 0.0, 0.0, 0.0, 0.0, 0.0, 0.0, 0.0, 0.0]",One must simply be careful and read magazines about products that he wants to acquire .
59,"[0.0, 0.0, 1.0, 0.0, 0.0, 0.0, 0.0, 0.0, 0.0, 0.0, 0.0]","Besides , I believe that advertisement is a everyday enjoyment ."
60,"[0.0, 0.0, 1.0, 0.0, 0.0, 0.0, 0.0, 0.0, 0.0, 0.0, 0.0]","It is part of our life , and i do think that they are some advertisements that are very well done and that are very enjoyable , even if they lie a little ."
61,"[0.0, 0.0, 1.0, 0.0, 0.0, 0.0, 0.0, 0.0, 0.0, 0.0, 0.0]",I prefer an interesting but lying commercial than a realistic boring one .
62,"[0.0, 0.0, 1.0, 0.0, 0.0, 0.0, 0.0, 0.0, 0.0, 0.0, 0.0]",Anyway the main goal of advertisements is to ; ake a product known right ?
63,"[0.0, 0.0, 1.0, 0.0, 0.0, 0.0, 0.0, 0.0, 0.0, 0.0, 0.0]",And what is ; ore striking that a beautiful advertisement ?
64,"[1.0, 0.0, 0.0, 0.0, 0.0, 0.0, 0.0, 0.0, 0.0, 0.0, 0.0]",in my opinion .
65,"[1.0, 0.0, 0.0, 0.0, 0.0, 0.0, 0.0, 0.0, 0.0, 0.0, 0.0]",i beleave it is more important for students to understand ideas and concepts than it is for them to learn factslike speed and smoke .
66,"[1.0, 0.0, 0.0, 0.0, 0.0, 0.0, 0.0, 0.0, 0.0, 0.0, 0.0]",for example when we talk about speed they must understand why it is dengues is better than if they have axcedant after that they learn .
67,"[1.0, 0.0, 0.0, 0.0, 0.0, 0.0, 0.0, 0.0, 0.0, 0.0, 0.0]",second example like smoke hf they understand why it is dangerous and they leave it is better than if they were sick or feel bad .
68,"[1.0, 0.0, 0.0, 0.0, 0.0, 0.0, 0.0, 0.0, 0.0, 0.0, 0.0]",finally i beleave it is more important for students to understand ideas and concepts it is for them to learn facts .
69,"[0.0, 0.0, 0.0, 0.0, 0.0, 0.0, 0.0, 0.0, 0.0, 0.0, 1.0]",I disagree the statement that young people enjoy life more than older people do because of some reasons .
70,"[0.0, 0.0, 0.0, 0.0, 0.0, 0.0, 0.0, 0.0, 0.0, 0.0, 1.0]","My some of the reasons to disagree that idea are ; first of all enjoying life does not connected to age completely , secondly when years are passed people get more experienced and finally older people understand life better than younger ones which help them to enjoy more ."
71,"[0.0, 0.0, 0.0, 0.0, 0.0, 0.0, 0.0, 0.0, 0.0, 0.0, 1.0]","To begin with , lets try to define ` enjoying` ."
72,"[0.0, 0.0, 0.0, 0.0, 0.0, 0.0, 0.0, 0.0, 0.0, 0.0, 1.0]",Is enjoying related to your physical situation ?
73,"[0.0, 0.0, 0.0, 0.0, 0.0, 0.0, 0.0, 0.0, 0.0, 0.0, 1.0]",what i think is that enjoying is having fun and being happy in a certain time period which is not dependent to your physical situation but your mental property .
74,"[0.0, 0.0, 0.0, 0.0, 0.0, 0.0, 0.0, 0.0, 0.0, 0.0, 1.0]","you can be very healthy about your muscles , organs and all your body but it doesnt mean anything if your mental condition is alright ."
75,"[0.0, 0.0, 0.0, 0.0, 0.0, 0.0, 0.0, 0.0, 0.0, 0.0, 1.0]","Additionally , experience is very important in life to enjoy it ."
76,"[0.0, 0.0, 0.0, 0.0, 0.0, 0.0, 0.0, 0.0, 0.0, 0.0, 1.0]",A famous singer says ` i know what it is to be young but you dont know what it is to be old ' when he reached the considerably old ages .
77,"[0.0, 0.0, 0.0, 0.0, 0.0, 0.0, 0.0, 0.0, 0.0, 0.0, 1.0]",People who lived a lot of things  -  which can be conspired as ` taste ' in life  -  learn how to defend and stand for bad happenings and it must help them to be happy even if they are in very bed situations .
78,"[0.0, 0.0, 0.0, 0.0, 0.0, 0.0, 0.0, 0.0, 0.0, 0.0, 1.0]","Finally , life is not very easy to understand and identify ."
79,"[0.0, 0.0, 0.0, 0.0, 0.0, 0.0, 0.0, 0.0, 0.0, 0.0, 1.0]",Every second passed through our life helps us to active the understanding of the aim and that identification of life .
80,"[0.0, 0.0, 0.0, 0.0, 0.0, 0.0, 0.0, 0.0, 0.0, 0.0, 1.0]",This identification helps people to enjoy since the unavoidable end of this life is to ` die ' .
81,"[0.0, 0.0, 0.0, 0.0, 0.0, 0.0, 0.0, 0.0, 0.0, 0.0, 1.0]",Young people live as if they will never die whereas olders see that end easier than the youth that philosophical finish .
82,"[0.0, 0.0, 0.0, 0.0, 0.0, 0.0, 0.0, 0.0, 0.0, 0.0, 1.0]","Hence , i dont believe the idea that older people enjoy life less than the younger people do because i think it doesnt completely dependent on age and the reasons i mentioned above ."
83,"[0.0, 0.0, 0.0, 0.0, 0.0, 0.0, 0.0, 0.0, 0.0, 0.0, 1.0]",I see a lot of young people never enjoy whereas a lot of very old people smiling and having fun with their friends .
84,"[0.0, 0.0, 0.0, 1.0, 0.0, 0.0, 0.0, 0.0, 0.0, 0.0, 0.0]",The following essay focuses on the statement that young people enjoy their life more than older people do .
85,"[0.0, 0.0, 0.0, 1.0, 0.0, 0.0, 0.0, 0.0, 0.0, 0.0, 0.0]",From my point of view there are lot of things that make me feel like agreeing with this statement .
86,"[0.0, 0.0, 0.0, 1.0, 0.0, 0.0, 0.0, 0.0, 0.0, 0.0, 0.0]","For example younger people are usually not that settled or depending on other persons , which makes you enjoy life more and live freely ."
87,"[0.0, 0.0, 0.0, 1.0, 0.0, 0.0, 0.0, 0.0, 0.0, 0.0, 0.0]","In younger years one does n't think that much about the difficulties of life that may appear later on , such as illnesses or financial security problems ."
88,"[0.0, 0.0, 0.0, 1.0, 0.0, 0.0, 0.0, 0.0, 0.0, 0.0, 0.0]","Furthermore one usually goes to college or university in younger years where life is most of the time a whole lot of joyful fun anyway , apart from some learning times ."
89,"[0.0, 0.0, 0.0, 1.0, 0.0, 0.0, 0.0, 0.0, 0.0, 0.0, 0.0]","So yes , I would say that the circumstances in your younger years make it often more easy to really enjoy life than in older years ."
90,"[0.0, 0.0, 0.0, 1.0, 0.0, 0.0, 0.0, 0.0, 0.0, 0.0, 0.0]",But on the other hand I think  -  and I can only think about it because I am in my younger years at the moment  -  the older people as well have their very own way of enjoying life .
91,"[0.0, 0.0, 0.0, 1.0, 0.0, 0.0, 0.0, 0.0, 0.0, 0.0, 0.0]","Surely they 'll do it in a different way because it 's not all about parties and having fun , but with a life - experience I am sure one can enjoy life at a different level ."
92,"[0.0, 0.0, 0.0, 1.0, 0.0, 0.0, 0.0, 0.0, 0.0, 0.0, 0.0]","Looking back on what offered life for you , everything you 've been already able to enjoy and all the goods and bads you 've gone through I think one can enjoy life as much as young people ."
93,"[0.0, 0.0, 0.0, 1.0, 0.0, 0.0, 0.0, 0.0, 0.0, 0.0, 0.0]","Apart from that I can imagine that a lot experience , which you definitely have as an older person , can give a good measure as well concerning what is really worth to enjoy and what is not ."
94,"[0.0, 0.0, 0.0, 1.0, 0.0, 0.0, 0.0, 0.0, 0.0, 0.0, 0.0]",So to bring it up to a point I would n't say that young people enjoy life more than older people do .
95,"[0.0, 0.0, 0.0, 1.0, 0.0, 0.0, 0.0, 0.0, 0.0, 0.0, 0.0]",Perhaps both groups enjoy and spend their time in different ways but in total I am sure that both are able to enjoy at a similar level .
96,"[0.0, 0.0, 0.0, 0.0, 0.0, 1.0, 0.0, 0.0, 0.0, 0.0, 0.0]","I think that in twenty years there wo n't be fewer cars than there are today , I think they will be different ."
97,"[0.0, 0.0, 0.0, 0.0, 0.0, 1.0, 0.0, 0.0, 0.0, 0.0, 0.0]","People wo n't happily leave the opportunity of having such a confort , they prefer going to the seaside with the whole family without depending from a public service like national railways by having they private car that could take them with all the packages directly from the house to the beach with no delays and not transporting luggages by hands ."
98,"[0.0, 0.0, 0.0, 0.0, 0.0, 1.0, 0.0, 0.0, 0.0, 0.0, 0.0]",The car in a century became a everyday thing in the life of the people and only few think they can do everything eeven without that .
99,"[0.0, 0.0, 0.0, 0.0, 0.0, 1.0, 0.0, 0.0, 0.0, 0.0, 0.0]",But the lack of oil will rise in the next decades and the pollution is getting too high to use this resource any longer so it will be necessary to find new energy resources to permit the use of these private transports .
100,"[0.0, 0.0, 0.0, 0.0, 0.0, 1.0, 0.0, 0.0, 0.0, 0.0, 0.0]","Petrol companies like Chevron and governments ' scientist are searching new ways to give power to cars engine , for example using hydrogen or converting sunlight in power , now this kind of energies cost a lot , but in some years they will be the most used way to give power not only to cars ."
101,"[0.0, 0.0, 0.0, 0.0, 0.0, 1.0, 0.0, 0.0, 0.0, 0.0, 0.0]",So the cars will have probably different engines in 2030 or ( why not ? )
102,"[0.0, 0.0, 0.0, 0.0, 0.0, 1.0, 0.0, 0.0, 0.0, 0.0, 0.0]","they will go on rails , but they number wo n't change a lot , maybe it will grow if the new resources will be accessible to everybody without making too much pollution ."
103,"[0.0, 0.0, 0.0, 0.0, 0.0, 0.0, 1.0, 0.0, 0.0, 0.0, 0.0]",I often watch advertisements on TV commercials or magazines .
104,"[0.0, 0.0, 0.0, 0.0, 0.0, 0.0, 1.0, 0.0, 0.0, 0.0, 0.0]","When I watch these advertisements , I always think that these advertisements are too much performance ."
105,"[0.0, 0.0, 0.0, 0.0, 0.0, 0.0, 1.0, 0.0, 0.0, 0.0, 0.0]",The reasons that I think such thing is that I have experiences that there are big difference between advertisements and real one .
106,"[0.0, 0.0, 0.0, 0.0, 0.0, 0.0, 1.0, 0.0, 0.0, 0.0, 0.0]",Therefore I agree with this statement .
107,"[0.0, 0.0, 0.0, 0.0, 0.0, 0.0, 1.0, 0.0, 0.0, 0.0, 0.0]","First of all , I watch advertisements on TV everyday ."
108,"[0.0, 0.0, 0.0, 0.0, 0.0, 0.0, 1.0, 0.0, 0.0, 0.0, 0.0]",Actually that advertisements are attracted me .
109,"[0.0, 0.0, 0.0, 0.0, 0.0, 0.0, 1.0, 0.0, 0.0, 0.0, 0.0]",And then I have experienced that I bought digital camera on TV shopping program .
110,"[0.0, 0.0, 0.0, 0.0, 0.0, 0.0, 1.0, 0.0, 0.0, 0.0, 0.0]","However when I got this camera , I was really disappointed it ."
111,"[0.0, 0.0, 0.0, 0.0, 0.0, 0.0, 1.0, 0.0, 0.0, 0.0, 0.0]",Because the camera was n't good .
112,"[0.0, 0.0, 0.0, 0.0, 0.0, 0.0, 1.0, 0.0, 0.0, 0.0, 0.0]","On the TV shopping program , I thought that the camera was good ."
113,"[0.0, 0.0, 0.0, 0.0, 0.0, 0.0, 1.0, 0.0, 0.0, 0.0, 0.0]","However , after getting it , I realized that that salesperson on the TV program explained it too much ."
114,"[0.0, 0.0, 0.0, 0.0, 0.0, 0.0, 1.0, 0.0, 0.0, 0.0, 0.0]","The person on the TV said that it is easy to use this camera , in fact I thought that this camera 's operation was so complicated ."
115,"[0.0, 0.0, 0.0, 0.0, 0.0, 0.0, 1.0, 0.0, 0.0, 0.0, 0.0]","In addition , when I worked for a bank , we were selling some stocks ."
116,"[0.0, 0.0, 0.0, 0.0, 0.0, 0.0, 1.0, 0.0, 0.0, 0.0, 0.0]",And then our bank was using advertisements on TV .
117,"[0.0, 0.0, 0.0, 0.0, 0.0, 0.0, 1.0, 0.0, 0.0, 0.0, 0.0]",That advertisements said only good aspects .
118,"[0.0, 0.0, 0.0, 0.0, 0.0, 0.0, 1.0, 0.0, 0.0, 0.0, 0.0]",However not only me but also my coworkers thoght that that stocks have also risks .
119,"[0.0, 0.0, 0.0, 0.0, 0.0, 0.0, 1.0, 0.0, 0.0, 0.0, 0.0]","I thought that our advertisements should announce about high risk and high return , and I thought that some customers must be misunderstand about this investment ."
120,"[0.0, 0.0, 0.0, 0.0, 0.0, 0.0, 1.0, 0.0, 0.0, 0.0, 0.0]",In fact some customers who watched our advertisements on TV misunderstood .
121,"[0.0, 0.0, 0.0, 0.0, 0.0, 0.0, 1.0, 0.0, 0.0, 0.0, 0.0]",They did n't know risks on this investments .
122,"[0.0, 0.0, 0.0, 0.0, 0.0, 0.0, 1.0, 0.0, 0.0, 0.0, 0.0]","I have bad experiences about advertisements , when I was customer , in addition , I felt that our bank 's advertisements where I was working for was much better than real one ."
123,"[0.0, 0.0, 0.0, 0.0, 0.0, 0.0, 1.0, 0.0, 0.0, 0.0, 0.0]",I understand that advertisements are strategy of sale .
124,"[0.0, 0.0, 0.0, 0.0, 0.0, 0.0, 1.0, 0.0, 0.0, 0.0, 0.0]",However I really think that it should n't do too much performances .
125,"[0.0, 0.0, 0.0, 0.0, 0.0, 0.0, 1.0, 0.0, 0.0, 0.0, 0.0]",Because many customers might misunderstand .
126,"[0.0, 0.0, 0.0, 0.0, 0.0, 0.0, 1.0, 0.0, 0.0, 0.0, 0.0]","However , in fact there are many too much performances advertisements in the world ."
127,"[0.0, 0.0, 0.0, 0.0, 0.0, 0.0, 1.0, 0.0, 0.0, 0.0, 0.0]",Therefore I agree with the idea that most advertisements make products seem much better than they really are .
128,"[0.0, 0.0, 0.0, 0.0, 0.0, 0.0, 1.0, 0.0, 0.0, 0.0, 0.0]",I think the most advertisements are made to look the products much better than they really are .
129,"[0.0, 0.0, 0.0, 0.0, 0.0, 0.0, 1.0, 0.0, 0.0, 0.0, 0.0]",They make the ad or TV commercials intensionally attract the customer by emphasizing a certain going of products .
130,"[0.0, 0.0, 0.0, 0.0, 0.0, 0.0, 1.0, 0.0, 0.0, 0.0, 0.0]","Typical example is , I think , an advertisements of car ."
131,"[0.0, 0.0, 0.0, 0.0, 0.0, 0.0, 1.0, 0.0, 0.0, 0.0, 0.0]",One commercial that I felt like I missed the going was the one ; a man at the groccary casher looks at what he was going to buy and what the other man is going to .
132,"[0.0, 0.0, 0.0, 0.0, 0.0, 0.0, 1.0, 0.0, 0.0, 0.0, 0.0]",He got vegetables and a pack of big in Tofu in his cart and the other man has huge bulk of beef .
133,"[0.0, 0.0, 0.0, 0.0, 0.0, 0.0, 1.0, 0.0, 0.0, 0.0, 0.0]",After that he rushes into a car dealer and buys a big car .
134,"[0.0, 0.0, 0.0, 0.0, 0.0, 0.0, 1.0, 0.0, 0.0, 0.0, 0.0]","An impression that I had from this TV commercial is , `` Get a big car , get your dignity . ''"
135,"[0.0, 0.0, 0.0, 0.0, 0.0, 0.0, 1.0, 0.0, 0.0, 0.0, 0.0]",But the car eats gas like a monster .
136,"[0.0, 0.0, 0.0, 0.0, 0.0, 0.0, 1.0, 0.0, 0.0, 0.0, 0.0]","In these days , especially after the midle - east crisis , the gas efficiency is one of the most important elements when you choose which car you purchase ."
137,"[0.0, 0.0, 0.0, 0.0, 0.0, 0.0, 1.0, 0.0, 0.0, 0.0, 0.0]",More people concern about efficiency much more they used to before .
138,"[0.0, 0.0, 0.0, 0.0, 0.0, 0.0, 1.0, 0.0, 0.0, 0.0, 0.0]",I believe that the car company ought to forces on what the era require them to make and respond what people need .
139,"[0.0, 0.0, 0.0, 0.0, 0.0, 0.0, 1.0, 0.0, 0.0, 0.0, 0.0]",The ad does n't show anything like that but encourage people to reverse the flow of the current .
140,"[0.0, 0.0, 0.0, 0.0, 0.0, 0.0, 1.0, 0.0, 0.0, 0.0, 0.0]","We , consumers need to be smart enough to read what they show and what they hide behind the advertisement ."
141,"[0.0, 0.0, 0.0, 0.0, 1.0, 0.0, 0.0, 0.0, 0.0, 0.0, 0.0]",Successful people try new things and take risks rather than doing what they already know is very precise and exact on its part .
142,"[0.0, 0.0, 0.0, 0.0, 1.0, 0.0, 0.0, 0.0, 0.0, 0.0, 0.0]",because a successful person is very ambitious and intrepid .
143,"[0.0, 0.0, 0.0, 0.0, 1.0, 0.0, 0.0, 0.0, 0.0, 0.0, 0.0]",he is full of spirit and ready to face any type of struggle or danger in any face of his life .
144,"[0.0, 0.0, 0.0, 0.0, 1.0, 0.0, 0.0, 0.0, 0.0, 0.0, 0.0]",they have a innate quality to invent new things and generate new ideas .
145,"[0.0, 0.0, 0.0, 0.0, 1.0, 0.0, 0.0, 0.0, 0.0, 0.0, 0.0]",it does not that successful people dont face failure in their life .
146,"[0.0, 0.0, 0.0, 0.0, 1.0, 0.0, 0.0, 0.0, 0.0, 0.0, 0.0]",but the fact is that they are not like other common people who lose their strength and determination in any part of difficulties .
147,"[0.0, 0.0, 0.0, 0.0, 1.0, 0.0, 0.0, 0.0, 0.0, 0.0, 0.0]",but rather they are people who spend their life only to face challenges and dangers .
148,"[0.0, 0.0, 0.0, 0.0, 1.0, 0.0, 0.0, 0.0, 0.0, 0.0, 0.0]",they follow on the principle `` failure is the stepping stone to success '' .doing only the things which you are confined to or which you know how to do well is very common and usual which can be done by anybody .
149,"[0.0, 0.0, 0.0, 0.0, 1.0, 0.0, 0.0, 0.0, 0.0, 0.0, 0.0]",the point lies in doing something different from others .
150,"[0.0, 0.0, 0.0, 0.0, 1.0, 0.0, 0.0, 0.0, 0.0, 0.0, 0.0]",there are certain examples showing how successful peoples are different from the common individuals .
151,"[0.0, 0.0, 0.0, 0.0, 1.0, 0.0, 0.0, 0.0, 0.0, 0.0, 0.0]","Firstly , Issac Newton is the one who had invented the bulbs and due to his contribution we are now in this time are available with energy source else no source was available to us for lightening ."
152,"[0.0, 0.0, 0.0, 0.0, 1.0, 0.0, 0.0, 0.0, 0.0, 0.0, 0.0]","Secondly , there are many freedom fighters responsible for the freedom of india like Mahatma Gandhi , Rani Lamp Bai , Subcash Chandra Bose and etc . , ."
153,"[0.0, 0.0, 0.0, 0.0, 1.0, 0.0, 0.0, 0.0, 0.0, 0.0, 0.0]",without their help and contribution it was very difficult to achieve the freedom .
