,label,sent
1048,"[0.0, 0.0, 0.0, 0.0, 0.0, 0.0, 0.0, 0.0, 0.0, 0.0, 1.0]",Let me explain this examplatorily .
1049,"[0.0, 0.0, 0.0, 0.0, 0.0, 0.0, 0.0, 0.0, 0.0, 0.0, 1.0]",When for instance Nike tries to sell some new shoes the are firstly nothing than shoes .
1050,"[0.0, 0.0, 0.0, 0.0, 0.0, 0.0, 0.0, 0.0, 0.0, 0.0, 1.0]",And what makes them different from other shoes ?
1051,"[0.0, 0.0, 0.0, 0.0, 0.0, 0.0, 0.0, 0.0, 0.0, 0.0, 1.0]",And how are people able to distinguish them from others ?
1052,"[0.0, 0.0, 0.0, 0.0, 0.0, 0.0, 0.0, 0.0, 0.0, 0.0, 1.0]",The company which advertises the product tries to arouse a awareness of a specific group in society like e.g. young basketball players .
1053,"[0.0, 0.0, 0.0, 0.0, 0.0, 0.0, 0.0, 0.0, 0.0, 0.0, 1.0]",The advertiser try to give their product a soul or feeling which automatically rises in a person who sees this product in the media .
1054,"[0.0, 0.0, 0.0, 0.0, 0.0, 0.0, 0.0, 0.0, 0.0, 0.0, 1.0]",Thus the advertisers attempt to render their customers an opportunity for identification with their product .
1055,"[0.0, 0.0, 0.0, 0.0, 0.0, 0.0, 0.0, 0.0, 0.0, 0.0, 1.0]",In this case we can imagine a young Boz sitting in front of his TV and watching this new ad and feeling the same as the people in the ad feel .
1056,"[0.0, 0.0, 0.0, 0.0, 0.0, 0.0, 0.0, 0.0, 0.0, 0.0, 1.0]","So , it is possible that whenever he gets this feeling he remembers those Nike shoes he saw last time on TV ."
1057,"[0.0, 0.0, 0.0, 0.0, 0.0, 0.0, 0.0, 0.0, 0.0, 0.0, 1.0]",Based on this example I would saz that product sellers make to a certain extant use of the feelings and thoughts of their customers .
1058,"[0.0, 0.0, 0.0, 0.0, 0.0, 0.0, 0.0, 0.0, 0.0, 0.0, 1.0]","The customers watch these kind of ads and absorb the message behind it unconsciously , which can lead them to buy a product without knowing why ."
1059,"[0.0, 0.0, 0.0, 0.0, 0.0, 0.0, 0.0, 0.0, 0.0, 0.0, 1.0]",I think that this depicts that we are somehow controled by the ads and the media .
1060,"[0.0, 0.0, 0.0, 0.0, 0.0, 0.0, 0.0, 0.0, 0.0, 0.0, 1.0]",And this is really scaring me that I 'm unconciously doing things I would n't do under normal circumstances .
1061,"[0.0, 0.0, 0.0, 0.0, 0.0, 0.0, 0.0, 0.0, 0.0, 0.0, 1.0]","Another example which shows that ads make products seem better than they are , is the successful marketing of alcohol and cigarettes ."
1062,"[0.0, 0.0, 0.0, 0.0, 0.0, 0.0, 0.0, 0.0, 0.0, 0.0, 1.0]",We all know that these products are hazardous to our health and can cause death but especially young people are capable of being seduced by these kinds of ads .
1063,"[0.0, 0.0, 0.0, 0.0, 0.0, 0.0, 0.0, 0.0, 0.0, 0.0, 1.0]",The do n't show the inconveniences of smoking like its smell or unsociability but more important is that the do n't show the hazardous effects this item could have on our health .
1064,"[0.0, 0.0, 0.0, 0.0, 0.0, 0.0, 0.0, 0.0, 0.0, 0.0, 1.0]",Besides the inscription on the cigarette packets there is no information given about impacts .
1065,"[0.0, 0.0, 0.0, 0.0, 0.0, 0.0, 0.0, 0.0, 0.0, 0.0, 1.0]",In my opinion ads just trick customers to buz products which are worse than the seem .
1066,"[0.0, 0.0, 0.0, 0.0, 0.0, 0.0, 1.0, 0.0, 0.0, 0.0, 0.0]",I agree with the statement that in twenty years there will be fewer cars in use than there are today for the following reasons .
1067,"[0.0, 0.0, 0.0, 0.0, 0.0, 0.0, 1.0, 0.0, 0.0, 0.0, 0.0]","First of all , driving cars will spend more money than other public traffics because the price of car fuels , gasoline and gas oil , will be raising ."
1068,"[0.0, 0.0, 0.0, 0.0, 0.0, 0.0, 1.0, 0.0, 0.0, 0.0, 0.0]","For example , I remember that in 2003 when I was in my first year at Showa - Shell - Sekiyu , a large oil company in Japan , gasoline price of Japanese market was less than one pallor ."
1069,"[0.0, 0.0, 0.0, 0.0, 0.0, 0.0, 1.0, 0.0, 0.0, 0.0, 0.0]","However now , it is raised about one half dollars ."
1070,"[0.0, 0.0, 0.0, 0.0, 0.0, 0.0, 1.0, 0.0, 0.0, 0.0, 0.0]","As the above example shows , driving cars will spend more money than other public traffics ."
1071,"[0.0, 0.0, 0.0, 0.0, 0.0, 0.0, 1.0, 0.0, 0.0, 0.0, 0.0]","Second , people will be thinking about environment more deeply and make a new low that limited the number of cars ."
1072,"[0.0, 0.0, 0.0, 0.0, 0.0, 0.0, 1.0, 0.0, 0.0, 0.0, 0.0]","For example when I was a eleventh grader at Okayama Jot High School , a public high shool in Japan , I was able to swim in the river next to my high school after school ."
1073,"[0.0, 0.0, 0.0, 0.0, 0.0, 0.0, 1.0, 0.0, 0.0, 0.0, 0.0]","But now , the river has been very duty because the new road was made by the river and a lot of drivers throw away their garbage in the river ."
1074,"[0.0, 0.0, 0.0, 0.0, 0.0, 0.0, 1.0, 0.0, 0.0, 0.0, 0.0]","At last , our city makes a new low of emitting from the gas oil cars ."
1075,"[0.0, 0.0, 0.0, 0.0, 0.0, 0.0, 1.0, 0.0, 0.0, 0.0, 0.0]","If the number of cars had been increasing , the beautiful environment would have lost away ."
1076,"[0.0, 0.0, 0.0, 0.0, 0.0, 0.0, 1.0, 0.0, 0.0, 0.0, 0.0]","As the above example demonstrates , people will be thinking about environment more deeply and make a new low that limited the number of cars ."
1077,"[0.0, 0.0, 0.0, 0.0, 0.0, 0.0, 1.0, 0.0, 0.0, 0.0, 0.0]","In conclusion , I strongly agree with the statement that in twenty years there will be fewer cars in use than there are today ."
1078,"[0.0, 0.0, 1.0, 0.0, 0.0, 0.0, 0.0, 0.0, 0.0, 0.0, 0.0]","I agree that successful people try news things and take risk rather than only doing what they already know how to do well , for these reasons ; By trying new things allow you to be curious to know how someone did it and you will find out how to do it too , that way it make you make a research ."
1079,"[0.0, 0.0, 1.0, 0.0, 0.0, 0.0, 0.0, 0.0, 0.0, 0.0, 0.0]",By trying new things allow you to be positive in your mind and to have a great desire to succeed no matter how difficult is the situation .
1080,"[0.0, 0.0, 1.0, 0.0, 0.0, 0.0, 0.0, 0.0, 0.0, 0.0, 0.0]","By trying new things you no that you should be openminded , go through discussion with people who have done the same thing to learn their ways of doing thing , you should meet or have conversation with a lot of these people in other to learn from their experiences ."
1081,"[0.0, 0.0, 1.0, 0.0, 0.0, 0.0, 0.0, 0.0, 0.0, 0.0, 0.0]","By trying new things you take a big risks , like in `` french we say if you do n't risk you do n't have anything '' , risk in a goog way to take something ."
1082,"[0.0, 0.0, 1.0, 0.0, 0.0, 0.0, 0.0, 0.0, 0.0, 0.0, 0.0]",We never know if we might succeed or not the only way to do it is to risk .
1083,"[0.0, 0.0, 1.0, 0.0, 0.0, 0.0, 0.0, 0.0, 0.0, 0.0, 0.0]",Since we do not loose anything when we risk .
1084,"[0.0, 0.0, 1.0, 0.0, 0.0, 0.0, 0.0, 0.0, 0.0, 0.0, 0.0]",ed
1085,"[0.0, 0.0, 1.0, 0.0, 0.0, 0.0, 0.0, 0.0, 0.0, 0.0, 0.0]","As for me doing the same thing every day become boring , i can say is a waste of energy and time ,"
1086,"[0.0, 0.0, 1.0, 0.0, 0.0, 0.0, 0.0, 0.0, 0.0, 0.0, 0.0]","To conclude , people who succeed try new things and take risks rather than only doing what they already know how to do well ."
1087,"[0.0, 1.0, 0.0, 0.0, 0.0, 0.0, 0.0, 0.0, 0.0, 0.0, 0.0]","At first , There are a great people said that : To be or not to be , That is a question ."
1088,"[0.0, 1.0, 0.0, 0.0, 0.0, 0.0, 0.0, 0.0, 0.0, 0.0, 0.0]","I still remembered this words , It makes do not be lazy and should be still work hard ."
1089,"[0.0, 1.0, 0.0, 0.0, 0.0, 0.0, 0.0, 0.0, 0.0, 0.0, 0.0]",For my opinion I would like to say I agree the statement .
1090,"[0.0, 1.0, 0.0, 0.0, 0.0, 0.0, 0.0, 0.0, 0.0, 0.0, 0.0]",There I would like to give OME short story .
1091,"[0.0, 1.0, 0.0, 0.0, 0.0, 0.0, 0.0, 0.0, 0.0, 0.0, 0.0]",I do not know whether the people had read a famose book name is `` who touch my cheese ? ''
1092,"[0.0, 1.0, 0.0, 0.0, 0.0, 0.0, 0.0, 0.0, 0.0, 0.0, 0.0]",If yes .
1093,"[0.0, 1.0, 0.0, 0.0, 0.0, 0.0, 0.0, 0.0, 0.0, 0.0, 0.0]",I think they will understand me .
1094,"[0.0, 1.0, 0.0, 0.0, 0.0, 0.0, 0.0, 0.0, 0.0, 0.0, 0.0]",The book talking about Two mouses and two small people they like ates cheese very much .
1095,"[0.0, 1.0, 0.0, 0.0, 0.0, 0.0, 0.0, 0.0, 0.0, 0.0, 0.0]","The mouses they are animals , so the only can smell ."
1096,"[0.0, 1.0, 0.0, 0.0, 0.0, 0.0, 0.0, 0.0, 0.0, 0.0, 0.0]",But the people they are very claver .
1097,"[0.0, 1.0, 0.0, 0.0, 0.0, 0.0, 0.0, 0.0, 0.0, 0.0, 0.0]",the can depends their mind to find where are the cheese .
1098,"[0.0, 1.0, 0.0, 0.0, 0.0, 0.0, 0.0, 0.0, 0.0, 0.0, 0.0]",One day .
1099,"[0.0, 1.0, 0.0, 0.0, 0.0, 0.0, 0.0, 0.0, 0.0, 0.0, 0.0]",they were found the cheese will be finished .
1100,"[0.0, 1.0, 0.0, 0.0, 0.0, 0.0, 0.0, 0.0, 0.0, 0.0, 0.0]",The are tinking about the future what thecal eat .
1101,"[0.0, 1.0, 0.0, 0.0, 0.0, 0.0, 0.0, 0.0, 0.0, 0.0, 0.0]",The mouse immediately left their house and go outside to looking foe there new house where have kinds of cheese when They found the cheese not have anymore .
1102,"[0.0, 1.0, 0.0, 0.0, 0.0, 0.0, 0.0, 0.0, 0.0, 0.0, 0.0]",But the two people still set down the old place to waiting and dreaming .
1103,"[0.0, 1.0, 0.0, 0.0, 0.0, 0.0, 0.0, 0.0, 0.0, 0.0, 0.0]",They dreaming for one day a lots of cheese appeared in the old house which the house they feels good .
1104,"[0.0, 1.0, 0.0, 0.0, 0.0, 0.0, 0.0, 0.0, 0.0, 0.0, 0.0]",They still fall in the beautiful memorise and lost the confidences to got out and looking foe the new place .
1105,"[0.0, 1.0, 0.0, 0.0, 0.0, 0.0, 0.0, 0.0, 0.0, 0.0, 0.0]",At the end .
1106,"[0.0, 1.0, 0.0, 0.0, 0.0, 0.0, 0.0, 0.0, 0.0, 0.0, 0.0]",of course the mouses find a new place first .
1107,"[0.0, 1.0, 0.0, 0.0, 0.0, 0.0, 0.0, 0.0, 0.0, 0.0, 0.0]",and the one of the small people find another one .
1108,"[0.0, 1.0, 0.0, 0.0, 0.0, 0.0, 0.0, 0.0, 0.0, 0.0, 0.0]",The one people study a lot through the process .
1109,"[0.0, 1.0, 0.0, 0.0, 0.0, 0.0, 0.0, 0.0, 0.0, 0.0, 0.0]","He think do not be afraid the risk in the future , maybe still do not have cheese ."
1110,"[0.0, 1.0, 0.0, 0.0, 0.0, 0.0, 0.0, 0.0, 0.0, 0.0, 0.0]",They will successes if they hold on their confidence .
1111,"[0.0, 1.0, 0.0, 0.0, 0.0, 0.0, 0.0, 0.0, 0.0, 0.0, 0.0]",The people can not stop when they already successes for something .
1112,"[0.0, 1.0, 0.0, 0.0, 0.0, 0.0, 0.0, 0.0, 0.0, 0.0, 0.0]","They still need work hard to continue , even there are tome risks in the future ."
1113,"[0.0, 1.0, 0.0, 0.0, 0.0, 0.0, 0.0, 0.0, 0.0, 0.0, 0.0]",But that can make people go the higher steps and more successful .
1114,"[0.0, 0.0, 0.0, 0.0, 1.0, 0.0, 0.0, 0.0, 0.0, 0.0, 0.0]",A person could excel in only one thing .
1115,"[0.0, 0.0, 0.0, 0.0, 1.0, 0.0, 0.0, 0.0, 0.0, 0.0, 0.0]",God has provided us just by one brain .
1116,"[0.0, 0.0, 0.0, 0.0, 1.0, 0.0, 0.0, 0.0, 0.0, 0.0, 0.0]",The brain could concentrate only at one point at a particular moment .
1117,"[0.0, 0.0, 0.0, 0.0, 1.0, 0.0, 0.0, 0.0, 0.0, 0.0, 0.0]",It would be better to be focussed on a single point than to be whimsical .
1118,"[0.0, 0.0, 0.0, 0.0, 1.0, 0.0, 0.0, 0.0, 0.0, 0.0, 0.0]","Moreover , the master blaster Jachin Tendulkar is the good example ."
1119,"[0.0, 0.0, 0.0, 0.0, 1.0, 0.0, 0.0, 0.0, 0.0, 0.0, 0.0]","Inspire of surrounding by controversies , he has always been focussed to the sports ."
1120,"[0.0, 0.0, 0.0, 0.0, 1.0, 0.0, 0.0, 0.0, 0.0, 0.0, 0.0]","Further , Stephen Hawking , the well known scientist have always been dreamt about the astronomy ."
1121,"[0.0, 0.0, 0.0, 0.0, 1.0, 0.0, 0.0, 0.0, 0.0, 0.0, 0.0]","Furthermore , Bill Gates have talked about the computers ."
1122,"[0.0, 0.0, 0.0, 0.0, 1.0, 0.0, 0.0, 0.0, 0.0, 0.0, 0.0]",They have reached to certain standards and have became an icon for the youth because of their single goal .
1123,"[0.0, 0.0, 0.0, 0.0, 1.0, 0.0, 0.0, 0.0, 0.0, 0.0, 0.0]",One need to be stronghold to achieve a goal .
1124,"[0.0, 0.0, 0.0, 0.0, 1.0, 0.0, 0.0, 0.0, 0.0, 0.0, 0.0]","However , there have been people who have done plenty of the things ."
1125,"[0.0, 0.0, 0.0, 0.0, 1.0, 0.0, 0.0, 0.0, 0.0, 0.0, 0.0]","Though , to live in the cut - throat competition , we are expected to know the certain things ."
1126,"[0.0, 0.0, 0.0, 0.0, 1.0, 0.0, 0.0, 0.0, 0.0, 0.0, 0.0]","Nevertheless , Iran Khan was a good sportsman but now he is a politician ."
1127,"[0.0, 0.0, 0.0, 0.0, 1.0, 0.0, 0.0, 0.0, 0.0, 0.0, 0.0]",Amitabha Bachachan who has done economics and now he is the celebrity and even the ambassador of many products .
1128,"[0.0, 0.0, 0.0, 0.0, 1.0, 0.0, 0.0, 0.0, 0.0, 0.0, 0.0]",They have shown to the world that they have been the all  -  rounder .
1129,"[0.0, 0.0, 0.0, 0.0, 1.0, 0.0, 0.0, 0.0, 0.0, 0.0, 0.0]",A one need to have the knowledge of the politics to the academics to survive in this world .
1130,"[0.0, 0.0, 0.0, 0.0, 1.0, 0.0, 0.0, 0.0, 0.0, 0.0, 0.0]","At the end , a person need to have a unique destination to accomplish it ."
1131,"[0.0, 0.0, 0.0, 0.0, 1.0, 0.0, 0.0, 0.0, 0.0, 0.0, 0.0]","However , it is rather difficult for the people to be masters of all ."
1132,"[0.0, 0.0, 0.0, 0.0, 1.0, 0.0, 0.0, 0.0, 0.0, 0.0, 0.0]",A person in higher school considers one specific subject to specialize in that .
1133,"[0.0, 0.0, 0.0, 0.0, 1.0, 0.0, 0.0, 0.0, 0.0, 0.0, 0.0]",An engineer could only be engineer and a doctor could be doctor .
1134,"[0.0, 0.0, 0.0, 0.0, 1.0, 0.0, 0.0, 0.0, 0.0, 0.0, 0.0]","Further , it is not an easy job to play several parts ."
1135,"[0.0, 0.0, 0.0, 0.0, 1.0, 0.0, 0.0, 0.0, 0.0, 0.0, 0.0]",One has to do lot of the other task like working on hobbies than academics .
1136,"[0.0, 0.0, 0.0, 0.0, 1.0, 0.0, 0.0, 0.0, 0.0, 0.0, 0.0]","Furthermore , a person need to maintain plenty of relations ."
1137,"[0.0, 0.0, 0.0, 0.0, 1.0, 0.0, 0.0, 0.0, 0.0, 0.0, 0.0]","In the conclusion , it is `` better to be a master of one than a slave of all '' ."
1138,"[0.0, 0.0, 0.0, 0.0, 1.0, 0.0, 0.0, 0.0, 0.0, 0.0, 0.0]",I do agree with the statement that young people do not give enough time to helping their communities .
1139,"[0.0, 0.0, 0.0, 0.0, 1.0, 0.0, 0.0, 0.0, 0.0, 0.0, 0.0]",Todays generation is caught up with a lot of other issues which they feel are important and necessary for them to survive in this world and also to be happy in the future .
1140,"[0.0, 0.0, 0.0, 0.0, 1.0, 0.0, 0.0, 0.0, 0.0, 0.0, 0.0]","These things include getting good education which takes up a lot of their time and energy , then they feel the need to earn a lot of money so that they can afford whatever they want in the future and last but not the least to spend the extra or free time enjoying life by attending parties and watching movies ."
1141,"[0.0, 0.0, 0.0, 0.0, 1.0, 0.0, 0.0, 0.0, 0.0, 0.0, 0.0]",Present generation has the urge to study more and more so that they can match up to the expectation of the changing world .
1142,"[0.0, 0.0, 0.0, 0.0, 1.0, 0.0, 0.0, 0.0, 0.0, 0.0, 0.0]",Frankly speaking it is not their fault either .
1143,"[0.0, 0.0, 0.0, 0.0, 1.0, 0.0, 0.0, 0.0, 0.0, 0.0, 0.0]",Every one requires a certain degree of education to support themselves and to be able to interact and communicate with the people of other countries .
1144,"[0.0, 0.0, 0.0, 0.0, 1.0, 0.0, 0.0, 0.0, 0.0, 0.0, 0.0]",This is so because most of the word carried out by our country is in collaboration with the developed countries like the U.S.A. and therefore to match up to their educational requirements it is important to be well educated .
1145,"[0.0, 0.0, 0.0, 0.0, 1.0, 0.0, 0.0, 0.0, 0.0, 0.0, 0.0]",To gain such quality of education one needs to devote full time and energy and so does not get the opportunity to help their communities .
1146,"[0.0, 0.0, 0.0, 0.0, 1.0, 0.0, 0.0, 0.0, 0.0, 0.0, 0.0]",Additional to the educational qualifications a person needs to have a good job in order to support his family .
1147,"[0.0, 0.0, 0.0, 0.0, 1.0, 0.0, 0.0, 0.0, 0.0, 0.0, 0.0]","In the era of increasing prices and low pay structure an individual needs to work like a Pig , as most of them put it , and then alone be able to match to his living standards ."
1148,"[0.0, 0.0, 0.0, 0.0, 1.0, 0.0, 0.0, 0.0, 0.0, 0.0, 0.0]",If someone does not do the required amount of work expected from him then he is not given a chance of promotion which inturn decreases the availability of resources with him to live peacefully and happily .
1149,"[0.0, 0.0, 0.0, 0.0, 1.0, 0.0, 0.0, 0.0, 0.0, 0.0, 0.0]",This is another reason why todays generation is not able to give enough time to their communities .
1150,"[0.0, 0.0, 0.0, 0.0, 1.0, 0.0, 0.0, 0.0, 0.0, 0.0, 0.0]","Finally , I think that as the world changes , the priorities of the people living in that generation changes ."
1151,"[0.0, 0.0, 0.0, 0.0, 1.0, 0.0, 0.0, 0.0, 0.0, 0.0, 0.0]",Earlier people used to utilize their free and extra time in helping old people or doing some amount of social service .
1152,"[0.0, 0.0, 0.0, 0.0, 1.0, 0.0, 0.0, 0.0, 0.0, 0.0, 0.0]",Every one had a feeling of responsibility towards the nation and its citizens .
1153,"[0.0, 0.0, 0.0, 0.0, 1.0, 0.0, 0.0, 0.0, 0.0, 0.0, 0.0]","But today if someone has free time they would want to rather go for a movie or party and enjoy themselves , instead of even thinking of the weaker and underprivileged section of the society ."
1154,"[0.0, 0.0, 0.0, 0.0, 1.0, 0.0, 0.0, 0.0, 0.0, 0.0, 0.0]","In conclusion , I would like to say that everyone in today 's world has become selfish and therefore wants to think of themselves before others ."
1155,"[0.0, 0.0, 0.0, 0.0, 1.0, 0.0, 0.0, 0.0, 0.0, 0.0, 0.0]",Today 's generation has forgot what is `` Service before Self '' .
1156,"[0.0, 0.0, 0.0, 0.0, 0.0, 0.0, 0.0, 0.0, 0.0, 1.0, 0.0]","I am agreeing with the topic that in twenty years there will be fewer cars in use than there are now today , Why because for better convenience , due to less cost , to show status purpose , and needs of the humans ."
1157,"[0.0, 0.0, 0.0, 0.0, 0.0, 0.0, 0.0, 0.0, 0.0, 1.0, 0.0]","Day by day the technology is growing and also at the same people also improved technologically and these people preferring to live better convenience , those convenient are protection from rain and sunlight etc. , and also people can travel longer distances with out suffering than that of other vehicles like two wheelers and three wheedlers ."
1158,"[0.0, 0.0, 0.0, 0.0, 0.0, 0.0, 0.0, 0.0, 0.0, 1.0, 0.0]",Secondly the costs also shows some reflection on the usage than that of past 20 years back .
1159,"[0.0, 0.0, 0.0, 0.0, 0.0, 0.0, 0.0, 0.0, 0.0, 1.0, 0.0]",At that time people may not be able to put that much money why because at that time he resources not available properly .
1160,"[0.0, 0.0, 0.0, 0.0, 0.0, 0.0, 0.0, 0.0, 0.0, 1.0, 0.0]",The old people thinks about money not for what they are using for travelling .
1161,"[0.0, 0.0, 0.0, 0.0, 0.0, 0.0, 0.0, 0.0, 0.0, 1.0, 0.0]",day by day cars becoming cheaper and people willing to purchase the car .
1162,"[0.0, 0.0, 0.0, 0.0, 0.0, 0.0, 0.0, 0.0, 0.0, 1.0, 0.0]",Thirdly status purpose .
1163,"[0.0, 0.0, 0.0, 0.0, 0.0, 0.0, 0.0, 0.0, 0.0, 1.0, 0.0]","Some people think that if one have a car he belongs to some higher range , Not only status purpose but also for build - up ."
1164,"[0.0, 0.0, 0.0, 0.0, 0.0, 0.0, 0.0, 0.0, 0.0, 1.0, 0.0]",Finally earnings of the people increasing day by day at the same time living cost of the people also increasing .
1165,"[0.0, 0.0, 0.0, 0.0, 0.0, 0.0, 0.0, 0.0, 0.0, 1.0, 0.0]",If some body earns more than $ 2000 he must have scar in this tren people changed like that .
1166,"[0.0, 0.0, 0.0, 0.0, 0.0, 0.0, 0.0, 0.0, 0.0, 1.0, 0.0]","People thinking that There is no need of saving money for future , what they have they have to enjoy now it self ."
1167,"[0.0, 0.0, 0.0, 0.0, 0.0, 0.0, 0.0, 0.0, 0.0, 1.0, 0.0]",thats why the number of cars increased than than of past twenty years back .
1168,"[0.0, 0.0, 0.0, 0.0, 0.0, 0.0, 0.0, 0.0, 0.0, 1.0, 0.0]",In conclusion definitely the number of cars increased due to some of above reasons .
1169,"[0.0, 0.0, 0.0, 0.0, 0.0, 0.0, 0.0, 0.0, 0.0, 1.0, 0.0]","the main reason is according to the technology the people modernizing them self , owning the car is also one of the modernization ."
1170,"[0.0, 0.0, 0.0, 0.0, 0.0, 0.0, 0.0, 0.0, 0.0, 1.0, 0.0]",So the number of cars more than what we have twenty years back .
1171,"[0.0, 0.0, 0.0, 0.0, 0.0, 0.0, 0.0, 0.0, 0.0, 1.0, 0.0]",What ever it mat be the usage of cars increased in these twenty years .
1172,"[0.0, 0.0, 0.0, 1.0, 0.0, 0.0, 0.0, 0.0, 0.0, 0.0, 0.0]",The problem we are dealing with is the lake of interest of young people to spend time to helping their communities .
1173,"[0.0, 0.0, 0.0, 1.0, 0.0, 0.0, 0.0, 0.0, 0.0, 0.0, 0.0]",It is a big problem that needs to be solved .
1174,"[0.0, 0.0, 0.0, 1.0, 0.0, 0.0, 0.0, 0.0, 0.0, 0.0, 0.0]","On the one hand , there is a rising number of requirements young people have to deal with ."
1175,"[0.0, 0.0, 0.0, 1.0, 0.0, 0.0, 0.0, 0.0, 0.0, 0.0, 0.0]",There are a lot of things to manage .
1176,"[0.0, 0.0, 0.0, 1.0, 0.0, 0.0, 0.0, 0.0, 0.0, 0.0, 0.0]","Nowadays , young people have to do good results at school or at the university to get a well - paid job later ."
1177,"[0.0, 0.0, 0.0, 1.0, 0.0, 0.0, 0.0, 0.0, 0.0, 0.0, 0.0]",Most of them are expected to make a good career .
1178,"[0.0, 0.0, 0.0, 1.0, 0.0, 0.0, 0.0, 0.0, 0.0, 0.0, 0.0]","They often have a lot of hobbies or activities and , last but not least , they also have to manage their social life ."
1179,"[0.0, 0.0, 0.0, 1.0, 0.0, 0.0, 0.0, 0.0, 0.0, 0.0, 0.0]","All these activities take a lot of time , sure ."
1180,"[0.0, 0.0, 0.0, 1.0, 0.0, 0.0, 0.0, 0.0, 0.0, 0.0, 0.0]","On the other hand , there must be a solution of the problem , we have to look into its matter ."
1181,"[0.0, 0.0, 0.0, 1.0, 0.0, 0.0, 0.0, 0.0, 0.0, 0.0, 0.0]","First , there has to be a good time management ."
1182,"[0.0, 0.0, 0.0, 1.0, 0.0, 0.0, 0.0, 0.0, 0.0, 0.0, 0.0]",Young people should learn to spend their time useful .
1183,"[0.0, 0.0, 0.0, 1.0, 0.0, 0.0, 0.0, 0.0, 0.0, 0.0, 0.0]",Adult people should support the young people with good advices or with more .
1184,"[0.0, 0.0, 0.0, 1.0, 0.0, 0.0, 0.0, 0.0, 0.0, 0.0, 0.0]",Parents can suggest a useful activity to their child .
1185,"[0.0, 0.0, 0.0, 1.0, 0.0, 0.0, 0.0, 0.0, 0.0, 0.0, 0.0]","They could drive their child to a soccer game and pick him or her up after the game to do some work in the helping center for homeless people , for example ."
1186,"[0.0, 0.0, 0.0, 1.0, 0.0, 0.0, 0.0, 0.0, 0.0, 0.0, 0.0]",Parents also could suggest to work in a local helping - station for animals .
1187,"[0.0, 0.0, 0.0, 1.0, 0.0, 0.0, 0.0, 0.0, 0.0, 0.0, 0.0]","It could be interesting work for a child , where it can learn to be responsible and to take care of others ."
1188,"[0.0, 0.0, 0.0, 1.0, 0.0, 0.0, 0.0, 0.0, 0.0, 0.0, 0.0]","Moreover , social work would increase and improve the social skills of a child or a young man or women ."
1189,"[0.0, 0.0, 0.0, 1.0, 0.0, 0.0, 0.0, 0.0, 0.0, 0.0, 0.0]","That does mean , that this young person may become more able to deal with problems or to solve conflicts in his life ."
1190,"[0.0, 0.0, 0.0, 1.0, 0.0, 0.0, 0.0, 0.0, 0.0, 0.0, 0.0]",It also could mean that the young person will simply be able to communicate better with others .
1191,"[0.0, 0.0, 0.0, 1.0, 0.0, 0.0, 0.0, 0.0, 0.0, 0.0, 0.0]",Whereas the young people have already enough to do is actually being debated .
1192,"[0.0, 0.0, 0.0, 1.0, 0.0, 0.0, 0.0, 0.0, 0.0, 0.0, 0.0]",Despite all sorrows there are a lot of advantages of social work and work for communities .
1193,"[0.0, 0.0, 0.0, 1.0, 0.0, 0.0, 0.0, 0.0, 0.0, 0.0, 0.0]",This work does help both sides .
1194,"[0.0, 0.0, 0.0, 1.0, 0.0, 0.0, 0.0, 0.0, 0.0, 0.0, 0.0]",I agree entirely with the opinion that it is more vital for students to comprehend ideas and concepts than it is for them to learn mere facts .
1195,"[0.0, 0.0, 0.0, 1.0, 0.0, 0.0, 0.0, 0.0, 0.0, 0.0, 0.0]","Why study facts , or even worse , learn them by heart to pass final examinations when you will forget most of them shortly afterwards , anyway ?"
1196,"[0.0, 0.0, 0.0, 1.0, 0.0, 0.0, 0.0, 0.0, 0.0, 0.0, 0.0]","Therefore , it can be far more beneficial to focus on teaching the general understanding of ideas and concepts ."
1197,"[0.0, 0.0, 0.0, 1.0, 0.0, 0.0, 0.0, 0.0, 0.0, 0.0, 0.0]",Research in psychology has proven that you will remember far more easily anything you have understood instead of learning it by heart .
1198,"[0.0, 0.0, 0.0, 1.0, 0.0, 0.0, 0.0, 0.0, 0.0, 0.0, 0.0]","And normally , you learn facts by heart because there is not much to understand ."
1199,"[0.0, 0.0, 0.0, 1.0, 0.0, 0.0, 0.0, 0.0, 0.0, 0.0, 0.0]","Moreover , in an increasingly dynamic environment , both in professional and private terms , the learning of facts could be in vain ."
1200,"[0.0, 0.0, 0.0, 1.0, 0.0, 0.0, 0.0, 0.0, 0.0, 0.0, 0.0]",Circumstances change more and more rapidly .
1201,"[0.0, 0.0, 0.0, 1.0, 0.0, 0.0, 0.0, 0.0, 0.0, 0.0, 0.0]",What was important to know now could be replaced by completely other facts who have to know in a couple of years .
1202,"[0.0, 0.0, 0.0, 1.0, 0.0, 0.0, 0.0, 0.0, 0.0, 0.0, 0.0]","That is the case , for instance , if you have to change your profession as a result of structural change of the employment market ."
1203,"[0.0, 0.0, 0.0, 1.0, 0.0, 0.0, 0.0, 0.0, 0.0, 0.0, 0.0]","As a matter of fact , experts say that these kind of structural changes will occur more and more frequently , so many people actually will have to change their profession several times during their life ."
1204,"[0.0, 0.0, 0.0, 1.0, 0.0, 0.0, 0.0, 0.0, 0.0, 0.0, 0.0]",The understanding of ideas and concepts can also be helpful in any profession as it offers a larger flexibility .
1205,"[0.0, 0.0, 0.0, 1.0, 0.0, 0.0, 0.0, 0.0, 0.0, 0.0, 0.0]",You can not study all kind of solutions to a problem by learning facts .
