,label,sent
2946,"[0.0, 0.0, 0.0, 0.0, 1.0, 0.0, 0.0, 0.0, 0.0, 0.0, 0.0]","Luckily throughout history we have seen mavericks , be it Galileo or Newton or even someone as recent as Einstein , who went against the tide to come up with ideas that allowed the next generations to flourish ."
2947,"[0.0, 0.0, 0.0, 0.0, 1.0, 0.0, 0.0, 0.0, 0.0, 0.0, 0.0]",Were it not for our unending thirst for knowledge we would still be living in the stone age .
2948,"[0.0, 0.0, 0.0, 0.0, 1.0, 0.0, 0.0, 0.0, 0.0, 0.0, 0.0]",This is self evident from the way kids grow and learn from their surroundings .
2949,"[0.0, 0.0, 0.0, 0.0, 1.0, 0.0, 0.0, 0.0, 0.0, 0.0, 0.0]",A baby may never learn how to walk or talk if its brain did not possess the ability to grasps the required steps involved in this complex process .
2950,"[0.0, 0.0, 0.0, 0.0, 1.0, 0.0, 0.0, 0.0, 0.0, 0.0, 0.0]",In this case it may be understanding subconsciously but if we want a robot to simulate the actions of a child we would first require a complete understanding of the involved steps .
2951,"[0.0, 0.0, 0.0, 0.0, 1.0, 0.0, 0.0, 0.0, 0.0, 0.0, 0.0]",Only after this can we put newer ideas into making machine emulate man .
2952,"[0.0, 0.0, 0.0, 0.0, 1.0, 0.0, 0.0, 0.0, 0.0, 0.0, 0.0]",As students it is much more important to understand ideas and concepts during our college years .
2953,"[0.0, 0.0, 0.0, 0.0, 1.0, 0.0, 0.0, 0.0, 0.0, 0.0, 0.0]",This is the time when we not only learn new things but also contribute to the society as a whole .
2954,"[0.0, 0.0, 0.0, 0.0, 1.0, 0.0, 0.0, 0.0, 0.0, 0.0, 0.0]",Be it in any field ; even activities like dancing and singing have evolved over time due to our constantly changing approaches .
2955,"[0.0, 0.0, 0.0, 0.0, 1.0, 0.0, 0.0, 0.0, 0.0, 0.0, 0.0]",Our world today is a technological world and needs constant changes owing to the ever increasing demands .
2956,"[0.0, 0.0, 0.0, 0.0, 1.0, 0.0, 0.0, 0.0, 0.0, 0.0, 0.0]",Computers are becoming increasingly complex and faster at the same time .
2957,"[0.0, 0.0, 0.0, 0.0, 1.0, 0.0, 0.0, 0.0, 0.0, 0.0, 0.0]",The computer was invented because of someones tremendous visions but little would he have realized its significance in todays world .
2958,"[0.0, 0.0, 0.0, 0.0, 1.0, 0.0, 0.0, 0.0, 0.0, 0.0, 0.0]",We students are the new work force of the future and are aware of the needs of todays world .
2959,"[0.0, 0.0, 0.0, 0.0, 1.0, 0.0, 0.0, 0.0, 0.0, 0.0, 0.0]",Despite all the progress we have made we suffer from difficulties in all countries rich or poor .
2960,"[0.0, 0.0, 0.0, 0.0, 1.0, 0.0, 0.0, 0.0, 0.0, 0.0, 0.0]","Our understanding of the world , its people and the interrelations have just evolved ."
2961,"[0.0, 0.0, 0.0, 0.0, 1.0, 0.0, 0.0, 0.0, 0.0, 0.0, 0.0]",Yes we do require facts to account for the details and observations we have made .
2962,"[0.0, 0.0, 0.0, 0.0, 1.0, 0.0, 0.0, 0.0, 0.0, 0.0, 0.0]",But it would serve no purpose if it is not backed up with proper interpretation and newer ideas to better our future .
2963,"[0.0, 0.0, 0.0, 0.0, 1.0, 0.0, 0.0, 0.0, 0.0, 0.0, 0.0]","Our future , thus , depends on how well we understand ideas and concepts and come out with newer ones ."
2964,"[0.0, 0.0, 0.0, 1.0, 0.0, 0.0, 0.0, 0.0, 0.0, 0.0, 0.0]",SUCCESSFULLY COMPLETING THE TASKS OF LIFE
2965,"[0.0, 0.0, 0.0, 1.0, 0.0, 0.0, 0.0, 0.0, 0.0, 0.0, 0.0]",In the following I want to take issue on why people wanting to be successful should try new and risky things .
2966,"[0.0, 0.0, 0.0, 1.0, 0.0, 0.0, 0.0, 0.0, 0.0, 0.0, 0.0]",Where would we be if people wanting to make progress did not affront new challenges ?
2967,"[0.0, 0.0, 0.0, 1.0, 0.0, 0.0, 0.0, 0.0, 0.0, 0.0, 0.0]",Is confronting yourself with new challenges and unknown tasks not always connected with taking a risk ?
2968,"[0.0, 0.0, 0.0, 1.0, 0.0, 0.0, 0.0, 0.0, 0.0, 0.0, 0.0]","So this means , taking risks is what makes people advance and this again I consider as being successful ."
2969,"[0.0, 0.0, 0.0, 1.0, 0.0, 0.0, 0.0, 0.0, 0.0, 0.0, 0.0]","Experiences like going to a new school , moving in a new apartment and having a new neighbourhood or start a new job or just do some bungee jumping , give the person carrying out the action a new point of view of life ."
2970,"[0.0, 0.0, 0.0, 1.0, 0.0, 0.0, 0.0, 0.0, 0.0, 0.0, 0.0]","The new living circumstances challenge him to get out of old patterns of behaviour and she/he will start to reflect on his captivities , no matter what captivity it is a social , professional or just a physical one ."
2971,"[0.0, 0.0, 0.0, 1.0, 0.0, 0.0, 0.0, 0.0, 0.0, 0.0, 0.0]",Having this new point of life permits you to enhance your horizon and allows you to go steps further .
2972,"[0.0, 0.0, 0.0, 1.0, 0.0, 0.0, 0.0, 0.0, 0.0, 0.0, 0.0]","All in all , this means to me going successfully through life ."
2973,"[0.0, 0.0, 0.0, 0.0, 0.0, 1.0, 0.0, 0.0, 0.0, 0.0, 0.0]","Young people feel life inside , while old people loose their energy ."
2974,"[0.0, 0.0, 0.0, 0.0, 0.0, 1.0, 0.0, 0.0, 0.0, 0.0, 0.0]",This is the main difference i think .
2975,"[0.0, 0.0, 0.0, 0.0, 0.0, 1.0, 0.0, 0.0, 0.0, 0.0, 0.0]","An old man has a lot of experience inside him ; he could feel tired sometimes : things are n't even more new , they do n't communicate the same sensation they were used to do in the past ."
2976,"[0.0, 0.0, 0.0, 0.0, 0.0, 1.0, 0.0, 0.0, 0.0, 0.0, 0.0]",In fact a young person knows that he has a whole life to live .
2977,"[0.0, 0.0, 0.0, 0.0, 0.0, 1.0, 0.0, 0.0, 0.0, 0.0, 0.0]","He enjoy living looking at the future , while an old man lives looking at what he has lived in the past ."
2978,"[0.0, 0.0, 0.0, 0.0, 0.0, 1.0, 0.0, 0.0, 0.0, 0.0, 0.0]",A young person has the enjoy to create his future catching each single sensation coming from the outside ( the world ) .
2979,"[0.0, 0.0, 0.0, 0.0, 0.0, 1.0, 0.0, 0.0, 0.0, 0.0, 0.0]","A baby is used to enjoy everything because everything is new ; a very old person may feels like he has no more reason to live , and so his life becomes something like `` Waiting for Godot '' , waiting for something trying to find some distraction to spend life ."
2980,"[0.0, 0.0, 0.0, 0.0, 0.0, 1.0, 0.0, 0.0, 0.0, 0.0, 0.0]","We have to underline that physical condiction is essential for enjoying life too : normally young people feel better so they can do a lot of things that old people ca n't , like sport , that represents an important way to satisfy ourselves ."
2981,"[0.0, 0.0, 0.0, 0.0, 0.0, 1.0, 0.0, 0.0, 0.0, 0.0, 0.0]",The preoccupation of health is another main attitude that contributes to make old people to life in fear .
2982,"[0.0, 0.0, 0.0, 0.0, 0.0, 1.0, 0.0, 0.0, 0.0, 0.0, 0.0]",But this is n't always correct : it depends even on the society .
2983,"[0.0, 0.0, 0.0, 0.0, 0.0, 1.0, 0.0, 0.0, 0.0, 0.0, 0.0]",I explain : in this years i can see that many friends of mine has lost their way of enjoying life ' like they are missing something .
2984,"[0.0, 0.0, 0.0, 0.0, 0.0, 1.0, 0.0, 0.0, 0.0, 0.0, 0.0]",They are just living waiting for a better future condition .
2985,"[0.0, 0.0, 0.0, 0.0, 0.0, 1.0, 0.0, 0.0, 0.0, 0.0, 0.0]",My grandfather instead was used to have fun in each single moment of his life ' even when he was said he would have died .
2986,"[0.0, 0.0, 0.0, 0.0, 0.0, 1.0, 0.0, 0.0, 0.0, 0.0, 0.0]",It 's wired I think .
2987,"[0.0, 0.0, 0.0, 0.0, 0.0, 1.0, 0.0, 0.0, 0.0, 0.0, 0.0]",In my personal opinion I think we have to enjoy life always because it has given to us a great opportunity and we must not let it go away .
2988,"[0.0, 0.0, 0.0, 0.0, 0.0, 0.0, 1.0, 0.0, 0.0, 0.0, 0.0]",I agree with the following statement .
2989,"[0.0, 0.0, 0.0, 0.0, 0.0, 0.0, 1.0, 0.0, 0.0, 0.0, 0.0]",I have two reasons why I agree .
2990,"[0.0, 0.0, 0.0, 0.0, 0.0, 0.0, 1.0, 0.0, 0.0, 0.0, 0.0]",The first reason is because the fuel is getting expensive .
2991,"[0.0, 0.0, 0.0, 0.0, 0.0, 0.0, 1.0, 0.0, 0.0, 0.0, 0.0]","As everybody know , the fuel in the earth which are used in large amount of machines and buildings are getting less ."
2992,"[0.0, 0.0, 0.0, 0.0, 0.0, 0.0, 1.0, 0.0, 0.0, 0.0, 0.0]",So the gasoline which provide energy for car is also getting expensive .
2993,"[0.0, 0.0, 0.0, 0.0, 0.0, 0.0, 1.0, 0.0, 0.0, 0.0, 0.0]","Then the people who uses car will stop using car so often , and start to walk or use bus or train ."
2994,"[0.0, 0.0, 0.0, 0.0, 0.0, 0.0, 1.0, 0.0, 0.0, 0.0, 0.0]","The second reason why I think the car in use will be fewer , is because of the enviroment problems ."
2995,"[0.0, 0.0, 0.0, 0.0, 0.0, 0.0, 1.0, 0.0, 0.0, 0.0, 0.0]","The dioxide which is include in the exhaust from the car , is damaging the ozone which is covering the earth ."
2996,"[0.0, 0.0, 0.0, 0.0, 0.0, 0.0, 1.0, 0.0, 0.0, 0.0, 0.0]",And it is still been damaged .
2997,"[0.0, 0.0, 0.0, 0.0, 0.0, 0.0, 1.0, 0.0, 0.0, 0.0, 0.0]","To stop damaging it , people have to stop providing dioxide ."
2998,"[0.0, 0.0, 0.0, 0.0, 0.0, 0.0, 1.0, 0.0, 0.0, 0.0, 0.0]",So people will have to stop using car so often .
2999,"[0.0, 0.0, 0.0, 0.0, 0.0, 0.0, 1.0, 0.0, 0.0, 0.0, 0.0]",This is the two reasons why I agree the statement .
3000,"[0.0, 0.0, 0.0, 0.0, 1.0, 0.0, 0.0, 0.0, 0.0, 0.0, 0.0]",knowledge is like an ocean and man gets this life only once .
3001,"[0.0, 0.0, 0.0, 0.0, 1.0, 0.0, 0.0, 0.0, 0.0, 0.0, 0.0]",only people who have experienced the taste of gaining knowledge can tell very importance of gaining knowledge .
3002,"[0.0, 0.0, 0.0, 0.0, 1.0, 0.0, 0.0, 0.0, 0.0, 0.0, 0.0]",what exaltation and exuberation knowledge it can have
3003,"[0.0, 0.0, 0.0, 0.0, 1.0, 0.0, 0.0, 0.0, 0.0, 0.0, 0.0]",i completely agree that it is better to have broader knowledge of many subjects rather than confining oneself to one subject .
3004,"[0.0, 0.0, 0.0, 0.0, 1.0, 0.0, 0.0, 0.0, 0.0, 0.0, 0.0]",it will give students a wide spectrum of Thier knowledge .
3005,"[0.0, 0.0, 0.0, 0.0, 1.0, 0.0, 0.0, 0.0, 0.0, 0.0, 0.0]",they are going to know a little about every thing .
3006,"[0.0, 0.0, 0.0, 0.0, 1.0, 0.0, 0.0, 0.0, 0.0, 0.0, 0.0]",i just state an example from my own personal experience .
3007,"[0.0, 0.0, 0.0, 0.0, 1.0, 0.0, 0.0, 0.0, 0.0, 0.0, 0.0]",when i was doing my undergraduate .
3008,"[0.0, 0.0, 0.0, 0.0, 1.0, 0.0, 0.0, 0.0, 0.0, 0.0, 0.0]",i was offered a variety af subjects .
3009,"[0.0, 0.0, 0.0, 0.0, 1.0, 0.0, 0.0, 0.0, 0.0, 0.0, 0.0]",and as i progressed i realised there is interconnections between different concepts from different subjects for example i studied metallurgy in my first demister .
3010,"[0.0, 0.0, 0.0, 0.0, 1.0, 0.0, 0.0, 0.0, 0.0, 0.0, 0.0]",and in second semester i had advance mechanics of structures .
3011,"[0.0, 0.0, 0.0, 0.0, 1.0, 0.0, 0.0, 0.0, 0.0, 0.0, 0.0]",first i thought that they had no connection but later i realised the without the metallurgy i would not have been able understand advance mechanics of structures .
3012,"[0.0, 0.0, 0.0, 0.0, 1.0, 0.0, 0.0, 0.0, 0.0, 0.0, 0.0]",also one specific subject can make a person master in that subject but he is going to have less job opportunities than the person with wide spectrum of knowledge .
3013,"[0.0, 0.0, 0.0, 0.0, 1.0, 0.0, 0.0, 0.0, 0.0, 0.0, 0.0]",a wide variety of subjects makes a person to be in the tune with the present world
3014,"[0.0, 0.0, 0.0, 0.0, 1.0, 0.0, 0.0, 0.0, 0.0, 0.0, 0.0]",i can give an another example of a scientists newton who had knowledge of wide variety of subject and was able to discover theories which were not related to field .
3015,"[0.0, 0.0, 0.0, 0.0, 1.0, 0.0, 0.0, 0.0, 0.0, 0.0, 0.0]",in hindu mythology it is said knowledge brings you closer to god so more u gain the knowledge more closer you will be to the god .
3016,"[0.0, 0.0, 0.0, 0.0, 1.0, 0.0, 0.0, 0.0, 0.0, 0.0, 0.0]",knowledge can unravel the hidden secrets of this physical world so the more you learn the more intellect you become
3017,"[0.0, 0.0, 0.0, 0.0, 0.0, 0.0, 1.0, 0.0, 0.0, 0.0, 0.0]","I disagree with the opinion that there will be fewer cars in use that there are today in twenty years , because , basically , I think it stays the same as many people like to have their private cars ."
3018,"[0.0, 0.0, 0.0, 0.0, 0.0, 0.0, 1.0, 0.0, 0.0, 0.0, 0.0]","Indeed , it is good to have public transportation means such as , trains and buses , as they reduces not only the traffic jam but also the pollutions ."
3019,"[0.0, 0.0, 0.0, 0.0, 0.0, 0.0, 1.0, 0.0, 0.0, 0.0, 0.0]","And I believe , for such reason , there will be more high - advanced public transportation means in the future and I can easily assume that many people may think that it may reduces the number of cars on the roads ."
3020,"[0.0, 0.0, 0.0, 0.0, 0.0, 0.0, 1.0, 0.0, 0.0, 0.0, 0.0]","However , at the same time , I believe that , even under such circumstances , many people still prefer to have their own private cars ."
3021,"[0.0, 0.0, 0.0, 0.0, 0.0, 0.0, 1.0, 0.0, 0.0, 0.0, 0.0]","There are many people whose residents are not close to the stop - point of the public transportation , especially in rural areas ."
3022,"[0.0, 0.0, 0.0, 0.0, 0.0, 0.0, 1.0, 0.0, 0.0, 0.0, 0.0]","For instance , my uncle is living in a rural area of Japan where it takes fifty minutes to get to the closest train station ."
3023,"[0.0, 0.0, 0.0, 0.0, 0.0, 0.0, 1.0, 0.0, 0.0, 0.0, 0.0]","And , there are many people who like driving itself ."
3024,"[0.0, 0.0, 0.0, 0.0, 0.0, 0.0, 1.0, 0.0, 0.0, 0.0, 0.0]","Also , there are many people who really prefer to have private space even at the the time of commute ."
3025,"[0.0, 0.0, 0.0, 0.0, 0.0, 0.0, 1.0, 0.0, 0.0, 0.0, 0.0]","For example , I have a friend who really likes to take cars ."
3026,"[0.0, 0.0, 0.0, 0.0, 0.0, 0.0, 1.0, 0.0, 0.0, 0.0, 0.0]","I usually prefer to go for trip by trains because , in that way , I do not need to care how to get to the destination and where to go to the bathrooms ."
3027,"[0.0, 0.0, 0.0, 0.0, 0.0, 0.0, 1.0, 0.0, 0.0, 0.0, 0.0]","However , this friend living in urban areas in Tokyo , always go for trip by car even if it takes longer time than going by trains ."
3028,"[0.0, 0.0, 0.0, 0.0, 0.0, 0.0, 1.0, 0.0, 0.0, 0.0, 0.0]",He once told me that he prefer cars to trains and buses because it gives him more private time and he does not want anybody to bother while commuting .
3029,"[0.0, 0.0, 0.0, 0.0, 0.0, 0.0, 1.0, 0.0, 0.0, 0.0, 0.0]",I believe this is true to many other persons .
3030,"[0.0, 0.0, 0.0, 0.0, 0.0, 0.0, 1.0, 0.0, 0.0, 0.0, 0.0]",Many people think it is important to have private time .
3031,"[0.0, 0.0, 0.0, 0.0, 0.0, 0.0, 1.0, 0.0, 0.0, 0.0, 0.0]","I think it is true that , if you are busy communicating people , then you feel frustrated and in that situation , people need private time ."
3032,"[0.0, 0.0, 0.0, 0.0, 0.0, 0.0, 1.0, 0.0, 0.0, 0.0, 0.0]","Given all those circumstances , I still believe that , so long as people are as busy as now , even twenty years after , the there will be same number or even more cars as it is now ."
3033,"[1.0, 0.0, 0.0, 0.0, 0.0, 0.0, 0.0, 0.0, 0.0, 0.0, 0.0]",The importance of understanding concepts
3034,"[1.0, 0.0, 0.0, 0.0, 0.0, 0.0, 0.0, 0.0, 0.0, 0.0, 0.0]","Learning facts is an important part in an educational system , but what counts most is understanding the concepts and ideas ."
3035,"[1.0, 0.0, 0.0, 0.0, 0.0, 0.0, 0.0, 0.0, 0.0, 0.0, 0.0]","First , if a student gets to understand how a certain system works , he would be able to understand the effect it has and be able to assimilate the information faster ."
3036,"[1.0, 0.0, 0.0, 0.0, 0.0, 0.0, 0.0, 0.0, 0.0, 0.0, 0.0]","If he memorized it as a fact without understanding the concept , he is probably going to forget it the next day ."
3037,"[1.0, 0.0, 0.0, 0.0, 0.0, 0.0, 0.0, 0.0, 0.0, 0.0, 0.0]","I take myself as an example , I am a pharmacy student , and in my field there are lots of facts , as example , a drug leads to a certain effect , but understanding the mechanism by which this drug works in the body and why it leads to this specific effect makes it easier for me to learn it and later use it ."
3038,"[1.0, 0.0, 0.0, 0.0, 0.0, 0.0, 0.0, 0.0, 0.0, 0.0, 0.0]","Another point in favor of understanding concepts is that by doing so , the student will be able to develop his logical and analytical thinking which Wil allow him later to applicate what he learned in another field or problem ."
3039,"[1.0, 0.0, 0.0, 0.0, 0.0, 0.0, 0.0, 0.0, 0.0, 0.0, 0.0]","For instance , understanding why the earth gravity around the sun is more important than the fact itself , because understanding this concept enables the student to apply it to the whole astronomy field including the understanding of eclipse and seasons changes ."
3040,"[1.0, 0.0, 0.0, 0.0, 0.0, 0.0, 0.0, 0.0, 0.0, 0.0, 0.0]","Finally , when learning facts , students tend to accumulate information and stick to them , whereas trying to understand an idea leads them to do their own research on the subject , to have their own judgment and approach ."
3041,"[1.0, 0.0, 0.0, 0.0, 0.0, 0.0, 0.0, 0.0, 0.0, 0.0, 0.0]",They tend to broaden their mind and increase their curiosity .
3042,"[1.0, 0.0, 0.0, 0.0, 0.0, 0.0, 0.0, 0.0, 0.0, 0.0, 0.0]","I think that learning facts is important depending on the field of study because there are things that ca n't be explained or are beyond students understanding , but what is the most important is to understand the concepts whenever it 's possible because by doing so , a student manage to develop his way of thinking and to apply the concept to another field ."
3043,"[0.0, 0.0, 0.0, 0.0, 0.0, 0.0, 0.0, 0.0, 1.0, 0.0, 0.0]","Being successful in life is something that we all desire , unluckily only a few ones will manage to get it ."
3044,"[0.0, 0.0, 0.0, 0.0, 0.0, 0.0, 0.0, 0.0, 1.0, 0.0, 0.0]","Personally , I think that success depends on many things and not only on taking risks because if you want to be the number one on something , you need to be born with certain skills , give the best of you and to make an important sacrifice ."
3045,"[0.0, 0.0, 0.0, 0.0, 0.0, 0.0, 0.0, 0.0, 1.0, 0.0, 0.0]","Some people may agree in saying that being succesful means to break the rules , However you can not break any rule if you do not know how rules work first ."
3046,"[0.0, 0.0, 0.0, 0.0, 0.0, 0.0, 0.0, 0.0, 1.0, 0.0, 0.0]","I mean , if you want to be the best at playing soccer , you need to know that there are certain rules that you are suppose to follow , like team work , solidarity , understanding your mates etc ."
3047,"[0.0, 0.0, 0.0, 0.0, 0.0, 0.0, 0.0, 0.0, 1.0, 0.0, 0.0]","in this case , to think that you will become the best football player in the world by doing whatever you want and not paying any attention at all to any recommendation is absolutely nonsense ."
3048,"[0.0, 0.0, 0.0, 0.0, 0.0, 0.0, 0.0, 0.0, 1.0, 0.0, 0.0]","Obviously , when you behave like this , you are taking a risk , but that risk is ridiculous and naive ."
3049,"[0.0, 0.0, 0.0, 0.0, 0.0, 0.0, 0.0, 0.0, 1.0, 0.0, 0.0]","I wholeheartedly believe that if you ever dream of being a successful man , sometimes you will have to take a risky step , but that step can not be taken without having the previous knowledge about something or without being fully aware of the consequences ."
3050,"[0.0, 0.0, 0.0, 0.0, 0.0, 0.0, 0.0, 0.0, 1.0, 0.0, 0.0]","The fact that we live in a society that everyday demands more and more , makes us think that if we do not gain success we are nothing ."
3051,"[0.0, 0.0, 0.0, 0.0, 0.0, 0.0, 0.0, 0.0, 1.0, 0.0, 0.0]","Nevertheless , success is not a matter of being the best at something , but being the best in all these small things that we do in our everyday life ."
3052,"[0.0, 0.0, 0.0, 0.0, 0.0, 0.0, 0.0, 0.0, 1.0, 0.0, 0.0]","To conclude , if you want to be successful take risk , but do not let this risk destroy your whole life ."
3053,"[0.0, 0.0, 0.0, 0.0, 1.0, 0.0, 0.0, 0.0, 0.0, 0.0, 0.0]",I agree that young people enjoy life more than older people do .
3054,"[0.0, 0.0, 0.0, 0.0, 1.0, 0.0, 0.0, 0.0, 0.0, 0.0, 0.0]",Because young people can do many things which they want .
3055,"[0.0, 0.0, 0.0, 0.0, 1.0, 0.0, 0.0, 0.0, 0.0, 0.0, 0.0]",Young people play many games which older people cant do .
3056,"[0.0, 0.0, 0.0, 0.0, 1.0, 0.0, 0.0, 0.0, 0.0, 0.0, 0.0]",Young people rome every where but older people cant because according to their age their stamina will be decreased .
3057,"[0.0, 0.0, 0.0, 0.0, 1.0, 0.0, 0.0, 0.0, 0.0, 0.0, 0.0]",Young people have much stamina to do everything .
3058,"[0.0, 0.0, 0.0, 0.0, 1.0, 0.0, 0.0, 0.0, 0.0, 0.0, 0.0]",The thinking of young people goes with the present generation which older person cant do .
3059,"[0.0, 0.0, 0.0, 0.0, 1.0, 0.0, 0.0, 0.0, 0.0, 0.0, 0.0]",For example a young person know much about computer and new softwares .
3060,"[0.0, 0.0, 0.0, 0.0, 1.0, 0.0, 0.0, 0.0, 0.0, 0.0, 0.0]",But older people they dont know and they dont need also .
3061,"[0.0, 0.0, 0.0, 0.0, 1.0, 0.0, 0.0, 0.0, 0.0, 0.0, 0.0]","A young person can play games to be healthy but a older person , they have to do exercise to be healthy because they cant play all games against the youth ."
3062,"[0.0, 0.0, 0.0, 0.0, 1.0, 0.0, 0.0, 0.0, 0.0, 0.0, 0.0]","As a people goes old , they behave Vey matured ."
3063,"[0.0, 0.0, 0.0, 0.0, 1.0, 0.0, 0.0, 0.0, 0.0, 0.0, 0.0]",Young person behaves as a child sometimes .
3064,"[0.0, 0.0, 0.0, 0.0, 1.0, 0.0, 0.0, 0.0, 0.0, 0.0, 0.0]",Young people can enjoy the new technologies and new things in the market .
3065,"[0.0, 0.0, 0.0, 0.0, 1.0, 0.0, 0.0, 0.0, 0.0, 0.0, 0.0]",They can get all advantages and make easier all works .
3066,"[0.0, 0.0, 0.0, 0.0, 1.0, 0.0, 0.0, 0.0, 0.0, 0.0, 0.0]",Older person cant enjoy with that new technology or science because they have over come with many things in their lives .
3067,"[0.0, 0.0, 0.0, 0.0, 1.0, 0.0, 0.0, 0.0, 0.0, 0.0, 0.0]","Young people go to college , office , parties where they can entertain themselves in many ways ."
3068,"[0.0, 0.0, 0.0, 0.0, 1.0, 0.0, 0.0, 0.0, 0.0, 0.0, 0.0]",But older people cant .
3069,"[0.0, 0.0, 0.0, 0.0, 1.0, 0.0, 0.0, 0.0, 0.0, 0.0, 0.0]",Because they have already enjoyed their life .
3070,"[0.0, 0.0, 0.0, 0.0, 1.0, 0.0, 0.0, 0.0, 0.0, 0.0, 0.0]",Young people dont have any responsibility and stress of family .
3071,"[0.0, 0.0, 0.0, 0.0, 1.0, 0.0, 0.0, 0.0, 0.0, 0.0, 0.0]",Older people have responsibility and stress with which they cant enjoy .
3072,"[0.0, 0.0, 0.0, 0.0, 1.0, 0.0, 0.0, 0.0, 0.0, 0.0, 0.0]",They did n't get time after all responsibilities to enjoy .
3073,"[0.0, 0.0, 0.0, 0.0, 1.0, 0.0, 0.0, 0.0, 0.0, 0.0, 0.0]",And one thing what older people can do young people cant do .
3074,"[0.0, 0.0, 0.0, 0.0, 1.0, 0.0, 0.0, 0.0, 0.0, 0.0, 0.0]",Once in my life i struck in a position that i was not able to solve that problem .
3075,"[0.0, 0.0, 0.0, 0.0, 1.0, 0.0, 0.0, 0.0, 0.0, 0.0, 0.0]",That time my grand father handle with that problem and solved .
3076,"[0.0, 0.0, 0.0, 0.0, 1.0, 0.0, 0.0, 0.0, 0.0, 0.0, 0.0]",It clearly tell that young people enjoy life when older people take care of them .
3077,"[0.0, 0.0, 0.0, 0.0, 1.0, 0.0, 0.0, 0.0, 0.0, 0.0, 0.0]","Young people walk with the present life , fashion , styles ."
3078,"[0.0, 0.0, 0.0, 0.0, 1.0, 0.0, 0.0, 0.0, 0.0, 0.0, 0.0]",Young people enjoy walking with the generation .
3079,"[0.0, 0.0, 0.0, 0.0, 1.0, 0.0, 0.0, 0.0, 0.0, 0.0, 0.0]",Older people are simple and make generation to walk properly .
3080,"[0.0, 0.0, 0.0, 1.0, 0.0, 0.0, 0.0, 0.0, 0.0, 0.0, 0.0]",I belive that there will be more cars in twenty years .
3081,"[0.0, 0.0, 0.0, 1.0, 0.0, 0.0, 0.0, 0.0, 0.0, 0.0, 0.0]",What forms my opinion are different points .
3082,"[0.0, 0.0, 0.0, 1.0, 0.0, 0.0, 0.0, 0.0, 0.0, 0.0, 0.0]",The first is caused by the individual need for transportation .
3083,"[0.0, 0.0, 0.0, 1.0, 0.0, 0.0, 0.0, 0.0, 0.0, 0.0, 0.0]",This meas that every one of us wants to reach a destination at every time in the shortest possible way .
3084,"[0.0, 0.0, 0.0, 1.0, 0.0, 0.0, 0.0, 0.0, 0.0, 0.0, 0.0]","This means , probably the cars will not be like the cars we have today , but there will always be automobiles for an individual journey form one place to another ."
3085,"[0.0, 0.0, 0.0, 1.0, 0.0, 0.0, 0.0, 0.0, 0.0, 0.0, 0.0]","A transportation in a train or bus can never replace this , just because a train or a bus needs to be profitable , so it needs to transport as many people at once and this leads us to a scedule for a department ."
3086,"[0.0, 0.0, 0.0, 1.0, 0.0, 0.0, 0.0, 0.0, 0.0, 0.0, 0.0]",This means it is no more a leaving a place at one time I wish and it will not bring me exactly to the place i wish .
3087,"[0.0, 0.0, 0.0, 1.0, 0.0, 0.0, 0.0, 0.0, 0.0, 0.0, 0.0]",Our needs for a resting time more and more needs that we work in a place far away from the place we work .
3088,"[0.0, 0.0, 0.0, 1.0, 0.0, 0.0, 0.0, 0.0, 0.0, 0.0, 0.0]","I can say this of my own , that I prefer to live in an little town away from the city where I work ."
3089,"[0.0, 0.0, 0.0, 1.0, 0.0, 0.0, 0.0, 0.0, 0.0, 0.0, 0.0]",It means that when I come home to my little town the world is not as busy and stressful .
3090,"[0.0, 0.0, 0.0, 1.0, 0.0, 0.0, 0.0, 0.0, 0.0, 0.0, 0.0]",This daily journey leads me to a drive of some kilometers I am doing every day by car .
3091,"[0.0, 0.0, 0.0, 1.0, 0.0, 0.0, 0.0, 0.0, 0.0, 0.0, 0.0]",My wife does the same just in the other direction .
3092,"[0.0, 0.0, 0.0, 1.0, 0.0, 0.0, 0.0, 0.0, 0.0, 0.0, 0.0]","So this leads us to have two cars and when I compare this to my parents they just only had one car , what was enough for them ."
3093,"[0.0, 0.0, 0.0, 1.0, 0.0, 0.0, 0.0, 0.0, 0.0, 0.0, 0.0]","For us , compared to my parents is has become normal to work and live in different cities ."
3094,"[0.0, 0.0, 0.0, 1.0, 0.0, 0.0, 0.0, 0.0, 0.0, 0.0, 0.0]",This automatically leads to more cars in a family .
