,label,sent
1036,"[0.0, 0.0, 1.0, 0.0, 0.0, 0.0, 0.0, 0.0, 0.0, 0.0, 0.0]","I think that these people do not realize that groups of young people such as the scouts help their communities as much as they can , that they forget that things were not so different in the past and that helping others without asking for compensation is for sure very much culturally determined ."
1037,"[0.0, 0.0, 1.0, 0.0, 0.0, 0.0, 0.0, 0.0, 0.0, 0.0, 0.0]","I think that having broad knowledge of many academic subjects is necessary , it is the first step of a good education , a good foundation giving the best chances to adapt ."
1038,"[0.0, 0.0, 1.0, 0.0, 0.0, 0.0, 0.0, 0.0, 0.0, 0.0, 0.0]",But then it is often required to get a specialization .
1039,"[0.0, 0.0, 1.0, 0.0, 0.0, 0.0, 0.0, 0.0, 0.0, 0.0, 0.0]","In our society being specialized in one specific subject is more and more a necessity , vital to get a job or to hold a position in a company ."
1040,"[0.0, 0.0, 1.0, 0.0, 0.0, 0.0, 0.0, 0.0, 0.0, 0.0, 0.0]",Also it helps to have a better salary .
1041,"[0.0, 0.0, 1.0, 0.0, 0.0, 0.0, 0.0, 0.0, 0.0, 0.0, 0.0]",It will often depend on the type of work or position .
1042,"[0.0, 0.0, 1.0, 0.0, 0.0, 0.0, 0.0, 0.0, 0.0, 0.0, 0.0]","For example , lawyers should have broad knowledge of the legal system , the main legal principles and cases ."
1043,"[0.0, 0.0, 1.0, 0.0, 0.0, 0.0, 0.0, 0.0, 0.0, 0.0, 0.0]","But during their training , they are required to choose a specialization ."
1044,"[0.0, 0.0, 1.0, 0.0, 0.0, 0.0, 0.0, 0.0, 0.0, 0.0, 0.0]",Corporate lawyers should have a good practice and experience in Company Law .
1045,"[0.0, 0.0, 1.0, 0.0, 0.0, 0.0, 0.0, 0.0, 0.0, 0.0, 0.0]",They can not practice in Public Law and be good at it at the same time .
1046,"[0.0, 0.0, 1.0, 0.0, 0.0, 0.0, 0.0, 0.0, 0.0, 0.0, 0.0]",These subjects are too different .
1047,"[0.0, 0.0, 1.0, 0.0, 0.0, 0.0, 0.0, 0.0, 0.0, 0.0, 0.0]","The more they can get an experience in a specific area of Law , the best they will be in their area , the more they will be competent , recognised and well - paid ."
1048,"[0.0, 0.0, 1.0, 0.0, 0.0, 0.0, 0.0, 0.0, 0.0, 0.0, 0.0]",The issue is the same for people working in Research or in the medical sector .
1049,"[0.0, 0.0, 1.0, 0.0, 0.0, 0.0, 0.0, 0.0, 0.0, 0.0, 0.0]","After a certain number of years of study , a specialization is often mandatory for a certain number of jobs ."
1050,"[0.0, 0.0, 1.0, 0.0, 0.0, 0.0, 0.0, 0.0, 0.0, 0.0, 0.0]",But the above mentioned statement can be exact for managers for example who should have a good knowledge of many areas of their companies in order to be able to take the right and appropriate decisions
1051,"[0.0, 0.0, 0.0, 0.0, 0.0, 0.0, 1.0, 0.0, 0.0, 0.0, 0.0]",I agree with this statement .
1052,"[0.0, 0.0, 0.0, 0.0, 0.0, 0.0, 1.0, 0.0, 0.0, 0.0, 0.0]","understanding ideas and concepts is more significant than learning facts because understanding ideas and concepts affect on the skill of remembering and explaining things , and it also helps to learn other information ."
1053,"[0.0, 0.0, 0.0, 0.0, 0.0, 0.0, 1.0, 0.0, 0.0, 0.0, 0.0]",Understanding ideas and concepts means that understanding things deeply .
1054,"[0.0, 0.0, 0.0, 0.0, 0.0, 0.0, 1.0, 0.0, 0.0, 0.0, 0.0]","If you understand details of thing which you want to remember , you do n't forget it easily ."
1055,"[0.0, 0.0, 0.0, 0.0, 0.0, 0.0, 1.0, 0.0, 0.0, 0.0, 0.0]","Also , you can explain about it when you are asked some one about it ."
1056,"[0.0, 0.0, 0.0, 0.0, 0.0, 0.0, 1.0, 0.0, 0.0, 0.0, 0.0]","If you learn only fact , it is good for remembering for short time to answer tomorrow 's quite , but you may not be able to remember it for long time ."
1057,"[0.0, 0.0, 0.0, 0.0, 0.0, 0.0, 1.0, 0.0, 0.0, 0.0, 0.0]",You ca n't also explain about it deeply in the class .
1058,"[0.0, 0.0, 0.0, 0.0, 0.0, 0.0, 1.0, 0.0, 0.0, 0.0, 0.0]","Therefore , Understanding ideas and concepts is more important than learning just facts for students ."
1059,"[0.0, 0.0, 0.0, 0.0, 0.0, 0.0, 1.0, 0.0, 0.0, 0.0, 0.0]",Another reason why understanding details is more important than learning facts is that it affects on learning new things .
1060,"[0.0, 0.0, 0.0, 0.0, 0.0, 0.0, 1.0, 0.0, 0.0, 0.0, 0.0]","If you perceive details of thing which you learn perfectly , you can understand things which you will learn next easily ."
1061,"[0.0, 0.0, 0.0, 0.0, 0.0, 0.0, 1.0, 0.0, 0.0, 0.0, 0.0]","Most of the things which student learn in school such as math , chemistry , physics or english tend to relate to each other ."
1062,"[0.0, 0.0, 0.0, 0.0, 0.0, 0.0, 1.0, 0.0, 0.0, 0.0, 0.0]","When you learn new things , new things are came from old things which you have already learned ."
1063,"[0.0, 0.0, 0.0, 0.0, 0.0, 0.0, 1.0, 0.0, 0.0, 0.0, 0.0]","Therefore , If you understand ideas and concepts deeply , you can understand new things easily ."
1064,"[0.0, 0.0, 0.0, 0.0, 0.0, 0.0, 1.0, 0.0, 0.0, 0.0, 0.0]","In conclusion , understanding details deeply helps to remember and explain things which you learned and to learn new knowledge easily ."
1065,"[0.0, 0.0, 0.0, 0.0, 0.0, 0.0, 1.0, 0.0, 0.0, 0.0, 0.0]","For all these reasons , understanding ideas and concepts is more important than learning facts for students ."
1066,"[0.0, 0.0, 0.0, 0.0, 0.0, 0.0, 0.0, 1.0, 0.0, 0.0, 0.0]",I agree that successful people try new things more important .
1067,"[0.0, 0.0, 0.0, 0.0, 0.0, 0.0, 0.0, 1.0, 0.0, 0.0, 0.0]",I think someone Who have desire about success are not satisfied one thing .
1068,"[0.0, 0.0, 0.0, 0.0, 0.0, 0.0, 0.0, 1.0, 0.0, 0.0, 0.0]","they seek another things , that is more attractive things ."
1069,"[0.0, 0.0, 0.0, 0.0, 0.0, 0.0, 0.0, 1.0, 0.0, 0.0, 0.0]",Successful people have an endless energy about doing something .
1070,"[0.0, 0.0, 0.0, 0.0, 0.0, 0.0, 0.0, 1.0, 0.0, 0.0, 0.0]","So , they do not like a safety position ."
1071,"[0.0, 0.0, 0.0, 0.0, 0.0, 0.0, 0.0, 1.0, 0.0, 0.0, 0.0]","They think that staying in a comfortable situation is dead , which makes them study many things ."
1072,"[0.0, 0.0, 0.0, 0.0, 0.0, 0.0, 0.0, 1.0, 0.0, 0.0, 0.0]","For example , scientists discover many things ."
1073,"[0.0, 0.0, 0.0, 0.0, 0.0, 0.0, 0.0, 1.0, 0.0, 0.0, 0.0]","Even though they earned much money from one project , they do not enjoy the money ."
1074,"[0.0, 0.0, 0.0, 0.0, 0.0, 0.0, 0.0, 1.0, 0.0, 0.0, 0.0]",They get courage about doing something and proceed forward .
1075,"[0.0, 0.0, 0.0, 0.0, 0.0, 0.0, 0.0, 1.0, 0.0, 0.0, 0.0]",They find new things every day .
1076,"[0.0, 0.0, 0.0, 0.0, 0.0, 0.0, 0.0, 1.0, 0.0, 0.0, 0.0]",I think someone who have power about things are received from God .
1077,"[0.0, 0.0, 0.0, 0.0, 0.0, 0.0, 0.0, 1.0, 0.0, 0.0, 0.0]",They are burned with the nature .
1078,"[0.0, 0.0, 0.0, 0.0, 0.0, 0.0, 0.0, 1.0, 0.0, 0.0, 0.0]","I like Edison because he has not been educated , but he did not stop studying something ."
1079,"[0.0, 0.0, 0.0, 0.0, 0.0, 0.0, 0.0, 1.0, 0.0, 0.0, 0.0]","As a result , he became the father of science ."
1080,"[0.0, 0.0, 0.0, 0.0, 0.0, 0.0, 0.0, 1.0, 0.0, 0.0, 0.0]","He invented many important , realistic , and useful things ."
1081,"[0.0, 0.0, 0.0, 0.0, 0.0, 0.0, 0.0, 1.0, 0.0, 0.0, 0.0]","In spite of his succussing , he invented another things continuously ."
1082,"[0.0, 0.0, 0.0, 0.0, 0.0, 0.0, 0.0, 1.0, 0.0, 0.0, 0.0]","In my opinion , successful people like better a risk , adventurous things , ."
1083,"[0.0, 0.0, 0.0, 0.0, 0.0, 0.0, 0.0, 1.0, 0.0, 0.0, 0.0]","That is , there is no satisfy ."
1084,"[0.0, 0.0, 0.0, 0.0, 0.0, 0.0, 0.0, 1.0, 0.0, 0.0, 0.0]",So they work for new things .
1085,"[1.0, 0.0, 0.0, 0.0, 0.0, 0.0, 0.0, 0.0, 0.0, 0.0, 0.0]",Is it right that young people enjoy life more than older people ?
1086,"[1.0, 0.0, 0.0, 0.0, 0.0, 0.0, 0.0, 0.0, 0.0, 0.0, 0.0]",is it right that old people hate life ?
1087,"[1.0, 0.0, 0.0, 0.0, 0.0, 0.0, 0.0, 0.0, 0.0, 0.0, 0.0]",some ideas come to my mind when i thing about this questions .
1088,"[1.0, 0.0, 0.0, 0.0, 0.0, 0.0, 0.0, 0.0, 0.0, 0.0, 0.0]","Hating life , boring from life difficulties , and stupidness ."
1089,"[1.0, 0.0, 0.0, 0.0, 0.0, 0.0, 0.0, 0.0, 0.0, 0.0, 0.0]",In my view i thing that it 's true that young people enjoy life more than older people .
1090,"[1.0, 0.0, 0.0, 0.0, 0.0, 0.0, 0.0, 0.0, 0.0, 0.0, 0.0]","First of all we know that life filled with problems and difficulties this is a fact and we ca n't say it 's not true at all , so from this point i think that old people have got barred from the life and it 's difficulties , they have saw too many people and too many places and the joyful things for the young will have no test to them ."
1091,"[1.0, 0.0, 0.0, 0.0, 0.0, 0.0, 0.0, 0.0, 0.0, 0.0, 0.0]","Second I thing that old people have hated life because of kind of routine they always get to do the same things and go same places , in better view let us thing that we have bought a new car first we will be very happy gaining it and day by day when time move this happiness will disappear so also old people life for them is like our car day by day it will loose its shiny appearance ."
1092,"[1.0, 0.0, 0.0, 0.0, 0.0, 0.0, 0.0, 0.0, 0.0, 0.0, 0.0]","Frome a different view , every time the human get older his thinking of his life end increases so he begin to take less care of his self so he will not be interested in his life ."
1093,"[1.0, 0.0, 0.0, 0.0, 0.0, 0.0, 0.0, 0.0, 0.0, 0.0, 0.0]","Finally but not the least I think that there are exceptions for my view because there are old people enjoy life much more than young and young people hate life more than old people so i only want to ask them , why ?"
1094,"[0.0, 0.0, 0.0, 0.0, 0.0, 0.0, 1.0, 0.0, 0.0, 0.0, 0.0]",I agree that young people nowadays do not give enough time to helping their communities .
1095,"[0.0, 0.0, 0.0, 0.0, 0.0, 0.0, 1.0, 0.0, 0.0, 0.0, 0.0]",as I said I do n't agree because I am also a young people and i also do n't spend that much time on my communities .
1096,"[0.0, 0.0, 0.0, 0.0, 0.0, 0.0, 1.0, 0.0, 0.0, 0.0, 0.0]","I think that it is because we , young people do not have enough time to spend their time on there communities because of their homeworks ."
1097,"[0.0, 0.0, 0.0, 0.0, 0.0, 0.0, 1.0, 0.0, 0.0, 0.0, 0.0]","they has too much homework , so they can not really concentrate what they need to do for themselves , They always get messed up in middle of their homework , they always start crying ."
1098,"[0.0, 0.0, 0.0, 0.0, 0.0, 0.0, 1.0, 0.0, 0.0, 0.0, 0.0]",Also another reason that I think is that they always spend their time to play their video games .
1099,"[0.0, 0.0, 0.0, 0.0, 0.0, 0.0, 1.0, 0.0, 0.0, 0.0, 0.0]",they always think about finishing the game Ina year or some what like that .
1100,"[0.0, 0.0, 0.0, 0.0, 0.0, 0.0, 1.0, 0.0, 0.0, 0.0, 0.0]",and also the bad thing about the video games is that their eyes will get bad .
1101,"[0.0, 0.0, 0.0, 0.0, 0.0, 0.0, 1.0, 0.0, 0.0, 0.0, 0.0]","as they do not limited how much time you can play video games a day , your eyes will burn some day ."
1102,"[0.0, 0.0, 0.0, 0.0, 0.0, 0.0, 1.0, 0.0, 0.0, 0.0, 0.0]",( Which means that you wo n't be able to see anything with out the horrible glasses . )
1103,"[0.0, 0.0, 0.0, 0.0, 0.0, 0.0, 1.0, 0.0, 0.0, 0.0, 0.0]",The horrible thing about getting your eyes getting burned is thetyou wo n't be able to see anything without your glasses .
1104,"[0.0, 0.0, 0.0, 0.0, 0.0, 0.0, 1.0, 0.0, 0.0, 0.0, 0.0]",As you wake up on the morning and open your eyes you will always start off the day with the blurry world .
1105,"[0.0, 0.0, 0.0, 0.0, 0.0, 0.0, 1.0, 0.0, 0.0, 0.0, 0.0]",And the world will change for ever .
1106,"[0.0, 0.0, 0.0, 0.0, 0.0, 0.0, 1.0, 0.0, 0.0, 0.0, 0.0]",Sometimes when my mother tells me that one of her friend that got a burnt eye took a surgery and got his/her normal eye back my mom 's friend said `` I never knew that the world was this beautiful '' as she was amaze her eyes again became burt again .
1107,"[0.0, 0.0, 0.0, 0.0, 0.0, 0.0, 1.0, 0.0, 0.0, 0.0, 0.0]",so even though you take a surgery of your eyes it wo n't be any good .
1108,"[0.0, 0.0, 0.0, 0.0, 0.0, 0.0, 1.0, 0.0, 0.0, 0.0, 0.0]",So these were the reasoning that why I agreed with young people now adays do not give enough time to helping their communities .
1109,"[0.0, 0.0, 0.0, 0.0, 0.0, 0.0, 1.0, 0.0, 0.0, 0.0, 0.0]",and my own opinion is that myself also do n't give enough time helping my communities myself .
1110,"[0.0, 0.0, 0.0, 0.0, 1.0, 0.0, 0.0, 0.0, 0.0, 0.0, 0.0]",The statement mentioned here is quite an interesting one and it holds considerable importance in this modern era .
1111,"[0.0, 0.0, 0.0, 0.0, 1.0, 0.0, 0.0, 0.0, 0.0, 0.0, 0.0]",At first glance majority of people will feel that the young people do n't enjoy life more than older people but if the matter is taken more seriously then people will realise that that 's not the case .
1112,"[0.0, 0.0, 0.0, 0.0, 1.0, 0.0, 0.0, 0.0, 0.0, 0.0, 0.0]",Young people have the advantage of being young .
1113,"[0.0, 0.0, 0.0, 0.0, 1.0, 0.0, 0.0, 0.0, 0.0, 0.0, 0.0]",Age is one thing that 's in their favor .
1114,"[0.0, 0.0, 0.0, 0.0, 1.0, 0.0, 0.0, 0.0, 0.0, 0.0, 0.0]",Even the older people in their younger days would have enjoyed life more then what they are enjoying now .
1115,"[0.0, 0.0, 0.0, 0.0, 1.0, 0.0, 0.0, 0.0, 0.0, 0.0, 0.0]",I feel that health is an issue to be taken into consideration .
1116,"[0.0, 0.0, 0.0, 0.0, 1.0, 0.0, 0.0, 0.0, 0.0, 0.0, 0.0]",Most of the young people maintain better health then the older people and hence they can enjoy more .
1117,"[0.0, 0.0, 0.0, 0.0, 1.0, 0.0, 0.0, 0.0, 0.0, 0.0, 0.0]",I say this because I feel that it 's not possible to worry about health issues and enjoy life at the same time .
1118,"[0.0, 0.0, 0.0, 0.0, 1.0, 0.0, 0.0, 0.0, 0.0, 0.0, 0.0]",I feel that young people enjoy more then older people because with age comes responsibility .
1119,"[0.0, 0.0, 0.0, 0.0, 1.0, 0.0, 0.0, 0.0, 0.0, 0.0, 0.0]",As compared to the older people young people do n't have much responsibility .
1120,"[0.0, 0.0, 0.0, 0.0, 1.0, 0.0, 0.0, 0.0, 0.0, 0.0, 0.0]",Young people do n't have to think of family and jobs whereas older people have to do that .
1121,"[0.0, 0.0, 0.0, 0.0, 1.0, 0.0, 0.0, 0.0, 0.0, 0.0, 0.0]",Stress is another factor that should be taken into consideration .
1122,"[0.0, 0.0, 0.0, 0.0, 1.0, 0.0, 0.0, 0.0, 0.0, 0.0, 0.0]",According to me older people are more stressed then younger people and that affects their overall outlook of life .
1123,"[0.0, 0.0, 0.0, 0.0, 1.0, 0.0, 0.0, 0.0, 0.0, 0.0, 0.0]",I feel that a person without stress tends to enjoy life more then a person under stress .
1124,"[0.0, 0.0, 0.0, 0.0, 1.0, 0.0, 0.0, 0.0, 0.0, 0.0, 0.0]",I also feel that young people have more options to enjoy .
1125,"[0.0, 0.0, 0.0, 0.0, 1.0, 0.0, 0.0, 0.0, 0.0, 0.0, 0.0]",I say this because I feel that health does n't really permit old people to take part in various activities like sports .
1126,"[0.0, 0.0, 0.0, 0.0, 1.0, 0.0, 0.0, 0.0, 0.0, 0.0, 0.0]",So looking at the points mentioned above I am confident to say that young people enjoy life more then older people and among the various points mentioned above I feel that 's health is something thatreally against the older people is their heath .
1127,"[0.0, 0.0, 0.0, 0.0, 1.0, 0.0, 0.0, 0.0, 0.0, 0.0, 0.0]",The above statement mentions that `` Most Advertisements make products seem much better than they really are '' .
1128,"[0.0, 0.0, 0.0, 0.0, 1.0, 0.0, 0.0, 0.0, 0.0, 0.0, 0.0]",In my opinion this statement is true and valid reasons can be given for the same .
1129,"[0.0, 0.0, 0.0, 0.0, 1.0, 0.0, 0.0, 0.0, 0.0, 0.0, 0.0]",Advertisement has been a mode of communication to the people worldwide .
1130,"[0.0, 0.0, 0.0, 0.0, 1.0, 0.0, 0.0, 0.0, 0.0, 0.0, 0.0]",These days there are various ways in which a product can be advertised .
1131,"[0.0, 0.0, 0.0, 0.0, 1.0, 0.0, 0.0, 0.0, 0.0, 0.0, 0.0]","It can be print , television , radio stations or even websites ."
1132,"[0.0, 0.0, 0.0, 0.0, 1.0, 0.0, 0.0, 0.0, 0.0, 0.0, 0.0]","Print media includes newspapers , fliers , leaflets , hoardings on the road etc ."
1133,"[0.0, 0.0, 0.0, 0.0, 1.0, 0.0, 0.0, 0.0, 0.0, 0.0, 0.0]","Firstly , consider the product wherein there is a huge competitive market , for instance beer ."
1134,"[0.0, 0.0, 0.0, 0.0, 1.0, 0.0, 0.0, 0.0, 0.0, 0.0, 0.0]",When there are so many brands available and when a person is already used to a certain brand what would make him change that brand ?
1135,"[0.0, 0.0, 0.0, 0.0, 1.0, 0.0, 0.0, 0.0, 0.0, 0.0, 0.0]",Nothing but the way it is advertised .
1136,"[0.0, 0.0, 0.0, 0.0, 1.0, 0.0, 0.0, 0.0, 0.0, 0.0, 0.0]",These days we see large hoardings which say that the beer named Bedlight has `` no carbs and no calories '' .
1137,"[0.0, 0.0, 0.0, 0.0, 1.0, 0.0, 0.0, 0.0, 0.0, 0.0, 0.0]",So this directs the people who are calorie conscious to drink that beer .
1138,"[0.0, 0.0, 0.0, 0.0, 1.0, 0.0, 0.0, 0.0, 0.0, 0.0, 0.0]",We just believe in the advertisement and go ahead to buy the product .
1139,"[0.0, 0.0, 0.0, 0.0, 1.0, 0.0, 0.0, 0.0, 0.0, 0.0, 0.0]",But does anyone really know if this is true and the other thing even if the beer is not good at taste people will drink only because of the way it has been advertised .
1140,"[0.0, 0.0, 0.0, 0.0, 1.0, 0.0, 0.0, 0.0, 0.0, 0.0, 0.0]","Secondly , in India there was a product called `` Fair n Lovely '' which is a fairness cream and when applied on the skin makes a person fair in 21 days ."
1141,"[0.0, 0.0, 0.0, 0.0, 1.0, 0.0, 0.0, 0.0, 0.0, 0.0, 0.0]",How far can we agree to this ?
1142,"[0.0, 0.0, 0.0, 0.0, 1.0, 0.0, 0.0, 0.0, 0.0, 0.0, 0.0]",Even if this does not actually happen to all people they still want to try .
1143,"[0.0, 0.0, 0.0, 0.0, 1.0, 0.0, 0.0, 0.0, 0.0, 0.0, 0.0]",All the people want to apply and see the result and psychologically they feel that there is a change in them .
1144,"[0.0, 0.0, 0.0, 0.0, 1.0, 0.0, 0.0, 0.0, 0.0, 0.0, 0.0]","Thirdly , there are certain products which have established a brand name in the market , so these sellers dont need to make their product look more better ."
1145,"[0.0, 0.0, 0.0, 0.0, 1.0, 0.0, 0.0, 0.0, 0.0, 0.0, 0.0]","To illustrate the food chain namely `` Subway '' has already created their brand name so they dont need to advertise Thier product in a way which seems to be good whereas the food chains like Jack in the Box , Dairy Queen who are making a stand in the market have to advertise in such a way that their products look tempting and can be sold easily ."
1146,"[0.0, 0.0, 0.0, 0.0, 1.0, 0.0, 0.0, 0.0, 0.0, 0.0, 0.0]","Thus , it can be said that Advertisement is the reason to make a product seem much better ."
1147,"[0.0, 0.0, 0.0, 0.0, 1.0, 0.0, 0.0, 0.0, 0.0, 0.0, 0.0]",No doubt some products are good in reality but the other products which can not survive in competition make their product look like the best one .
1148,"[0.0, 0.0, 0.0, 0.0, 1.0, 0.0, 0.0, 0.0, 0.0, 0.0, 0.0]",Therefore without Advertisement no product can be sold or made noticeable to the people locally or globally .
1149,"[0.0, 0.0, 0.0, 0.0, 1.0, 0.0, 0.0, 0.0, 0.0, 0.0, 0.0]",Advertisement forms a part or a necessity of every organisation but the methods used for advertising should be straight and not misleading to the consumers .
1150,"[0.0, 0.0, 0.0, 0.0, 0.0, 1.0, 0.0, 0.0, 0.0, 0.0, 0.0]","I disagree with the sentence , because the economy of more countries depends on cars ."
1151,"[0.0, 0.0, 0.0, 0.0, 0.0, 1.0, 0.0, 0.0, 0.0, 0.0, 0.0]","There are , intact , more companies that sold cars in the world , and tecnology , often , is trained by the cars ' economy ."
1152,"[0.0, 0.0, 0.0, 0.0, 0.0, 1.0, 0.0, 0.0, 0.0, 0.0, 0.0]",Than there are the oil companies that want always sold their black gold .
1153,"[0.0, 0.0, 0.0, 0.0, 0.0, 1.0, 0.0, 0.0, 0.0, 0.0, 0.0]",The industries of cars give many jobs to person and for a state this is a good reason to help that .
1154,"[0.0, 0.0, 0.0, 0.0, 0.0, 1.0, 0.0, 0.0, 0.0, 0.0, 0.0]","For example , in Italy , there is a company who name is FIAT ."
1155,"[0.0, 0.0, 0.0, 0.0, 0.0, 1.0, 0.0, 0.0, 0.0, 0.0, 0.0]",Often the italian state give help to theme to have a job for many people and to govern with serenity .
1156,"[0.0, 0.0, 0.0, 0.0, 0.0, 1.0, 0.0, 0.0, 0.0, 0.0, 0.0]",The tecnology in a lot of cases is trained but the industries of cars that ask to scientist many things that are used to be more beautiful and comfortable cars .
1157,"[0.0, 0.0, 0.0, 0.0, 0.0, 1.0, 0.0, 0.0, 0.0, 0.0, 0.0]",The lights and the interiors became necessary to have a nice car .
1158,"[0.0, 0.0, 0.0, 0.0, 0.0, 1.0, 0.0, 0.0, 0.0, 0.0, 0.0]",Consequence of this is that many other companies found their job on the car 's industries .
1159,"[0.0, 0.0, 0.0, 0.0, 0.0, 1.0, 0.0, 0.0, 0.0, 0.0, 0.0]",It 's very complicate to transform in only twenty years all the trainers in the world .
1160,"[0.0, 0.0, 0.0, 0.0, 0.0, 1.0, 0.0, 0.0, 0.0, 0.0, 0.0]","Than for the tecnology that we have today , cars are the better machine to move that we can have and the most economic ."
1161,"[0.0, 0.0, 0.0, 0.0, 0.0, 1.0, 0.0, 0.0, 0.0, 0.0, 0.0]",In twenty years is impossible to discover and research a new type of machine .
1162,"[0.0, 0.0, 0.0, 0.0, 0.0, 1.0, 0.0, 0.0, 0.0, 0.0, 0.0]",Intact to design a new machine the industries have to study more than ten years .
1163,"[0.0, 0.0, 0.0, 0.0, 0.0, 1.0, 0.0, 0.0, 0.0, 0.0, 0.0]",Than starts the testing on the machine .
1164,"[0.0, 0.0, 0.0, 0.0, 0.0, 1.0, 0.0, 0.0, 0.0, 0.0, 0.0]","it 's necessary a lot of time to build a new kind of car , but in also necessary to study very quickly fot the pollution that cause many ills ."
1165,"[0.0, 1.0, 0.0, 0.0, 0.0, 0.0, 0.0, 0.0, 0.0, 0.0, 0.0]","To be more flexible in this information world , we should gain various knowledge and relatively deeper knowledge in some majors ."
1166,"[0.0, 1.0, 0.0, 0.0, 0.0, 0.0, 0.0, 0.0, 0.0, 0.0, 0.0]",Broad knowledge of many academic subjects and specialize in one specific subject are both useful and important .
1167,"[0.0, 1.0, 0.0, 0.0, 0.0, 0.0, 0.0, 0.0, 0.0, 0.0, 0.0]","To be a person with broad knowledge of many academic subjects , you could be more flexible in some common field ."
1168,"[0.0, 1.0, 0.0, 0.0, 0.0, 0.0, 0.0, 0.0, 0.0, 0.0, 0.0]",One person could solve so many problems if she or he commands enough various knowledges .
1169,"[0.0, 1.0, 0.0, 0.0, 0.0, 0.0, 0.0, 0.0, 0.0, 0.0, 0.0]","With big range of knowledge , Evey problem could be handled in a quick and relatively effective way ."
1170,"[0.0, 1.0, 0.0, 0.0, 0.0, 0.0, 0.0, 0.0, 0.0, 0.0, 0.0]","For example , in the hospital , a general doctor could give advises to the patients of all kinds of common diseases such as bad cold , fever , etc ."
1171,"[0.0, 1.0, 0.0, 0.0, 0.0, 0.0, 0.0, 0.0, 0.0, 0.0, 0.0]","However , when a serious injury occurs , a general doctor can not even handle it ."
1172,"[0.0, 1.0, 0.0, 0.0, 0.0, 0.0, 0.0, 0.0, 0.0, 0.0, 0.0]","In such case , we need a surgeon to do a specialized rescue to the patient ."
1173,"[0.0, 1.0, 0.0, 0.0, 0.0, 0.0, 0.0, 0.0, 0.0, 0.0, 0.0]","When you feel that one of your tooth is badly aching , you turn to a dentist ."
1174,"[0.0, 1.0, 0.0, 0.0, 0.0, 0.0, 0.0, 0.0, 0.0, 0.0, 0.0]","That is , we solve specialized problem with specialized professional knowledge ."
1175,"[0.0, 1.0, 0.0, 0.0, 0.0, 0.0, 0.0, 0.0, 0.0, 0.0, 0.0]","In our study or work , we may face some difficulties or complexities involving professional knowledge ."
1176,"[0.0, 1.0, 0.0, 0.0, 0.0, 0.0, 0.0, 0.0, 0.0, 0.0, 0.0]",What we could do best is to find the only right shortcut to let the obstacle gone .
1177,"[0.0, 1.0, 0.0, 0.0, 0.0, 0.0, 0.0, 0.0, 0.0, 0.0, 0.0]","Generally , broad knowledge help us become thinking natural , and have the basic ability to handle daily problems ."
1178,"[0.0, 1.0, 0.0, 0.0, 0.0, 0.0, 0.0, 0.0, 0.0, 0.0, 0.0]",It makes us have the problem solving sense .
1179,"[0.0, 1.0, 0.0, 0.0, 0.0, 0.0, 0.0, 0.0, 0.0, 0.0, 0.0]","With professional specialized knowledge , we could do a qualified job in a specific field , to know more , to dig deeper , to do better ."
1180,"[0.0, 0.0, 0.0, 0.0, 0.0, 0.0, 0.0, 0.0, 0.0, 0.0, 1.0]","I disagree with the idea that it is better to have broad knowledge of many academic subjects than to specialize in one specific subject firstly because it is impractical to have knowledge on many issues , and secondly because broad knowledge may not be enough for the solution of a problem and it does not promote development ."
1181,"[0.0, 0.0, 0.0, 0.0, 0.0, 0.0, 0.0, 0.0, 0.0, 0.0, 1.0]",I think having a broad knowledge of various different academic subjects would be a very time consuming attempt .
1182,"[0.0, 0.0, 0.0, 0.0, 0.0, 0.0, 0.0, 0.0, 0.0, 0.0, 1.0]","For example in my study of expertise which is psychology , none can be expected even to know the subfields of the area ."
1183,"[0.0, 0.0, 0.0, 0.0, 0.0, 0.0, 0.0, 0.0, 0.0, 0.0, 1.0]","There are various areas under the large area of psychology like cognitive psychology , developmental psychology and social psychology ."
1184,"[0.0, 0.0, 0.0, 0.0, 0.0, 0.0, 0.0, 0.0, 0.0, 0.0, 1.0]",It is impossible for a person to learn all from these issues since there are many issues that needs covering even in a broad way .
1185,"[0.0, 0.0, 0.0, 0.0, 0.0, 0.0, 0.0, 0.0, 0.0, 0.0, 1.0]","And if we think wider of academic subjects like physics , chemistry and not the subfields of a specific subject it even becomes more impractical to possess a general knowledge about them ."
1186,"[0.0, 0.0, 0.0, 0.0, 0.0, 0.0, 0.0, 0.0, 0.0, 0.0, 1.0]",Another problem with having a broad knowledge is regards to its sufficiency .
1187,"[0.0, 0.0, 0.0, 0.0, 0.0, 0.0, 0.0, 0.0, 0.0, 0.0, 1.0]",Most of the time we can not expect broad knowledge to help in specific cases .
1188,"[0.0, 0.0, 0.0, 0.0, 0.0, 0.0, 0.0, 0.0, 0.0, 0.0, 1.0]",If we take the area of health and medicine we can see clot of specialization .
