,label,sent
0,"[0.0, 0.0, 0.0, 0.0, 0.0, 1.0, 0.0, 0.0, 0.0, 0.0, 0.0]",In this essay I will argue my opinion in favour about the statement that says that in twenty years there will be fewer cars in use than there are today .
1,"[0.0, 0.0, 0.0, 0.0, 0.0, 1.0, 0.0, 0.0, 0.0, 0.0, 0.0]",Nowadays cars become a necessary object that anyone `` must '' to have for different reasons : for example today the majority of mothers has a job and so they use the car to move fastly from a site to another to assist their sons .
2,"[0.0, 0.0, 0.0, 0.0, 0.0, 1.0, 0.0, 0.0, 0.0, 0.0, 0.0]","Beside , the car , in the last years , becomes a status symbol and so anyone would have one of these ."
3,"[0.0, 0.0, 0.0, 0.0, 0.0, 1.0, 0.0, 0.0, 0.0, 0.0, 0.0]","I think that the presence of car will decrease in the next year for different reasons : the city are too trafficated , there are not possibility for parking , and having a car is becoming too expensive ."
4,"[0.0, 0.0, 0.0, 0.0, 0.0, 1.0, 0.0, 0.0, 0.0, 0.0, 0.0]","Often , people think that to travel in the city is very fast and comfortable to use the car but , nowadays , it is impossible turn in big city , because there is too much traffic and so , I think that people , by the time , will prefer to use public transport ."
5,"[0.0, 0.0, 0.0, 0.0, 0.0, 1.0, 0.0, 0.0, 0.0, 0.0, 0.0]",Another reasons is that todays is impossible find a parking to left our car because there are too car and few parking .
6,"[0.0, 0.0, 0.0, 0.0, 0.0, 1.0, 0.0, 0.0, 0.0, 0.0, 0.0]","Beside , if someone would have a close box , this become very expensive and very scarce ."
7,"[0.0, 0.0, 0.0, 0.0, 0.0, 1.0, 0.0, 0.0, 0.0, 0.0, 0.0]","At the end , having a car is very expensive for cost of soil , for the manutention , for the accessories ."
8,"[0.0, 0.0, 0.0, 0.0, 0.0, 1.0, 0.0, 0.0, 0.0, 0.0, 0.0]","I think that if public transport became better , pool [ pol"
9,"[0.0, 1.0, 0.0, 0.0, 0.0, 0.0, 0.0, 0.0, 0.0, 0.0, 0.0]","In recent years , the education systems are different ."
10,"[0.0, 1.0, 0.0, 0.0, 0.0, 0.0, 0.0, 0.0, 0.0, 0.0, 0.0]","Some people prefer the students should have broad knowledge of many academic subjects , however other prefer to have specialize in one specific subject ."
11,"[0.0, 1.0, 0.0, 0.0, 0.0, 0.0, 0.0, 0.0, 0.0, 0.0, 0.0]","For me , i would agree with first opinion ."
12,"[0.0, 1.0, 0.0, 0.0, 0.0, 0.0, 0.0, 0.0, 0.0, 0.0, 0.0]",The reasons are as follows .
13,"[0.0, 1.0, 0.0, 0.0, 0.0, 0.0, 0.0, 0.0, 0.0, 0.0, 0.0]",First and foremost reason is that in this society we need comprehensive person .
14,"[0.0, 1.0, 0.0, 0.0, 0.0, 0.0, 0.0, 0.0, 0.0, 0.0, 0.0]","Nowadays , the competition is very drastic , every body has ambition to be the first , if i just have specialize in one specific subject , i could not allow to have various job opportunities , and also i will lose some good chance ."
15,"[0.0, 1.0, 0.0, 0.0, 0.0, 0.0, 0.0, 0.0, 0.0, 0.0, 0.0]","for example , if i specialize in history , i just can find some job rely on history , but there are not have many job in history , but if i study broad subjects i can afford many different jobs , even it not interested , but i can get job and money ."
16,"[0.0, 1.0, 0.0, 0.0, 0.0, 0.0, 0.0, 0.0, 0.0, 0.0, 0.0]",I can service .
17,"[0.0, 1.0, 0.0, 0.0, 0.0, 0.0, 0.0, 0.0, 0.0, 0.0, 0.0]",Second factor is that it can improve my organization skills .
18,"[0.0, 1.0, 0.0, 0.0, 0.0, 0.0, 0.0, 0.0, 0.0, 0.0, 0.0]","for example , if i study broad knowledge of many academic subjects i will organize the time , and my work ethic ."
19,"[0.0, 1.0, 0.0, 0.0, 0.0, 0.0, 0.0, 0.0, 0.0, 0.0, 0.0]","Also it enlarge my view , also in different classes , i will meet different people , it also can improve my communication skills and interpersonal skills ."
20,"[0.0, 1.0, 0.0, 0.0, 0.0, 0.0, 0.0, 0.0, 0.0, 0.0, 0.0]",This lies in fact is that it pave my way for future .
21,"[0.0, 1.0, 0.0, 0.0, 0.0, 0.0, 0.0, 0.0, 0.0, 0.0, 0.0]","If i have abroad knowledge of many academic subjects , i can have good job opportunity and also if i meet different people , i can easy to talk with them and easy to find interest objects to talk , because i have large knowledge ."
22,"[0.0, 1.0, 0.0, 0.0, 0.0, 0.0, 0.0, 0.0, 0.0, 0.0, 0.0]",Also it improve my local communication .
23,"[0.0, 1.0, 0.0, 0.0, 0.0, 0.0, 0.0, 0.0, 0.0, 0.0, 0.0]","In brief , even specialize in one specific subject , you might save time and save money , but you will loss more ."
24,"[0.0, 1.0, 0.0, 0.0, 0.0, 0.0, 0.0, 0.0, 0.0, 0.0, 0.0]","According to what i have discuss about , if you want to give them good impression and if you want to survive in this society , you should have broad knowledge if many academic subjects than specialize in one specific subject ."
25,"[0.0, 1.0, 0.0, 0.0, 0.0, 0.0, 0.0, 0.0, 0.0, 0.0, 0.0]","Weighing the pros and cons of these argumentation , i agree that it is better to Habe broad knowledge of many academic subject ."
26,"[0.0, 0.0, 0.0, 0.0, 0.0, 0.0, 1.0, 0.0, 0.0, 0.0, 0.0]","Nowadays many people succeeds on some business , and also many people wants to succeed ."
27,"[0.0, 0.0, 0.0, 0.0, 0.0, 0.0, 1.0, 0.0, 0.0, 0.0, 0.0]","People usually use own idea or knowledges that they already known , however I think try new things is very important to succeed even though there are some risks or problems ."
28,"[0.0, 0.0, 0.0, 0.0, 0.0, 0.0, 1.0, 0.0, 0.0, 0.0, 0.0]","First , people need new thing to live ."
29,"[0.0, 0.0, 0.0, 0.0, 0.0, 0.0, 1.0, 0.0, 0.0, 0.0, 0.0]",I mean we need to develop many thing to be useful that I think many people hope .
30,"[0.0, 0.0, 0.0, 0.0, 0.0, 0.0, 1.0, 0.0, 0.0, 0.0, 0.0]",Therefor we ca n't make success if we do same thing or do n't try .
31,"[0.0, 0.0, 0.0, 0.0, 0.0, 0.0, 1.0, 0.0, 0.0, 0.0, 0.0]","Also if I made new thing , nobody would knowes about the new thing , and people wants to try new thing even though they do n't know the new things ."
32,"[0.0, 0.0, 0.0, 0.0, 0.0, 0.0, 1.0, 0.0, 0.0, 0.0, 0.0]",Yet it may be able to succeed even if the new thing is not useful or necessary .
33,"[0.0, 0.0, 0.0, 0.0, 0.0, 0.0, 1.0, 0.0, 0.0, 0.0, 0.0]","When we think about success , we need to think deferent idea from anybody else ."
34,"[0.0, 0.0, 0.0, 0.0, 0.0, 0.0, 1.0, 0.0, 0.0, 0.0, 0.0]","If the idea is same as someone it 's not going to make it , also we ca n't even initiate a business or something with the idea because the someone has already short something with the idea ."
35,"[0.0, 0.0, 0.0, 0.0, 0.0, 0.0, 1.0, 0.0, 0.0, 0.0, 0.0]","For example , I wanted to sell `` washed '' that is king of toilet and it useful and commoning japan , in the USA ."
36,"[0.0, 0.0, 0.0, 0.0, 0.0, 0.0, 1.0, 0.0, 0.0, 0.0, 0.0]","However a company , toto , has already started the business in the US so I ca n't do it any more even though it is a new idea nad it may be going to make big many ."
37,"[0.0, 0.0, 0.0, 0.0, 0.0, 0.0, 1.0, 0.0, 0.0, 0.0, 0.0]","Imagine new idea also helped us at different enviroment , and the idea may help you to succeed even if it is not what you want to do ."
38,"[0.0, 0.0, 0.0, 0.0, 0.0, 0.0, 1.0, 0.0, 0.0, 0.0, 0.0]","Today , if we want to succeed , we need to try new thing and not only doing same as before or doing what they already know ."
39,"[1.0, 0.0, 0.0, 0.0, 0.0, 0.0, 0.0, 0.0, 0.0, 0.0, 0.0]",In the following essay I am going to write about the difference between the general and specific academic knowledge .
40,"[1.0, 0.0, 0.0, 0.0, 0.0, 0.0, 0.0, 0.0, 0.0, 0.0, 0.0]",I am writing about this topic because people are conflicting a lot upon it .
41,"[1.0, 0.0, 0.0, 0.0, 0.0, 0.0, 0.0, 0.0, 0.0, 0.0, 0.0]",To reach my opinion in this subject IAM going to first clearly the points that support my opinion .
42,"[1.0, 0.0, 0.0, 0.0, 0.0, 0.0, 0.0, 0.0, 0.0, 0.0, 0.0]",then i will include a personal example from my own experience .
43,"[1.0, 0.0, 0.0, 0.0, 0.0, 0.0, 0.0, 0.0, 0.0, 0.0, 0.0]",Then i will demonstrate a more general example to support my opinion .
44,"[1.0, 0.0, 0.0, 0.0, 0.0, 0.0, 0.0, 0.0, 0.0, 0.0, 0.0]",At the end of my essay i will restate my opinion and summerize my findings .
45,"[1.0, 0.0, 0.0, 0.0, 0.0, 0.0, 0.0, 0.0, 0.0, 0.0, 0.0]",I believe it is better to have broad knowledge of many academic subjects than to specialize in one specific subject .
46,"[1.0, 0.0, 0.0, 0.0, 0.0, 0.0, 0.0, 0.0, 0.0, 0.0, 0.0]",ell having a broad knowledge is much better than having specific knowledge because a broad knowledge is much more common than a specific one .
47,"[1.0, 0.0, 0.0, 0.0, 0.0, 0.0, 0.0, 0.0, 0.0, 0.0, 0.0]",to \ his is specially the case in during the last stages of studies in school .
48,"[1.0, 0.0, 0.0, 0.0, 0.0, 0.0, 0.0, 0.0, 0.0, 0.0, 0.0]",where some schools make the students choose the field of specialization in such an early stages which they are not yet ready to make the mission in their life at that time .
49,"[1.0, 0.0, 0.0, 0.0, 0.0, 0.0, 0.0, 0.0, 0.0, 0.0, 0.0]",for that they specify the courses that they take under a specific field and prevent them from taking subjects from other fields .
50,"[1.0, 0.0, 0.0, 0.0, 0.0, 0.0, 0.0, 0.0, 0.0, 0.0, 0.0]",this effects student clot in their future so it is much better for them to have general knowledge than specific one .
51,"[1.0, 0.0, 0.0, 0.0, 0.0, 0.0, 0.0, 0.0, 0.0, 0.0, 0.0]","however , i have suffered this problem by my self where IAM know a twelfth great student specialized in the field of medicine and from the last year i did n't take any physics or computer since courses ."
52,"[1.0, 0.0, 0.0, 0.0, 0.0, 0.0, 0.0, 0.0, 0.0, 0.0, 0.0]",you may think that it is easier that way but trust me it is not where know i have changed my mind from medine to graphic deigning and i am having huge problem in my application for collage and this is stooping my way of development and i truly hope to have a solution for that problem soon .
53,"[1.0, 0.0, 0.0, 0.0, 0.0, 0.0, 0.0, 0.0, 0.0, 0.0, 0.0]",this is not the case for me only but there are many other people in the world that are having the same problems .
54,"[1.0, 0.0, 0.0, 0.0, 0.0, 0.0, 0.0, 0.0, 0.0, 0.0, 0.0]",A graduate friend of my mother had actually studied in the collage a very specified field that could n't counter for her any good related job but she is setting home with no job to do .
55,"[1.0, 0.0, 0.0, 0.0, 0.0, 0.0, 0.0, 0.0, 0.0, 0.0, 0.0]",By that we can see clearly the effect of very specified knowledge can harm a person 's future .
56,"[1.0, 0.0, 0.0, 0.0, 0.0, 0.0, 0.0, 0.0, 0.0, 0.0, 0.0]",i have reached the end of my essay where i can say again that i am totally against specific field subject studies specially in last stage if school .
57,"[1.0, 0.0, 0.0, 0.0, 0.0, 0.0, 0.0, 0.0, 0.0, 0.0, 0.0]",Noting that having a more a broad knowledge is more useful and let us always put in mind that a good leader have enough knowledge about every thing in life .
58,"[1.0, 0.0, 0.0, 0.0, 0.0, 0.0, 0.0, 0.0, 0.0, 0.0, 0.0]","Also a broad knowledge would affect the future of a person more effectively to make a person choose his future correctly and more effectively ,"
59,"[0.0, 0.0, 0.0, 0.0, 0.0, 0.0, 0.0, 0.0, 1.0, 0.0, 0.0]",My personal opinion towards this matter is that a person with a specialised academic subject tends to be more successful than someone who has a good general overview of most subjects .
60,"[0.0, 0.0, 0.0, 0.0, 0.0, 0.0, 0.0, 0.0, 1.0, 0.0, 0.0]",By this I do not mean that a person with a specialised subject is more knowledgable than a well rounded person .
61,"[0.0, 0.0, 0.0, 0.0, 0.0, 0.0, 0.0, 0.0, 1.0, 0.0, 0.0]","Someone who has studied a subject in depth and has received a degree for it , will be more prone to getting a good job in their field of study than someone who has a wider general knowledge but a shadier knowledge in a certain particular field ."
62,"[0.0, 0.0, 0.0, 0.0, 0.0, 0.0, 0.0, 0.0, 1.0, 0.0, 0.0]","Nowadays , a degree is perhaps the most essential element required in order to get a good job due to the increasing competitiveness for places ."
63,"[0.0, 0.0, 0.0, 0.0, 0.0, 0.0, 0.0, 0.0, 1.0, 0.0, 0.0]","Therefore , somebody who lacks this degree will not be as likely to get the job as someone who has perfected their field of study , as the latter is likely to be more efficient and to provide a company with a different and wider approach of the subject required ."
64,"[0.0, 0.0, 0.0, 0.0, 0.0, 0.0, 0.0, 0.0, 1.0, 0.0, 0.0]","Notwithstanding that it is important to specialise in a field of study , it is also essential to have a wide understanding of other aspects in life which could be helpful towards a career ."
65,"[0.0, 0.0, 0.0, 0.0, 0.0, 0.0, 0.0, 0.0, 1.0, 0.0, 0.0]","Through past experience , I have encountered people who concentrate on a subject and are probably near to being the best at it ."
66,"[0.0, 0.0, 0.0, 0.0, 0.0, 0.0, 0.0, 0.0, 1.0, 0.0, 0.0]","However , I have also noticed that some of these people lack basic skills such as socialising with others ."
67,"[0.0, 0.0, 0.0, 0.0, 0.0, 0.0, 0.0, 0.0, 1.0, 0.0, 0.0]","This is not a generalisation , but a partial observation ."
68,"[0.0, 0.0, 0.0, 0.0, 0.0, 0.0, 0.0, 0.0, 1.0, 0.0, 0.0]","In conclusion , it is vastly important to have a good knowledge of a certain field of study , but optimally , it would be better to have an equilibrium between the two , having a broad general knowledge as well as knowing substantial about a certain topic ."
69,"[1.0, 0.0, 0.0, 0.0, 0.0, 0.0, 0.0, 0.0, 0.0, 0.0, 0.0]",Mostly there is two kinds of people .
70,"[1.0, 0.0, 0.0, 0.0, 0.0, 0.0, 0.0, 0.0, 0.0, 0.0, 0.0]",one is trying to do new things and takes risks .
71,"[1.0, 0.0, 0.0, 0.0, 0.0, 0.0, 0.0, 0.0, 0.0, 0.0, 0.0]","on the there hand , people like to do only thing they know it before without takeing any risky things ."
72,"[1.0, 0.0, 0.0, 0.0, 0.0, 0.0, 0.0, 0.0, 0.0, 0.0, 0.0]",Each kind of these people have their reasons .
73,"[1.0, 0.0, 0.0, 0.0, 0.0, 0.0, 0.0, 0.0, 0.0, 0.0, 0.0]",I will discuss more about them in this assay .
74,"[1.0, 0.0, 0.0, 0.0, 0.0, 0.0, 0.0, 0.0, 0.0, 0.0, 0.0]","First of all , people who like to do new things and to involve in risky things , i will call it a `` risky man '' ."
75,"[1.0, 0.0, 0.0, 0.0, 0.0, 0.0, 0.0, 0.0, 0.0, 0.0, 0.0]",This man have the feel of challenge .
76,"[1.0, 0.0, 0.0, 0.0, 0.0, 0.0, 0.0, 0.0, 0.0, 0.0, 0.0]","There fore , he likes to do risky and strange things and he enjoy it ."
77,"[1.0, 0.0, 0.0, 0.0, 0.0, 0.0, 0.0, 0.0, 0.0, 0.0, 0.0]","For instance , a man who like to claim mountains , sailing a round the world or , for more risky , swimming from country to others ."
78,"[1.0, 0.0, 0.0, 0.0, 0.0, 0.0, 0.0, 0.0, 0.0, 0.0, 0.0]",why do the risky man do this things ?
79,"[1.0, 0.0, 0.0, 0.0, 0.0, 0.0, 0.0, 0.0, 0.0, 0.0, 0.0]",Properly he want to grant a huge number of money and to be a famous and unforgivable .
80,"[1.0, 0.0, 0.0, 0.0, 0.0, 0.0, 0.0, 0.0, 0.0, 0.0, 0.0]","Further more , most of these people you can find them in ginnet record ."
81,"[1.0, 0.0, 0.0, 0.0, 0.0, 0.0, 0.0, 0.0, 0.0, 0.0, 0.0]","Secondly , people who like to do normal and usual things , i can call them a `` calmy man '' ."
82,"[1.0, 0.0, 0.0, 0.0, 0.0, 0.0, 0.0, 0.0, 0.0, 0.0, 0.0]",This man like to live in peaceful and calm life .
83,"[1.0, 0.0, 0.0, 0.0, 0.0, 0.0, 0.0, 0.0, 0.0, 0.0, 0.0]",He prefer to have a happy family than making risky things .
84,"[1.0, 0.0, 0.0, 0.0, 0.0, 0.0, 0.0, 0.0, 0.0, 0.0, 0.0]","plus , he think that person who do a risky things is crazy ."
85,"[1.0, 0.0, 0.0, 0.0, 0.0, 0.0, 0.0, 0.0, 0.0, 0.0, 0.0]","More over , this calmy man usually have a job with loving partners ."
86,"[1.0, 0.0, 0.0, 0.0, 0.0, 0.0, 0.0, 0.0, 0.0, 0.0, 0.0]","how ever , he rarely go on trails and trips ."
87,"[1.0, 0.0, 0.0, 0.0, 0.0, 0.0, 0.0, 0.0, 0.0, 0.0, 0.0]","Finally , i think being a risky man it is not good due to the risky situations that he faces during his life ."
88,"[1.0, 0.0, 0.0, 0.0, 0.0, 0.0, 0.0, 0.0, 0.0, 0.0, 0.0]","Also , being a calmy man is not good too ."
89,"[1.0, 0.0, 0.0, 0.0, 0.0, 0.0, 0.0, 0.0, 0.0, 0.0, 0.0]",His life is very quite and boring .
90,"[1.0, 0.0, 0.0, 0.0, 0.0, 0.0, 0.0, 0.0, 0.0, 0.0, 0.0]",In my onion is that combining between the two personality is better .
91,"[1.0, 0.0, 0.0, 0.0, 0.0, 0.0, 0.0, 0.0, 0.0, 0.0, 0.0]",So then from time to another you can make little risky and new things like saying about or building a wooden house .
92,"[1.0, 0.0, 0.0, 0.0, 0.0, 0.0, 0.0, 0.0, 0.0, 0.0, 0.0]","More over , having a nice family with a good job ."
93,"[0.0, 0.0, 0.0, 0.0, 0.0, 1.0, 0.0, 0.0, 0.0, 0.0, 0.0]",I have always enjoyed travelling .
94,"[0.0, 0.0, 0.0, 0.0, 0.0, 1.0, 0.0, 0.0, 0.0, 0.0, 0.0]",Every year I have the chance to come to the United States for three months by myself to improve my English language skills ( I have been doing this for more than five years now !
95,"[0.0, 0.0, 0.0, 0.0, 0.0, 1.0, 0.0, 0.0, 0.0, 0.0, 0.0]",I guess I am very lucky ! ) .
96,"[0.0, 0.0, 0.0, 0.0, 0.0, 1.0, 0.0, 0.0, 0.0, 0.0, 0.0]","Since I have the chance to spend several hours a week at my friend 's travel agency I noticed that most of the people prefer being led by a tour guide , I wonder if that is because they are afraid to get lost or not being able to enjoy their vacation at the best or because they are too lazy to organize their vacation by themselves ."
97,"[0.0, 0.0, 0.0, 0.0, 0.0, 1.0, 0.0, 0.0, 0.0, 0.0, 0.0]","But it also true that if you want to go on a cultural vacation you do need a tour guide who shows and describes you all the places , the monuments , the history of the place that you are visiting and all those beautiful things that every place in the world has to offer to the tourists ."
98,"[0.0, 0.0, 0.0, 0.0, 0.0, 1.0, 0.0, 0.0, 0.0, 0.0, 0.0]",Plus if you go to a place where a foreign language is spoken you might not be able to enjoy the vacation because of that .
99,"[0.0, 0.0, 0.0, 0.0, 0.0, 1.0, 0.0, 0.0, 0.0, 0.0, 0.0]","Personally I think that , since I am a `` free spirit '' , I love organizing my trips by myself ."
100,"[0.0, 0.0, 0.0, 0.0, 0.0, 1.0, 0.0, 0.0, 0.0, 0.0, 0.0]","I just like to wake up in the morning when I want to without worrying too much if my trip mates are already downstairs with the tourist guide , ready to go to explore the new places !"
101,"[0.0, 0.0, 0.0, 0.0, 0.0, 1.0, 0.0, 0.0, 0.0, 0.0, 0.0]","But I also think that if you decide to go to a place where there is a little danger , having a tourist guide who tells you where you can or ca n't go is really important for your safety ."
102,"[0.0, 0.0, 0.0, 0.0, 0.0, 1.0, 0.0, 0.0, 0.0, 0.0, 0.0]",I think that as long as I will have the chance to travel by myself I will keep doing that .
103,"[0.0, 0.0, 0.0, 0.0, 0.0, 1.0, 0.0, 0.0, 0.0, 0.0, 0.0]",Maybe I will change my mind once I get older !
104,"[0.0, 0.0, 0.0, 0.0, 0.0, 1.0, 0.0, 0.0, 0.0, 0.0, 0.0]",Who knows . ..
105,"[0.0, 0.0, 0.0, 1.0, 0.0, 0.0, 0.0, 0.0, 0.0, 0.0, 0.0]","You can not know everything , that is a fact ."
106,"[0.0, 0.0, 0.0, 1.0, 0.0, 0.0, 0.0, 0.0, 0.0, 0.0, 0.0]",But should we try to get a widely spread knowledge of many different topics rather than be a specialist in only one certain subject .
107,"[0.0, 0.0, 0.0, 1.0, 0.0, 0.0, 0.0, 0.0, 0.0, 0.0, 0.0]",In the end it depends on which solution is the best match with your personality .
108,"[0.0, 0.0, 0.0, 1.0, 0.0, 0.0, 0.0, 0.0, 0.0, 0.0, 0.0]",I am a medical student and I spend really a lot of time studying but there are so much things to know about medicine that I can only learn a small part with my limited brain capacities .
109,"[0.0, 0.0, 0.0, 1.0, 0.0, 0.0, 0.0, 0.0, 0.0, 0.0, 0.0]","Hence , I try to be at least a specialist in a certain area with determined outlines because a doctor who knew a little bit of everything but nothing exactly is absolutely redundant ."
110,"[0.0, 0.0, 0.0, 1.0, 0.0, 0.0, 0.0, 0.0, 0.0, 0.0, 0.0]",So in order to get a job I am inevitably forced to concentrate on a few certain topics .
111,"[0.0, 0.0, 0.0, 1.0, 0.0, 0.0, 0.0, 0.0, 0.0, 0.0, 0.0]","By contrast , I think that beyond the job , it is very important to have a widely spread knowledge of lots of different things ."
112,"[0.0, 0.0, 0.0, 1.0, 0.0, 0.0, 0.0, 0.0, 0.0, 0.0, 0.0]","An urbane person should know many different things about other cultures , histories and literature , because in that time we are living in so much information and knowledge is offered to everyone ."
113,"[0.0, 0.0, 0.0, 1.0, 0.0, 0.0, 0.0, 0.0, 0.0, 0.0, 0.0]",Specializing would be insular in my opinion .
114,"[0.0, 0.0, 0.0, 1.0, 0.0, 0.0, 0.0, 0.0, 0.0, 0.0, 0.0]","As far as the knowledge beyond the job is concerned it does not make sense to try to know everything about one topic , because if you have a broad knowledge you have many topics to talk about with other people ."
115,"[0.0, 0.0, 0.0, 1.0, 0.0, 0.0, 0.0, 0.0, 0.0, 0.0, 0.0]","For instance , I will try to teach my children things about world history as well as different languages so that they know a little bit of everything and can deepen their knowledge of these subjects they are most interested in single handed ."
116,"[0.0, 0.0, 0.0, 1.0, 0.0, 0.0, 0.0, 0.0, 0.0, 0.0, 0.0]","In conclusion , I propose to specialize whenever it is necessary , for the job for example as I already mentioned ."
117,"[0.0, 0.0, 0.0, 1.0, 0.0, 0.0, 0.0, 0.0, 0.0, 0.0, 0.0]","Beyond the job I prefer a broad knowledge of many different things , but that is a matter of personality . .."
118,"[0.0, 0.0, 0.0, 0.0, 0.0, 1.0, 0.0, 0.0, 0.0, 0.0, 0.0]",This statement can not be used for general lines .
119,"[0.0, 0.0, 0.0, 0.0, 0.0, 1.0, 0.0, 0.0, 0.0, 0.0, 0.0]",It is better to have a specialization in one specific subject if it involves your work .
120,"[0.0, 0.0, 0.0, 0.0, 0.0, 1.0, 0.0, 0.0, 0.0, 0.0, 0.0]",An airline pilot or a doctor can not just have an idea on how their work is supposed to be .
121,"[0.0, 0.0, 0.0, 0.0, 0.0, 1.0, 0.0, 0.0, 0.0, 0.0, 0.0]",They must exactly know how to contact the control tower or how to execute a lumbar injection .
122,"[0.0, 0.0, 0.0, 0.0, 0.0, 1.0, 0.0, 0.0, 0.0, 0.0, 0.0]",A teacher that can not resolve a student 's doubt can never be an effective one .
123,"[0.0, 0.0, 0.0, 0.0, 0.0, 1.0, 0.0, 0.0, 0.0, 0.0, 0.0]",All people should have a complete and exhausting knowledge on the specific subject or job they depend on .
124,"[0.0, 0.0, 0.0, 0.0, 0.0, 1.0, 0.0, 0.0, 0.0, 0.0, 0.0]","Surely if this does not happen , people will be damaged by it ."
125,"[0.0, 0.0, 0.0, 0.0, 0.0, 1.0, 0.0, 0.0, 0.0, 0.0, 0.0]","On the other hand , to have a general culture is useful in everyday 's life ."
126,"[0.0, 0.0, 0.0, 0.0, 0.0, 1.0, 0.0, 0.0, 0.0, 0.0, 0.0]",Knowing basic things on politics and political candidates will make you able to exercise one of man 's biggest freedoms : the right to vote .
127,"[0.0, 0.0, 0.0, 0.0, 0.0, 1.0, 0.0, 0.0, 0.0, 0.0, 0.0]",Simple math knowledge will help you in filling out tax declaration papers .
128,"[0.0, 0.0, 0.0, 0.0, 0.0, 1.0, 0.0, 0.0, 0.0, 0.0, 0.0]","A high school biology courses clears every doubt that Egyptians , Greeks and Romans hav n't been able to explain in ages ; people with a broad knowledge are advantaged in understanding and communicating with the rest of the world ."
129,"[0.0, 0.0, 0.0, 0.0, 0.0, 1.0, 0.0, 0.0, 0.0, 0.0, 0.0]","Just like every other thing knowledge has to be a combination , a balance between specific and broad ."
130,"[0.0, 0.0, 0.0, 0.0, 0.0, 1.0, 0.0, 0.0, 0.0, 0.0, 0.0]",Specific knowledge helps you in your work and the people that benefit from it .
131,"[0.0, 0.0, 0.0, 0.0, 0.0, 1.0, 0.0, 0.0, 0.0, 0.0, 0.0]",General knowledge is a unestimable luxury that most people give for granted very often .
132,"[0.0, 0.0, 0.0, 0.0, 0.0, 0.0, 0.0, 1.0, 0.0, 0.0, 0.0]",I disagree with the statement that having broad knowledge of many academic subjects is better than specializing in one specific subject .
133,"[0.0, 0.0, 0.0, 0.0, 0.0, 0.0, 0.0, 1.0, 0.0, 0.0, 0.0]",I believe that specializing and concentrating in a single specific subject is far more important for two reasons .
134,"[0.0, 0.0, 0.0, 0.0, 0.0, 0.0, 0.0, 1.0, 0.0, 0.0, 0.0]","First , our life is limited ."
135,"[0.0, 0.0, 0.0, 0.0, 0.0, 0.0, 0.0, 1.0, 0.0, 0.0, 0.0]",We do n't have enough time to learn about every topics or subjects during our lifetime .
136,"[0.0, 0.0, 0.0, 0.0, 0.0, 0.0, 0.0, 1.0, 0.0, 0.0, 0.0]","If we can live for five hundred years as turtle does , we can study and learn almost every accessible subjects that we need to know ."
137,"[0.0, 0.0, 0.0, 0.0, 0.0, 0.0, 0.0, 1.0, 0.0, 0.0, 0.0]","However , the real is not ."
138,"[0.0, 0.0, 0.0, 0.0, 0.0, 0.0, 0.0, 1.0, 0.0, 0.0, 0.0]","For example , if all students are educated in purpose of having broad knowledge without any indent specific knowledge about science , they might understand how machines operates but they can not fix in case the machines stop or are destroyed ."
139,"[0.0, 0.0, 0.0, 0.0, 0.0, 0.0, 0.0, 1.0, 0.0, 0.0, 0.0]",We do not want our children to have only shallow knowledge in many subjects without their own specialties .
140,"[0.0, 0.0, 0.0, 0.0, 0.0, 0.0, 0.0, 1.0, 0.0, 0.0, 0.0]","Second , I strongly believe that being equipped with specialized knowledge may result in inspiring people from using the specific knowledge and applying the knowledge to various other areas ."
141,"[0.0, 0.0, 0.0, 0.0, 0.0, 0.0, 0.0, 1.0, 0.0, 0.0, 0.0]","In my case , I have been very interested in collecting butter flies in every different kinds since I was five years ."
142,"[0.0, 0.0, 0.0, 0.0, 0.0, 0.0, 0.0, 1.0, 0.0, 0.0, 0.0]",This hobby made me read the related books and articles about insects as much as I could .
143,"[0.0, 0.0, 0.0, 0.0, 0.0, 0.0, 0.0, 1.0, 0.0, 0.0, 0.0]","As I know about the insects more , I was more deeply inspired from their behavior ."
