,label,sent
3039,"[0.0, 0.0, 0.0, 0.0, 0.0, 0.0, 0.0, 0.0, 0.0, 0.0, 1.0]",for a moment lets take the word enjoying life as having fun and doing lots of things .
3040,"[0.0, 0.0, 0.0, 0.0, 0.0, 0.0, 0.0, 0.0, 0.0, 0.0, 1.0]",young people are active because of their age .
3041,"[0.0, 0.0, 0.0, 0.0, 0.0, 0.0, 0.0, 0.0, 0.0, 0.0, 1.0]",the age is a big advantage .
3042,"[0.0, 0.0, 0.0, 0.0, 0.0, 0.0, 0.0, 0.0, 0.0, 0.0, 1.0]",they have the energy for doing lots of things .
3043,"[0.0, 0.0, 0.0, 0.0, 0.0, 0.0, 0.0, 0.0, 0.0, 0.0, 1.0]","for example , traveling , riding a bike , running , and sex of course , things most older people dont have much energy to do ."
3044,"[0.0, 0.0, 0.0, 0.0, 0.0, 0.0, 0.0, 0.0, 0.0, 0.0, 1.0]",and course they have kids maybe even grand kids to tie them in to the life they currently have .
3045,"[0.0, 0.0, 0.0, 0.0, 0.0, 0.0, 0.0, 0.0, 0.0, 0.0, 1.0]",this is maybe their only satisfaction in life .
3046,"[0.0, 0.0, 0.0, 0.0, 0.0, 0.0, 0.0, 0.0, 0.0, 0.0, 1.0]",to be able to achieve lots of things that younger people did not achieve yet .
3047,"[0.0, 0.0, 0.0, 0.0, 0.0, 0.0, 0.0, 0.0, 0.0, 0.0, 1.0]",because of this satisfaction they maybe have no need to really experience different things .
3048,"[0.0, 0.0, 0.0, 0.0, 0.0, 0.0, 0.0, 0.0, 0.0, 0.0, 1.0]",on the other hand i can not really say that young people can enjoy life much either . century really does not allow lots of us to explore .
3049,"[0.0, 0.0, 0.0, 0.0, 0.0, 0.0, 0.0, 0.0, 0.0, 0.0, 1.0]",with the need of a succesful job ; the need of a diploma appears .
3050,"[0.0, 0.0, 0.0, 0.0, 0.0, 0.0, 0.0, 0.0, 0.0, 0.0, 1.0]",with the need of a diploma money comes in to the story .
3051,"[0.0, 0.0, 0.0, 0.0, 0.0, 0.0, 0.0, 0.0, 0.0, 0.0, 1.0]",well we all know that we can not grow money on trees so we start working part or full time at an early age .
3052,"[0.0, 0.0, 0.0, 0.0, 0.0, 0.0, 0.0, 0.0, 0.0, 0.0, 1.0]",on top of working we have to study in order to graduate .
3053,"[0.0, 0.0, 0.0, 0.0, 0.0, 0.0, 0.0, 0.0, 0.0, 0.0, 1.0]",even after all of this the only time we will enjoy life seems like retirement .
3054,"[0.0, 0.0, 0.0, 0.0, 0.0, 0.0, 0.0, 0.0, 0.0, 0.0, 1.0]",well again when we retire we are considered older people .
3055,"[0.0, 0.0, 0.0, 0.0, 0.0, 0.0, 0.0, 0.0, 0.0, 0.0, 1.0]",so tell me who are the people that really have fun .
3056,"[0.0, 0.0, 0.0, 0.0, 0.0, 0.0, 0.0, 0.0, 0.0, 0.0, 1.0]",younger or older people ?
3057,"[0.0, 0.0, 0.0, 0.0, 0.0, 0.0, 0.0, 0.0, 0.0, 0.0, 1.0]",having fun is not about age or activity .
3058,"[0.0, 0.0, 0.0, 0.0, 0.0, 0.0, 0.0, 0.0, 0.0, 0.0, 1.0]",it is about being able to enjoy life at its most .
3059,"[0.0, 0.0, 0.0, 0.0, 0.0, 0.0, 0.0, 0.0, 0.0, 0.0, 1.0]",we are the ones who determine the term enjoying life for our selfs .
3060,"[0.0, 0.0, 0.0, 0.0, 0.0, 0.0, 0.0, 0.0, 0.0, 0.0, 1.0]",at any age if we are satisfied with what we are doing and who we are and how we interact with people then we are the ones who choses to enjoy or not to enjoy .
3061,"[0.0, 0.0, 0.0, 0.0, 0.0, 0.0, 0.0, 0.0, 0.0, 0.0, 1.0]",lets ask this question to our self : TO ENJOY OR NOT TO ENJOY ?
3062,"[0.0, 1.0, 0.0, 0.0, 0.0, 0.0, 0.0, 0.0, 0.0, 0.0, 0.0]",We are living in a modern world filled with advertisements .
3063,"[0.0, 1.0, 0.0, 0.0, 0.0, 0.0, 0.0, 0.0, 0.0, 0.0, 0.0]",All advertisements try to show the magic of their products .
3064,"[0.0, 1.0, 0.0, 0.0, 0.0, 0.0, 0.0, 0.0, 0.0, 0.0, 0.0]","However , I have little belief in what the advertisements have told me ."
3065,"[0.0, 1.0, 0.0, 0.0, 0.0, 0.0, 0.0, 0.0, 0.0, 0.0, 0.0]",I think most advertisements make products seem much better than they really are !
3066,"[0.0, 1.0, 0.0, 0.0, 0.0, 0.0, 0.0, 0.0, 0.0, 0.0, 0.0]",The goal of advertisements determines their poor credit .
3067,"[0.0, 1.0, 0.0, 0.0, 0.0, 0.0, 0.0, 0.0, 0.0, 0.0, 0.0]",All the advertisements are aiming to attract as many customers as they can .
3068,"[0.0, 1.0, 0.0, 0.0, 0.0, 0.0, 0.0, 0.0, 0.0, 0.0, 0.0]",And how can they obtain this achievement ?
3069,"[0.0, 1.0, 0.0, 0.0, 0.0, 0.0, 0.0, 0.0, 0.0, 0.0, 0.0]",They give misleading and uncredible information of their products .
3070,"[0.0, 1.0, 0.0, 0.0, 0.0, 0.0, 0.0, 0.0, 0.0, 0.0, 0.0]","For example , some healthy food will claim its body - building function in the advertisement ."
3071,"[0.0, 1.0, 0.0, 0.0, 0.0, 0.0, 0.0, 0.0, 0.0, 0.0, 0.0]",But few gives any convincing statistical state or trustworthy survey on how it makes effort on people who have used it .
3072,"[0.0, 1.0, 0.0, 0.0, 0.0, 0.0, 0.0, 0.0, 0.0, 0.0, 0.0]",We may see a set of comparison between a fat girl and a thin girl .
3073,"[0.0, 1.0, 0.0, 0.0, 0.0, 0.0, 0.0, 0.0, 0.0, 0.0, 0.0]",But how can we believe it s just the effection of the food ?
3074,"[0.0, 1.0, 0.0, 0.0, 0.0, 0.0, 0.0, 0.0, 0.0, 0.0, 0.0]","Since advertisements used for commercial use , most of them will not provide scientific proof ."
3075,"[0.0, 1.0, 0.0, 0.0, 0.0, 0.0, 0.0, 0.0, 0.0, 0.0, 0.0]",Another interesting phenomena is that famous actresses and actors often appear on the screen to advertise a product .
3076,"[0.0, 1.0, 0.0, 0.0, 0.0, 0.0, 0.0, 0.0, 0.0, 0.0, 0.0]","Of course , the actresses and actors are attractive and beautiful ."
3077,"[0.0, 1.0, 0.0, 0.0, 0.0, 0.0, 0.0, 0.0, 0.0, 0.0, 0.0]","By these kinds of advertisements , we attach the products to these beautiful imagines ."
3078,"[0.0, 1.0, 0.0, 0.0, 0.0, 0.0, 0.0, 0.0, 0.0, 0.0, 0.0]","But the truth is , how many celebrities really use the products they recommend ?"
3079,"[0.0, 1.0, 0.0, 0.0, 0.0, 0.0, 0.0, 0.0, 0.0, 0.0, 0.0]","They are just invited to say a sentences , show a pose , and etc . ."
3080,"[0.0, 1.0, 0.0, 0.0, 0.0, 0.0, 0.0, 0.0, 0.0, 0.0, 0.0]",It misguides the costumer to some extent .
3081,"[0.0, 1.0, 0.0, 0.0, 0.0, 0.0, 0.0, 0.0, 0.0, 0.0, 0.0]",Costumers will connect the products to the good imagines in their minds .
3082,"[0.0, 1.0, 0.0, 0.0, 0.0, 0.0, 0.0, 0.0, 0.0, 0.0, 0.0]","Actually , the products are not so perfect as the advertisements said or the customer think ."
3083,"[0.0, 1.0, 0.0, 0.0, 0.0, 0.0, 0.0, 0.0, 0.0, 0.0, 0.0]",The reason why there exists such a huge gap between the products in the advertisements and in the facts is because there is n't effective norm to regulate advertisements .
3084,"[0.0, 1.0, 0.0, 0.0, 0.0, 0.0, 0.0, 0.0, 0.0, 0.0, 0.0]",No specific policy has given to restrict the advertisements .
3085,"[0.0, 1.0, 0.0, 0.0, 0.0, 0.0, 0.0, 0.0, 0.0, 0.0, 0.0]","In fact , exaggeration becomes one of the keywords in advertisements ."
3086,"[0.0, 1.0, 0.0, 0.0, 0.0, 0.0, 0.0, 0.0, 0.0, 0.0, 0.0]",I have already disappointed to find a real product in any advertisement .
3087,"[0.0, 1.0, 0.0, 0.0, 0.0, 0.0, 0.0, 0.0, 0.0, 0.0, 0.0]","Only when our government and media realize the importance to supply the audience unbiased and true facts instead of the beautiful lies in advertisements , can we choose the products without doubt following the instruction of advertisements ."
3088,"[0.0, 1.0, 0.0, 0.0, 0.0, 0.0, 0.0, 0.0, 0.0, 0.0, 0.0]","So , when you choose something to buy , do not trust what the advertisements told you ."
3089,"[0.0, 1.0, 0.0, 0.0, 0.0, 0.0, 0.0, 0.0, 0.0, 0.0, 0.0]",Turn off the television when you see an unbelievable product in an advertisement again .
3090,"[0.0, 1.0, 0.0, 0.0, 0.0, 0.0, 0.0, 0.0, 0.0, 0.0, 0.0]",A clever customer should try to evaluate and judge a product by him herself .
3091,"[1.0, 0.0, 0.0, 0.0, 0.0, 0.0, 0.0, 0.0, 0.0, 0.0, 0.0]",The issue of wether young people enjoy life more than other people meet grate debate in the mean time .
3092,"[1.0, 0.0, 0.0, 0.0, 0.0, 0.0, 0.0, 0.0, 0.0, 0.0, 0.0]","Young people has ambition , the look to the future , the ability to get new informations about technology as life is widely opened for them to gain experience and learn a new cultural , scientific , and social them ."
3093,"[1.0, 0.0, 0.0, 0.0, 0.0, 0.0, 0.0, 0.0, 0.0, 0.0, 0.0]","they have the health and capability to enjoy different programs for entertainment , has the chance of getting new demands and relationship and keeping them ."
3094,"[1.0, 0.0, 0.0, 0.0, 0.0, 0.0, 0.0, 0.0, 0.0, 0.0, 0.0]",but do they have enough support or backup to help them achieve what the like to do .
3095,"[1.0, 0.0, 0.0, 0.0, 0.0, 0.0, 0.0, 0.0, 0.0, 0.0, 0.0]","foe example young couple may like to get along vacation from work to travel to anew country to enjoy their love and life but they have not enough money as they are in their being of employment life , moreover vacations may affect their promotions , on the other hand they are responsable for other people for example they have to take care of their parents or kids ."
3096,"[1.0, 0.0, 0.0, 0.0, 0.0, 0.0, 0.0, 0.0, 0.0, 0.0, 0.0]",Clot of young people have shortage of intertament facilities for finnetial reasons or they have to obey other persons who is sponsoring them .
3097,"[1.0, 0.0, 0.0, 0.0, 0.0, 0.0, 0.0, 0.0, 0.0, 0.0, 0.0]","The you are under tension and pressure of life and not had the enough esperance to take over problems On otherhand older people have clot of relationships with friends , colleagues family members as sons or grand sons who support them and take care of them , in addition to gaining of properties through life and financial independence ."
3098,"[1.0, 0.0, 0.0, 0.0, 0.0, 0.0, 0.0, 0.0, 0.0, 0.0, 0.0]","but some of them might get health problems which most of them are controllable now , older couple for example can enjoy themselves with no worry about somebody else clot of them believe that what is going to happen let happen or let go ."
3099,"[1.0, 0.0, 0.0, 0.0, 0.0, 0.0, 0.0, 0.0, 0.0, 0.0, 0.0]",so not care much about future .
3100,"[1.0, 0.0, 0.0, 0.0, 0.0, 0.0, 0.0, 0.0, 0.0, 0.0, 0.0]",An old man once said the life is composed of three sections first thirty years of life Aman has health and enjoy his joy as he has something to do in life but not too much resposnsbities and he has enough time to spend for leisures and entertainment but he dosenot have money to achieve his wishes .
3101,"[1.0, 0.0, 0.0, 0.0, 0.0, 0.0, 0.0, 0.0, 0.0, 0.0, 0.0]","Second thirty years Aman has health , money but he had to work hard to carry on his success but he donnot have enough time ."
3102,"[1.0, 0.0, 0.0, 0.0, 0.0, 0.0, 0.0, 0.0, 0.0, 0.0, 0.0]",The later life the are the time and money but no health .
3103,"[1.0, 0.0, 0.0, 0.0, 0.0, 0.0, 0.0, 0.0, 0.0, 0.0, 0.0]","But in summary I thought i have enjoyed my life when i was young by clot of things mainly friendship , passion and love ."
3104,"[1.0, 0.0, 0.0, 0.0, 0.0, 0.0, 0.0, 0.0, 0.0, 0.0, 0.0]","all with experiencing of establishment of a family of our own and how happy we where , but i think We are bit older now and we feel life worth to live in and enjoy relationships , work , belongings ."
3105,"[0.0, 0.0, 0.0, 0.0, 0.0, 0.0, 0.0, 0.0, 0.0, 1.0, 0.0]",Taking risks is the only way to improve our knowledge and to succeed in life .
3106,"[0.0, 0.0, 0.0, 0.0, 0.0, 0.0, 0.0, 0.0, 0.0, 1.0, 0.0]",keeping this in view i would like to agree with the statement that successful people try newer things and take risks rather than only doing what they already know how to do well .
3107,"[0.0, 0.0, 0.0, 0.0, 0.0, 0.0, 0.0, 0.0, 0.0, 1.0, 0.0]","this may include many aspects like inventing many things , knowing other side of coin or the other solution of problem ."
3108,"[0.0, 0.0, 0.0, 0.0, 0.0, 0.0, 0.0, 0.0, 0.0, 1.0, 0.0]","firstly , take the point of inventing new things the inventors who would discover a new thing couldn , t either know whats the result is going to be its a saught of risk that is taken by them ."
3109,"[0.0, 0.0, 0.0, 0.0, 0.0, 0.0, 0.0, 0.0, 0.0, 1.0, 0.0]",but what if they are succeeded inventing that then there will add some more glory to them instead of just sitting quite simply because they already have done well and fearing about the risk they has to take .
3110,"[0.0, 0.0, 0.0, 0.0, 0.0, 0.0, 0.0, 0.0, 0.0, 1.0, 0.0]","after all , FAILURES ARE STEPPING STONES TO SUCCESS . they may learn a new thing by failure which will be definitely useful again ."
3111,"[0.0, 0.0, 0.0, 0.0, 0.0, 0.0, 0.0, 0.0, 0.0, 1.0, 0.0]","secondly , take the point of finding other solution to the existing problem ."
3112,"[0.0, 0.0, 0.0, 0.0, 0.0, 0.0, 0.0, 0.0, 0.0, 1.0, 0.0]",If the Indian president A . P . J . Abdul
3113,"[0.0, 0.0, 0.0, 0.0, 0.0, 0.0, 0.0, 0.0, 0.0, 1.0, 0.0]",Kalam could not have risked the launch of rocket into space people could not know the information of what actually happens in other planet or the interesting points about space that we know now .
3114,"[0.0, 0.0, 0.0, 0.0, 0.0, 0.0, 0.0, 0.0, 0.0, 1.0, 0.0]",though it was a failure for the first time he did not stop there and followed the saying try and try until you succeed which brought him great fame .
3115,"[0.0, 0.0, 0.0, 0.0, 0.0, 0.0, 0.0, 0.0, 0.0, 1.0, 0.0]","Thirdly , consider the case of invention of many metals by scientists which is invented by the experiments which risked their life itself ."
3116,"[0.0, 0.0, 0.0, 0.0, 0.0, 0.0, 0.0, 0.0, 0.0, 1.0, 0.0]",but those people are more successful in life because they had the fame and importance even after their period .
3117,"[0.0, 0.0, 0.0, 0.0, 0.0, 0.0, 0.0, 0.0, 0.0, 1.0, 0.0]",these people did not do what they already know how to do well .
3118,"[0.0, 0.0, 0.0, 0.0, 0.0, 0.0, 0.0, 0.0, 0.0, 1.0, 0.0]","intact , they risked their life for the discoveries they have done ."
3119,"[0.0, 0.0, 0.0, 0.0, 0.0, 0.0, 0.0, 0.0, 0.0, 1.0, 0.0]","Finally , i conclude by saying that each and every individual should always risk on doing new things which will definitely yield better result ."
3120,"[0.0, 0.0, 0.0, 0.0, 1.0, 0.0, 0.0, 0.0, 0.0, 0.0, 0.0]",Now a days the young people do not devote their enough time for helping their communities which they should do .
3121,"[0.0, 0.0, 0.0, 0.0, 1.0, 0.0, 0.0, 0.0, 0.0, 0.0, 0.0]",A youngster should always help his community because they are the one s who will help him if he will have any problem .
3122,"[0.0, 0.0, 0.0, 0.0, 1.0, 0.0, 0.0, 0.0, 0.0, 0.0, 0.0]",They safeguard the youngsters .
3123,"[0.0, 0.0, 0.0, 0.0, 1.0, 0.0, 0.0, 0.0, 0.0, 0.0, 0.0]","From my point of view , the young people are not devoting sufficient time to the community ."
3124,"[0.0, 0.0, 0.0, 0.0, 1.0, 0.0, 0.0, 0.0, 0.0, 0.0, 0.0]",Instead of this they like to party with their friends .
3125,"[0.0, 0.0, 0.0, 0.0, 1.0, 0.0, 0.0, 0.0, 0.0, 0.0, 0.0]",Some utilise their time in studying and tuitions .
3126,"[0.0, 0.0, 0.0, 0.0, 1.0, 0.0, 0.0, 0.0, 0.0, 0.0, 0.0]",Some find playing games interesting rather than providing support to their community .
3127,"[0.0, 0.0, 0.0, 0.0, 1.0, 0.0, 0.0, 0.0, 0.0, 0.0, 0.0]",The have now a days no feeling in their heart which the people in the past used to have for serving their community .
3128,"[0.0, 0.0, 0.0, 0.0, 1.0, 0.0, 0.0, 0.0, 0.0, 0.0, 0.0]",They are unaware of the fact that the community is the one who is going to help them when in need .
3129,"[0.0, 0.0, 0.0, 0.0, 1.0, 0.0, 0.0, 0.0, 0.0, 0.0, 0.0]",He should therefore work for it to take his community to great heights and create a level for it i . e a separate entity .
3130,"[0.0, 0.0, 0.0, 0.0, 1.0, 0.0, 0.0, 0.0, 0.0, 0.0, 0.0]",For example Mohandas Karamchand Gandhi was not called the Father of India like that only .
3131,"[0.0, 0.0, 0.0, 0.0, 1.0, 0.0, 0.0, 0.0, 0.0, 0.0, 0.0]",He had suffered a lot in freeing his country from the Britishers who were ruling it for many years .
3132,"[0.0, 0.0, 0.0, 0.0, 1.0, 0.0, 0.0, 0.0, 0.0, 0.0, 0.0]",He did not did this all alone .
3133,"[0.0, 0.0, 0.0, 0.0, 1.0, 0.0, 0.0, 0.0, 0.0, 0.0, 0.0]",Slowly and steadily he gathered Indians to support him and carried out several movements to rule them out .
3134,"[0.0, 0.0, 0.0, 0.0, 1.0, 0.0, 0.0, 0.0, 0.0, 0.0, 0.0]","At last his country gained freedom on August , after struggling for a few decades ."
3135,"[0.0, 0.0, 0.0, 0.0, 1.0, 0.0, 0.0, 0.0, 0.0, 0.0, 0.0]",The young one s should therefore wake up from their sleep and help in strengthening freedom .
3136,"[0.0, 0.0, 0.0, 0.0, 1.0, 0.0, 0.0, 0.0, 0.0, 0.0, 0.0]",The should not leave it at the stake .
3137,"[0.0, 0.0, 0.0, 0.0, 1.0, 0.0, 0.0, 0.0, 0.0, 0.0, 0.0]","Thus , the youngsters view should always be on helping their community as GURU NANAK did for the Sikhs ."
3138,"[0.0, 0.0, 0.0, 0.0, 1.0, 0.0, 0.0, 0.0, 0.0, 0.0, 0.0]",Therefore the primary function of every people belonging to a particular community is to have the potential to do whatever his community requires from him .
3139,"[0.0, 0.0, 0.0, 0.0, 1.0, 0.0, 0.0, 0.0, 0.0, 0.0, 0.0]",He should serve his community as best as he can .
3140,"[0.0, 0.0, 0.0, 0.0, 0.0, 0.0, 0.0, 1.0, 0.0, 0.0, 0.0]",Everyone wants to enjoy life and live happily .
3141,"[0.0, 0.0, 0.0, 0.0, 0.0, 0.0, 0.0, 1.0, 0.0, 0.0, 0.0]",We are all different and can not be same in appearances and preferences .
3142,"[0.0, 0.0, 0.0, 0.0, 0.0, 0.0, 0.0, 1.0, 0.0, 0.0, 0.0]","As industry develops , people get more chances to enjoy their life in various ways ."
3143,"[0.0, 0.0, 0.0, 0.0, 0.0, 0.0, 0.0, 1.0, 0.0, 0.0, 0.0]","For example , before invention of airplane , taking travel around the world was not easy as nowadays ."
3144,"[0.0, 0.0, 0.0, 0.0, 0.0, 0.0, 0.0, 1.0, 0.0, 0.0, 0.0]",But we have a lot of things to do in our free time .
3145,"[0.0, 0.0, 0.0, 0.0, 0.0, 0.0, 0.0, 1.0, 0.0, 0.0, 0.0]","Therefore , some people might say that young people in these days enjoy life more than older people do ."
3146,"[0.0, 0.0, 0.0, 0.0, 0.0, 0.0, 0.0, 1.0, 0.0, 0.0, 0.0]",It is true in some aspects because young people have more alternations for enjoying life and many leisure equipment have been inventing gradually .
3147,"[0.0, 0.0, 0.0, 0.0, 0.0, 0.0, 0.0, 1.0, 0.0, 0.0, 0.0]",I thinks that enjoyment of life does not mean the physical aspects always .
3148,"[0.0, 0.0, 0.0, 0.0, 0.0, 0.0, 0.0, 1.0, 0.0, 0.0, 0.0]","Of coure , youth itself is a beautiful one ."
3149,"[0.0, 0.0, 0.0, 0.0, 0.0, 0.0, 0.0, 1.0, 0.0, 0.0, 0.0]","In other hands , we should plan our future life and plan to prepare for that in our young days ."
3150,"[0.0, 0.0, 0.0, 0.0, 0.0, 0.0, 0.0, 1.0, 0.0, 0.0, 0.0]",Older people enjoy their life with a sound wisdom of living .
3151,"[0.0, 0.0, 0.0, 0.0, 0.0, 0.0, 0.0, 1.0, 0.0, 0.0, 0.0]",They have experienced many things through life and have a wise sight for life and world .
3152,"[0.0, 0.0, 0.0, 0.0, 0.0, 0.0, 0.0, 1.0, 0.0, 0.0, 0.0]",Being young is not a critical fact for enjoying one s life .
3153,"[0.0, 0.0, 0.0, 0.0, 0.0, 0.0, 0.0, 1.0, 0.0, 0.0, 0.0]",Older people can enjoy their life in more various ways with their experiences of life and open eyes for others .
3154,"[0.0, 0.0, 0.0, 0.0, 0.0, 0.0, 0.0, 1.0, 0.0, 0.0, 0.0]","Some people can have broad knowledge of many academic subjects , other people can specialize in one specific subject ."
3155,"[0.0, 0.0, 0.0, 0.0, 0.0, 0.0, 0.0, 1.0, 0.0, 0.0, 0.0]",I agree with that it is better to have broad knowledge of many academic subjects than to specialize in one specific subject .
3156,"[0.0, 0.0, 0.0, 0.0, 0.0, 0.0, 0.0, 1.0, 0.0, 0.0, 0.0]","First , to have broad knowledge of many academic subjects helps people think widely ."
3157,"[0.0, 0.0, 0.0, 0.0, 0.0, 0.0, 0.0, 1.0, 0.0, 0.0, 0.0]","When we have broad knowledge of many academic subjects , we can convince them in various ways ."
3158,"[0.0, 0.0, 0.0, 0.0, 0.0, 0.0, 0.0, 1.0, 0.0, 0.0, 0.0]",We can think more carefully about possibilities .
3159,"[0.0, 0.0, 0.0, 0.0, 0.0, 0.0, 0.0, 1.0, 0.0, 0.0, 0.0]","Second , to have broad knowledge of many academic subjects helps people cooperate with each other ."
3160,"[0.0, 0.0, 0.0, 0.0, 0.0, 0.0, 0.0, 1.0, 0.0, 0.0, 0.0]",We can know about each other more .
3161,"[0.0, 0.0, 0.0, 0.0, 0.0, 0.0, 0.0, 1.0, 0.0, 0.0, 0.0]",We have to help others .
3162,"[0.0, 0.0, 0.0, 0.0, 0.0, 0.0, 0.0, 1.0, 0.0, 0.0, 0.0]","Third , to have broad knowledge of many academic subjects help people look many diversities ."
3163,"[0.0, 0.0, 0.0, 0.0, 0.0, 0.0, 0.0, 1.0, 0.0, 0.0, 0.0]","In three reasons , I agree with that It is better to have broad knowledge of many academic subjects than to specialize in one specific subject ."
3164,"[0.0, 0.0, 0.0, 1.0, 0.0, 0.0, 0.0, 0.0, 0.0, 0.0, 0.0]",Different ways of learning can be taught by a professor or lecturer in order to make it easier for their students to memorize certain study matters .
3165,"[0.0, 0.0, 0.0, 1.0, 0.0, 0.0, 0.0, 0.0, 0.0, 0.0, 0.0]","Some believe , that trying to help their students to understand ideas and concepts is more important than just learning facts ."
3166,"[0.0, 0.0, 0.0, 1.0, 0.0, 0.0, 0.0, 0.0, 0.0, 0.0, 0.0]","To begin with , encouraging students to develop their own ideas and concepts about a certain topic and in the end to draw a conclusion , is very likely to have a positive aspect on the student s memory ."
3167,"[0.0, 0.0, 0.0, 1.0, 0.0, 0.0, 0.0, 0.0, 0.0, 0.0, 0.0]","For example , if a student in a history class has the task to think about the way the German people must have felt at the end of the Second World War , and s he works out their feelings of desperation and hopelessness , s he has learned through experience ."
3168,"[0.0, 0.0, 0.0, 1.0, 0.0, 0.0, 0.0, 0.0, 0.0, 0.0, 0.0]","Moreover , through having understood certain ideas and concepts , a student can basically transfer them to nowadays situations and as well to another subject or theme ."
3169,"[0.0, 0.0, 0.0, 1.0, 0.0, 0.0, 0.0, 0.0, 0.0, 0.0, 0.0]","For instance , having learned the concept of social behaviour on a specific example and having understood the idea of it , the student will be easily able to observe the social behaviour , its causes and consequences , in his her own environment and to compare them to other unsocial behaviour and the way it differs in every country and continent ."
3170,"[0.0, 0.0, 0.0, 1.0, 0.0, 0.0, 0.0, 0.0, 0.0, 0.0, 0.0]",Learning facts surely has its disadvantages in specific exam situations .
3171,"[0.0, 0.0, 0.0, 1.0, 0.0, 0.0, 0.0, 0.0, 0.0, 0.0, 0.0]","For example , if a student is being asked about when certain historical events took place ."
3172,"[0.0, 0.0, 0.0, 1.0, 0.0, 0.0, 0.0, 0.0, 0.0, 0.0, 0.0]","Especially in the subject of history , learning dates by heart is rather important , mostly in order to avoid getting mixed up with situations that happened before another event and to receive a basic overview of certain periods of time ."
3173,"[0.0, 0.0, 0.0, 1.0, 0.0, 0.0, 0.0, 0.0, 0.0, 0.0, 0.0]","All things considered , there are more benefits for students , not only in school but for the entire life , to being able to use learned ideas and concepts in a variety of fields than to learn facts that can be easily forgotten just after the exam has finished ."
3174,"[0.0, 0.0, 0.0, 0.0, 1.0, 0.0, 0.0, 0.0, 0.0, 0.0, 0.0]",I fully agree with this statement .
3175,"[0.0, 0.0, 0.0, 0.0, 1.0, 0.0, 0.0, 0.0, 0.0, 0.0, 0.0]",Young people dont give enough time to helping their communities .
3176,"[0.0, 0.0, 0.0, 0.0, 1.0, 0.0, 0.0, 0.0, 0.0, 0.0, 0.0]","They mostly indulge in activities that they want to do or having things they desire , instead of looking at the problems affecting their homes and localities ."
3177,"[0.0, 0.0, 0.0, 0.0, 1.0, 0.0, 0.0, 0.0, 0.0, 0.0, 0.0]","I myself , being a young person and living alongwith numerous other fellows in a hostel , has lots of experiences of such neglect shown by young individuals towards social and community needs ."
3178,"[0.0, 0.0, 0.0, 0.0, 1.0, 0.0, 0.0, 0.0, 0.0, 0.0, 0.0]","Most of the time being spent by young people goes mainly in fun activities like partying , gaming , chatting etc . or either in studying , preparing for the exams ."
3179,"[0.0, 0.0, 0.0, 0.0, 1.0, 0.0, 0.0, 0.0, 0.0, 0.0, 0.0]","There seems to be no thought processes in the mind that deals with the immediate difficulties , shortages or problems that is going around the place which need to be solved ."
3180,"[0.0, 0.0, 0.0, 0.0, 1.0, 0.0, 0.0, 0.0, 0.0, 0.0, 0.0]","For example , in our institution there is a major problem of standing water bodies in and around campus which provides a typical breeding ground for mosquitoes that can cause dangerous infections to the Ocala living in and around the area ."
3181,"[0.0, 0.0, 0.0, 0.0, 1.0, 0.0, 0.0, 0.0, 0.0, 0.0, 0.0]","But inspire of this , there seems to be no concern shown by the students who themselves might be affected by it ."
3182,"[0.0, 0.0, 0.0, 0.0, 1.0, 0.0, 0.0, 0.0, 0.0, 0.0, 0.0]",The situation can grow worse if not taken seriously .
3183,"[0.0, 0.0, 0.0, 0.0, 1.0, 0.0, 0.0, 0.0, 0.0, 0.0, 0.0]",Effective measures can be applied with the help of young students if they are willing .
3184,"[0.0, 0.0, 0.0, 0.0, 1.0, 0.0, 0.0, 0.0, 0.0, 0.0, 0.0]","Similarly , there are issues like education of poor workers and their children , who work in the campus for construction of new buildings ."
3185,"[0.0, 0.0, 0.0, 0.0, 1.0, 0.0, 0.0, 0.0, 0.0, 0.0, 0.0]",Young students can really help such poor people by organizing free weekly or monthly classes within the area and it could be of great help to the children who can think of having a much better life in future .
3186,"[0.0, 0.0, 0.0, 0.0, 1.0, 0.0, 0.0, 0.0, 0.0, 0.0, 0.0]","But till now , nothing has been done by the young people living here ."
3187,"[0.0, 0.0, 0.0, 0.0, 1.0, 0.0, 0.0, 0.0, 0.0, 0.0, 0.0]",Young people mostly dont listen to the advices given by seniors or the elderly people .
3188,"[0.0, 0.0, 0.0, 0.0, 1.0, 0.0, 0.0, 0.0, 0.0, 0.0, 0.0]",They always do what they feel is right .
3189,"[0.0, 0.0, 0.0, 0.0, 1.0, 0.0, 0.0, 0.0, 0.0, 0.0, 0.0]",Spending time to help communities is not the popular choice in their minds .
