,label,sent
1046,"[0.0, 0.0, 0.0, 0.0, 0.0, 0.0, 0.0, 0.0, 0.0, 0.0, 1.0]",At the beginning lets talk about the advertisement sector .
1047,"[0.0, 0.0, 0.0, 0.0, 0.0, 0.0, 0.0, 0.0, 0.0, 0.0, 1.0]",This sector is very important for the producers to reach to the consumers .
1048,"[0.0, 0.0, 0.0, 0.0, 0.0, 0.0, 0.0, 0.0, 0.0, 0.0, 1.0]",That is why producers do what ever they can do to reach tophe consumers .
1049,"[0.0, 0.0, 0.0, 0.0, 0.0, 0.0, 0.0, 0.0, 0.0, 0.0, 1.0]","However selling products are important , sometimes advertisement are make products much better than it was ."
1050,"[0.0, 0.0, 0.0, 0.0, 0.0, 0.0, 0.0, 0.0, 0.0, 0.0, 1.0]",I think it is true .
1051,"[0.0, 0.0, 0.0, 0.0, 0.0, 0.0, 0.0, 0.0, 0.0, 0.0, 1.0]",For a consumer buying a product at first sight is strongly related with its advertisement on TV or Newspaper .
1052,"[0.0, 0.0, 0.0, 0.0, 0.0, 0.0, 0.0, 0.0, 0.0, 0.0, 1.0]",If the advertisement was giving information about the product wrongly the producer easily belive it .
1053,"[0.0, 0.0, 0.0, 0.0, 0.0, 0.0, 0.0, 0.0, 0.0, 0.0, 1.0]",Today there are lot of rule 's existing to protect the consumer from the wrong informations that was given by the producer by using advertisements .
1054,"[0.0, 0.0, 0.0, 0.0, 0.0, 0.0, 0.0, 0.0, 0.0, 0.0, 1.0]",Using television and papers are very effective impress the producers .
1055,"[0.0, 0.0, 0.0, 0.0, 0.0, 0.0, 0.0, 0.0, 0.0, 0.0, 1.0]",Producer easily reach the consumers .
1056,"[0.0, 0.0, 0.0, 0.0, 0.0, 0.0, 0.0, 0.0, 0.0, 0.0, 1.0]",But You must give the right information and right pictures to the people which are potential consumers .
1057,"[0.0, 0.0, 0.0, 0.0, 0.0, 0.0, 0.0, 0.0, 0.0, 0.0, 1.0]",It is Teh easy way to make your product sell but in long term when truth is come across this will cause the firm very badly .
1058,"[0.0, 0.0, 0.0, 0.0, 0.0, 0.0, 0.0, 0.0, 0.0, 0.0, 1.0]","In conclusion , i can easily say that some of the advertisements make the products in consumers eyes much better than they really are ."
1059,"[0.0, 0.0, 0.0, 0.0, 0.0, 0.0, 0.0, 0.0, 0.0, 0.0, 1.0]",Advertisement is
1060,"[0.0, 0.0, 0.0, 1.0, 0.0, 0.0, 0.0, 0.0, 0.0, 0.0, 0.0]","In a society fixed on issues like youth and beauty , quite often people think that enjoying life is a matter of age , or better said a matter of not being old ."
1061,"[0.0, 0.0, 0.0, 1.0, 0.0, 0.0, 0.0, 0.0, 0.0, 0.0, 0.0]","When you look at TV commercials for example , you will find it surprisingly hard to find older people enjoying a joy  -  ride in the new Range Rover rather than young and good looking adults ."
1062,"[0.0, 0.0, 0.0, 1.0, 0.0, 0.0, 0.0, 0.0, 0.0, 0.0, 0.0]","On the other hand if there are reports about the elder it is mostly about poverty or illness , or other issues old people are likely to get in contact with ."
1063,"[0.0, 0.0, 0.0, 1.0, 0.0, 0.0, 0.0, 0.0, 0.0, 0.0, 0.0]",But this is as many things in our society a misleading thought .
1064,"[0.0, 0.0, 0.0, 1.0, 0.0, 0.0, 0.0, 0.0, 0.0, 0.0, 0.0]",If one watches closer it is not that hard to find the complete opposite of what was written before .
1065,"[0.0, 0.0, 0.0, 1.0, 0.0, 0.0, 0.0, 0.0, 0.0, 0.0, 0.0]","A lot of old people actually enjoy their life , despite of the picture some might have of them ."
1066,"[0.0, 0.0, 0.0, 1.0, 0.0, 0.0, 0.0, 0.0, 0.0, 0.0, 0.0]",On one hand they have got a lot of time because the do not have to work anymore and on the other hand they use that time much better as the generations before them .
1067,"[0.0, 0.0, 0.0, 1.0, 0.0, 0.0, 0.0, 0.0, 0.0, 0.0, 0.0]",A whole new market with special offers made exclusively for elders has developed .
1068,"[0.0, 0.0, 0.0, 1.0, 0.0, 0.0, 0.0, 0.0, 0.0, 0.0, 0.0]","Sports , travelling or social work is part of that huge variety ."
1069,"[0.0, 0.0, 0.0, 1.0, 0.0, 0.0, 0.0, 0.0, 0.0, 0.0, 0.0]",So enjoying your life is not a question of age rather than a question of willingness to do so .
1070,"[0.0, 0.0, 0.0, 1.0, 0.0, 0.0, 0.0, 0.0, 0.0, 0.0, 0.0]",There are of course a lot of older people who would call there life boring and not very enjoyable but you will find young people with the same opinion .
1071,"[0.0, 0.0, 0.0, 1.0, 0.0, 0.0, 0.0, 0.0, 0.0, 0.0, 0.0]",As a matter of fact the whole issue of enjoying life is a question of your financial background as well .
1072,"[0.0, 0.0, 0.0, 1.0, 0.0, 0.0, 0.0, 0.0, 0.0, 0.0, 0.0]",It is obvious that for some older people it is hard to get along with their small pensions as it is for young unemployed or under qualified people .
1073,"[0.0, 0.0, 0.0, 1.0, 0.0, 0.0, 0.0, 0.0, 0.0, 0.0, 0.0]",Taking these ideas together you will come to the conclusion that young people do not enjoy their life more the olders do or the other way around .
1074,"[0.0, 0.0, 0.0, 1.0, 0.0, 0.0, 0.0, 0.0, 0.0, 0.0, 0.0]","Being old is no reason to have less pleasure living , and being young is no free  -  ticket to happiness ."
1075,"[0.0, 0.0, 0.0, 1.0, 0.0, 0.0, 0.0, 0.0, 0.0, 0.0, 0.0]","So easily enjoying life is up to you , because if you are not making the best out of what you got , nobody will do ."
1076,"[0.0, 0.0, 0.0, 0.0, 0.0, 0.0, 1.0, 0.0, 0.0, 0.0, 0.0]",I agree with the topic because they dont care about it .
1077,"[0.0, 0.0, 0.0, 0.0, 0.0, 0.0, 1.0, 0.0, 0.0, 0.0, 0.0]",They care about only themselves .
1078,"[0.0, 0.0, 0.0, 0.0, 0.0, 0.0, 1.0, 0.0, 0.0, 0.0, 0.0]",It cause them not to help their communities .
1079,"[0.0, 0.0, 0.0, 0.0, 0.0, 0.0, 1.0, 0.0, 0.0, 0.0, 0.0]",I think they had better be interested in something around them .
1080,"[0.0, 0.0, 0.0, 0.0, 0.0, 0.0, 1.0, 0.0, 0.0, 0.0, 0.0]",There are only one reason about this problem .
1081,"[0.0, 0.0, 0.0, 0.0, 0.0, 0.0, 1.0, 0.0, 0.0, 0.0, 0.0]",This is that young people have to think about their future and they think they can do anything in their future but it 's impossible for them to do this .
1082,"[0.0, 0.0, 0.0, 0.0, 0.0, 0.0, 1.0, 0.0, 0.0, 0.0, 0.0]",They can not do anything without their communities but they ignore this fact no maybe they dont just wanna think about it .
1083,"[0.0, 0.0, 0.0, 0.0, 0.0, 0.0, 1.0, 0.0, 0.0, 0.0, 0.0]",So I think they can not give them their communities .
1084,"[0.0, 0.0, 0.0, 0.0, 0.0, 0.0, 1.0, 0.0, 0.0, 0.0, 0.0]",If they can notice about it they will make our society increasing and improve their skilled .
1085,"[0.0, 0.0, 0.0, 0.0, 0.0, 0.0, 1.0, 0.0, 0.0, 0.0, 0.0]",I hope so that .
1086,"[0.0, 0.0, 0.0, 0.0, 0.0, 0.0, 1.0, 0.0, 0.0, 0.0, 0.0]",and many young people think their future are blighting and they have many wish but they can not succeed these .
1087,"[0.0, 0.0, 0.0, 0.0, 0.0, 0.0, 0.0, 0.0, 1.0, 0.0, 0.0]","According with the previous statement , young current people do not have a active role in the society , and I think that is true , but is not a big problem ."
1088,"[0.0, 0.0, 0.0, 0.0, 0.0, 0.0, 0.0, 0.0, 1.0, 0.0, 0.0]","In my country is very common that young people do not have any interest in the national economy , politic or culture that surround themself ."
1089,"[0.0, 0.0, 0.0, 0.0, 0.0, 0.0, 0.0, 0.0, 1.0, 0.0, 0.0]",They do not want to spend time helping other citizens in their communities .
1090,"[0.0, 0.0, 0.0, 0.0, 0.0, 0.0, 0.0, 0.0, 1.0, 0.0, 0.0]","They have the time , is true , but not for helping ."
1091,"[0.0, 0.0, 0.0, 0.0, 0.0, 0.0, 0.0, 0.0, 1.0, 0.0, 0.0]","their `` reals '' interest are friends , video games and entertainment ."
1092,"[0.0, 0.0, 0.0, 0.0, 0.0, 0.0, 0.0, 0.0, 1.0, 0.0, 0.0]","In my opinion , Society has the responsibility to catch the attention of this young people through to different ways that it has ."
1093,"[0.0, 0.0, 0.0, 0.0, 0.0, 0.0, 0.0, 0.0, 1.0, 0.0, 0.0]","Here in Spain , government prepare special events for young people : Culture events focus in young people , governments workers are helping in the schools in order to have more implicated young people , etc ."
1094,"[0.0, 0.0, 0.0, 0.0, 0.0, 0.0, 0.0, 0.0, 1.0, 0.0, 0.0]",We have to create some essential values in the young people in order to they understand the enviroment in which they are living .
1095,"[0.0, 0.0, 0.0, 0.0, 0.0, 0.0, 0.0, 0.0, 1.0, 0.0, 0.0]","But I sure that is not a great problem for the society , because people start the interest in the community when they need it ."
1096,"[0.0, 0.0, 0.0, 0.0, 0.0, 0.0, 0.0, 0.0, 1.0, 0.0, 0.0]","I would like to explain it with an example : If we take a young boy of a development country , we have to ask us : Which thinks need this boy from the community ?"
1097,"[0.0, 0.0, 0.0, 0.0, 0.0, 0.0, 0.0, 0.0, 1.0, 0.0, 0.0]",Nothing .
1098,"[0.0, 0.0, 0.0, 0.0, 0.0, 0.0, 0.0, 0.0, 1.0, 0.0, 0.0]","He has a home , lovely parents , cable television , friends , video games , internet , etc . .."
1099,"[0.0, 0.0, 0.0, 0.0, 0.0, 0.0, 0.0, 0.0, 1.0, 0.0, 0.0]","They do n't need anything from the community , so he is not going to collaborate with it ."
1100,"[0.0, 0.0, 0.0, 0.0, 0.0, 0.0, 0.0, 0.0, 1.0, 0.0, 0.0]",This situation changes totally when young people start uppergrade studies or start in his first job .
1101,"[0.0, 0.0, 0.0, 0.0, 0.0, 0.0, 0.0, 0.0, 1.0, 0.0, 0.0]",They start the contact with the society .
1102,"[0.0, 0.0, 0.0, 0.0, 0.0, 0.0, 0.0, 0.0, 1.0, 0.0, 0.0]","Is in this moment , when young people understand that they are living with a lot of people and we have to talk , work , study , etc , with them in order to develop themself in their lives and in the society ."
1103,"[0.0, 0.0, 0.0, 0.0, 0.0, 0.0, 0.0, 0.0, 1.0, 0.0, 0.0]","When young people reach this level , they want to start the collaboration with their communities ."
1104,"[0.0, 0.0, 0.0, 0.0, 0.0, 0.0, 0.0, 0.0, 0.0, 0.0, 1.0]","Everybody wants to be successful , but success is not so easy that people can reach swiftly to it ."
1105,"[0.0, 0.0, 0.0, 0.0, 0.0, 0.0, 0.0, 0.0, 0.0, 0.0, 1.0]","Thus , humans must have some features in order to achieve ."
1106,"[0.0, 0.0, 0.0, 0.0, 0.0, 0.0, 0.0, 0.0, 0.0, 0.0, 1.0]","Therefore , these should be their knowledge , experiences and skills ."
1107,"[0.0, 0.0, 0.0, 0.0, 0.0, 0.0, 0.0, 0.0, 0.0, 0.0, 1.0]","As a result , I think people who do what they already know exactly can be successful with their knowledge , experiences and skills ."
1108,"[0.0, 0.0, 0.0, 0.0, 0.0, 0.0, 0.0, 0.0, 0.0, 0.0, 1.0]","First of all , to take risks is dangerous in business life ."
1109,"[0.0, 0.0, 0.0, 0.0, 0.0, 0.0, 0.0, 0.0, 0.0, 0.0, 1.0]",We even lose easily our job .
1110,"[0.0, 0.0, 0.0, 0.0, 0.0, 0.0, 0.0, 0.0, 0.0, 0.0, 1.0]","Moreover , doing what we do not know or understand would damage our Carriere , so it is not a good idea ."
1111,"[0.0, 0.0, 0.0, 0.0, 0.0, 0.0, 0.0, 0.0, 0.0, 0.0, 1.0]","For example , if ones have an exam and they do not study very well ."
1112,"[0.0, 0.0, 0.0, 0.0, 0.0, 0.0, 0.0, 0.0, 0.0, 0.0, 1.0]","As they answer the questions by wrong , these students would take a big risk about their future or notes ."
1113,"[0.0, 0.0, 0.0, 0.0, 0.0, 0.0, 0.0, 0.0, 0.0, 0.0, 1.0]","Briefly , people must think twice while they meet a problem because of not to take wrong decision ."
1114,"[0.0, 0.0, 0.0, 0.0, 0.0, 0.0, 0.0, 0.0, 0.0, 0.0, 1.0]","On the other hand , a person who has experiences and who is skillful and of course knowledgeable can not take risks because he knows the results of it ."
1115,"[0.0, 0.0, 0.0, 0.0, 0.0, 0.0, 0.0, 0.0, 0.0, 0.0, 1.0]","Furthermore , he has already met this situation before , that is why this person has not ever taken risks and will not in his all life ."
1116,"[0.0, 0.0, 0.0, 0.0, 0.0, 0.0, 0.0, 0.0, 0.0, 0.0, 1.0]","In conclusion , experience , knowledge and skill advance the human 's statue ."
1117,"[0.0, 0.0, 0.0, 0.0, 0.0, 0.0, 0.0, 0.0, 0.0, 0.0, 1.0]","All in all , as I said before taking risk is not a good thin"
1118,"[0.0, 0.0, 0.0, 0.0, 0.0, 0.0, 0.0, 0.0, 1.0, 0.0, 0.0]","As in all areas , there are many disagreements on education approach ."
1119,"[0.0, 0.0, 0.0, 0.0, 0.0, 0.0, 0.0, 0.0, 1.0, 0.0, 0.0]","Regarding teaching methods , some believe that it is more important for students to understand ideas and concepts than it is for them to learn facts ."
1120,"[0.0, 0.0, 0.0, 0.0, 0.0, 0.0, 0.0, 0.0, 1.0, 0.0, 0.0]","Both teaching methods are highly used in all over the world , but when it comes to my teaching method , I am a clear defender that it is far more important for students to understand ideas and concepts rather than learn plain and simple facts ."
1121,"[0.0, 0.0, 0.0, 0.0, 0.0, 0.0, 0.0, 0.0, 1.0, 0.0, 0.0]",It dose n't require any type of creativity for a student to understand a fact .
1122,"[0.0, 0.0, 0.0, 0.0, 0.0, 0.0, 0.0, 0.0, 1.0, 0.0, 0.0]",Facts are facts .
1123,"[0.0, 0.0, 0.0, 0.0, 0.0, 0.0, 0.0, 0.0, 1.0, 0.0, 0.0]",Facts can not be developed nor changed .
1124,"[0.0, 0.0, 0.0, 0.0, 0.0, 0.0, 0.0, 0.0, 1.0, 0.0, 0.0]","On the other hand , ideas and concepts require creativity and development ."
1125,"[0.0, 0.0, 0.0, 0.0, 0.0, 0.0, 0.0, 0.0, 1.0, 0.0, 0.0]","By teaching students to understand an idea , you are teaching him the why and how of the fact ."
1126,"[0.0, 0.0, 0.0, 0.0, 0.0, 0.0, 0.0, 0.0, 1.0, 0.0, 0.0]","You are fostering the student to think about it , analyze it and reach his own conclusion  -  a conclusion that with time , will develop in"
1127,"[0.0, 0.0, 0.0, 0.0, 0.0, 0.0, 0.0, 0.0, 1.0, 0.0, 0.0]",Take the example of a teacher who is trying to teach his student not to swear at other people .
1128,"[0.0, 0.0, 0.0, 0.0, 0.0, 0.0, 0.0, 0.0, 1.0, 0.0, 0.0]","If he would tell him not to swear because swearing is against the kinder - garden rules and it sounds bad ( which are facts ) , the kid is most likely to stop swearing because those are the rules , he was told not to , not because he has understood the concept of morale , or because he regrets hurting people ."
1129,"[0.0, 0.0, 0.0, 0.0, 0.0, 0.0, 0.0, 0.0, 1.0, 0.0, 0.0]","If we teach him the idea , the concept about swearing and all its consequences ( which are such and such ) , the kid can truly understand why not to swear ."
1130,"[0.0, 0.0, 0.0, 0.0, 0.0, 0.0, 0.0, 0.0, 1.0, 0.0, 0.0]","By teaching our students the idea and the concepts behind the facts that control our lives , we are encouraging our students to become flexible , analyze and have a mind of their own ."
1131,"[0.0, 0.0, 0.0, 0.0, 0.0, 0.0, 0.0, 0.0, 1.0, 0.0, 0.0]","We are fostering students who do not only know the facts , but also know the why and the how of facts ."
1132,"[0.0, 0.0, 0.0, 0.0, 0.0, 0.0, 0.0, 0.0, 1.0, 0.0, 0.0]",David Tunica Leyton
1133,"[0.0, 0.0, 0.0, 0.0, 0.0, 0.0, 0.0, 1.0, 0.0, 0.0, 0.0]",People always say that successful people will try new things and take risks rather that just doing what they already know how to do well .
1134,"[0.0, 0.0, 0.0, 0.0, 0.0, 0.0, 0.0, 1.0, 0.0, 0.0, 0.0]","Personally , i totally agree with this statement since i think successful people usually have two typical characteristics ."
1135,"[0.0, 0.0, 0.0, 0.0, 0.0, 0.0, 0.0, 1.0, 0.0, 0.0, 0.0]","In fact , they are ambitious and confident ."
1136,"[0.0, 0.0, 0.0, 0.0, 0.0, 0.0, 0.0, 1.0, 0.0, 0.0, 0.0]","First of all , ambition makes successful people not satisfy with what they currently are ."
1137,"[0.0, 0.0, 0.0, 0.0, 0.0, 0.0, 0.0, 1.0, 0.0, 0.0, 0.0]","Successful people are ambitious about things about them , like life standards , job positions , etc ."
1138,"[0.0, 0.0, 0.0, 0.0, 0.0, 0.0, 0.0, 1.0, 0.0, 0.0, 0.0]","Since they want to have a better life or higher pay job , they are willing to take any necessary steps to change they current life ."
1139,"[0.0, 0.0, 0.0, 0.0, 0.0, 0.0, 0.0, 1.0, 0.0, 0.0, 0.0]",They will not satisfy about the thing they already know how to do well .
1140,"[0.0, 0.0, 0.0, 0.0, 0.0, 0.0, 0.0, 1.0, 0.0, 0.0, 0.0]",They tend to challenge themselves .
1141,"[0.0, 0.0, 0.0, 0.0, 0.0, 0.0, 0.0, 1.0, 0.0, 0.0, 0.0]","In addition , confidence also influence successful people to try new things and take risk ."
1142,"[0.0, 0.0, 0.0, 0.0, 0.0, 0.0, 0.0, 1.0, 0.0, 0.0, 0.0]","Since they think they can handle many things and have that kind of ability , they think they will also success even if they try any new things ."
1143,"[0.0, 0.0, 0.0, 0.0, 0.0, 0.0, 0.0, 1.0, 0.0, 0.0, 0.0]","They are brave , and most of the time , they will not worry too much about the risk they have to take after trying new things ."
1144,"[0.0, 0.0, 0.0, 0.0, 0.0, 0.0, 0.0, 1.0, 0.0, 0.0, 0.0]","For example , i have a friend who is successful in his original career , and he is so confident about his ability to deal with any matter ."
1145,"[0.0, 0.0, 0.0, 0.0, 0.0, 0.0, 0.0, 1.0, 0.0, 0.0, 0.0]","Somehow , this year he just suddenly decides to quit his current job and to get a new one in another area which is unfamiliar with him ."
1146,"[0.0, 0.0, 0.0, 0.0, 0.0, 0.0, 0.0, 1.0, 0.0, 0.0, 0.0]",He made the decisions just because he thinks the new job is interesting to him .
1147,"[0.0, 0.0, 0.0, 0.0, 0.0, 0.0, 0.0, 1.0, 0.0, 0.0, 0.0]","Although there are some other reasons for others to disagree with this statement , i think the reasons that i provide would support my agreement with this statement that successful people"
1148,"[0.0, 0.0, 0.0, 0.0, 0.0, 0.0, 0.0, 0.0, 1.0, 0.0, 0.0]",Most advertisements make products seems more efficient than they really are .
1149,"[0.0, 0.0, 0.0, 0.0, 0.0, 0.0, 0.0, 0.0, 1.0, 0.0, 0.0]","Nowaday the marketing improvements , in order to sell more products , does not care about the needs of the costumers and what they are looking for ."
1150,"[0.0, 0.0, 0.0, 0.0, 0.0, 0.0, 0.0, 0.0, 1.0, 0.0, 0.0]","The big business usually find solutions to their economic selling problems only by taking care of their wealth , and not by taking care of what the costumers need and if the product they are selling has a good advertisements of its qualities , and say the true about the content ."
1151,"[0.0, 0.0, 0.0, 0.0, 0.0, 0.0, 0.0, 0.0, 1.0, 0.0, 0.0]","The advertisements of a product introduce us to what are we going to buy , so is an important part of the marketing in the business , because by looking at the advertisements of a product , the costumer will decide if is good for him and if is what he is really looking for ."
1152,"[0.0, 0.0, 0.0, 0.0, 0.0, 0.0, 0.0, 0.0, 1.0, 0.0, 0.0]","Nowaday with the new improvements in the industry , make long quantities of a product is easier than in the past , and also is easier to transport them to the stores , so they are more accessible for the costumers ."
1153,"[0.0, 0.0, 0.0, 0.0, 0.0, 0.0, 0.0, 0.0, 1.0, 0.0, 0.0]","With this improvements , the big business are starting not to take care of the product qualities , and this qualities have to be shown in the advertisements of the products ."
1154,"[0.0, 0.0, 0.0, 0.0, 0.0, 0.0, 0.0, 0.0, 1.0, 0.0, 0.0]",So the business try to make the product seem better than it really is .
1155,"[0.0, 0.0, 0.0, 0.0, 0.0, 0.0, 0.0, 0.0, 1.0, 0.0, 0.0]","For this marketing function , incentive the buy of a product is the first objective ."
1156,"[0.0, 0.0, 0.0, 0.0, 0.0, 0.0, 0.0, 0.0, 1.0, 0.0, 0.0]",There are many ways to reach this objective .
1157,"[0.0, 0.0, 0.0, 0.0, 0.0, 0.0, 0.0, 0.0, 1.0, 0.0, 0.0]","One of those is to make the external part of a product seem cool or really good , so with that , the costumer can not try the product or see the real characteristics of it , and he will decide if he buy it by looking at the advertisements ."
1158,"[0.0, 0.0, 0.0, 0.0, 0.0, 0.0, 0.0, 0.0, 1.0, 0.0, 0.0]","Finally I think that that economy plays an important role in this cheat , because money make people do anything they could to be wealthy ."
1159,"[0.0, 0.0, 0.0, 0.0, 0.0, 0.0, 0.0, 0.0, 0.0, 0.0, 1.0]",There is a statement here about being successful .
1160,"[0.0, 0.0, 0.0, 0.0, 0.0, 0.0, 0.0, 0.0, 0.0, 0.0, 1.0]",It says : successful people try new things and take risks rather than only doing what they already know how to do well .
1161,"[0.0, 0.0, 0.0, 0.0, 0.0, 0.0, 0.0, 0.0, 0.0, 0.0, 1.0]","I want to express my opinion by giving examples from real life ; First , look at Ataturk 's life ."
1162,"[0.0, 0.0, 0.0, 0.0, 0.0, 0.0, 0.0, 0.0, 0.0, 0.0, 1.0]",He attempted to save his country with his friends and at the end of the war he achieved it .
1163,"[0.0, 0.0, 0.0, 0.0, 0.0, 0.0, 0.0, 0.0, 0.0, 0.0, 1.0]",Indeed it was not a new thing .
1164,"[0.0, 0.0, 0.0, 0.0, 0.0, 0.0, 0.0, 0.0, 0.0, 0.0, 1.0]","There are , exactly , similar conditions and successes in turkish and world history ."
1165,"[0.0, 0.0, 0.0, 0.0, 0.0, 0.0, 0.0, 0.0, 0.0, 0.0, 1.0]",But after the war he tried to found a new country which is governed by citizens ( although this term was new for the turkey in those days ) and try to bring democracy culture here .
1166,"[0.0, 0.0, 0.0, 0.0, 0.0, 0.0, 0.0, 0.0, 0.0, 0.0, 1.0]","After all of these , he is remembered as succesful man and a leader ."
1167,"[0.0, 0.0, 0.0, 0.0, 0.0, 0.0, 0.0, 0.0, 0.0, 0.0, 1.0]","In conclusion , i can say that trying new things and taking risks can help you to be succesful ."
1168,"[0.0, 0.0, 0.0, 0.0, 0.0, 0.0, 0.0, 0.0, 0.0, 0.0, 1.0]",But . ..
1169,"[0.0, 0.0, 0.0, 0.0, 0.0, 0.0, 0.0, 0.0, 0.0, 0.0, 1.0]",In the twentieth century businessmen found a new business strategy : franchising .
1170,"[0.0, 0.0, 0.0, 0.0, 0.0, 0.0, 0.0, 0.0, 0.0, 0.0, 1.0]","There are lots of chains of companies and you just contact with them , giving them amount of money which they determined and you can be successful in this way ."
1171,"[0.0, 0.0, 0.0, 0.0, 0.0, 0.0, 0.0, 0.0, 0.0, 0.0, 1.0]",That is a way of success without taking risk and without finding new things .
1172,"[0.0, 0.0, 0.0, 0.0, 0.0, 0.0, 0.0, 0.0, 0.0, 0.0, 1.0]",After these instances how can i conclude ?
1173,"[0.0, 0.0, 0.0, 0.0, 0.0, 0.0, 0.0, 0.0, 0.0, 0.0, 1.0]",And do i have to ask this question : what is success ?
1174,"[0.0, 0.0, 0.0, 0.0, 0.0, 0.0, 0.0, 0.0, 0.0, 0.0, 1.0]",To answering these questions is not easy but i want response in my way ; if you just want to be successful person who lives in high standards you do not have to take risks .
1175,"[0.0, 0.0, 0.0, 0.0, 0.0, 0.0, 0.0, 0.0, 0.0, 0.0, 1.0]","But if you want to be a successful person who will be remembered untill the end of time you must take risks , you must find new solutions to old problems ."
1176,"[0.0, 0.0, 0.0, 0.0, 0.0, 0.0, 0.0, 0.0, 0.0, 0.0, 1.0]","At the end , i just can say that i agreed the statement and i have to add that at the same time i disagreed it ."
1177,"[0.0, 0.0, 0.0, 0.0, 0.0, 0.0, 0.0, 0.0, 0.0, 0.0, 1.0]",I hope i profess it well .
1178,"[0.0, 0.0, 0.0, 0.0, 0.0, 0.0, 1.0, 0.0, 0.0, 0.0, 0.0]",Some people disagree with the statement most advertisements make products seem much better than they really are .
1179,"[0.0, 0.0, 0.0, 0.0, 0.0, 0.0, 1.0, 0.0, 0.0, 0.0, 0.0]",I guess the people are just lucky .
1180,"[0.0, 0.0, 0.0, 0.0, 0.0, 0.0, 1.0, 0.0, 0.0, 0.0, 0.0]",Most of the time the goods look much better than they really are .
1181,"[0.0, 0.0, 0.0, 0.0, 0.0, 0.0, 1.0, 0.0, 0.0, 0.0, 0.0]","For instances , when you go try to taste a new menu of food , or when you buy furnitures ."
1182,"[0.0, 0.0, 0.0, 0.0, 0.0, 0.0, 1.0, 0.0, 0.0, 0.0, 0.0]","For the first example , when you watch the advertisement about the fast food on TV , it looks flesh , and looks homemade ."
1183,"[0.0, 0.0, 0.0, 0.0, 0.0, 0.0, 1.0, 0.0, 0.0, 0.0, 0.0]","However when you try the menu at the fast food restaurant , the veritable is not flesh , and they do not taste the same as the TV sais ."
1184,"[0.0, 0.0, 0.0, 0.0, 0.0, 0.0, 1.0, 0.0, 0.0, 0.0, 0.0]","Second , you see furnitures on the catalogue ."
1185,"[0.0, 0.0, 0.0, 0.0, 0.0, 0.0, 1.0, 0.0, 0.0, 0.0, 0.0]",They look very gorgeous and beautiful .
1186,"[0.0, 0.0, 0.0, 0.0, 0.0, 0.0, 1.0, 0.0, 0.0, 0.0, 0.0]","However when you go to the store to see the furnitures that were on the catalogue , they look so different ."
1187,"[0.0, 0.0, 0.0, 0.0, 0.0, 0.0, 1.0, 0.0, 0.0, 0.0, 0.0]","They look cheap , the color is different , and the shapes are a little different ."
1188,"[0.0, 0.0, 0.0, 0.0, 0.0, 0.0, 1.0, 0.0, 0.0, 0.0, 0.0]",I think the display on the catalogue makes them very fascinating .
1189,"[0.0, 0.0, 0.0, 0.0, 0.0, 0.0, 1.0, 0.0, 0.0, 0.0, 0.0]",Although most advertisement make products seem much better than they really are .
1190,"[0.0, 0.0, 0.0, 0.0, 0.0, 0.0, 1.0, 0.0, 0.0, 0.0, 0.0]","They compliment about the goods too much on TV , and also they take very good picture of them ."
1191,"[0.0, 0.0, 0.0, 0.0, 0.0, 1.0, 0.0, 0.0, 0.0, 0.0, 0.0]",Today it - s impossible walk early in the city .
1192,"[0.0, 0.0, 0.0, 0.0, 0.0, 1.0, 0.0, 0.0, 0.0, 0.0, 0.0]","There are so much cars that stopped the street when you walk , and the smog it - s the bad thinks ."
1193,"[0.0, 0.0, 0.0, 0.0, 0.0, 1.0, 0.0, 0.0, 0.0, 0.0, 0.0]","I like the city whiteout cars cars and less traffic , you can see it with another side . .."
1194,"[0.0, 0.0, 0.0, 0.0, 0.0, 1.0, 0.0, 0.0, 0.0, 0.0, 0.0]",It s amazing if i can look 50 years few my city . ..
1195,"[0.0, 0.0, 0.0, 0.0, 0.0, 1.0, 0.0, 0.0, 0.0, 0.0, 0.0]","It - s ok , cars are very very important for our life ; go to work , shopping , go to holiday , go out at the night , ..."
1196,"[0.0, 0.0, 0.0, 0.0, 0.0, 1.0, 0.0, 0.0, 0.0, 0.0, 0.0]","But the problem is not how many cars are around , the problem is what we use this ."
1197,"[0.0, 0.0, 0.0, 0.0, 0.0, 1.0, 0.0, 0.0, 0.0, 0.0, 0.0]","In Milan are a lot of big cars , and the use of this it - s incredible ."
1198,"[0.0, 0.0, 0.0, 0.0, 0.0, 1.0, 0.0, 0.0, 0.0, 0.0, 0.0]",For instance people bring cars only to make 5 minutes . ..
1199,"[0.0, 0.0, 0.0, 0.0, 0.0, 1.0, 0.0, 0.0, 0.0, 0.0, 0.0]",The main facts is the envelope that the cars make at the ambient .
1200,"[0.0, 0.0, 0.0, 0.0, 0.0, 1.0, 0.0, 0.0, 0.0, 0.0, 0.0]","We can see now .. , the big problem in a polar place , the great meaning in the south america , the hot in the summer and cold in the winter !"
