,label,sent
2039,"[0.0, 0.0, 0.0, 0.0, 0.0, 1.0, 0.0, 0.0, 0.0, 0.0, 0.0]","Specializing in one topic , and leaving all the other subjects , is a very strong challenge , and actually it is a risk because you have to take a decision about the main field of knowledge you are going to develop probably during you whole life ."
2040,"[0.0, 0.0, 0.0, 0.0, 0.0, 1.0, 0.0, 0.0, 0.0, 0.0, 0.0]","But , if you like challenges , probably you will obtain higher aims ."
2041,"[0.0, 0.0, 0.0, 0.0, 0.0, 1.0, 0.0, 0.0, 0.0, 0.0, 0.0]","Life is full of choices , and this is a very difficult choice for you career , and for you life ."
2042,"[0.0, 0.0, 0.0, 0.0, 0.0, 1.0, 0.0, 0.0, 0.0, 0.0, 0.0]",But I think that challenges and chaises make life colourful and funny .
2043,"[0.0, 0.0, 0.0, 0.0, 0.0, 0.0, 1.0, 0.0, 0.0, 0.0, 0.0]",Some people are of the opinion that the best way to travel is to take a trip by alone .
2044,"[0.0, 0.0, 0.0, 0.0, 0.0, 0.0, 1.0, 0.0, 0.0, 0.0, 0.0]",Such people tend to think that they feel more comfortable taking a travel alone as they do not have to follow the schedules and intentions of others .
2045,"[0.0, 0.0, 0.0, 0.0, 0.0, 0.0, 1.0, 0.0, 0.0, 0.0, 0.0]","In my opinion , however , the best way to travel is in a group by tour guide ."
2046,"[0.0, 0.0, 0.0, 0.0, 0.0, 0.0, 1.0, 0.0, 0.0, 0.0, 0.0]",This essay will discuss the two key reasons to support my opinion in more detail below .
2047,"[0.0, 0.0, 0.0, 0.0, 0.0, 0.0, 1.0, 0.0, 0.0, 0.0, 0.0]","First , I am definitely of the opinion that it is best to take a trip in a group led by a tour guide ."
2048,"[0.0, 0.0, 0.0, 0.0, 0.0, 0.0, 1.0, 0.0, 0.0, 0.0, 0.0]",The reason is that I can get a sense of security when traveling in a group .
2049,"[0.0, 0.0, 0.0, 0.0, 0.0, 0.0, 1.0, 0.0, 0.0, 0.0, 0.0]","For example , if I lose all of my money on the way to my travel by accident , I can ask somebody participating in the tour as well as the tour guide for help at any time ."
2050,"[0.0, 0.0, 0.0, 0.0, 0.0, 0.0, 1.0, 0.0, 0.0, 0.0, 0.0]","That is to say , in case of emergency , I do not have to worry about financial problems during my trip ."
2051,"[0.0, 0.0, 0.0, 0.0, 0.0, 0.0, 1.0, 0.0, 0.0, 0.0, 0.0]","Hence , I do believe it is much better and safer to take a trip in a group guided by a tour conductor ."
2052,"[0.0, 0.0, 0.0, 0.0, 0.0, 0.0, 1.0, 0.0, 0.0, 0.0, 0.0]","Second , I do feel that the best way to travel is in a group led by a tour guide because it is more affordable to take part in package tours as a group ."
2053,"[0.0, 0.0, 0.0, 0.0, 0.0, 0.0, 1.0, 0.0, 0.0, 0.0, 0.0]","Not only that , I can get more useful information about the places and sites which I am going to visit from the tour guide in more effective ways ."
2054,"[0.0, 0.0, 0.0, 0.0, 0.0, 0.0, 1.0, 0.0, 0.0, 0.0, 0.0]","On the other hand , it is really tiresome and troublesome for me to make my study plans such as the duration of my travel , where to stay , and making a list of places to visit on my own ."
2055,"[0.0, 0.0, 0.0, 0.0, 0.0, 0.0, 1.0, 0.0, 0.0, 0.0, 0.0]","To conclude , all things stated above considered , I do feel the best way to take a trip is in a group led by a tour guide as it is more secure , financially affordable and more easy to get the more useful and enjoyable information regarding my trip ."
2056,"[0.0, 0.0, 0.0, 0.0, 0.0, 0.0, 0.0, 0.0, 0.0, 1.0, 0.0]",I completely agree with the statement `` Most advertisements make products seem much better than they really are '' .
2057,"[0.0, 0.0, 0.0, 0.0, 0.0, 0.0, 0.0, 0.0, 0.0, 1.0, 0.0]",Advertising is all about projecting the brand image of the product .
2058,"[0.0, 0.0, 0.0, 0.0, 0.0, 0.0, 0.0, 0.0, 0.0, 1.0, 0.0]",The idea of adversing is to improve the sales of the product .
2059,"[0.0, 0.0, 0.0, 0.0, 0.0, 0.0, 0.0, 0.0, 0.0, 1.0, 0.0]",This necessarily means attracting customers to their product .
2060,"[0.0, 0.0, 0.0, 0.0, 0.0, 0.0, 0.0, 0.0, 0.0, 1.0, 0.0]",The means to attract lies in the image they project .
2061,"[0.0, 0.0, 0.0, 0.0, 0.0, 0.0, 0.0, 0.0, 0.0, 1.0, 0.0]","So , it comes as no surprise if the advertisers make their product look the best ."
2062,"[0.0, 0.0, 0.0, 0.0, 0.0, 0.0, 0.0, 0.0, 0.0, 1.0, 0.0]","When projecting the image of the project , anyone would tend to speak about the positive points ."
2063,"[0.0, 0.0, 0.0, 0.0, 0.0, 0.0, 0.0, 0.0, 0.0, 1.0, 0.0]",How could they expect their product to be sold if they project the negative shade of the project ??
2064,"[0.0, 0.0, 0.0, 0.0, 0.0, 0.0, 0.0, 0.0, 0.0, 1.0, 0.0]",But the problem lies in the fact that the advertisers tend to go overboard with the qualities of their products .
2065,"[0.0, 0.0, 0.0, 0.0, 0.0, 0.0, 0.0, 0.0, 0.0, 1.0, 0.0]","Their steps in making the product desirable to the audience are appreciated , but not at the cost of the trust or belief people have in it ."
2066,"[0.0, 0.0, 0.0, 0.0, 0.0, 0.0, 0.0, 0.0, 0.0, 1.0, 0.0]",The main aim is to gain advantage over the competitors product .
2067,"[0.0, 0.0, 0.0, 0.0, 0.0, 0.0, 0.0, 0.0, 0.0, 1.0, 0.0]","So , they try to grasp the negative aspects associated with the competitor 's product and project an image of their product ."
2068,"[0.0, 0.0, 0.0, 0.0, 0.0, 0.0, 0.0, 0.0, 0.0, 1.0, 0.0]",This image necessarily speaks about what qualities are there in the products that their competitors do n't provide .
2069,"[0.0, 0.0, 0.0, 0.0, 0.0, 0.0, 0.0, 0.0, 0.0, 1.0, 0.0]",The Head & Shoulders advertisement comes as a reference in this regard .
2070,"[0.0, 0.0, 0.0, 0.0, 0.0, 0.0, 0.0, 0.0, 0.0, 1.0, 0.0]",It might not be as successful in removing dandruff as it projects itself to be .
2071,"[0.0, 0.0, 0.0, 0.0, 0.0, 0.0, 0.0, 0.0, 0.0, 1.0, 0.0]",Some advertisements even tend to put the health of individuals in jeopardy .
2072,"[0.0, 0.0, 0.0, 0.0, 0.0, 0.0, 0.0, 0.0, 0.0, 1.0, 0.0]",One classic example I can give in this regard is the Soft Drinks .
2073,"[0.0, 0.0, 0.0, 0.0, 0.0, 0.0, 0.0, 0.0, 0.0, 1.0, 0.0]",The recent Coke controversy serves as a classic example to this fact .
2074,"[0.0, 0.0, 0.0, 0.0, 0.0, 0.0, 0.0, 0.0, 0.0, 1.0, 0.0]","Recently , there was some evidence that coke has some unreasonable amount of pesticides in it ."
2075,"[0.0, 0.0, 0.0, 0.0, 0.0, 0.0, 0.0, 0.0, 0.0, 1.0, 0.0]","When coke is projected as a healthy and safe drink , evidences to this degree act as a blot on the reputation ."
2076,"[0.0, 0.0, 0.0, 0.0, 0.0, 0.0, 0.0, 0.0, 0.0, 1.0, 0.0]",But I wonder if the products would sell off if TRUE information is advertised .
2077,"[0.0, 0.0, 0.0, 0.0, 0.0, 0.0, 0.0, 0.0, 0.0, 1.0, 0.0]",Imagine the sales of H & S if it says `` Try out for yourself '' rather than projecting their good image .
2078,"[0.0, 0.0, 0.0, 0.0, 0.0, 0.0, 0.0, 0.0, 0.0, 1.0, 0.0]",Or if Coke people say '' Be careful .
2079,"[0.0, 0.0, 0.0, 0.0, 0.0, 0.0, 0.0, 0.0, 0.0, 1.0, 0.0]",This drink might be harmful to health '' .
2080,"[0.0, 0.0, 0.0, 0.0, 0.0, 0.0, 0.0, 0.0, 0.0, 1.0, 0.0]",But one thing i can be sure .
2081,"[0.0, 0.0, 0.0, 0.0, 0.0, 0.0, 0.0, 0.0, 0.0, 1.0, 0.0]",This advertising world is for people to sel their brands and they would do it at the best way possible .
2082,"[0.0, 0.0, 0.0, 0.0, 0.0, 0.0, 0.0, 0.0, 0.0, 0.0, 1.0]",There are some people who voice serious doubts about having broad knowledge of many academic subjects and who are prepared to argue with specializing in one subject .
2083,"[0.0, 0.0, 0.0, 0.0, 0.0, 0.0, 0.0, 0.0, 0.0, 0.0, 1.0]","But , I would have to say that , If I faced with the decision , I would probably chose broad knowledge of many subjects because it is very useful for our social life and our future life ."
2084,"[0.0, 0.0, 0.0, 0.0, 0.0, 0.0, 0.0, 0.0, 0.0, 0.0, 1.0]","To start with , it is very beneficial for our social life ."
2085,"[0.0, 0.0, 0.0, 0.0, 0.0, 0.0, 0.0, 0.0, 0.0, 0.0, 1.0]","To illustrate , people who know many academic subject trust themselves and it is very important for their whole life ."
2086,"[0.0, 0.0, 0.0, 0.0, 0.0, 0.0, 0.0, 0.0, 0.0, 0.0, 1.0]","Moreover , they can apply a lot of conversations and give their opinions about the issues ."
2087,"[0.0, 0.0, 0.0, 0.0, 0.0, 0.0, 0.0, 0.0, 0.0, 0.0, 1.0]","If people have only one specific subject , they may not give any advice to the people owing to lack of knowledge about a lot of different topics ."
2088,"[0.0, 0.0, 0.0, 0.0, 0.0, 0.0, 0.0, 0.0, 0.0, 0.0, 1.0]",It is obvious that we can not underestimate the benefits of broad knowledge of many academic subjects .
2089,"[0.0, 0.0, 0.0, 0.0, 0.0, 0.0, 0.0, 0.0, 0.0, 0.0, 1.0]","Secondly , broad knowledge is very important for our future life ."
2090,"[0.0, 0.0, 0.0, 0.0, 0.0, 0.0, 0.0, 0.0, 0.0, 0.0, 1.0]","To put it more simply , if we are familiar a lot of subjects , we can easily find job ."
2091,"[0.0, 0.0, 0.0, 0.0, 0.0, 0.0, 0.0, 0.0, 0.0, 0.0, 1.0]","Namely , all instructions want their workers to know a lot of things ."
2092,"[0.0, 0.0, 0.0, 0.0, 0.0, 0.0, 0.0, 0.0, 0.0, 0.0, 1.0]","In addition , knowing a lot of subjects affect people and we can reach very good positions thanks to our knowledge and also it brings us to find good couple , to have a beautiful family and to earn a lot of money to be happy in our future life ."
2093,"[0.0, 0.0, 0.0, 0.0, 0.0, 0.0, 0.0, 0.0, 0.0, 0.0, 1.0]",Several other examples might be given easily but these will suffice .
2094,"[0.0, 0.0, 0.0, 0.0, 0.0, 0.0, 0.0, 0.0, 0.0, 0.0, 1.0]","All in all , from what has been discussed above , we can clearly draw the conclusion that having broad knowledge of several subjects more beneficial than specializing in one subject ."
2095,"[0.0, 0.0, 0.0, 0.0, 0.0, 0.0, 0.0, 0.0, 0.0, 0.0, 1.0]","Therefore , people attach great importance to be familiar in a lof topics ."
2096,"[0.0, 0.0, 0.0, 1.0, 0.0, 0.0, 0.0, 0.0, 0.0, 0.0, 0.0]",I believe that is more important to understand ideas and concepts .
2097,"[0.0, 0.0, 0.0, 1.0, 0.0, 0.0, 0.0, 0.0, 0.0, 0.0, 0.0]",I think so because it is important to learn how to handle problems and not to know everything .
2098,"[0.0, 0.0, 0.0, 1.0, 0.0, 0.0, 0.0, 0.0, 0.0, 0.0, 0.0]",The first reason is that in later time there is everytime the possibility to look a fact up in a book .
2099,"[0.0, 0.0, 0.0, 1.0, 0.0, 0.0, 0.0, 0.0, 0.0, 0.0, 0.0]",So for example if do not know a special word you can look it up and it will take only some minutes .
2100,"[0.0, 0.0, 0.0, 1.0, 0.0, 0.0, 0.0, 0.0, 0.0, 0.0, 0.0]",So it is not very important to learn all the facts in school or in university .
2101,"[0.0, 0.0, 0.0, 1.0, 0.0, 0.0, 0.0, 0.0, 0.0, 0.0, 0.0]",An other aspect is that in real life especially in work there are normally other problems as in university .
2102,"[0.0, 0.0, 0.0, 1.0, 0.0, 0.0, 0.0, 0.0, 0.0, 0.0, 0.0]",So it is possible that you have learned all facts but can not solve the given problem .
2103,"[0.0, 0.0, 0.0, 1.0, 0.0, 0.0, 0.0, 0.0, 0.0, 0.0, 0.0]",So you will not get your work done well .
2104,"[0.0, 0.0, 0.0, 1.0, 0.0, 0.0, 0.0, 0.0, 0.0, 0.0, 0.0]",But if you understood the concept you are able to handle the situation and find a new solution .
2105,"[0.0, 0.0, 0.0, 1.0, 0.0, 0.0, 0.0, 0.0, 0.0, 0.0, 0.0]",Third the work in later job is so specialized that it is not possible to learn these facts in detail at university .
2106,"[0.0, 0.0, 0.0, 1.0, 0.0, 0.0, 0.0, 0.0, 0.0, 0.0, 0.0]",For example in geology you can not learn everything you need for mining .
2107,"[0.0, 0.0, 0.0, 1.0, 0.0, 0.0, 0.0, 0.0, 0.0, 0.0, 0.0]",The concept is the important point .
2108,"[0.0, 0.0, 0.0, 1.0, 0.0, 0.0, 0.0, 0.0, 0.0, 0.0, 0.0]",It is also possible that a student will work after university in an other sector .
2109,"[0.0, 0.0, 0.0, 1.0, 0.0, 0.0, 0.0, 0.0, 0.0, 0.0, 0.0]",It is today not unusual to get get a job for example in a bank if studied law before .
2110,"[0.0, 0.0, 0.0, 1.0, 0.0, 0.0, 0.0, 0.0, 0.0, 0.0, 0.0]",In this case you do not need the special knowledge but structures how to work efficiently .
2111,"[0.0, 0.0, 0.0, 1.0, 0.0, 0.0, 0.0, 0.0, 0.0, 0.0, 0.0]",Finally university should give student the possibility to do researches on new areas of science .
2112,"[0.0, 0.0, 0.0, 1.0, 0.0, 0.0, 0.0, 0.0, 0.0, 0.0, 0.0]",There will be no new project or e.g. a new medicine when only facts are important .
2113,"[0.0, 0.0, 0.0, 1.0, 0.0, 0.0, 0.0, 0.0, 0.0, 0.0, 0.0]","Through understanding the main ideas , concepts and structures students can reach new possibilities and goals ."
2114,"[0.0, 0.0, 0.0, 1.0, 0.0, 0.0, 0.0, 0.0, 0.0, 0.0, 0.0]","So to conclude , of course , this does not mean that facts should not be taught ."
2115,"[0.0, 0.0, 0.0, 1.0, 0.0, 0.0, 0.0, 0.0, 0.0, 0.0, 0.0]",But in the later life the structures and main ideas will be more helpful .
2116,"[0.0, 0.0, 0.0, 1.0, 0.0, 0.0, 0.0, 0.0, 0.0, 0.0, 0.0]",So it is more important for students to understands this then learning all the facts .
2117,"[0.0, 0.0, 0.0, 0.0, 0.0, 0.0, 0.0, 0.0, 0.0, 1.0, 0.0]",Selecting the number of subjects will basically depend upon many factors .
2118,"[0.0, 0.0, 0.0, 0.0, 0.0, 0.0, 0.0, 0.0, 0.0, 1.0, 0.0]","However , selecting one specific subject and working over it would help to get complete command over the subject ."
2119,"[0.0, 0.0, 0.0, 0.0, 0.0, 0.0, 0.0, 0.0, 0.0, 1.0, 0.0]",But I personally believe that having command over many subjects would be better .
2120,"[0.0, 0.0, 0.0, 0.0, 0.0, 0.0, 0.0, 0.0, 0.0, 1.0, 0.0]","Firstly , it can help in making further studies ."
2121,"[0.0, 0.0, 0.0, 0.0, 0.0, 0.0, 0.0, 0.0, 0.0, 1.0, 0.0]",By choosing many subjects we can have command over a number of topics which can help us to use it effectively .
2122,"[0.0, 0.0, 0.0, 0.0, 0.0, 0.0, 0.0, 0.0, 0.0, 1.0, 0.0]","For example , when I was in graduation I had a chance to take either one subject or two subjects ."
2123,"[0.0, 0.0, 0.0, 0.0, 0.0, 0.0, 0.0, 0.0, 0.0, 1.0, 0.0]",I then felt to take two subjects one as my major other as the minor .
2124,"[0.0, 0.0, 0.0, 0.0, 0.0, 0.0, 0.0, 0.0, 0.0, 1.0, 0.0]",Which helped me to learn both Finance and Marketing .
2125,"[0.0, 0.0, 0.0, 0.0, 0.0, 0.0, 0.0, 0.0, 0.0, 1.0, 0.0]",I also felt the importance of selecting the two subjects when i want to make out the project in final demister .
2126,"[0.0, 0.0, 0.0, 0.0, 0.0, 0.0, 0.0, 0.0, 0.0, 1.0, 0.0]","Which helped me to work for two subject , which are Finance and Marketing ."
2127,"[0.0, 0.0, 0.0, 0.0, 0.0, 0.0, 0.0, 0.0, 0.0, 1.0, 0.0]",So I was able to prepare two projects which inturn helped me to keep up my final grades .
2128,"[0.0, 0.0, 0.0, 0.0, 0.0, 0.0, 0.0, 0.0, 0.0, 1.0, 0.0]","Secondly , it will increase our knowledge ."
2129,"[0.0, 0.0, 0.0, 0.0, 0.0, 0.0, 0.0, 0.0, 0.0, 1.0, 0.0]",When we study about more subjects it can increase our knowledge about all of them .
2130,"[0.0, 0.0, 0.0, 0.0, 0.0, 0.0, 0.0, 0.0, 0.0, 1.0, 0.0]",When I was in school days we used to have general knowledge and moral science as our extra subjects .
2131,"[0.0, 0.0, 0.0, 0.0, 0.0, 0.0, 0.0, 0.0, 0.0, 1.0, 0.0]",I felt great benefit of these subjects when i matured as a student .
2132,"[0.0, 0.0, 0.0, 0.0, 0.0, 0.0, 0.0, 0.0, 0.0, 1.0, 0.0]",It helped me to participate in quiz competitions and also helped me to increase the helping nature where i learnt through moral science .
2133,"[0.0, 0.0, 0.0, 0.0, 0.0, 0.0, 0.0, 0.0, 0.0, 1.0, 0.0]","Lastly , it makes us to have a fruitful career ."
2134,"[0.0, 0.0, 0.0, 0.0, 0.0, 0.0, 0.0, 0.0, 0.0, 1.0, 0.0]","When the time comes for me to make out a job , the command over different subjects can help me to secure a good job ."
2135,"[0.0, 0.0, 0.0, 0.0, 0.0, 0.0, 0.0, 0.0, 0.0, 1.0, 0.0]",Where I can have a number of choices and I can choose the field which is good .
2136,"[0.0, 0.0, 0.0, 0.0, 0.0, 0.0, 0.0, 0.0, 0.0, 1.0, 0.0]","So , it helps to have a good and fruitful career ."
2137,"[0.0, 0.0, 0.0, 0.0, 0.0, 0.0, 0.0, 0.0, 0.0, 1.0, 0.0]","When I completed graduation , as i studied both marketing and finance as subjects in my graduation , it helped me to fetch a job in both the fields ."
2138,"[0.0, 0.0, 0.0, 0.0, 0.0, 0.0, 0.0, 0.0, 0.0, 1.0, 0.0]",So I had a choice to prefer .
2139,"[0.0, 0.0, 0.0, 0.0, 0.0, 0.0, 0.0, 0.0, 0.0, 1.0, 0.0]","So , because of these reasons I prefer that learing about more subjects helps us in different ways ."
2140,"[0.0, 0.0, 0.0, 0.0, 0.0, 0.0, 0.0, 0.0, 0.0, 1.0, 0.0]","Even though learing about a particular subject can bring specialisation , I still believe to have broad knowledge of many subjects ."
2141,"[0.0, 0.0, 0.0, 0.0, 0.0, 0.0, 0.0, 1.0, 0.0, 0.0, 0.0]",There can be many opinion in this topic that twenty years later cars will be fewer than today .
2142,"[0.0, 0.0, 0.0, 0.0, 0.0, 0.0, 0.0, 1.0, 0.0, 0.0, 0.0]",Actually the oil and gas will be gone in 21C .
2143,"[0.0, 0.0, 0.0, 0.0, 0.0, 0.0, 0.0, 1.0, 0.0, 0.0, 0.0]",However I disagree with this statement .
2144,"[0.0, 0.0, 0.0, 0.0, 0.0, 0.0, 0.0, 1.0, 0.0, 0.0, 0.0]",Because car is developing very fast and in some years we can needed just 1liter of oil to go 30000m .
2145,"[0.0, 0.0, 0.0, 0.0, 0.0, 0.0, 0.0, 1.0, 0.0, 0.0, 0.0]",Moreover before the oil and gas gone scientist will make new car that go by electricity or by sun light .
2146,"[0.0, 0.0, 0.0, 0.0, 0.0, 0.0, 0.0, 1.0, 0.0, 0.0, 0.0]","First , car is developing extremely fast ."
2147,"[0.0, 0.0, 0.0, 0.0, 0.0, 0.0, 0.0, 1.0, 0.0, 0.0, 0.0]","Before 10years normal car can go 5or 6000m by 1liter of oil , However now car can go 18000m by just 1liter of oil ."
2148,"[0.0, 0.0, 0.0, 0.0, 0.0, 0.0, 0.0, 1.0, 0.0, 0.0, 0.0]","And now car is developing very fast that , we can not imagine ."
2149,"[0.0, 0.0, 0.0, 0.0, 0.0, 0.0, 0.0, 1.0, 0.0, 0.0, 0.0]","For example , their was a car that , go 5000m per 1liter of oil ."
2150,"[0.0, 0.0, 0.0, 0.0, 0.0, 0.0, 0.0, 1.0, 0.0, 0.0, 0.0]",And in the future car will go 30000m per 1liter of oil .
2151,"[0.0, 0.0, 0.0, 0.0, 0.0, 0.0, 0.0, 1.0, 0.0, 0.0, 0.0]",Than oil needed 1/6 than the past .
2152,"[0.0, 0.0, 0.0, 0.0, 0.0, 0.0, 0.0, 1.0, 0.0, 0.0, 0.0]",However scientist calculated that only 40years left to use all of oil and gas .
2153,"[0.0, 0.0, 0.0, 0.0, 0.0, 0.0, 0.0, 1.0, 0.0, 0.0, 0.0]","However when car develop like this , the time will be spent 120 years to use all of oil and gas ."
2154,"[0.0, 0.0, 0.0, 0.0, 0.0, 0.0, 0.0, 1.0, 0.0, 0.0, 0.0]",And of course you will change your car when you use 15 ~ 20years .
2155,"[0.0, 0.0, 0.0, 0.0, 0.0, 0.0, 0.0, 1.0, 0.0, 0.0, 0.0]",Than it means after 20years there will be a plenty of cars by development of cars .
2156,"[0.0, 0.0, 0.0, 0.0, 0.0, 0.0, 0.0, 1.0, 0.0, 0.0, 0.0]","Second , scientist will develop and make the cars that do not need any oil and gas ."
2157,"[0.0, 0.0, 0.0, 0.0, 0.0, 0.0, 0.0, 1.0, 0.0, 0.0, 0.0]",Like electronic cars or sun light powered cars .
2158,"[0.0, 0.0, 0.0, 0.0, 0.0, 0.0, 0.0, 1.0, 0.0, 0.0, 0.0]",Now Vents the car company is developing the electronic cars and sun light powered cars .
2159,"[0.0, 0.0, 0.0, 0.0, 0.0, 0.0, 0.0, 1.0, 0.0, 0.0, 0.0]",And Vents company will make that cars in 20years .
2160,"[0.0, 0.0, 0.0, 0.0, 0.0, 0.0, 0.0, 1.0, 0.0, 0.0, 0.0]",That means in 20years people do not need oil and gas cars anymore .
2161,"[0.0, 0.0, 0.0, 0.0, 0.0, 0.0, 0.0, 1.0, 0.0, 0.0, 0.0]","For example , the oil and gas price rises up , Like 3times than now ."
2162,"[0.0, 0.0, 0.0, 0.0, 0.0, 0.0, 0.0, 1.0, 0.0, 0.0, 0.0]",After that oil price rises up car company made electronic and sun light powered car .
2163,"[0.0, 0.0, 0.0, 0.0, 0.0, 0.0, 0.0, 1.0, 0.0, 0.0, 0.0]",Than what do you prefer to buy ?
2164,"[0.0, 0.0, 0.0, 0.0, 0.0, 0.0, 0.0, 1.0, 0.0, 0.0, 0.0]",New car or oil and gas powered cars .
2165,"[0.0, 0.0, 0.0, 0.0, 0.0, 0.0, 0.0, 1.0, 0.0, 0.0, 0.0]",Many people will buy the new powered cars .
2166,"[0.0, 0.0, 0.0, 0.0, 0.0, 0.0, 0.0, 1.0, 0.0, 0.0, 0.0]",Than there can be a plenty of cars on the streets like now days .
2167,"[0.0, 0.0, 0.0, 0.0, 0.0, 0.0, 0.0, 1.0, 0.0, 0.0, 0.0]",In my opinion I think there will be plenty of cars after 20years .
2168,"[0.0, 0.0, 0.0, 0.0, 0.0, 0.0, 0.0, 1.0, 0.0, 0.0, 0.0]",Because car will be develop very fast and scientist will make electronic car or sunlight powered cars .
2169,"[0.0, 0.0, 0.0, 0.0, 0.0, 0.0, 0.0, 1.0, 0.0, 0.0, 0.0]",And this will makes people to ride cars after 20years
2170,"[0.0, 0.0, 0.0, 0.0, 0.0, 0.0, 0.0, 0.0, 1.0, 0.0, 0.0]",Many people are worried about the quality of the educational system at schools and high schools .
2171,"[0.0, 0.0, 0.0, 0.0, 0.0, 0.0, 0.0, 0.0, 1.0, 0.0, 0.0]",One of the debts is if it is more important for students to understand ideas and concepts than it is for them to learn facts .
2172,"[0.0, 0.0, 0.0, 0.0, 0.0, 0.0, 0.0, 0.0, 1.0, 0.0, 0.0]",In my opinion it is more important for students to understand ideas and concepts than to learn facts .
2173,"[0.0, 0.0, 0.0, 0.0, 0.0, 0.0, 0.0, 0.0, 1.0, 0.0, 0.0]","Firstly , if you learn ideas or concepts you can apply them in more topics and you can understand other issues based in the same principle ."
2174,"[0.0, 0.0, 0.0, 0.0, 0.0, 0.0, 0.0, 0.0, 1.0, 0.0, 0.0]","On the other hand , if you learn only facts , you have a little knowledge about a few things or questions ."
2175,"[0.0, 0.0, 0.0, 0.0, 0.0, 0.0, 0.0, 0.0, 1.0, 0.0, 0.0]",Learning ideas does not mean only that the teacher tell you something and you believe it by heart .
2176,"[0.0, 0.0, 0.0, 0.0, 0.0, 0.0, 0.0, 0.0, 1.0, 0.0, 0.0]","However , it means that with this idea , you can develop more and apply them in facts ."
2177,"[0.0, 0.0, 0.0, 0.0, 0.0, 0.0, 0.0, 0.0, 1.0, 0.0, 0.0]","For instance , if someone teaches you the concepts of the physical mouvement of cars , you may transfer it to facts ."
2178,"[0.0, 0.0, 0.0, 0.0, 0.0, 0.0, 0.0, 0.0, 1.0, 0.0, 0.0]",You will be able to put a car in mouvement if you understood the basic principles .
2179,"[0.0, 0.0, 0.0, 0.0, 0.0, 0.0, 0.0, 0.0, 1.0, 0.0, 0.0]","If someone learns only facts , this person will not be able to think by herself because her knowledge and experience is not really wide ."
2180,"[0.0, 0.0, 0.0, 0.0, 0.0, 0.0, 0.0, 0.0, 1.0, 0.0, 0.0]","Therefore , I think that learning ideas and concepts may help the person to develop her mind and way of thinking ."
2181,"[0.0, 0.0, 0.0, 0.0, 0.0, 0.0, 0.0, 0.0, 1.0, 0.0, 0.0]","However , sometimes people can not understand the ideas or concepts without examples , so they prefer to learn only practical things ."
2182,"[0.0, 0.0, 0.0, 0.0, 0.0, 0.0, 0.0, 0.0, 1.0, 0.0, 0.0]","To summarize , in my opinion is always better to learn ideas or concepts than only facts because it will be more useful for the future career of students ."
2183,"[0.0, 0.0, 0.0, 0.0, 0.0, 0.0, 0.0, 0.0, 1.0, 0.0, 0.0]",The students will learn ideas or concepts about one topic but they can extend them to several fields .
2184,"[0.0, 0.0, 0.0, 0.0, 0.0, 0.0, 0.0, 0.0, 1.0, 0.0, 0.0]","Furthermore , they will develop their skills and improve their way of thinking by themselves ."
2185,"[0.0, 0.0, 0.0, 0.0, 0.0, 0.0, 0.0, 0.0, 0.0, 0.0, 1.0]",In my opinion it is more important to understand ideas about a lesson .
2186,"[0.0, 0.0, 0.0, 0.0, 0.0, 0.0, 0.0, 0.0, 0.0, 0.0, 1.0]",I believe that students has to focus on main concept of issues .
2187,"[0.0, 0.0, 0.0, 0.0, 0.0, 0.0, 0.0, 0.0, 0.0, 0.0, 1.0]","By learning facts , students can gain only the information ."
2188,"[0.0, 0.0, 0.0, 0.0, 0.0, 0.0, 0.0, 0.0, 0.0, 0.0, 1.0]","As for me , first reason for it that when students focus on the main idea of any lesson , they might improve the idea , and they can add different types of ideas to it ."
2189,"[0.0, 0.0, 0.0, 0.0, 0.0, 0.0, 0.0, 0.0, 0.0, 0.0, 1.0]",Because i think that younger brains usually open for creativity .
2190,"[0.0, 0.0, 0.0, 0.0, 0.0, 0.0, 0.0, 0.0, 0.0, 0.0, 1.0]","So if a teacher depends on teaching facts , he/she may cause lost of creativity in class ."
2191,"[0.0, 0.0, 0.0, 0.0, 0.0, 0.0, 0.0, 0.0, 0.0, 0.0, 1.0]","My second reason is , if students think about concepts and try to understand the idea , they can produce questions to teacher ."
2192,"[0.0, 0.0, 0.0, 0.0, 0.0, 0.0, 0.0, 0.0, 0.0, 0.0, 1.0]","So when they are asking these questions , they may understand and learn all the facts of lesson ."
2193,"[0.0, 0.0, 0.0, 0.0, 0.0, 0.0, 0.0, 0.0, 0.0, 0.0, 1.0]","In the class , if teachers pay attention on giving the main idea , they can help to raise in numbers of innovative individuals ."
2194,"[0.0, 0.0, 0.0, 0.0, 0.0, 0.0, 0.0, 0.0, 0.0, 0.0, 1.0]",Because i believe that any student who ask questions by using `` how '' and `` why '' can learn all structure .
2195,"[0.0, 0.0, 0.0, 0.0, 0.0, 0.0, 0.0, 0.0, 0.0, 0.0, 1.0]",When i was in high school we had two chemistry teachers in one year .
2196,"[0.0, 0.0, 0.0, 0.0, 0.0, 0.0, 0.0, 0.0, 0.0, 0.0, 1.0]",Our first chemistry teacher always asking elements properties whose students has to know from periodic table .
2197,"[0.0, 0.0, 0.0, 0.0, 0.0, 0.0, 0.0, 0.0, 0.0, 0.0, 1.0]",So we should know all elements from that table .
2198,"[0.0, 0.0, 0.0, 0.0, 0.0, 0.0, 0.0, 0.0, 0.0, 0.0, 1.0]",Otherwise we sure that we ca n't pass the lesson .
2199,"[0.0, 0.0, 0.0, 0.0, 0.0, 0.0, 0.0, 0.0, 0.0, 0.0, 1.0]","After his retirement , we had a new teacher for chemistry ."
2200,"[0.0, 0.0, 0.0, 0.0, 0.0, 0.0, 0.0, 0.0, 0.0, 0.0, 1.0]",She was always giving research homeworks in the class .
2201,"[0.0, 0.0, 0.0, 0.0, 0.0, 0.0, 0.0, 0.0, 0.0, 0.0, 1.0]",Also we had to prepare projects with our classmates .
2202,"[0.0, 0.0, 0.0, 0.0, 0.0, 0.0, 0.0, 0.0, 0.0, 0.0, 1.0]",After that we got start to understand that how chemistry and it 's theories works .
2203,"[0.0, 0.0, 0.0, 0.0, 0.0, 0.0, 0.0, 0.0, 0.0, 0.0, 1.0]",We were staying in library for hours .
2204,"[0.0, 0.0, 0.0, 0.0, 0.0, 0.0, 0.0, 0.0, 0.0, 0.0, 1.0]",We were reading articles about our homeworks .
