,label,sent
1044,"[0.0, 0.0, 0.0, 0.0, 0.0, 0.0, 1.0, 0.0, 0.0, 0.0, 0.0]","For example , if you are a doctor , you must know how new machines works too ."
1045,"[0.0, 0.0, 0.0, 0.0, 0.0, 0.0, 1.0, 0.0, 0.0, 0.0, 0.0]","If you know about the mechanism of human body , it 's meaningless ."
1046,"[0.0, 0.0, 0.0, 0.0, 0.0, 0.0, 1.0, 0.0, 0.0, 0.0, 0.0]",These days there are so many high tech machines or robots .
1047,"[0.0, 0.0, 0.0, 0.0, 0.0, 0.0, 1.0, 0.0, 0.0, 0.0, 0.0]",So doctors need to know high level physics too .
1048,"[0.0, 0.0, 0.0, 0.0, 0.0, 0.0, 1.0, 0.0, 0.0, 0.0, 0.0]","Overall , I think we should have broad knowledge of many academic subjects , as we can get wider view ."
1049,"[0.0, 0.0, 0.0, 0.0, 0.0, 0.0, 1.0, 0.0, 0.0, 0.0, 0.0]","Also , because a society is complicately connected ."
1050,"[0.0, 0.0, 0.0, 0.0, 0.0, 0.0, 0.0, 0.0, 0.0, 1.0, 0.0]",It is important for the students to understand the ideas and concepts and also to learn the facts about those ideas .
1051,"[0.0, 0.0, 0.0, 0.0, 0.0, 0.0, 0.0, 0.0, 0.0, 1.0, 0.0]",This is because only knowing the ideas does n't help them to understand the theories accurately .
1052,"[0.0, 0.0, 0.0, 0.0, 0.0, 0.0, 0.0, 0.0, 0.0, 1.0, 0.0]",The facts help them to get the live ideas of the theories they study .
1053,"[0.0, 0.0, 0.0, 0.0, 0.0, 0.0, 0.0, 0.0, 0.0, 1.0, 0.0]",For example if we consider the lightening and the sound which will occur during the time of rain gives them the idea that the sound is heard before that the light appears .
1054,"[0.0, 0.0, 0.0, 0.0, 0.0, 0.0, 0.0, 0.0, 0.0, 1.0, 0.0]",This is the idea that every student knows .
1055,"[0.0, 0.0, 0.0, 0.0, 0.0, 0.0, 0.0, 0.0, 0.0, 1.0, 0.0]",But the fact behind it is that the sound travels faster than the light so it happens as such .
1056,"[0.0, 0.0, 0.0, 0.0, 0.0, 0.0, 0.0, 0.0, 0.0, 1.0, 0.0]",So it is important for the students to know both the ideas and facts of any theory .
1057,"[0.0, 0.0, 0.0, 0.0, 0.0, 0.0, 0.0, 0.0, 0.0, 1.0, 0.0]",Just knowing the idea without the fact makes it waste as they could n't apply any where .
1058,"[0.0, 0.0, 0.0, 0.0, 0.0, 0.0, 0.0, 0.0, 0.0, 1.0, 0.0]","As experience is the best teacher , the facts they come across in their day to day life even helps them to understand some new ideas that they learn in their classes ."
1059,"[0.0, 0.0, 0.0, 0.0, 0.0, 0.0, 0.0, 0.0, 0.0, 1.0, 0.0]","If the student just understands the concept of the way of arranging all the parts of an automobile in the mechanics class and if he or she do n't know the facts based on that that is how to do it practically , it is not possible for them to arrange it in the real life time ."
1060,"[0.0, 0.0, 0.0, 0.0, 0.0, 0.0, 0.0, 0.0, 0.0, 1.0, 0.0]",In all the ways it is necessary for a student to know the ideas and concepts as well as to know the facts .
1061,"[0.0, 0.0, 0.0, 0.0, 0.0, 0.0, 0.0, 0.0, 0.0, 1.0, 0.0]",As I am a student doing a project now and as I see my friends who know only the ideas but not facts suffering because of their lack of knowledge based on it and I myself doing the project and answering the questions related to my project without any difficulty as I know the facts of the subject on which my project is based on .
1062,"[0.0, 0.0, 0.0, 0.0, 0.0, 0.0, 0.0, 0.0, 0.0, 1.0, 0.0]",So I can say that if the student knows both the ideas and facts then only he or she will come out with flying colours in their real life .
1063,"[0.0, 0.0, 0.0, 1.0, 0.0, 0.0, 0.0, 0.0, 0.0, 0.0, 0.0]","I agree with the statement , I think successful people try a lot more things , because of many reasons ."
1064,"[0.0, 0.0, 0.0, 1.0, 0.0, 0.0, 0.0, 0.0, 0.0, 0.0, 0.0]","The most important one is that they have nothing to worry about , because if you are successful , you are good in what you do , so you probably gain a lot of money for this ."
1065,"[0.0, 0.0, 0.0, 1.0, 0.0, 0.0, 0.0, 0.0, 0.0, 0.0, 0.0]",That means you do not have to worry about how you can feed your family for example .
1066,"[0.0, 0.0, 0.0, 1.0, 0.0, 0.0, 0.0, 0.0, 0.0, 0.0, 0.0]","Poor people mostly have to worry about that , which means they have not much freedom in what they can do ."
1067,"[0.0, 0.0, 0.0, 1.0, 0.0, 0.0, 0.0, 0.0, 0.0, 0.0, 0.0]","So , if you are successful and rich you have the opportunity to do the things you want and do not have to worry about financial problems , so you can risk a lot more things ."
1068,"[0.0, 0.0, 0.0, 1.0, 0.0, 0.0, 0.0, 0.0, 0.0, 0.0, 0.0]","Besides , successful people often need stress and drill , because they probably work a lot of time and put themself under pressure to motivate themself , so they always must do something to get the drill , which also forces them to take risks and look for challenges ."
1069,"[0.0, 0.0, 0.0, 1.0, 0.0, 0.0, 0.0, 0.0, 0.0, 0.0, 0.0]","I also think that those people are bored after a certain time if they are good in what they do , because they always work in this field ."
1070,"[0.0, 0.0, 0.0, 1.0, 0.0, 0.0, 0.0, 0.0, 0.0, 0.0, 0.0]","So they need not only a challenge , but also a change in their life ."
1071,"[0.0, 0.0, 0.0, 1.0, 0.0, 0.0, 0.0, 0.0, 0.0, 0.0, 0.0]","This is , of course , something , that fits for everyone ."
1072,"[0.0, 0.0, 0.0, 1.0, 0.0, 0.0, 0.0, 0.0, 0.0, 0.0, 0.0]","Everybody wants to have a change when he does the same thing the whole day , even if he is good in this ."
1073,"[0.0, 0.0, 0.0, 1.0, 0.0, 0.0, 0.0, 0.0, 0.0, 0.0, 0.0]","But , as I already mentioned , e.g. poor people do not have the possibility to decide whether they want to do this job or take any risks with stock exchanges or whatever ."
1074,"[0.0, 0.0, 0.0, 1.0, 0.0, 0.0, 0.0, 0.0, 0.0, 0.0, 0.0]","To sum up , I would say , successful people are not the onlyones , which rather try new thing than do what they always do , but in contrast to the others they have the possibility to do so ."
1075,"[0.0, 0.0, 0.0, 0.0, 0.0, 0.0, 0.0, 0.0, 0.0, 1.0, 0.0]",SUCCESSFUL the word by itself describes people who does things taking risks I strongly agree that successful people certainly must have done things at risk rather than only doing what they already known I can support my statement with a couple of examples for instance Sunitha and Kaliana Chawia the great two indians would certainly not be noticed in the Indian history as they have been the two only Indian women exploring into space if they had a thought of learning underneath and excelling in what they knew they might have certainly not been known to the world one can only encell in his knowledge by improving his own personal experiences but exploring out with risk will certainly find a way to him for succes All successful people should or might have certainly taken risk at one point or the other in the journey of success without out which it certainly be impossible .
1076,"[0.0, 0.0, 0.0, 0.0, 0.0, 0.0, 0.0, 0.0, 0.0, 1.0, 0.0]",Trying for new things will enable one self in discovering things and bring him to the stage of success .
1077,"[0.0, 0.0, 0.0, 0.0, 0.0, 0.0, 0.0, 0.0, 0.0, 1.0, 0.0]",Trying new things also makes oneself unique in the world and certainly they would have pride and a meaningful life lived .
1078,"[0.0, 0.0, 0.0, 0.0, 0.0, 0.0, 0.0, 0.0, 0.0, 1.0, 0.0]",successful comes out primarily from the scientist experiment or invention .
1079,"[0.0, 0.0, 0.0, 0.0, 0.0, 0.0, 0.0, 0.0, 0.0, 1.0, 0.0]",Yes certainly the scientist without a risk would not have been successful with his work any individual to be successful should be dare enough to face the new aspects and try new things then he would certainly not miss the step of success .
1080,"[0.0, 0.0, 0.0, 0.0, 0.0, 0.0, 0.0, 0.0, 0.0, 1.0, 0.0]",one can not have a satisfaction in his so called success without implementing certain new things if not that could only be for his self assessment .
1081,"[0.0, 0.0, 0.0, 0.0, 0.0, 0.0, 0.0, 0.0, 0.0, 1.0, 0.0]",Successful people like George bush and Abdul kalam the presidents of America and India are known for there successful life they have tried upon new amendments upon risk and could discover things .
1082,"[0.0, 0.0, 0.0, 0.0, 0.0, 0.0, 0.0, 0.0, 0.0, 1.0, 0.0]",Every individual is not all perfect enough one can make themselves perfect by doing things so certainly successful people try new things and take risks rather than do what they already knew and always put their heads high and taking risks will be the only aspect to be successful .
1083,"[0.0, 1.0, 0.0, 0.0, 0.0, 0.0, 0.0, 0.0, 0.0, 0.0, 0.0]",I disagree with this point of view .
1084,"[0.0, 1.0, 0.0, 0.0, 0.0, 0.0, 0.0, 0.0, 0.0, 0.0, 0.0]","Nowadays with the fast development in medical field , social environment and the advanced concept towards the good old days , more and more older people are enjoying the pleasure of the daily life and the proportion of older ones keep on rising in recent years ."
1085,"[0.0, 1.0, 0.0, 0.0, 0.0, 0.0, 0.0, 0.0, 0.0, 0.0, 0.0]",Older people as well as young people are enjoying the improving life .
1086,"[0.0, 1.0, 0.0, 0.0, 0.0, 0.0, 0.0, 0.0, 0.0, 0.0, 0.0]","First , I think older people have more leisure than young people ."
1087,"[0.0, 1.0, 0.0, 0.0, 0.0, 0.0, 0.0, 0.0, 0.0, 0.0, 0.0]","Young people have to struggling to get enough money to maintain a life in the daytime and go on to study in the night colleges and other training system , which provide them with the technics necessary for their work ."
1088,"[0.0, 1.0, 0.0, 0.0, 0.0, 0.0, 0.0, 0.0, 0.0, 0.0, 0.0]","In contrast to them , old people do n't need to go to the company everyday to strive for money due to the funds supplied by the government and they do n't need to be punished by bosses for not finishing the work properly ."
1089,"[0.0, 1.0, 0.0, 0.0, 0.0, 0.0, 0.0, 0.0, 0.0, 0.0, 0.0]","What they need to do is just to lie in the sofa , watching TV or go to meet the former companions and call on at friends ' houses ."
1090,"[0.0, 1.0, 0.0, 0.0, 0.0, 0.0, 0.0, 0.0, 0.0, 0.0, 0.0]",What a wonderful life !
1091,"[0.0, 1.0, 0.0, 0.0, 0.0, 0.0, 0.0, 0.0, 0.0, 0.0, 0.0]","Second , older people gain happiness by thinking about what they have achieved during the adult time ."
1092,"[0.0, 1.0, 0.0, 0.0, 0.0, 0.0, 0.0, 0.0, 0.0, 0.0, 0.0]",But the young have no time to consider this and they are experiencing failure everyday .
1093,"[0.0, 1.0, 0.0, 0.0, 0.0, 0.0, 0.0, 0.0, 0.0, 0.0, 0.0]","Therefore , they are surrounded by pains , sorrows and any other unpleasant things , which constantly appear ."
1094,"[0.0, 1.0, 0.0, 0.0, 0.0, 0.0, 0.0, 0.0, 0.0, 0.0, 0.0]","The older have no risk to compete with others , leaving the young people to be engaged in the competitive world ."
1095,"[0.0, 1.0, 0.0, 0.0, 0.0, 0.0, 0.0, 0.0, 0.0, 0.0, 0.0]","Last but not least , the old ones enjoying the care given by their sons or daughters ."
1096,"[0.0, 1.0, 0.0, 0.0, 0.0, 0.0, 0.0, 0.0, 0.0, 0.0, 0.0]","In China , every child , when growing up , must commit the responsibility to look after their parents ."
1097,"[0.0, 1.0, 0.0, 0.0, 0.0, 0.0, 0.0, 0.0, 0.0, 0.0, 0.0]","Their children will bring money , fruit or other wonderful things to the old but they themselves have to spend time teaching their own little children ."
1098,"[0.0, 1.0, 0.0, 0.0, 0.0, 0.0, 0.0, 0.0, 0.0, 0.0, 0.0]",Generally older people enjoy almost everything given in the old days .
1099,"[0.0, 1.0, 0.0, 0.0, 0.0, 0.0, 0.0, 0.0, 0.0, 0.0, 0.0]","As the whole environment is improving rapidly , More and more older people will realize what an excellent life we have received ."
1100,"[0.0, 0.0, 0.0, 0.0, 0.0, 0.0, 1.0, 0.0, 0.0, 0.0, 0.0]","Certainly , these days it is said young people do not give enough time to helping their communities ."
1101,"[0.0, 0.0, 0.0, 0.0, 0.0, 0.0, 1.0, 0.0, 0.0, 0.0, 0.0]","In fact , it might be decreasing time that young people help their communities little by little ."
1102,"[0.0, 0.0, 0.0, 0.0, 0.0, 0.0, 1.0, 0.0, 0.0, 0.0, 0.0]",But they still give enough time to helping Thier communities .
1103,"[0.0, 0.0, 0.0, 0.0, 0.0, 0.0, 1.0, 0.0, 0.0, 0.0, 0.0]",I disagree that young people nowadays do not give enough time to helping their communities .
1104,"[0.0, 0.0, 0.0, 0.0, 0.0, 0.0, 1.0, 0.0, 0.0, 0.0, 0.0]",The primary reason is that a lot of young people work for communities .
1105,"[0.0, 0.0, 0.0, 0.0, 0.0, 0.0, 1.0, 0.0, 0.0, 0.0, 0.0]","Perhaps the best example to illustrate this point is that where I live , in Japan , there are farmers ."
1106,"[0.0, 0.0, 0.0, 0.0, 0.0, 0.0, 1.0, 0.0, 0.0, 0.0, 0.0]",Some elder people do not have the person who succeed in them .
1107,"[0.0, 0.0, 0.0, 0.0, 0.0, 0.0, 1.0, 0.0, 0.0, 0.0, 0.0]",So it must be difficult for them to keep on working .
1108,"[0.0, 0.0, 0.0, 0.0, 0.0, 0.0, 1.0, 0.0, 0.0, 0.0, 0.0]",But young people like students of university or community college helps farmers a lot .
1109,"[0.0, 0.0, 0.0, 0.0, 0.0, 0.0, 1.0, 0.0, 0.0, 0.0, 0.0]","Second , young people help the elder people in their houses ."
1110,"[0.0, 0.0, 0.0, 0.0, 0.0, 0.0, 1.0, 0.0, 0.0, 0.0, 0.0]",There are a lot of elder people who can not do things by him or herself in Japan .
1111,"[0.0, 0.0, 0.0, 0.0, 0.0, 0.0, 1.0, 0.0, 0.0, 0.0, 0.0]","The example of this is that Many young people helps elder peoples in their houses and also in the ROUVIN home , which is the home take caring for elder people ."
1112,"[0.0, 0.0, 0.0, 0.0, 0.0, 0.0, 1.0, 0.0, 0.0, 0.0, 0.0]",Young people helps them to go to the rest room or to clear them up with hot water or to make them eat easily .
1113,"[0.0, 0.0, 0.0, 0.0, 0.0, 0.0, 1.0, 0.0, 0.0, 0.0, 0.0]","Considering the above factors , I disagree that young people nowadays do not give enough time to helping their communities ."
1114,"[0.0, 0.0, 0.0, 0.0, 0.0, 0.0, 0.0, 0.0, 1.0, 0.0, 0.0]","In my personal opinion I am disagree with the question , because if you travel in a group you need too go to the same place that the other people of the group want ."
1115,"[0.0, 0.0, 0.0, 0.0, 0.0, 0.0, 0.0, 0.0, 1.0, 0.0, 0.0]","Maybe if the group is integrated by people that I know , is fine , because I could have the thrust to said if something or some place dont like me , but if the group is integrated for people that I do not know I prefer to travel just with one friend or one sister because we could go to any place where we want and when we can ."
1116,"[0.0, 0.0, 0.0, 0.0, 0.0, 0.0, 0.0, 0.0, 1.0, 0.0, 0.0]",The idea of have a tour guide is good because we can know a lot of places and things without the necessity of are asking all the time to the people around about the places to visit in the city .
1117,"[0.0, 0.0, 0.0, 0.0, 0.0, 0.0, 0.0, 0.0, 1.0, 0.0, 0.0]","In other hands if you have a tour guide the trip will be more enjoyable because the tour guide give you all the information necessary that you need to enjoy your stance in the place or city , maybe the cost that you need to pay to the tour guide will be expensive but will be more expensive go from one place to another without know in reality that you want ."
1118,"[0.0, 0.0, 0.0, 0.0, 0.0, 0.0, 0.0, 0.0, 1.0, 0.0, 0.0]",I think that in some cases you need a person who lead you and help you in your trip .
1119,"[0.0, 0.0, 0.0, 0.0, 0.0, 0.0, 0.0, 0.0, 1.0, 0.0, 0.0]",For example in a museum is good that you have a person who explain you about the exposition get the best benefit and know the hole place .
1120,"[0.0, 0.0, 0.0, 0.0, 0.0, 0.0, 0.0, 0.0, 1.0, 0.0, 0.0]","In my personal experience last year I traveled to Guanajuato in a group integrated for friends , and it was a great experience ."
1121,"[0.0, 0.0, 0.0, 0.0, 0.0, 0.0, 0.0, 0.0, 1.0, 0.0, 0.0]","We did not have a tour guide but before the trip we made sure of know exactly what places were available to visit , we looked for the cost of hotels and the typical things to do in that city searching by internet and the result was a really good trip and we dont need to pay a tour guide and we salved money to spend in other things ."
1122,"[1.0, 0.0, 0.0, 0.0, 0.0, 0.0, 0.0, 0.0, 0.0, 0.0, 0.0]",I disagree with the statement that say `` it is more important for student to understand ideas and concepts than it is for them to learn facts '' because of many reasons .
1123,"[1.0, 0.0, 0.0, 0.0, 0.0, 0.0, 0.0, 0.0, 0.0, 0.0, 0.0]","First of all , they will learn more about the facts because it is real and they will believe it so it would help them more and more ."
1124,"[1.0, 0.0, 0.0, 0.0, 0.0, 0.0, 0.0, 0.0, 0.0, 0.0, 0.0]",In addition the ideas will not help them because they can forget them quickly and it could be wrong .
1125,"[1.0, 0.0, 0.0, 0.0, 0.0, 0.0, 0.0, 0.0, 0.0, 0.0, 0.0]","Second , it would help them it their life and give them more experience and lesions ."
1126,"[1.0, 0.0, 0.0, 0.0, 0.0, 0.0, 0.0, 0.0, 0.0, 0.0, 0.0]",Such as if anyone of the students had strange question maybe he had learn from that facts clot of information that would help him to solve it .
1127,"[1.0, 0.0, 0.0, 0.0, 0.0, 0.0, 0.0, 0.0, 0.0, 0.0, 0.0]","Third , they will learn about new things that they have not know about it ."
1128,"[1.0, 0.0, 0.0, 0.0, 0.0, 0.0, 0.0, 0.0, 0.0, 0.0, 0.0]",Moreover it would get to the other generation .
1129,"[1.0, 0.0, 0.0, 0.0, 0.0, 0.0, 0.0, 0.0, 0.0, 0.0, 0.0]",So that facts would be inhertants for all generation and all of them can get what they want to know about .
1130,"[1.0, 0.0, 0.0, 0.0, 0.0, 0.0, 0.0, 0.0, 0.0, 0.0, 0.0]",Also that information that they get from the facts would make them more serious with this life .
1131,"[1.0, 0.0, 0.0, 0.0, 0.0, 0.0, 0.0, 0.0, 0.0, 0.0, 0.0]",In addition it would make people who were sleep to wake up and go to work because facts have many true and strange information .
1132,"[1.0, 0.0, 0.0, 0.0, 0.0, 0.0, 0.0, 0.0, 0.0, 0.0, 0.0]",In the end I see that the facts much better that the ideas because the ideas might be wrong and it will effect our society .
1133,"[1.0, 0.0, 0.0, 0.0, 0.0, 0.0, 0.0, 0.0, 0.0, 0.0, 0.0]","So , learn facts is much betters because all the people and scientise Kwon about it ."
1134,"[0.0, 0.0, 0.0, 0.0, 0.0, 0.0, 0.0, 1.0, 0.0, 0.0, 0.0]",I think that we will see fewer cars on the road in 20 years from now non .
1135,"[0.0, 0.0, 0.0, 0.0, 0.0, 0.0, 0.0, 1.0, 0.0, 0.0, 0.0]","Even though cars brought us many conveniences so far , together came many problems with cars ."
1136,"[0.0, 0.0, 0.0, 0.0, 0.0, 0.0, 0.0, 1.0, 0.0, 0.0, 0.0]",They have been polluting the environments ; are exhausting natural resources ; and are not safer means of transportation than others .
1137,"[0.0, 0.0, 0.0, 0.0, 0.0, 0.0, 0.0, 1.0, 0.0, 0.0, 0.0]",So governments and companies are developing other transportation methods .
1138,"[0.0, 0.0, 0.0, 0.0, 0.0, 0.0, 0.0, 1.0, 0.0, 0.0, 0.0]",People will have to choose other means of moving than cars .
1139,"[0.0, 0.0, 0.0, 0.0, 0.0, 0.0, 0.0, 1.0, 0.0, 0.0, 0.0]","First , environments have been polluted by cars so badly that we have to take drastic measures to block more pollution before the situation gets worse beyond our capability ."
1140,"[0.0, 0.0, 0.0, 0.0, 0.0, 0.0, 0.0, 1.0, 0.0, 0.0, 0.0]","The experts say that the main source of air pollution is the consumption of fossil fuels , most of which comes from cars ."
1141,"[0.0, 0.0, 0.0, 0.0, 0.0, 0.0, 0.0, 1.0, 0.0, 0.0, 0.0]","Albeit car manufacturers ' efforts to cut down the level of emission , there are limits in diminishing the emission ."
1142,"[0.0, 0.0, 0.0, 0.0, 0.0, 0.0, 0.0, 1.0, 0.0, 0.0, 0.0]","Besides emitted gases , we are appalled at the noise from cars in the metropolitan downtown like Manhattan , New York ."
1143,"[0.0, 0.0, 0.0, 0.0, 0.0, 0.0, 0.0, 1.0, 0.0, 0.0, 0.0]",The only solution to be pursued should be fewer cars on the road .
1144,"[0.0, 0.0, 0.0, 0.0, 0.0, 0.0, 0.0, 1.0, 0.0, 0.0, 0.0]","Second , cars are called gas guzzlers because they consume so much gasoline ."
1145,"[0.0, 0.0, 0.0, 0.0, 0.0, 0.0, 0.0, 1.0, 0.0, 0.0, 0.0]",We are dependent on imported petroleum to run our cars .
1146,"[0.0, 0.0, 0.0, 0.0, 0.0, 0.0, 0.0, 1.0, 0.0, 0.0, 0.0]",The world is running out of petroleum in the not - so - far future .
1147,"[0.0, 0.0, 0.0, 0.0, 0.0, 0.0, 0.0, 1.0, 0.0, 0.0, 0.0]",We are at a critical time where we should curtail the use of cars .
1148,"[0.0, 0.0, 0.0, 0.0, 0.0, 0.0, 0.0, 1.0, 0.0, 0.0, 0.0]",There will be fewer cars if the oil prices skyrocket to the unbearable level .
1149,"[0.0, 0.0, 0.0, 0.0, 0.0, 0.0, 0.0, 1.0, 0.0, 0.0, 0.0]",Recently the prices went over more than 70 U.S. dollars a barrel .
1150,"[0.0, 0.0, 0.0, 0.0, 0.0, 0.0, 0.0, 1.0, 0.0, 0.0, 0.0]","Third , comparatively speaking , cars are not safer than other transportations , e.g. , buses , subways or trains ."
1151,"[0.0, 0.0, 0.0, 0.0, 0.0, 0.0, 0.0, 1.0, 0.0, 0.0, 0.0]","We are seeing so many casualties , amputees and disadvantaged from car accidents ."
1152,"[0.0, 0.0, 0.0, 0.0, 0.0, 0.0, 0.0, 1.0, 0.0, 0.0, 0.0]",Big mass transportations as safer movement tool between places will be preferred if we have more convenient mass transportation system .
1153,"[0.0, 0.0, 0.0, 0.0, 0.0, 0.0, 0.0, 1.0, 0.0, 0.0, 0.0]","Fourth , governments and companies are making various efforts to alternative transportations ."
1154,"[0.0, 0.0, 0.0, 0.0, 0.0, 0.0, 0.0, 1.0, 0.0, 0.0, 0.0]","For example , some companies are developing monorails , magnetic buoyant trains and high - speed electric trains ."
1155,"[0.0, 0.0, 0.0, 0.0, 0.0, 0.0, 0.0, 1.0, 0.0, 0.0, 0.0]","Monorails and the high - speed electric trains are already in operation between Seoul and Susan , Seoul and Kwangju in Kioea ."
1156,"[0.0, 0.0, 0.0, 0.0, 0.0, 0.0, 0.0, 1.0, 0.0, 0.0, 0.0]","Finally , it will be inevitable to give up on cars and turn to inexpensive , efficient vehicles in the future ."
1157,"[0.0, 0.0, 0.0, 0.0, 0.0, 0.0, 0.0, 1.0, 0.0, 0.0, 0.0]","Every one 's wise choice will save the Earth from dirty pollutants , free the country from dependency on imported oil , save many lives from tragic accidents and steer Korean toward more livable place ."
1158,"[0.0, 0.0, 0.0, 0.0, 0.0, 0.0, 0.0, 1.0, 0.0, 0.0, 0.0]",I disagree with the statement .
1159,"[0.0, 0.0, 0.0, 0.0, 0.0, 0.0, 0.0, 1.0, 0.0, 0.0, 0.0]",I think it is more important to focus o one specific subject which you are interested in and make it to your major skill .
1160,"[0.0, 0.0, 0.0, 0.0, 0.0, 0.0, 0.0, 1.0, 0.0, 0.0, 0.0]",You have to be the best on the subject you chose to gain success .
1161,"[0.0, 0.0, 0.0, 0.0, 0.0, 0.0, 0.0, 1.0, 0.0, 0.0, 0.0]",There are some examples to prove that one good specific subject is much helpful than broad knowledge of many academic subjects .
1162,"[0.0, 0.0, 0.0, 0.0, 0.0, 0.0, 0.0, 1.0, 0.0, 0.0, 0.0]",I have two uncles .
1163,"[0.0, 0.0, 0.0, 0.0, 0.0, 0.0, 0.0, 1.0, 0.0, 0.0, 0.0]",One was very good at business and another was just normally good at all the subjects .
1164,"[0.0, 0.0, 0.0, 0.0, 0.0, 0.0, 0.0, 1.0, 0.0, 0.0, 0.0]","Later on , an uncle who was very good at business chose his major skill to business and study deeply in business ."
1165,"[0.0, 0.0, 0.0, 0.0, 0.0, 0.0, 0.0, 1.0, 0.0, 0.0, 0.0]","Finally , he graduated very good business university and got a good position in a company ."
1166,"[0.0, 0.0, 0.0, 0.0, 0.0, 0.0, 0.0, 1.0, 0.0, 0.0, 0.0]","On the other hand , an uncle who was adequately good at all the subjects could n't make good choice to decide his major skill ."
1167,"[0.0, 0.0, 0.0, 0.0, 0.0, 0.0, 0.0, 1.0, 0.0, 0.0, 0.0]",He majored English but his English was not as good as those people who focuses on only English .
1168,"[0.0, 0.0, 0.0, 0.0, 0.0, 0.0, 0.0, 1.0, 0.0, 0.0, 0.0]","Therefore , he is now just a normal teacher in an English academy ."
1169,"[0.0, 0.0, 0.0, 0.0, 0.0, 0.0, 0.0, 1.0, 0.0, 0.0, 0.0]","As a result , the uncle who was good at only one specific subject seemed to have better life in the future ."
1170,"[0.0, 0.0, 0.0, 0.0, 0.0, 0.0, 0.0, 1.0, 0.0, 0.0, 0.0]",Another example is about a famous soccer player called Ronalda who is the best soccer player .
1171,"[0.0, 0.0, 0.0, 0.0, 0.0, 0.0, 0.0, 1.0, 0.0, 0.0, 0.0]",Ronalda is only good at soccer .
1172,"[0.0, 0.0, 0.0, 0.0, 0.0, 0.0, 0.0, 1.0, 0.0, 0.0, 0.0]","He is n't good at math , business and other things ."
1173,"[0.0, 0.0, 0.0, 0.0, 0.0, 0.0, 0.0, 1.0, 0.0, 0.0, 0.0]",He only practiced soccer from when he was young .
1174,"[0.0, 0.0, 0.0, 0.0, 0.0, 0.0, 0.0, 1.0, 0.0, 0.0, 0.0]","As he tried to do best on his job and focused on only soccer , he finally became best of it ."
1175,"[0.0, 0.0, 0.0, 0.0, 0.0, 0.0, 0.0, 1.0, 0.0, 0.0, 0.0]","Since he became best of well known sport , he got wealth and fame at the same time ."
1176,"[0.0, 0.0, 0.0, 0.0, 0.0, 0.0, 0.0, 1.0, 0.0, 0.0, 0.0]","If he tried to do other sports also , he surely wo n't be in the position he have in present time ."
1177,"[0.0, 0.0, 0.0, 0.0, 0.0, 0.0, 0.0, 1.0, 0.0, 0.0, 0.0]","As a result , to be a best on the subject you chose is very important ."
1178,"[0.0, 0.0, 0.0, 0.0, 0.0, 0.0, 0.0, 1.0, 0.0, 0.0, 0.0]",People will always look for the person who is best at their subject because they are sure the person is good at the subject .
1179,"[0.0, 0.0, 0.0, 0.0, 0.0, 0.0, 0.0, 1.0, 0.0, 0.0, 0.0]","When you become the best at a certain subject , you will gain wealth and fame at the same time as Ronalda did ."
1180,"[0.0, 0.0, 0.0, 0.0, 0.0, 0.0, 0.0, 1.0, 0.0, 0.0, 0.0]","Therefore , try to find something that interests you and do your best to make it your major ."
1181,"[0.0, 0.0, 0.0, 0.0, 1.0, 0.0, 0.0, 0.0, 0.0, 0.0, 0.0]",I agree with the statement that it is more important for students to understand ideas and concepts than to learn facts .
1182,"[0.0, 0.0, 0.0, 0.0, 1.0, 0.0, 0.0, 0.0, 0.0, 0.0, 0.0]",Learning is a process of memorizing a given context or material .
1183,"[0.0, 0.0, 0.0, 0.0, 1.0, 0.0, 0.0, 0.0, 0.0, 0.0, 0.0]","Thus is memorizing is usually a short  -  term , learning facts will be short term as well ."
