,label,sent
2089,"[0.0, 0.0, 0.0, 0.0, 0.0, 1.0, 0.0, 0.0, 0.0, 0.0, 0.0]",Please enjoy !
2090,"[0.0, 0.0, 0.0, 0.0, 0.0, 0.0, 0.0, 1.0, 0.0, 0.0, 0.0]",Have you ever try new things even though you knew risk is going to be extreme ?
2091,"[0.0, 0.0, 0.0, 0.0, 0.0, 0.0, 0.0, 1.0, 0.0, 0.0, 0.0]","There are a few successful people who take chances and try new things , Bill Gates and Steve Jobs ."
2092,"[0.0, 0.0, 0.0, 0.0, 0.0, 0.0, 0.0, 1.0, 0.0, 0.0, 0.0]",Two most renown rival in the world .
2093,"[0.0, 0.0, 0.0, 0.0, 0.0, 0.0, 0.0, 1.0, 0.0, 0.0, 0.0]",Therefore I agree with the topic .
2094,"[0.0, 0.0, 0.0, 0.0, 0.0, 0.0, 0.0, 1.0, 0.0, 0.0, 0.0]",First example is Bill Gates .
2095,"[0.0, 0.0, 0.0, 0.0, 0.0, 0.0, 0.0, 1.0, 0.0, 0.0, 0.0]","In 2000 , Sony 's PlayStation 2 was the best game instrument in the world ."
2096,"[0.0, 0.0, 0.0, 0.0, 0.0, 0.0, 0.0, 1.0, 0.0, 0.0, 0.0]",Any other companies did not even try to beat the power of PS2 .
2097,"[0.0, 0.0, 0.0, 0.0, 0.0, 0.0, 0.0, 1.0, 0.0, 0.0, 0.0]","However , there were one man who challenge Sony 's PS2 ."
2098,"[0.0, 0.0, 0.0, 0.0, 0.0, 0.0, 0.0, 1.0, 0.0, 0.0, 0.0]",Bill Gates demanded his workers to work on a game instrument .
2099,"[0.0, 0.0, 0.0, 0.0, 0.0, 0.0, 0.0, 1.0, 0.0, 0.0, 0.0]","And eventually , he created X - box ."
2100,"[0.0, 0.0, 0.0, 0.0, 0.0, 0.0, 0.0, 1.0, 0.0, 0.0, 0.0]",He knew that risk would be gigantic enough to shut down his company for a while .
2101,"[0.0, 0.0, 0.0, 0.0, 0.0, 0.0, 0.0, 1.0, 0.0, 0.0, 0.0]","Despite of risk , his Microsoft jumped into a game industry ."
2102,"[0.0, 0.0, 0.0, 0.0, 0.0, 0.0, 0.0, 1.0, 0.0, 0.0, 0.0]","In 2003 , Microsoft made Halo2 , which is considered as the greatest game of all time ."
2103,"[0.0, 0.0, 0.0, 0.0, 0.0, 0.0, 0.0, 1.0, 0.0, 0.0, 0.0]","Second example is Steve Jobs , the CEO of Apple inc ."
2104,"[0.0, 0.0, 0.0, 0.0, 0.0, 0.0, 0.0, 1.0, 0.0, 0.0, 0.0]","In San Fransisco , California , the MP3 companies were amazed by sudden appearance of iPod , which can hold up to 1,000 songs ."
2105,"[0.0, 0.0, 0.0, 0.0, 0.0, 0.0, 0.0, 1.0, 0.0, 0.0, 0.0]","Because Apple was a computer - making company , the other companies were surely surprized ."
2106,"[0.0, 0.0, 0.0, 0.0, 0.0, 0.0, 0.0, 1.0, 0.0, 0.0, 0.0]","According to Steve Job 's biography , icon , he knew the risk was literally going to tear his company apart because of its financial problem ."
2107,"[0.0, 0.0, 0.0, 0.0, 0.0, 0.0, 0.0, 1.0, 0.0, 0.0, 0.0]","Hw also knew that if he successes , it is going to resurrect Apple ."
2108,"[0.0, 0.0, 0.0, 0.0, 0.0, 0.0, 0.0, 1.0, 0.0, 0.0, 0.0]","As you all know , iPod is success ."
2109,"[0.0, 0.0, 0.0, 0.0, 0.0, 0.0, 0.0, 1.0, 0.0, 0.0, 0.0]","There are a lot of successful people in the world , but a few try new things and willing to take chances rather than only doing what they already know how to do well ."
2110,"[0.0, 0.0, 0.0, 0.0, 0.0, 0.0, 0.0, 1.0, 0.0, 0.0, 0.0]",Bill Gates success gaming industry while Steve Jobs dominated a field of MP3 .
2111,"[0.0, 0.0, 0.0, 0.0, 0.0, 0.0, 0.0, 1.0, 0.0, 0.0, 0.0]",There is no doubt in my mind that successful people try new things .
2112,"[0.0, 0.0, 0.0, 0.0, 0.0, 0.0, 0.0, 0.0, 1.0, 0.0, 0.0]","In many of country the products seem much better than they really are , because the company need obtain the money who was used in the production of the product and obtain the garance of their seld ."
2113,"[0.0, 0.0, 0.0, 0.0, 0.0, 0.0, 0.0, 0.0, 1.0, 0.0, 0.0]","The cost the product is determined by the materials that was used in the build , of the instruments uses in the company ."
2114,"[0.0, 0.0, 0.0, 0.0, 0.0, 0.0, 0.0, 0.0, 1.0, 0.0, 0.0]",other important point that determined the real cost of the products is the pay of the people that working in the company .
2115,"[0.0, 0.0, 0.0, 0.0, 0.0, 0.0, 0.0, 0.0, 1.0, 0.0, 0.0]","In the past year , the cost of the national products has been increasing because they are compar whit the international products for example cars or dress make in Asia when the material are more chip , for this reason a disagree with that the most products seem much better than they really are ."
2116,"[0.0, 0.0, 0.0, 0.0, 0.0, 0.0, 0.0, 0.0, 1.0, 0.0, 0.0]",But the government have created the specif rules that premiated decrease the deferents in the price of the international and national products
2117,"[0.0, 0.0, 0.0, 1.0, 0.0, 0.0, 0.0, 0.0, 0.0, 0.0, 0.0]",In my opinion most of the young people enjoy life more than older people do .
2118,"[0.0, 0.0, 0.0, 1.0, 0.0, 0.0, 0.0, 0.0, 0.0, 0.0, 0.0]",Most young people are free in thinking and do not worry about their future as much as older people .
2119,"[0.0, 0.0, 0.0, 1.0, 0.0, 0.0, 0.0, 0.0, 0.0, 0.0, 0.0]","They just live their life as it comes and enjoy every minute , while playing with other kids ."
2120,"[0.0, 0.0, 0.0, 1.0, 0.0, 0.0, 0.0, 0.0, 0.0, 0.0, 0.0]","Older people , on the other hand , mostly worry much about their future or the future of their kids and it is hard for them not to think of the future and the dangerous sites of what their actions ."
2121,"[0.0, 0.0, 0.0, 1.0, 0.0, 0.0, 0.0, 0.0, 0.0, 0.0, 0.0]",They worry so much about a point that they can not just enjoy life and the stuff they do .
2122,"[0.0, 0.0, 0.0, 1.0, 0.0, 0.0, 0.0, 0.0, 0.0, 0.0, 0.0]","Because of their background and the bad things that might have happened in their past , they see new situations from an different ankle , and avoid them , instead of improving new things and new ways of life ."
2123,"[0.0, 0.0, 0.0, 1.0, 0.0, 0.0, 0.0, 0.0, 0.0, 0.0, 0.0]","There are many problems , such as money , job , or the comments of other people , that young people do not care about , because someone else ( mostly their parents ) worry for them ."
2124,"[0.0, 0.0, 0.0, 1.0, 0.0, 0.0, 0.0, 0.0, 0.0, 0.0, 0.0]","Living in a society does involve a lot of difficulties , that young people When there is someone they like , they play together , even if there are different barriers like a different language ."
2125,"[0.0, 0.0, 0.0, 1.0, 0.0, 0.0, 0.0, 0.0, 0.0, 0.0, 0.0]","I think young people are more open to new things and new people , which is an important fact of enjoying life ."
2126,"[0.0, 0.0, 0.0, 1.0, 0.0, 0.0, 0.0, 0.0, 0.0, 0.0, 0.0]",But not everyone is the same .
2127,"[0.0, 0.0, 0.0, 1.0, 0.0, 0.0, 0.0, 0.0, 0.0, 0.0, 0.0]","There are older people who do not fear any situation and enjoy their life to an high age , just like young children , are open to every new step in their life and to every new person ."
2128,"[0.0, 0.0, 0.0, 1.0, 0.0, 0.0, 0.0, 0.0, 0.0, 0.0, 0.0]","They do not miss any opportunity of exploring something new , wether it is skydiving , traveling to a new country far away , or playing a new sport with their grandchildren ."
2129,"[0.0, 0.0, 0.0, 1.0, 0.0, 0.0, 0.0, 0.0, 0.0, 0.0, 0.0]",But `` enjoying life '' has a lot of different sites and the variety of the word ` joy ' is differs from person to person .
2130,"[0.0, 0.0, 0.0, 1.0, 0.0, 0.0, 0.0, 0.0, 0.0, 0.0, 0.0]",Some people enjoy life by having a family and live a quiet life at their farm in the middle of nowhere .
2131,"[0.0, 0.0, 0.0, 1.0, 0.0, 0.0, 0.0, 0.0, 0.0, 0.0, 0.0]",Others like to live a `` starlike '' in Hollywood or any other big city .
2132,"[0.0, 0.0, 0.0, 1.0, 0.0, 0.0, 0.0, 0.0, 0.0, 0.0, 0.0]","Even other people enjoy their life , risking their life everyday , by exploring any new extremsport ."
2133,"[0.0, 0.0, 0.0, 1.0, 0.0, 0.0, 0.0, 0.0, 0.0, 0.0, 0.0]","Some people need a lot of money to enjoy their life , others do not ."
2134,"[0.0, 0.0, 0.0, 1.0, 0.0, 0.0, 0.0, 0.0, 0.0, 0.0, 0.0]",So the question is very difficult to answer .
2135,"[0.0, 0.0, 0.0, 1.0, 0.0, 0.0, 0.0, 0.0, 0.0, 0.0, 0.0]","But from my point of view and my young background , i think that most young people enjoy their life more than older people , just because of the fact that they are more open and do not worry about their future as much as older people do ."
2136,"[0.0, 0.0, 0.0, 0.0, 0.0, 0.0, 0.0, 0.0, 0.0, 1.0, 0.0]",No i donor agree with the statement .
2137,"[0.0, 0.0, 0.0, 0.0, 0.0, 0.0, 0.0, 0.0, 0.0, 1.0, 0.0]",Youngsters are now a days really looking active to spare time for helping their communities .
2138,"[0.0, 0.0, 0.0, 0.0, 0.0, 0.0, 0.0, 0.0, 0.0, 1.0, 0.0]","community may mean by area , by religion , by race and many ."
2139,"[0.0, 0.0, 0.0, 0.0, 0.0, 0.0, 0.0, 0.0, 0.0, 1.0, 0.0]",Now a days youngsters have been looking for helping their home countries in a big manner .
2140,"[0.0, 0.0, 0.0, 0.0, 0.0, 0.0, 0.0, 0.0, 0.0, 1.0, 0.0]",I have many reasons to support my statement .
2141,"[0.0, 0.0, 0.0, 0.0, 0.0, 0.0, 0.0, 0.0, 0.0, 1.0, 0.0]",In olden days youngsters used to work hard for themselves and their families .
2142,"[0.0, 0.0, 0.0, 0.0, 0.0, 0.0, 0.0, 0.0, 0.0, 1.0, 0.0]",But its different in the modern case .
2143,"[0.0, 0.0, 0.0, 0.0, 0.0, 0.0, 0.0, 0.0, 0.0, 1.0, 0.0]",youngsters are being in the front row of doing service to all of their communities .
2144,"[0.0, 0.0, 0.0, 0.0, 0.0, 0.0, 0.0, 0.0, 0.0, 1.0, 0.0]",They help them in all the fields .
2145,"[0.0, 0.0, 0.0, 0.0, 0.0, 0.0, 0.0, 0.0, 0.0, 1.0, 0.0]","Donating blood to the people in need , helping old people , ladies in all aspects ."
2146,"[0.0, 0.0, 0.0, 0.0, 0.0, 0.0, 0.0, 0.0, 0.0, 1.0, 0.0]","Students are conducting welfare programmes , encouraging poor students by giving scholarships , helping the flood affected people by joining the natural disaster schemes and many to tell ."
2147,"[0.0, 0.0, 0.0, 0.0, 0.0, 0.0, 0.0, 0.0, 0.0, 1.0, 0.0]",The young people who are working in corporate jobs having been sparing time on saturdays and sundays in serving the needy .
2148,"[0.0, 0.0, 0.0, 0.0, 0.0, 0.0, 0.0, 0.0, 0.0, 1.0, 0.0]",They are enjoying happiness of helping in such manner .
2149,"[0.0, 0.0, 0.0, 0.0, 0.0, 0.0, 0.0, 0.0, 0.0, 1.0, 0.0]",I had an example to support my statement .
2150,"[0.0, 0.0, 0.0, 0.0, 0.0, 0.0, 0.0, 0.0, 0.0, 1.0, 0.0]",The following example took in my native place Guntur .
2151,"[0.0, 0.0, 0.0, 0.0, 0.0, 0.0, 0.0, 0.0, 0.0, 1.0, 0.0]",A small boy who is affected with a viral fever named dengues fever is in need of blood as blood from his body has been completely going out .
2152,"[0.0, 0.0, 0.0, 0.0, 0.0, 0.0, 0.0, 0.0, 0.0, 1.0, 0.0]",So one student gave 2000 rs to that persons father and asked him to give an advertisement regarding the need of blood .
2153,"[0.0, 0.0, 0.0, 0.0, 0.0, 0.0, 0.0, 0.0, 0.0, 1.0, 0.0]",As my blood group too was the same i went to the hospital to donate .
2154,"[0.0, 0.0, 0.0, 0.0, 0.0, 0.0, 0.0, 0.0, 0.0, 1.0, 0.0]",By the time i went there were about 800 students who came there to donate .
2155,"[0.0, 0.0, 0.0, 0.0, 0.0, 0.0, 0.0, 0.0, 0.0, 1.0, 0.0]",The boy in need is not a brother or relative of anybody .
2156,"[0.0, 0.0, 0.0, 0.0, 0.0, 0.0, 0.0, 0.0, 0.0, 1.0, 0.0]",But all the students came there as they had the intention of helping people in their community .
2157,"[0.0, 0.0, 0.0, 0.0, 0.0, 0.0, 0.0, 0.0, 0.0, 1.0, 0.0]",Another best example for supporting my statement is the army of our country .
2158,"[0.0, 0.0, 0.0, 0.0, 0.0, 0.0, 0.0, 0.0, 0.0, 1.0, 0.0]",According to the records of 2005 our army contained 80 % of youngsters who were even ready to offer their lives for their mother land .
2159,"[0.0, 0.0, 0.0, 0.0, 0.0, 0.0, 0.0, 0.0, 0.0, 1.0, 0.0]",Finally i strongly stand by my word that young people of modern times are sparing more time for helping their communities .
2160,"[0.0, 0.0, 1.0, 0.0, 0.0, 0.0, 0.0, 0.0, 0.0, 0.0, 0.0]",Cars belong to the big progress in our industrialized period .
2161,"[0.0, 0.0, 1.0, 0.0, 0.0, 0.0, 0.0, 0.0, 0.0, 0.0, 0.0]","Nowadays , in industrialized countries , cars are really common and sometimes really helpful and useful during our daily life ."
2162,"[0.0, 0.0, 1.0, 0.0, 0.0, 0.0, 0.0, 0.0, 0.0, 0.0, 0.0]","But for many reasons people will have to use less cars , first because of the lack of petroleum in a coming soon future , then the effect on the environment caused by the pollution of cars and the growing of the population ."
2163,"[0.0, 0.0, 1.0, 0.0, 0.0, 0.0, 0.0, 0.0, 0.0, 0.0, 0.0]",The petroleum is becoming more and more rare and therefore really expensive .
2164,"[0.0, 0.0, 1.0, 0.0, 0.0, 0.0, 0.0, 0.0, 0.0, 0.0, 0.0]",It will become so much expensive that more and more people will have no choice that taking common transportation instead of individual cars .
2165,"[0.0, 0.0, 1.0, 0.0, 0.0, 0.0, 0.0, 0.0, 0.0, 0.0, 0.0]",We are also spoken about new fuels that can be used instead of petrol but I think it will be also expensive for the people .
2166,"[0.0, 0.0, 1.0, 0.0, 0.0, 0.0, 0.0, 0.0, 0.0, 0.0, 0.0]",For example a hydrogen car is a highly technological solution but as we are talking we are just in the prototype level .
2167,"[0.0, 0.0, 1.0, 0.0, 0.0, 0.0, 0.0, 0.0, 0.0, 0.0, 0.0]",Organical oil can be also an alternative solution but it will mean that we will need to have uncredible huge crop yields to feed all the cars which is impossible .
2168,"[0.0, 0.0, 1.0, 0.0, 0.0, 0.0, 0.0, 0.0, 0.0, 0.0, 0.0]",Another aspect which can decrease the number of car is the pollution .
2169,"[0.0, 0.0, 1.0, 0.0, 0.0, 0.0, 0.0, 0.0, 0.0, 0.0, 0.0]",All people know the bad effect created by a car for our atmosphere .
2170,"[0.0, 0.0, 1.0, 0.0, 0.0, 0.0, 0.0, 0.0, 0.0, 0.0, 0.0]",People are all the more aware of the problem that we can see in our period time the consequences of the pollution in the climate .
2171,"[0.0, 0.0, 1.0, 0.0, 0.0, 0.0, 0.0, 0.0, 0.0, 0.0, 0.0]",The climate is becoming warmer and we are more face to natural catastrophe caused by a strange behaviour of the weather .
2172,"[0.0, 0.0, 1.0, 0.0, 0.0, 0.0, 0.0, 0.0, 0.0, 0.0, 0.0]",People are sensibilize to the subject of the bad effect of some gaz emission in our atmosphere .
2173,"[0.0, 0.0, 1.0, 0.0, 0.0, 0.0, 0.0, 0.0, 0.0, 0.0, 0.0]",We will reach a time where people will had no choice that to leave their car if they want to prevent the earth from an ecological drama .
2174,"[0.0, 0.0, 1.0, 0.0, 0.0, 0.0, 0.0, 0.0, 0.0, 0.0, 0.0]",Finally the population on the earth is increasingly growing up .
2175,"[0.0, 0.0, 1.0, 0.0, 0.0, 0.0, 0.0, 0.0, 0.0, 0.0, 0.0]",We are know almost 6.5 billions .
2176,"[0.0, 0.0, 1.0, 0.0, 0.0, 0.0, 0.0, 0.0, 0.0, 0.0, 0.0]","Some crowded countries are becoming more and more industrialized , for instance India and China ."
2177,"[0.0, 0.0, 1.0, 0.0, 0.0, 0.0, 0.0, 0.0, 0.0, 0.0, 0.0]",There will be probably a problem of logistic if everybody has a car .
2178,"[0.0, 0.0, 1.0, 0.0, 0.0, 0.0, 0.0, 0.0, 0.0, 0.0, 0.0]","It will be impossible to drive , there will be too much traffic ."
2179,"[0.0, 0.0, 1.0, 0.0, 0.0, 0.0, 0.0, 0.0, 0.0, 0.0, 0.0]","People in this case should find another solution to move , to commute ."
2180,"[0.0, 0.0, 1.0, 0.0, 0.0, 0.0, 0.0, 0.0, 0.0, 0.0, 0.0]",We can conclude that in twenty years there will be fewer cars in use than today when we observe the problems we are faced todays with the numbers of car .
2181,"[0.0, 0.0, 1.0, 0.0, 0.0, 0.0, 0.0, 0.0, 0.0, 0.0, 0.0]",It will be obviously a cost for our confort but it will be totally beneficial for the future of our planet .
2182,"[0.0, 0.0, 0.0, 0.0, 0.0, 0.0, 0.0, 0.0, 0.0, 1.0, 0.0]",I agree with the statement that `` Young people enjoy life more than older people do '' .
2183,"[0.0, 0.0, 0.0, 0.0, 0.0, 0.0, 0.0, 0.0, 0.0, 1.0, 0.0]","I support the above statement because younger people have the capability , vitality and vigour to do things than what older people can do ."
2184,"[0.0, 0.0, 0.0, 0.0, 0.0, 0.0, 0.0, 0.0, 0.0, 1.0, 0.0]",I can explain this by following examples .
2185,"[0.0, 0.0, 0.0, 0.0, 0.0, 0.0, 0.0, 0.0, 0.0, 1.0, 0.0]","Firstly , considering the present situation of technological developments taking place and day by day the world market is being stormed by a variety of innovative gadgets ."
2186,"[0.0, 0.0, 0.0, 0.0, 0.0, 0.0, 0.0, 0.0, 0.0, 1.0, 0.0]",Younger people have the edge over older people for enjoying these products .
2187,"[0.0, 0.0, 0.0, 0.0, 0.0, 0.0, 0.0, 0.0, 0.0, 1.0, 0.0]",Young people have the strong inclination to use these products which the older people may not possess due loss in interests in the worldly pleasures .
2188,"[0.0, 0.0, 0.0, 0.0, 0.0, 0.0, 0.0, 0.0, 0.0, 1.0, 0.0]","Secondly , considering the examples of learning , younger people are exposed newer innovative ideas and newer discoveries being made ."
2189,"[0.0, 0.0, 0.0, 0.0, 0.0, 0.0, 0.0, 0.0, 0.0, 1.0, 0.0]",By learning these things they can come to a better understanding of the present situation of their society which ultimately leads them to create a better enjoyable life of their own .
2190,"[0.0, 0.0, 0.0, 0.0, 0.0, 0.0, 0.0, 0.0, 0.0, 1.0, 0.0]",Where as the older people may lack the interest of learning new things which may be due to their old age or due to a prejudiced feeling that they know everything .
2191,"[0.0, 0.0, 0.0, 0.0, 0.0, 0.0, 0.0, 0.0, 0.0, 1.0, 0.0]","Finally , considering the biological aspect younger people can do a lot of work than the older people can do ."
2192,"[0.0, 0.0, 0.0, 0.0, 0.0, 0.0, 0.0, 0.0, 0.0, 1.0, 0.0]",While doing the work of their interest young people can enjoy that work as the physically they can subject their body to stress .
2193,"[0.0, 0.0, 0.0, 0.0, 0.0, 0.0, 0.0, 0.0, 0.0, 1.0, 0.0]","Where as considering the old people , even they have interest to do some work the physical condition of their body may not cooperate for doing the work ."
2194,"[0.0, 0.0, 0.0, 0.0, 0.0, 0.0, 0.0, 0.0, 0.0, 1.0, 0.0]",In addition young people tend to be more healthy .
2195,"[0.0, 0.0, 0.0, 0.0, 0.0, 0.0, 0.0, 0.0, 0.0, 1.0, 0.0]","So , they can enjoy different types recopies whereas it is not possible in the case of older people who are more prone to health ailments ."
2196,"[0.0, 0.0, 0.0, 0.0, 0.0, 0.0, 0.0, 0.0, 0.0, 1.0, 0.0]",Considering the above stated three examples I think that I was able to justify my statement that `` younger people enjoy life more than older people do ''
2197,"[0.0, 0.0, 0.0, 0.0, 0.0, 0.0, 0.0, 1.0, 0.0, 0.0, 0.0]",I agree that most products may be shown better than real by advertisement .
2198,"[0.0, 0.0, 0.0, 0.0, 0.0, 0.0, 0.0, 1.0, 0.0, 0.0, 0.0]",People can not know about a product before using .
2199,"[0.0, 0.0, 0.0, 0.0, 0.0, 0.0, 0.0, 1.0, 0.0, 0.0, 0.0]",Advertisement is used to inform the products to costumer .
2200,"[0.0, 0.0, 0.0, 0.0, 0.0, 0.0, 0.0, 1.0, 0.0, 0.0, 0.0]",The reason to be made better is that advertisement not only presents useful and discriminated information but also makes to fantastic feature the products .
2201,"[0.0, 0.0, 0.0, 0.0, 0.0, 0.0, 0.0, 1.0, 0.0, 0.0, 0.0]","Firstly , advertisement has a goal to promote about the products ."
2202,"[0.0, 0.0, 0.0, 0.0, 0.0, 0.0, 0.0, 1.0, 0.0, 0.0, 0.0]",most companies invest a great deal of money for advertisement to sell their product in every year .
2203,"[0.0, 0.0, 0.0, 0.0, 0.0, 0.0, 0.0, 1.0, 0.0, 0.0, 0.0]","If the advertisement might not useful to sell the product , the company would n't pay the money for advertisement ."
2204,"[0.0, 0.0, 0.0, 0.0, 0.0, 0.0, 0.0, 1.0, 0.0, 0.0, 0.0]","Because of those reason , advertisement may effort to supply the strengthen of the products ."
2205,"[0.0, 0.0, 0.0, 0.0, 0.0, 0.0, 0.0, 1.0, 0.0, 0.0, 0.0]","For example , I had worked a company in my country , my company had advertised about our products on TV , radio , and newspaper ."
2206,"[0.0, 0.0, 0.0, 0.0, 0.0, 0.0, 0.0, 1.0, 0.0, 0.0, 0.0]","However , In the advertisement , the defection was not informed ."
2207,"[0.0, 0.0, 0.0, 0.0, 0.0, 0.0, 0.0, 1.0, 0.0, 0.0, 0.0]","Furthermore , in the advertisement , most products looks like more visible than real aspects ."
2208,"[0.0, 0.0, 0.0, 0.0, 0.0, 0.0, 0.0, 1.0, 0.0, 0.0, 0.0]",there are a lot of techniques In advertisement .
2209,"[0.0, 0.0, 0.0, 0.0, 0.0, 0.0, 0.0, 1.0, 0.0, 0.0, 0.0]","The skills are used to appeal to the costumer such as beautiful , fantastic , and strong ."
2210,"[0.0, 0.0, 0.0, 0.0, 0.0, 0.0, 0.0, 1.0, 0.0, 0.0, 0.0]","For example , although the car looks like a rocketing a car advertisement , that is not real ."
2211,"[0.0, 0.0, 0.0, 0.0, 0.0, 0.0, 0.0, 1.0, 0.0, 0.0, 0.0]","However , the product in the advertisement has a fantastical feature ."
2212,"[0.0, 0.0, 0.0, 0.0, 0.0, 0.0, 0.0, 1.0, 0.0, 0.0, 0.0]","As I mentioned above , the advertisement make a product much better than real product because the purpose is to sell the product , and to sell is imp"
2213,"[0.0, 1.0, 0.0, 0.0, 0.0, 0.0, 0.0, 0.0, 0.0, 0.0, 0.0]",Now there is a general delation that if it is better for people to have broad knowledge of many academic subjects or to specialize in one specific subject .
2214,"[0.0, 1.0, 0.0, 0.0, 0.0, 0.0, 0.0, 0.0, 0.0, 0.0, 0.0]",Different people have different ideas .
2215,"[0.0, 1.0, 0.0, 0.0, 0.0, 0.0, 0.0, 0.0, 0.0, 0.0, 0.0]","As far as I am concerned , I think that it is better to have broad knowledge of many academic ."
2216,"[0.0, 1.0, 0.0, 0.0, 0.0, 0.0, 0.0, 0.0, 0.0, 0.0, 0.0]","There are a lot of reasons suppuration my idea , but I would only explain some of them due to the limited time ."
2217,"[0.0, 1.0, 0.0, 0.0, 0.0, 0.0, 0.0, 0.0, 0.0, 0.0, 0.0]","To begin with , if people have broad knowledge of many academic subjects , it will be easier for them to find jobs ."
2218,"[0.0, 1.0, 0.0, 0.0, 0.0, 0.0, 0.0, 0.0, 0.0, 0.0, 0.0]","That is to say that if you study a large amount of subjects , you may gain job opportunities very quickly and chang job freely ."
2219,"[0.0, 1.0, 0.0, 0.0, 0.0, 0.0, 0.0, 0.0, 0.0, 0.0, 0.0]",A good example is the part - time job .
2220,"[0.0, 1.0, 0.0, 0.0, 0.0, 0.0, 0.0, 0.0, 0.0, 0.0, 0.0]","If you have lots of knowledges of many academic subjects , you know both English and Economics well , then there will be many jobs readily available for you ."
2221,"[0.0, 1.0, 0.0, 0.0, 0.0, 0.0, 0.0, 0.0, 0.0, 0.0, 0.0]","Working as a manager in a big company to show you economics skill during weekdays , you may teach English in a training school , standing in front of the blackboard , pronounce `` A.B.C '' ."
2222,"[0.0, 1.0, 0.0, 0.0, 0.0, 0.0, 0.0, 0.0, 0.0, 0.0, 0.0]","This experience will be extremely interesting for you , you must enjoy it very much ."
2223,"[0.0, 1.0, 0.0, 0.0, 0.0, 0.0, 0.0, 0.0, 0.0, 0.0, 0.0]",The second reason is that you may be more intelligent by studying many academic subjects .
2224,"[0.0, 1.0, 0.0, 0.0, 0.0, 0.0, 0.0, 0.0, 0.0, 0.0, 0.0]",A recent research has shown that people who learn knowledge in different areas will be more clever than those who only specialize in one specific subjects because these people 's idea managed to jump from one field to another field easily .
2225,"[0.0, 1.0, 0.0, 0.0, 0.0, 0.0, 0.0, 0.0, 0.0, 0.0, 0.0]","The last reasons , as well as the most interesting reason is that people who have broad knowledge of many academic subjects are more likely to be easygoing , in another word , they will develop better relationship with other people , in comparison with those who merely have knowledge in one specific subject ."
2226,"[0.0, 1.0, 0.0, 0.0, 0.0, 0.0, 0.0, 0.0, 0.0, 0.0, 0.0]","The reason is quite simple , these people can communicate with others well ."
2227,"[0.0, 1.0, 0.0, 0.0, 0.0, 0.0, 0.0, 0.0, 0.0, 0.0, 0.0]","For instance , if a person who learn some about history , as well as sport , it can be easily to make result these people are able to talk as well as chat with people who enjoy different interests ."
2228,"[0.0, 1.0, 0.0, 0.0, 0.0, 0.0, 0.0, 0.0, 0.0, 0.0, 0.0]","Therefore , from what I mentioned above , it is reasonable to get the conclusion that it is better to have broad knowledge of many academic subjects than to specialized in one specific subject ."
2229,"[0.0, 1.0, 0.0, 0.0, 0.0, 0.0, 0.0, 0.0, 0.0, 0.0, 0.0]","in my opinion , to agree or disgreewith it is a matter of balancing the pros and cons ."
2230,"[0.0, 1.0, 0.0, 0.0, 0.0, 0.0, 0.0, 0.0, 0.0, 0.0, 0.0]",because every thing or doing any thing has its advantages and disadvantages .
2231,"[0.0, 1.0, 0.0, 0.0, 0.0, 0.0, 0.0, 0.0, 0.0, 0.0, 0.0]",just like a coin has two coins .
2232,"[0.0, 1.0, 0.0, 0.0, 0.0, 0.0, 0.0, 0.0, 0.0, 0.0, 0.0]","for this title statement , many people think successful people try new things and take risks rather than only doing what they already know how to do it while other do not agree ."
2233,"[0.0, 1.0, 0.0, 0.0, 0.0, 0.0, 0.0, 0.0, 0.0, 0.0, 0.0]","For my personal perspective , i agree with this statement ."
2234,"[0.0, 1.0, 0.0, 0.0, 0.0, 0.0, 0.0, 0.0, 0.0, 0.0, 0.0]","from countless factors with influence my choice , there are three conspicuous reasons listed following ."
2235,"[0.0, 1.0, 0.0, 0.0, 0.0, 0.0, 0.0, 0.0, 0.0, 0.0, 0.0]",the most important benefit is that the person can gain experience which other people can not when one try new things and take risks .
2236,"[0.0, 1.0, 0.0, 0.0, 0.0, 0.0, 0.0, 0.0, 0.0, 0.0, 0.0]","both common sense and our experience have informed us that when can combine our knowledge with practice , and also make us know more about the things or risks ."
2237,"[0.0, 1.0, 0.0, 0.0, 0.0, 0.0, 0.0, 0.0, 0.0, 0.0, 0.0]",then we can do better next time .
2238,"[0.0, 1.0, 0.0, 0.0, 0.0, 0.0, 0.0, 0.0, 0.0, 0.0, 0.0]","For example , my father is a succesful businessman ."
2239,"[0.0, 1.0, 0.0, 0.0, 0.0, 0.0, 0.0, 0.0, 0.0, 0.0, 0.0]",he always tries new things .
2240,"[0.0, 1.0, 0.0, 0.0, 0.0, 0.0, 0.0, 0.0, 0.0, 0.0, 0.0]","about 10 years age , he tries to do something about seege project ."
2241,"[0.0, 1.0, 0.0, 0.0, 0.0, 0.0, 0.0, 0.0, 0.0, 0.0, 0.0]",he had no experience at that time .
2242,"[0.0, 1.0, 0.0, 0.0, 0.0, 0.0, 0.0, 0.0, 0.0, 0.0, 0.0]",but he said this project would be developed in the future .
2243,"[0.0, 1.0, 0.0, 0.0, 0.0, 0.0, 0.0, 0.0, 0.0, 0.0, 0.0]",so he worked hard on it alone .
