,label,sent
2084,"[0.0, 0.0, 0.0, 0.0, 0.0, 1.0, 0.0, 0.0, 0.0, 0.0, 0.0]",The most important brands have a great experience in working and they use all kind of machines or material they need .
2085,"[0.0, 0.0, 0.0, 0.0, 0.0, 1.0, 0.0, 0.0, 0.0, 0.0, 0.0]",In this capitalistic era intact there are many people that open an industry to selling a products .
2086,"[0.0, 0.0, 0.0, 0.0, 0.0, 1.0, 0.0, 0.0, 0.0, 0.0, 0.0]",To have a very low costs they use a material that is not good .
2087,"[0.0, 0.0, 0.0, 0.0, 0.0, 1.0, 0.0, 0.0, 0.0, 0.0, 0.0]",This is occurred for example in China where the prices of the products are very cheap .
2088,"[0.0, 0.0, 0.0, 0.0, 0.0, 1.0, 0.0, 0.0, 0.0, 0.0, 0.0]","I had a lot of experiences in buying a product that are not good as they are showed , for this reason I suggest to buy a very famous product !!"
2089,"[0.0, 0.0, 0.0, 0.0, 0.0, 0.0, 0.0, 0.0, 0.0, 0.0, 1.0]",The pace of the development in science and technology is hard to compare with any of the previous periods .
2090,"[0.0, 0.0, 0.0, 0.0, 0.0, 0.0, 0.0, 0.0, 0.0, 0.0, 1.0]","We witness a post - industrial revolution , or in other words we are transforming into a knowledge - society ."
2091,"[0.0, 0.0, 0.0, 0.0, 0.0, 0.0, 0.0, 0.0, 0.0, 0.0, 1.0]","With this great transformation , academic world is also reshaping its way of doing research ."
2092,"[0.0, 0.0, 0.0, 0.0, 0.0, 0.0, 0.0, 0.0, 0.0, 0.0, 1.0]",The number of the research areas are increasing and interactions among disciplines become more frequent .
2093,"[0.0, 0.0, 0.0, 0.0, 0.0, 0.0, 0.0, 0.0, 0.0, 0.0, 1.0]","In this context , a broad knowledge of many academic subjects will contribute much more to our scientific knowledge than to specialize in one specific subject ."
2094,"[0.0, 0.0, 0.0, 0.0, 0.0, 0.0, 0.0, 0.0, 0.0, 0.0, 1.0]","Specialization in one specific area is sometimes good for instance , in discovering a new medicine ."
2095,"[0.0, 0.0, 0.0, 0.0, 0.0, 0.0, 0.0, 0.0, 0.0, 0.0, 1.0]","But , there may be waiting a number of opportunities with a broad knowledge of academic subject ."
2096,"[0.0, 0.0, 0.0, 0.0, 0.0, 0.0, 0.0, 0.0, 0.0, 0.0, 1.0]","Therefore , in scientific research there is an increasing tendency to make inter - disciplinery studies ."
2097,"[0.0, 0.0, 0.0, 0.0, 0.0, 0.0, 0.0, 0.0, 0.0, 0.0, 1.0]","For example , economics and physics are rather different two subjects ."
2098,"[0.0, 0.0, 0.0, 0.0, 0.0, 0.0, 0.0, 0.0, 0.0, 0.0, 1.0]","But , scientists from these fields are arranging joint - congresses in order to find solutions to the problems of Theis fields ."
2099,"[0.0, 0.0, 0.0, 0.0, 0.0, 0.0, 0.0, 0.0, 0.0, 0.0, 1.0]",Biologist and sociologists are collaborating to understand the nature of the behaviors of animals living together like ants .
2100,"[0.0, 0.0, 0.0, 0.0, 0.0, 0.0, 0.0, 0.0, 0.0, 0.0, 1.0]",This kind of inter - disciplinery approach can open new doors for some critical inventions .
2101,"[0.0, 0.0, 0.0, 0.0, 0.0, 0.0, 0.0, 0.0, 0.0, 0.0, 1.0]",Using nano - technology for some vital heart problems saves a lot of peoples life or at least increase the quality of their life .
2102,"[0.0, 0.0, 0.0, 0.0, 0.0, 0.0, 0.0, 0.0, 0.0, 0.0, 1.0]","Finally , in a very rapidly developing enviroment of sciences , inter - disciplinery studies will bring a lot of sunrises to our lives ."
2103,"[0.0, 0.0, 0.0, 0.0, 0.0, 0.0, 0.0, 0.0, 0.0, 0.0, 1.0]","So , it is better to have a broad knowledge of academic subjects and education systems much revised with this approach ."
2104,"[0.0, 0.0, 0.0, 0.0, 0.0, 1.0, 0.0, 0.0, 0.0, 0.0, 0.0]","Nowadays since people are children there is a sort of competition for everything , for a footballmatch for example or for a running competition or for having a better marks at school ."
2105,"[0.0, 0.0, 0.0, 0.0, 0.0, 1.0, 0.0, 0.0, 0.0, 0.0, 0.0]",In this way a person always try to do the better of her so I think that people who can try always to win this competition in life can have the power to became a successful person because they love to risks and they 're proud when they try to pass their limit .
2106,"[0.0, 0.0, 0.0, 0.0, 0.0, 1.0, 0.0, 0.0, 0.0, 0.0, 0.0]",I think also that pass ownself limits means to make something that its bigger and more important than do a thing well known .
2107,"[0.0, 0.0, 0.0, 0.0, 0.0, 1.0, 0.0, 0.0, 0.0, 0.0, 0.0]",It 's easier to do well something that we known than create something new .
2108,"[0.0, 0.0, 0.0, 0.0, 0.0, 1.0, 0.0, 0.0, 0.0, 0.0, 0.0]","For example a normal artists can produce an academical paint well made , that it 's also armoniac and pleasant to see but it remains an exercise of the hand ."
2109,"[0.0, 0.0, 0.0, 0.0, 0.0, 1.0, 0.0, 0.0, 0.0, 0.0, 0.0]","Instead a successful people want to experiment new thecnics , new points of views ; new colors in order to really create something new that none had ever seen and in order to obtain this , the successful people have to risks , have to abandon all his own knowledge to adventure himself in another unknown world of the creation ."
2110,"[0.0, 0.0, 0.0, 0.0, 0.0, 1.0, 0.0, 0.0, 0.0, 0.0, 0.0]","At the end I agree with the statement also if often people who risks , ca n't reach success because of differences causes and on the other hand someone who had never tried to risks became a successful person because the raccomandation of some important people ."
2111,"[0.0, 0.0, 1.0, 0.0, 0.0, 0.0, 0.0, 0.0, 0.0, 0.0, 0.0]",It is sometimes in people mind that young people are more likely to enjoy the life more than older people .
2112,"[0.0, 0.0, 1.0, 0.0, 0.0, 0.0, 0.0, 0.0, 0.0, 0.0, 0.0]","Everybody has already heard a fifty years - old person saying : '' Oh , if only I was twenty , I would do these things ! '' or '' What can I do to go back when I was young ! ''"
2113,"[0.0, 0.0, 1.0, 0.0, 0.0, 0.0, 0.0, 0.0, 0.0, 0.0, 0.0]",.
2114,"[0.0, 0.0, 1.0, 0.0, 0.0, 0.0, 0.0, 0.0, 0.0, 0.0, 0.0]",But it is too easy to believe that older people or seniors does n't enjoy their life like young people .
2115,"[0.0, 0.0, 1.0, 0.0, 0.0, 0.0, 0.0, 0.0, 0.0, 0.0, 0.0]","Moreover , it will be easy to show that their life can be even greater than the one of a twenty years - old person ."
2116,"[0.0, 0.0, 1.0, 0.0, 0.0, 0.0, 0.0, 0.0, 0.0, 0.0, 0.0]",We will give some examples and headline the fact that enjoying life is just a question of point of view .
2117,"[0.0, 0.0, 1.0, 0.0, 0.0, 0.0, 0.0, 0.0, 0.0, 0.0, 0.0]","For a young person , enjoying life can be simpler because he is often healthier than an older person ."
2118,"[0.0, 0.0, 1.0, 0.0, 0.0, 0.0, 0.0, 0.0, 0.0, 0.0, 0.0]","So a young one can more easily practising sports , going out lately , etc . .."
2119,"[0.0, 0.0, 1.0, 0.0, 0.0, 0.0, 0.0, 0.0, 0.0, 0.0, 0.0]","For a student , life can be very nice , because of all the opportunities he is given to him , to do a lot of different and meet new people ."
2120,"[0.0, 0.0, 1.0, 0.0, 0.0, 0.0, 0.0, 0.0, 0.0, 0.0, 0.0]","But as he has only a few experience of life , he ca n't appreciate well enough things he does ."
2121,"[0.0, 0.0, 1.0, 0.0, 0.0, 0.0, 0.0, 0.0, 0.0, 0.0, 0.0]","In contrary , for an older person who have experience the world , people and life im general , it is easier to take more benefits and appreciate even more things he does ."
2122,"[0.0, 0.0, 1.0, 0.0, 0.0, 0.0, 0.0, 0.0, 0.0, 0.0, 0.0]","But young people are just beginning their life , so that willness of saying `` I 'm enjoying life '' could be seen as a way of do n't thinking to the future because he fears it ."
2123,"[0.0, 0.0, 1.0, 0.0, 0.0, 0.0, 0.0, 0.0, 0.0, 0.0, 0.0]","For a senior who have just finish their working life , it is easier to appreciate now a different way of living , without stress , and enjoying his family ."
2124,"[0.0, 0.0, 1.0, 0.0, 0.0, 0.0, 0.0, 0.0, 0.0, 0.0, 0.0]","In conclusion , being a young people does n't automatically imply to enjoy more the life than older people ."
2125,"[0.0, 0.0, 0.0, 0.0, 0.0, 0.0, 0.0, 0.0, 1.0, 0.0, 0.0]","Personally , I outgo to have broad knowledge of many academic subject because i am a person of open mind , for example in my personal case , i am student in chemical engineering but i am interesting in chemistry too , In fact In France people who study chemical engineering do not understand anything in chemistry subject , maybe it will be crazy but is true ."
2126,"[0.0, 0.0, 0.0, 0.0, 0.0, 0.0, 0.0, 0.0, 1.0, 0.0, 0.0]",I had made different internship in Peru and France and i saw this problem .
2127,"[0.0, 0.0, 0.0, 0.0, 0.0, 0.0, 0.0, 0.0, 1.0, 0.0, 0.0]",I .
2128,"[0.0, 0.0, 0.0, 0.0, 0.0, 0.0, 0.0, 0.0, 1.0, 0.0, 0.0]","These subjects were in chemistry and chemical engineering , i did not afraid because i think i have broad knowledge in both ."
2129,"[0.0, 0.0, 0.0, 0.0, 0.0, 0.0, 0.0, 0.0, 1.0, 0.0, 0.0]",During my studies at university i learned to work in specific and general subjects .
2130,"[0.0, 0.0, 0.0, 0.0, 0.0, 0.0, 0.0, 0.0, 1.0, 0.0, 0.0]",I got the capacity for working in both of them .
2131,"[0.0, 0.0, 0.0, 0.0, 0.0, 0.0, 0.0, 0.0, 1.0, 0.0, 0.0]","In fact i have a few knowledge in different domains like management work group , computer system , In my opinion it is very interesting to know a little of different subjects ."
2132,"[0.0, 0.0, 0.0, 0.0, 0.0, 0.0, 0.0, 0.0, 1.0, 0.0, 0.0]",The manners of companies are interested to recrate people who can work in different subjects because it could be more easy to give them different responsibility because they are more adapted to changed .
2133,"[0.0, 0.0, 0.0, 0.0, 0.0, 0.0, 0.0, 0.0, 1.0, 0.0, 0.0]",In this globalization world people have to have an open mind for getting more opportunities in the life work .
2134,"[0.0, 0.0, 0.0, 0.0, 0.0, 0.0, 0.0, 0.0, 1.0, 0.0, 0.0]",If people is specialize in one specific subject they wont understand the different ways to resolving a general problem .
2135,"[0.0, 0.0, 0.0, 0.0, 0.0, 0.0, 0.0, 0.0, 1.0, 0.0, 0.0]","finally , I think is a personal decision to have the knowledge in particular or many general subjects"
2136,"[1.0, 0.0, 0.0, 0.0, 0.0, 0.0, 0.0, 0.0, 0.0, 0.0, 0.0]",The provided topic states that `` young people enjoy life more than older people do '' .
2137,"[1.0, 0.0, 0.0, 0.0, 0.0, 0.0, 0.0, 0.0, 0.0, 0.0, 0.0]",I disagree with the statement as it is my opinion that older people enjoy life more than young people .
2138,"[1.0, 0.0, 0.0, 0.0, 0.0, 0.0, 0.0, 0.0, 0.0, 0.0, 0.0]","Nowadays , we live in a world that is economically driven and requires good planning and wise decision making ."
2139,"[1.0, 0.0, 0.0, 0.0, 0.0, 0.0, 0.0, 0.0, 0.0, 0.0, 0.0]","Due to their wide experiences in life , older people are able to plan wisely in order to enjoy their lives ."
2140,"[1.0, 0.0, 0.0, 0.0, 0.0, 0.0, 0.0, 0.0, 0.0, 0.0, 0.0]","For example , older people will plan their outings , vacations , activities , and events more effectively than young people ."
2141,"[1.0, 0.0, 0.0, 0.0, 0.0, 0.0, 0.0, 0.0, 0.0, 0.0, 0.0]","For a action , they plan where they wanted to go and what they wanted to see and how much the cost would be ."
2142,"[1.0, 0.0, 0.0, 0.0, 0.0, 0.0, 0.0, 0.0, 0.0, 0.0, 0.0]",This way they will enjoy all aspects of their vacation and not miss important events or sightings .
2143,"[1.0, 0.0, 0.0, 0.0, 0.0, 0.0, 0.0, 0.0, 0.0, 0.0, 0.0]","Whilst , if they went on a action , younger people would not plan as well and eventually miss out a lot of important activities and sightings ."
2144,"[1.0, 0.0, 0.0, 0.0, 0.0, 0.0, 0.0, 0.0, 0.0, 0.0, 0.0]","Consequently , with their good planning , older people would only spend mony on what they wanted to see and enjoy ."
2145,"[1.0, 0.0, 0.0, 0.0, 0.0, 0.0, 0.0, 0.0, 0.0, 0.0, 0.0]",Whilst younger people would run out of money and usually regret some of the things they did not see in their vacation .
2146,"[1.0, 0.0, 0.0, 0.0, 0.0, 0.0, 0.0, 0.0, 0.0, 0.0, 0.0]","In addition , older people would have more money to enjoy life with than younger people ."
2147,"[1.0, 0.0, 0.0, 0.0, 0.0, 0.0, 0.0, 0.0, 0.0, 0.0, 0.0]",Older people are more established in their careers and therefore more financially sound and actually save have saved their money to enjoy their lives at this stage .
2148,"[1.0, 0.0, 0.0, 0.0, 0.0, 0.0, 0.0, 0.0, 0.0, 0.0, 0.0]",Whilst younger people may not have as much money to enjoy life with as some of them may be in school or not employed .
2149,"[1.0, 0.0, 0.0, 0.0, 0.0, 0.0, 0.0, 0.0, 0.0, 0.0, 0.0]",Some of them may have not even thought of a career at this point in their lives .
2150,"[1.0, 0.0, 0.0, 0.0, 0.0, 0.0, 0.0, 0.0, 0.0, 0.0, 0.0]","On the other hand , there are always exceptions as there are younger people who do plan well , are established in their careers , and are financially well off ."
2151,"[1.0, 0.0, 0.0, 0.0, 0.0, 0.0, 0.0, 0.0, 0.0, 0.0, 0.0]","But generally speaking , due to their life experiences , older people plan well , established in their fields , and are financially more sound than younger people ."
2152,"[0.0, 0.0, 0.0, 0.0, 1.0, 0.0, 0.0, 0.0, 0.0, 0.0, 0.0]","While some may argue that learning facts may be the best way to impart education among students , I do not believe so ."
2153,"[0.0, 0.0, 0.0, 0.0, 1.0, 0.0, 0.0, 0.0, 0.0, 0.0, 0.0]",Learning core concepts and understanding ideas are important for a holistic learning experience .
2154,"[0.0, 0.0, 0.0, 0.0, 1.0, 0.0, 0.0, 0.0, 0.0, 0.0, 0.0]",In the following text I present my reasons for this belief and my contention that learning and understanding of ideas and concepts is in fact better than solely learning facts .
2155,"[0.0, 0.0, 0.0, 0.0, 1.0, 0.0, 0.0, 0.0, 0.0, 0.0, 0.0]","Firstly , learning ideas and concepts helps in clearer and a more thorough understanding of a topic ."
2156,"[0.0, 0.0, 0.0, 0.0, 1.0, 0.0, 0.0, 0.0, 0.0, 0.0, 0.0]",Stating facts in addition to this would serve as an example that makes it even clearer .
2157,"[0.0, 0.0, 0.0, 0.0, 1.0, 0.0, 0.0, 0.0, 0.0, 0.0, 0.0]",A thorough understanding of a topic helps in engendering a scientific mindset that encourages inquisitiveness and a pursuit to learn even more .
2158,"[0.0, 0.0, 0.0, 0.0, 1.0, 0.0, 0.0, 0.0, 0.0, 0.0, 0.0]","Secondly , facts are useless without knowledge ."
2159,"[0.0, 0.0, 0.0, 0.0, 1.0, 0.0, 0.0, 0.0, 0.0, 0.0, 0.0]","Facts might help in the development of a student 's memory , but they in no way impart true knowledge ."
2160,"[0.0, 0.0, 0.0, 0.0, 1.0, 0.0, 0.0, 0.0, 0.0, 0.0, 0.0]","Facts are information , while knowledge is what needs to be imparted to the students ."
2161,"[0.0, 0.0, 0.0, 0.0, 1.0, 0.0, 0.0, 0.0, 0.0, 0.0, 0.0]","Thirdly , ideas and concepts are the core fundamentals without which learning would be an incomplete experience ."
2162,"[0.0, 0.0, 0.0, 0.0, 1.0, 0.0, 0.0, 0.0, 0.0, 0.0, 0.0]",Merely scratching the surface by discussing facts and examples would be an injustice to the students .
2163,"[0.0, 0.0, 0.0, 0.0, 1.0, 0.0, 0.0, 0.0, 0.0, 0.0, 0.0]","Thirdly , a discussion of ideas and concepts brings out the knowledge a student already has and shares with his peers ."
2164,"[0.0, 0.0, 0.0, 0.0, 1.0, 0.0, 0.0, 0.0, 0.0, 0.0, 0.0]",Such a setting where ideas flow freely among students and professors paints the picture of an ideal educational environment that every student dreams of .
2165,"[0.0, 0.0, 0.0, 0.0, 1.0, 0.0, 0.0, 0.0, 0.0, 0.0, 0.0]","In addition , such an environment kindles students ' interest in the topic and makes them even more interested in it ."
2166,"[0.0, 0.0, 0.0, 0.0, 1.0, 0.0, 0.0, 0.0, 0.0, 0.0, 0.0]","Any student would be more interested in learning concepts and ideas and practically apply them than to merely memorize facts , which have little or no applicability in the real world ."
2167,"[0.0, 0.0, 0.0, 0.0, 1.0, 0.0, 0.0, 0.0, 0.0, 0.0, 0.0]","It needs to be realized that facts are complementary to the ideas and concepts that are tought , and they should be treated so They should be stated as examples for the purpose of clearer understanding of the topic of discussion ."
2168,"[0.0, 0.0, 0.0, 0.0, 1.0, 0.0, 0.0, 0.0, 0.0, 0.0, 0.0]","However , they should not be used in isolation as it would lead to an incomplete knowledge transfer between the teacher and the student ."
2169,"[0.0, 1.0, 0.0, 0.0, 0.0, 0.0, 0.0, 0.0, 0.0, 0.0, 0.0]",I agreed with the statement .
2170,"[0.0, 1.0, 0.0, 0.0, 0.0, 0.0, 0.0, 0.0, 0.0, 0.0, 0.0]",People who succeed try new things rather than doing what they have already know how to do well .
2171,"[0.0, 1.0, 0.0, 0.0, 0.0, 0.0, 0.0, 0.0, 0.0, 0.0, 0.0]",We will learn new things and gain some experience by trying new things .
2172,"[0.0, 1.0, 0.0, 0.0, 0.0, 0.0, 0.0, 0.0, 0.0, 0.0, 0.0]",These experience are precious .
2173,"[0.0, 1.0, 0.0, 0.0, 0.0, 0.0, 0.0, 0.0, 0.0, 0.0, 0.0]",We can only gain them when we tried !
2174,"[0.0, 1.0, 0.0, 0.0, 0.0, 0.0, 0.0, 0.0, 0.0, 0.0, 0.0]","And if it dose n't work or we are not satisfied with the result , we can keep on trying and trying until we are satisfied ."
2175,"[0.0, 1.0, 0.0, 0.0, 0.0, 0.0, 0.0, 0.0, 0.0, 0.0, 0.0]",I have heard of a phrase `` People who are successful find solutions to solve their problem and people who are in failure try to find reasons for their problems '' and I think this phrase really makes sense .
2176,"[0.0, 1.0, 0.0, 0.0, 0.0, 0.0, 0.0, 0.0, 0.0, 0.0, 0.0]",We should always find the solution to solve our problems rather than finding reasons for the problems .
2177,"[0.0, 1.0, 0.0, 0.0, 0.0, 0.0, 0.0, 0.0, 0.0, 0.0, 0.0]","For example , a man named Tony ."
2178,"[0.0, 1.0, 0.0, 0.0, 0.0, 0.0, 0.0, 0.0, 0.0, 0.0, 0.0]",He opened a bakery selling only toast and water .
2179,"[0.0, 1.0, 0.0, 0.0, 0.0, 0.0, 0.0, 0.0, 0.0, 0.0, 0.0]",Plain toast and water .
2180,"[0.0, 1.0, 0.0, 0.0, 0.0, 0.0, 0.0, 0.0, 0.0, 0.0, 0.0]",No one wants to come to his shop because there are only toast and water .
2181,"[0.0, 1.0, 0.0, 0.0, 0.0, 0.0, 0.0, 0.0, 0.0, 0.0, 0.0]",Suddenly he decided to try new things .
2182,"[0.0, 1.0, 0.0, 0.0, 0.0, 0.0, 0.0, 0.0, 0.0, 0.0, 0.0]","He decided to learn how to make bedels , milkshakes and a variety of cakes such as Tiramisu and chocolate cakes ."
2183,"[0.0, 1.0, 0.0, 0.0, 0.0, 0.0, 0.0, 0.0, 0.0, 0.0, 0.0]",He started to sell them after he have learned how to make them .
2184,"[0.0, 1.0, 0.0, 0.0, 0.0, 0.0, 0.0, 0.0, 0.0, 0.0, 0.0]",After a month he earned lots of money after selling all these snacks .
2185,"[0.0, 1.0, 0.0, 0.0, 0.0, 0.0, 0.0, 0.0, 0.0, 0.0, 0.0]",He became a successful businessman .
2186,"[0.0, 1.0, 0.0, 0.0, 0.0, 0.0, 0.0, 0.0, 0.0, 0.0, 0.0]",The reason why the man had became a successful businessman is that he tried new things .
2187,"[0.0, 1.0, 0.0, 0.0, 0.0, 0.0, 0.0, 0.0, 0.0, 0.0, 0.0]","And while he was trying , he also learned ."
2188,"[0.0, 1.0, 0.0, 0.0, 0.0, 0.0, 0.0, 0.0, 0.0, 0.0, 0.0]",I do n't think the man will become a successful businessman if he did not try and do things that he have already know how to do such as buying jam to put onto the toast or frying eggs .
2189,"[0.0, 1.0, 0.0, 0.0, 0.0, 0.0, 0.0, 0.0, 0.0, 0.0, 0.0]",These are just a piece of cake even a children from kindergarten can do all these things !
2190,"[0.0, 1.0, 0.0, 0.0, 0.0, 0.0, 0.0, 0.0, 0.0, 0.0, 0.0]",There is also another example .
2191,"[0.0, 1.0, 0.0, 0.0, 0.0, 0.0, 0.0, 0.0, 0.0, 0.0, 0.0]","If we lose a job , why do n't we try another or open a business ?"
2192,"[0.0, 1.0, 0.0, 0.0, 0.0, 0.0, 0.0, 0.0, 0.0, 0.0, 0.0]",We can always try and there will be a day we succeed .
2193,"[0.0, 1.0, 0.0, 0.0, 0.0, 0.0, 0.0, 0.0, 0.0, 0.0, 0.0]","In conclusion , agreed with the statement `` Successful people try new things and take risks rather than only doing what they already know how to do well '' ."
2194,"[0.0, 0.0, 0.0, 0.0, 0.0, 0.0, 0.0, 0.0, 0.0, 1.0, 0.0]",Enjoyment means make the life happy .
2195,"[0.0, 0.0, 0.0, 0.0, 0.0, 0.0, 0.0, 0.0, 0.0, 1.0, 0.0]",by satisfying the soul of the body not only physically but also mentally .
2196,"[0.0, 0.0, 0.0, 0.0, 0.0, 0.0, 0.0, 0.0, 0.0, 1.0, 0.0]",if a person can get through both the mental and physical stresses .
2197,"[0.0, 0.0, 0.0, 0.0, 0.0, 0.0, 0.0, 0.0, 0.0, 1.0, 0.0]",Then the person is said to be enjoying his life .
2198,"[0.0, 0.0, 0.0, 0.0, 0.0, 0.0, 0.0, 0.0, 0.0, 1.0, 0.0]",For the enjoyment of the life especially the is no age limit .
2199,"[0.0, 0.0, 0.0, 0.0, 0.0, 0.0, 0.0, 0.0, 0.0, 1.0, 0.0]",both young ANG old people can enjoy the life beautifully if they plan there life properly .
2200,"[0.0, 0.0, 0.0, 0.0, 0.0, 0.0, 0.0, 0.0, 0.0, 1.0, 0.0]",if not the person at any age can not enjoy his life .
2201,"[0.0, 0.0, 0.0, 0.0, 0.0, 0.0, 0.0, 0.0, 0.0, 1.0, 0.0]","In my opinion old people enjoy there life more happily than the Younger ones because , in this Morten world people should run with the time they rearly get the time to enjoy ."
2202,"[0.0, 0.0, 0.0, 0.0, 0.0, 0.0, 0.0, 0.0, 0.0, 1.0, 0.0]",For instance if u see a school going boy/girl they alway run with the time .
2203,"[0.0, 0.0, 0.0, 0.0, 0.0, 0.0, 0.0, 0.0, 0.0, 1.0, 0.0]",there curriculum schedule is so tight that they are unable even to talk to there own parents .
2204,"[0.0, 0.0, 0.0, 0.0, 0.0, 0.0, 0.0, 0.0, 0.0, 1.0, 0.0]","they are totally missing there sweet time by enjoying with there parent which is necessary for a young child to share his feelings , which is not possible for a young child ."
2205,"[0.0, 0.0, 0.0, 0.0, 0.0, 0.0, 0.0, 0.0, 0.0, 1.0, 0.0]",but the older people are spending enjoyable life by doing the things at the time they want to do least they are having that liberty .
2206,"[0.0, 0.0, 0.0, 0.0, 0.0, 0.0, 0.0, 0.0, 0.0, 1.0, 0.0]",coming to the young people who are going to jobs they schedule is also not at all planned according to them .
2207,"[0.0, 0.0, 0.0, 0.0, 0.0, 0.0, 0.0, 0.0, 0.0, 1.0, 0.0]",they hav to do hard work to earn money .
2208,"[0.0, 0.0, 0.0, 0.0, 0.0, 0.0, 0.0, 0.0, 0.0, 1.0, 0.0]",The people around him will respect him only if he have money .
2209,"[0.0, 0.0, 0.0, 0.0, 0.0, 0.0, 0.0, 0.0, 0.0, 1.0, 0.0]",So people all over the world is running all around to earn money .
2210,"[0.0, 0.0, 0.0, 0.0, 0.0, 0.0, 0.0, 0.0, 0.0, 1.0, 0.0]",Such young people who are at great stress full job are unable even to take care of there health .
2211,"[0.0, 0.0, 0.0, 0.0, 0.0, 0.0, 0.0, 0.0, 0.0, 1.0, 0.0]",so they are also not enjoying the life .
2212,"[0.0, 0.0, 0.0, 0.0, 0.0, 0.0, 0.0, 0.0, 0.0, 1.0, 0.0]",If we see older people who are out of there jobs are least having right food at time .
2213,"[0.0, 0.0, 0.0, 0.0, 0.0, 0.0, 0.0, 0.0, 0.0, 1.0, 0.0]",they are enjoying by taking care of there own grand children .
2214,"[0.0, 0.0, 0.0, 0.0, 0.0, 0.0, 0.0, 0.0, 0.0, 1.0, 0.0]","Thus , i conclude that even youngsters can enjoy there life if they make some free time sharing there happiness and sadness with there family or friends ."
2215,"[0.0, 0.0, 0.0, 0.0, 0.0, 0.0, 0.0, 0.0, 0.0, 1.0, 0.0]",They can really enjoy the full sweetness of life than older ones .
2216,"[0.0, 0.0, 0.0, 0.0, 0.0, 0.0, 0.0, 0.0, 0.0, 1.0, 0.0]",because they have great time to enjoy .
2217,"[0.0, 1.0, 0.0, 0.0, 0.0, 0.0, 0.0, 0.0, 0.0, 0.0, 0.0]","Understanding ideas and concepts and learning facts , thats two different ways of leaning new things , but which one is more important may lead people discuss about it ."
2218,"[0.0, 1.0, 0.0, 0.0, 0.0, 0.0, 0.0, 0.0, 0.0, 0.0, 0.0]","In my opinion , to understand ideas and concepts is more important for students than just learn facts ."
2219,"[0.0, 1.0, 0.0, 0.0, 0.0, 0.0, 0.0, 0.0, 0.0, 0.0, 0.0]","Because many problem - solving are based on the ideas , concepts or theories ."
2220,"[0.0, 1.0, 0.0, 0.0, 0.0, 0.0, 0.0, 0.0, 0.0, 0.0, 0.0]","Firstly , when students understand a idea or a concepts , they can use what they know to apply to vigours of situation , to analyze the problem , to think of them and solve them ."
2221,"[0.0, 1.0, 0.0, 0.0, 0.0, 0.0, 0.0, 0.0, 0.0, 0.0, 0.0]","Many things happen in the world are based on some theories , such as how a object moves , why some times computer do not work etc ."
2222,"[0.0, 1.0, 0.0, 0.0, 0.0, 0.0, 0.0, 0.0, 0.0, 0.0, 0.0]","For example , when a car is designed , engineers need to follow the rules of physics , and chemistry ."
2223,"[0.0, 1.0, 0.0, 0.0, 0.0, 0.0, 0.0, 0.0, 0.0, 0.0, 0.0]","However , when engineers know the theories of the dynamic , they can use same theories to apply to other manufactures such as ships , planes and so on ."
2224,"[0.0, 1.0, 0.0, 0.0, 0.0, 0.0, 0.0, 0.0, 0.0, 0.0, 0.0]","In contrast if students only know the fact that a car can move in this way but do not know why , they can not deal with other problems , because they only know the facts , but reasons ."
2225,"[0.0, 1.0, 0.0, 0.0, 0.0, 0.0, 0.0, 0.0, 0.0, 0.0, 0.0]","Secondly , facts are only restricted in few aspects ."
2226,"[0.0, 1.0, 0.0, 0.0, 0.0, 0.0, 0.0, 0.0, 0.0, 0.0, 0.0]",Students who learn facts are usually can not analyze some situations indeed .
2227,"[0.0, 1.0, 0.0, 0.0, 0.0, 0.0, 0.0, 0.0, 0.0, 0.0, 0.0]","Students know what are happening on some things , they know the appearance , but they might not know why that is happened ."
2228,"[0.0, 1.0, 0.0, 0.0, 0.0, 0.0, 0.0, 0.0, 0.0, 0.0, 0.0]","Sometimes they might know the reasons that course the condition happened , but because there are not ideas and concepts in students mind , they would not understand the reasons fully , they can not analyze correctly , therefor they might not solve the problem , the problem is still on there ."
2229,"[0.0, 1.0, 0.0, 0.0, 0.0, 0.0, 0.0, 0.0, 0.0, 0.0, 0.0]","To sum up , in my opinion , to understand ideas and concepts is more important for student them to learn facts , as i mention be"
2230,"[0.0, 0.0, 0.0, 0.0, 0.0, 0.0, 0.0, 1.0, 0.0, 0.0, 0.0]","The advertisement is first made to introduce the product to the customers , as the mess media keep developing and became popular source of advertising the advertisement skill is also developing ."
