,label,sent
2932,"[0.0, 0.0, 0.0, 0.0, 1.0, 0.0, 0.0, 0.0, 0.0, 0.0, 0.0]","For example , during the Cultural Revolution in China , the Red Guards , as the youth was referred to , at the behest of Chairman Mao Zedong , without any inkling as to how to improve their society , lead to the killing and slaughter of intellectuals , the very intellectuals who were agents of change in the community ."
2933,"[0.0, 0.0, 0.0, 0.0, 1.0, 0.0, 0.0, 0.0, 0.0, 0.0, 0.0]","In conclusion , the youth has done its fair share of community service ."
2934,"[0.0, 0.0, 0.0, 0.0, 1.0, 0.0, 0.0, 0.0, 0.0, 0.0, 0.0]","In fact , they have been welcome agents of change amidst a sea of senility and inaction by previous generations ."
2935,"[0.0, 0.0, 0.0, 0.0, 1.0, 0.0, 0.0, 0.0, 0.0, 0.0, 0.0]",The role essayed by them will only increase in size and stature as time progresses .
2936,"[0.0, 0.0, 0.0, 0.0, 0.0, 1.0, 0.0, 0.0, 0.0, 0.0, 0.0]","When young people have to decide between doing something for their own benefit , or something that could benefit the whole community , they would mostly likely chose to benefit themselves , unless the action for the community would give them something in exchange ."
2937,"[0.0, 0.0, 0.0, 0.0, 0.0, 1.0, 0.0, 0.0, 0.0, 0.0, 0.0]","I agree with the statement `` young people nowadays do not give enough time to helping their communities '' , and I also belive that they should understand why helping the community is important ."
2938,"[0.0, 0.0, 0.0, 0.0, 0.0, 1.0, 0.0, 0.0, 0.0, 0.0, 0.0]",Nowadays young people are much more selfish and dedicate less time to help others unless they are forced to do so .
2939,"[0.0, 0.0, 0.0, 0.0, 0.0, 1.0, 0.0, 0.0, 0.0, 0.0, 0.0]",Schools most of the time need to force students to complete hours of community service .
2940,"[0.0, 0.0, 0.0, 0.0, 0.0, 1.0, 0.0, 0.0, 0.0, 0.0, 0.0]",This is a right decision that the schools take as the students have to learn that sometimes it is best to sacrifice some of their time to give it to the community that they live in .
2941,"[0.0, 0.0, 0.0, 0.0, 0.0, 1.0, 0.0, 0.0, 0.0, 0.0, 0.0]","In addition , helping the community does not necessary take a great amount of work , time or dedication ."
2942,"[0.0, 0.0, 0.0, 0.0, 0.0, 1.0, 0.0, 0.0, 0.0, 0.0, 0.0]",Even small actions done frequently are a great input for the society .
2943,"[0.0, 0.0, 0.0, 0.0, 0.0, 1.0, 0.0, 0.0, 0.0, 0.0, 0.0]","Young people need to understand that they can not only take from the community but they need to give something back to it , not necessary because they have to do it , but because they should want to do it ."
2944,"[0.0, 0.0, 0.0, 0.0, 0.0, 1.0, 0.0, 0.0, 0.0, 0.0, 0.0]","When completing an action for the good of the community , one should get back the satisfaction of being able to give something to the community that one is part of , the satisfaction of doing something good , and the satisfaction of being useful to a great number of people rather than only yourself ."
2945,"[0.0, 0.0, 0.0, 0.0, 0.0, 1.0, 0.0, 0.0, 0.0, 0.0, 0.0]","To conclude , I personally agree with the statement and belive in a need for change in respect of the attitude of these young people who do not dedicate enough time to the community they live in , and do not understand the importance of giving in something for the good of a group of individuals rather than only one ."
2946,"[0.0, 0.0, 0.0, 0.0, 0.0, 0.0, 0.0, 1.0, 0.0, 0.0, 0.0]",There might be different argument regarding whether in twenty years there will be fewer cars in use than there are today .
2947,"[0.0, 0.0, 0.0, 0.0, 0.0, 0.0, 0.0, 1.0, 0.0, 0.0, 0.0]","Personally , I agree with the statement for the following reasons ."
2948,"[0.0, 0.0, 0.0, 0.0, 0.0, 0.0, 0.0, 1.0, 0.0, 0.0, 0.0]",The car is crucial for surviving and succeeding .
2949,"[0.0, 0.0, 0.0, 0.0, 0.0, 0.0, 0.0, 1.0, 0.0, 0.0, 0.0]","As well , it can lead fruitful and happy lives ."
2950,"[0.0, 0.0, 0.0, 0.0, 0.0, 0.0, 0.0, 1.0, 0.0, 0.0, 0.0]","First , the car is essential for survival and success in today 's society ."
2951,"[0.0, 0.0, 0.0, 0.0, 0.0, 0.0, 0.0, 1.0, 0.0, 0.0, 0.0]","In general , most salespeople admit the fact that they are promoted faster due to their talent for the car ."
2952,"[0.0, 0.0, 0.0, 1.0, 0.0, 0.0, 0.0, 0.0, 0.0, 0.0, 0.0]",I definitely agree with the statement that most advertisements make products seem much better than they really are .
2953,"[0.0, 0.0, 0.0, 1.0, 0.0, 0.0, 0.0, 0.0, 0.0, 0.0, 0.0]",I have to admit that I am not the type of person that watches a lot of television and I am also not paying too much attention to advertisements I see on newspapers or magazines .
2954,"[0.0, 0.0, 0.0, 1.0, 0.0, 0.0, 0.0, 0.0, 0.0, 0.0, 0.0]","However , it happened a few times in my life that I trusted in what I saw on TV , but I do not want to mention all the disappointing moments I had , trusting too much what I have seen on the advertisements ."
2955,"[0.0, 0.0, 0.0, 1.0, 0.0, 0.0, 0.0, 0.0, 0.0, 0.0, 0.0]",So let us try to imagine what is in the `` company 's mind '' .
2956,"[0.0, 0.0, 0.0, 1.0, 0.0, 0.0, 0.0, 0.0, 0.0, 0.0, 0.0]","Since it is the aim of an advertisement to make it look great and to make it seem like you , the customer , really needs it , the company has to do everything in order to make you believe that the product is great ."
2957,"[0.0, 0.0, 0.0, 1.0, 0.0, 0.0, 0.0, 0.0, 0.0, 0.0, 0.0]","The consequence is that marketing plays with pictures , sounds , words , and emotions so that the customer gets appealed to the product ."
2958,"[0.0, 0.0, 0.0, 1.0, 0.0, 0.0, 0.0, 0.0, 0.0, 0.0, 0.0]",If this mathes with reality or not does not matter at all .
2959,"[0.0, 0.0, 0.0, 1.0, 0.0, 0.0, 0.0, 0.0, 0.0, 0.0, 0.0]",Even the last `` finish '' on the computer makes the product look a thousand times better than in real life .
2960,"[0.0, 0.0, 0.0, 1.0, 0.0, 0.0, 0.0, 0.0, 0.0, 0.0, 0.0]",What matters is that the product sells  -  and that 's why it has to look great .
2961,"[0.0, 0.0, 0.0, 1.0, 0.0, 0.0, 0.0, 0.0, 0.0, 0.0, 0.0]",In order to sell the product the company has to make up an image that really makes you think that there is no better product available on the market .
2962,"[0.0, 0.0, 0.0, 1.0, 0.0, 0.0, 0.0, 0.0, 0.0, 0.0, 0.0]", -  That 's why we think we have to spend money in detergent that makes clothes whiter than white or in tooth paste that makes teeth cleaner that clean .
2963,"[0.0, 0.0, 0.0, 1.0, 0.0, 0.0, 0.0, 0.0, 0.0, 0.0, 0.0]",Sometimes you sit there and wonder how it can be possible that you are fooled that way .
2964,"[0.0, 0.0, 0.0, 1.0, 0.0, 0.0, 0.0, 0.0, 0.0, 0.0, 0.0]","looking at the facts , it is widely known that companies spent thousands of dollars in market research for the purpose of finding out how the breaking of a cookie has to sound in order to be sold or what color the tomato on the Big - Mc - advertisement has to have so that it looks appealing to the buyer ."
2965,"[0.0, 0.0, 0.0, 1.0, 0.0, 0.0, 0.0, 0.0, 0.0, 0.0, 0.0]","Maybe it helps us , as the consent , to view advertisements as a plain product information , just to find out what is there on the market and not rely too much on the opinion , the value , the image it is trying to come across ."
2966,"[0.0, 0.0, 0.0, 1.0, 0.0, 0.0, 0.0, 0.0, 0.0, 0.0, 0.0]","Then we do not have to worry whether the product is better or not , but just make up our mind on our own ."
2967,"[0.0, 0.0, 0.0, 1.0, 0.0, 0.0, 0.0, 0.0, 0.0, 0.0, 0.0]","It is obvious that reality is not as colorful , tasty , clean , white  -  whatever you want to take as an example  -  as the advertisements make you think in the first place ."
2968,"[0.0, 0.0, 0.0, 1.0, 0.0, 0.0, 0.0, 0.0, 0.0, 0.0, 0.0]","However , if you as the customer keep that in mind you do not get too disappointed and still can enjoy your Big - Mc ."
2969,"[0.0, 0.0, 0.0, 0.0, 0.0, 0.0, 1.0, 0.0, 0.0, 0.0, 0.0]","I agree the idea that `` Successful people try new things and take risks rather than only doing what they already know how to do well '' , because I have three models of the successful people ."
2970,"[0.0, 0.0, 0.0, 0.0, 0.0, 0.0, 1.0, 0.0, 0.0, 0.0, 0.0]","First , one of the three successful people is my old brother ."
2971,"[0.0, 0.0, 0.0, 0.0, 0.0, 0.0, 1.0, 0.0, 0.0, 0.0, 0.0]","When he was a junior high school student , he did not like to study very well ."
2972,"[0.0, 0.0, 0.0, 0.0, 0.0, 0.0, 1.0, 0.0, 0.0, 0.0, 0.0]","He did not study , so his grade was not good ."
2973,"[0.0, 0.0, 0.0, 0.0, 0.0, 0.0, 1.0, 0.0, 0.0, 0.0, 0.0]","But one day , he met a high school teacher in the town ."
2974,"[0.0, 0.0, 0.0, 0.0, 0.0, 0.0, 1.0, 0.0, 0.0, 0.0, 0.0]","Then he thought I want to be his student , so I want to take the his school entrance exam ."
2975,"[0.0, 0.0, 0.0, 0.0, 0.0, 0.0, 1.0, 0.0, 0.0, 0.0, 0.0]",But the school study revel is high .
2976,"[0.0, 0.0, 0.0, 0.0, 0.0, 0.0, 1.0, 0.0, 0.0, 0.0, 0.0]",I should study hard .
2977,"[0.0, 0.0, 0.0, 0.0, 0.0, 0.0, 1.0, 0.0, 0.0, 0.0, 0.0]","After my brother met the teacher , he studied very hard ."
2978,"[0.0, 0.0, 0.0, 0.0, 0.0, 0.0, 1.0, 0.0, 0.0, 0.0, 0.0]","So he could get better grade than before , and he could be one of a student of the teacher 's high school ."
2979,"[0.0, 0.0, 0.0, 0.0, 0.0, 0.0, 1.0, 0.0, 0.0, 0.0, 0.0]","Second , one of the three successful people is Mr. Toyota ."
2980,"[0.0, 0.0, 0.0, 0.0, 0.0, 0.0, 1.0, 0.0, 0.0, 0.0, 0.0]",He created the big and famous car company in Japan .
2981,"[0.0, 0.0, 0.0, 0.0, 0.0, 0.0, 1.0, 0.0, 0.0, 0.0, 0.0]",I think the company was one of the famous car companies in the world .
2982,"[0.0, 0.0, 0.0, 0.0, 0.0, 0.0, 1.0, 0.0, 0.0, 0.0, 0.0]","When he was a child , his family was poor ."
2983,"[0.0, 0.0, 0.0, 0.0, 0.0, 0.0, 1.0, 0.0, 0.0, 0.0, 0.0]","Because he must help to his family in his child age , he could not get studying opportunity well ."
2984,"[0.0, 0.0, 0.0, 0.0, 0.0, 0.0, 1.0, 0.0, 0.0, 0.0, 0.0]","His father 's job was small bike store , so when he graduate junior high school , he was president of the small company ."
2985,"[0.0, 0.0, 0.0, 0.0, 0.0, 0.0, 1.0, 0.0, 0.0, 0.0, 0.0]",Then he created idea of corporation like big american train companies .
2986,"[0.0, 0.0, 0.0, 0.0, 0.0, 0.0, 1.0, 0.0, 0.0, 0.0, 0.0]","The idea was very big risk then , because it was not common idea in Japan ."
2987,"[0.0, 0.0, 0.0, 0.0, 0.0, 0.0, 1.0, 0.0, 0.0, 0.0, 0.0]","Today , his company became a big company ."
2988,"[0.0, 0.0, 0.0, 0.0, 0.0, 0.0, 1.0, 0.0, 0.0, 0.0, 0.0]","Third , one of the three successful people is Syrian Yoshida ."
2989,"[0.0, 0.0, 0.0, 0.0, 0.0, 0.0, 1.0, 0.0, 0.0, 0.0, 0.0]",He was one of the most famous people in Japan .
2990,"[0.0, 0.0, 0.0, 0.0, 0.0, 0.0, 1.0, 0.0, 0.0, 0.0, 0.0]",He was teacher in MEIJI era .
2991,"[0.0, 0.0, 0.0, 0.0, 0.0, 0.0, 1.0, 0.0, 0.0, 0.0, 0.0]","When he was teacher , he thought Japan should learn from other countries like England or America ."
2992,"[0.0, 0.0, 0.0, 0.0, 0.0, 0.0, 1.0, 0.0, 0.0, 0.0, 0.0]","But then people , who go to abroad without permistion from government , was very big crime ."
2993,"[0.0, 0.0, 0.0, 0.0, 0.0, 0.0, 1.0, 0.0, 0.0, 0.0, 0.0]",But he tried to go to America .
2994,"[0.0, 0.0, 0.0, 0.0, 0.0, 0.0, 1.0, 0.0, 0.0, 0.0, 0.0]",He swam to the America 's big boart at the night .
2995,"[0.0, 0.0, 0.0, 0.0, 0.0, 0.0, 1.0, 0.0, 0.0, 0.0, 0.0]",And he tried to go to America .
2996,"[0.0, 0.0, 0.0, 0.0, 0.0, 0.0, 1.0, 0.0, 0.0, 0.0, 0.0]",But then american officer did not permit because America did not want to attack .
2997,"[0.0, 0.0, 0.0, 0.0, 0.0, 0.0, 1.0, 0.0, 0.0, 0.0, 0.0]",But the story made Japan courage .
2998,"[0.0, 0.0, 0.0, 0.0, 0.0, 0.0, 1.0, 0.0, 0.0, 0.0, 0.0]",I agree with that most advertisements make products seem much better than they really are .
2999,"[0.0, 0.0, 0.0, 0.0, 0.0, 0.0, 1.0, 0.0, 0.0, 0.0, 0.0]","The advertisements can make products seem more amazing and special , and it makes people want to buy the products ."
3000,"[0.0, 0.0, 0.0, 0.0, 0.0, 0.0, 1.0, 0.0, 0.0, 0.0, 0.0]",In addition that 's the reason for advertisements .
3001,"[0.0, 0.0, 0.0, 0.0, 0.0, 0.0, 1.0, 0.0, 0.0, 0.0, 0.0]",Advertisements should make products better than real to attract people .
3002,"[0.0, 0.0, 0.0, 0.0, 0.0, 0.0, 1.0, 0.0, 0.0, 0.0, 0.0]","First , the advertisement on the TV such as commercial shows can attract peoples attention ."
3003,"[0.0, 0.0, 0.0, 0.0, 0.0, 0.0, 1.0, 0.0, 0.0, 0.0, 0.0]",It 's directly influenced peoples desire .
3004,"[0.0, 0.0, 0.0, 0.0, 0.0, 0.0, 1.0, 0.0, 0.0, 0.0, 0.0]","If people watch the cool soda 's CM in summer when they are thirty , they want to drink that kind of drinks even though they know these products are n't good for there health ."
3005,"[0.0, 0.0, 0.0, 0.0, 0.0, 0.0, 1.0, 0.0, 0.0, 0.0, 0.0]","If they watch the tasty steak CM before the dinner , they want to eat steak ."
3006,"[0.0, 0.0, 0.0, 0.0, 0.0, 0.0, 1.0, 0.0, 0.0, 0.0, 0.0]",The visual moving advertisements have big influence to people 's Isare quickly .
3007,"[0.0, 0.0, 0.0, 0.0, 0.0, 0.0, 1.0, 0.0, 0.0, 0.0, 0.0]","Second , when you drive the car on the high way , you can see some advertisement bords next to the road ."
3008,"[0.0, 0.0, 0.0, 0.0, 0.0, 0.0, 1.0, 0.0, 0.0, 0.0, 0.0]","For example , when you go to local side , you can find the hotel or restaurant advertisement bords ."
3009,"[0.0, 0.0, 0.0, 0.0, 0.0, 0.0, 1.0, 0.0, 0.0, 0.0, 0.0]","It does n't have the big impact like commercial on TV , yet , it can effect your mind to think about that kind of things ."
3010,"[0.0, 0.0, 0.0, 0.0, 0.0, 0.0, 1.0, 0.0, 0.0, 0.0, 0.0]",It makes you think that you need it or not .
3011,"[0.0, 0.0, 0.0, 0.0, 0.0, 0.0, 1.0, 0.0, 0.0, 0.0, 0.0]","Also , in most situation , you want to get it at that time because this bord made it there for exactly that people need it at this time although the situation is that no choice because of in local area ."
3012,"[0.0, 0.0, 0.0, 0.0, 0.0, 0.0, 1.0, 0.0, 0.0, 0.0, 0.0]","Third , if you read newspaper , you might also get some advertisement paper for seling house and new restaurants etc ."
3013,"[0.0, 0.0, 0.0, 0.0, 0.0, 0.0, 1.0, 0.0, 0.0, 0.0, 0.0]",It does n't pass you quickly like commercial show and advertisement bords .
3014,"[0.0, 0.0, 0.0, 0.0, 0.0, 0.0, 1.0, 0.0, 0.0, 0.0, 0.0]","It can be left in your space , so you can look them later when you have time ."
3015,"[0.0, 0.0, 0.0, 0.0, 0.0, 0.0, 1.0, 0.0, 0.0, 0.0, 0.0]",It has some advantages .
3016,"[0.0, 0.0, 0.0, 0.0, 0.0, 0.0, 1.0, 0.0, 0.0, 0.0, 0.0]","You can see that whenever , so it can be seen more than other kinds of advertisement things ."
3017,"[0.0, 0.0, 0.0, 0.0, 0.0, 0.0, 1.0, 0.0, 0.0, 0.0, 0.0]",It means it more effects to people 's mind .
3018,"[0.0, 0.0, 0.0, 0.0, 0.0, 0.0, 1.0, 0.0, 0.0, 0.0, 0.0]","For instance , on the sunday , if mother see the new restaurant 's advertisement paper , she will ask about going to there to her husband because AHE want to try new taste and she dose n't feel to cook today ."
3019,"[0.0, 0.0, 0.0, 0.0, 0.0, 0.0, 1.0, 0.0, 0.0, 0.0, 0.0]","In conclusion , the advertisements have many ways such as the CM on the TV , advertisement bords and advertisement papers ."
3020,"[0.0, 0.0, 0.0, 0.0, 0.0, 0.0, 1.0, 0.0, 0.0, 0.0, 0.0]",These has effective influence to people 's desire to want to get products .
3021,"[0.0, 0.0, 0.0, 0.0, 0.0, 0.0, 1.0, 0.0, 0.0, 0.0, 0.0]","Unfortunately , in many case , people felt kind of disappoint after they tried the products because before they try it , they were hoping too much ."
3022,"[0.0, 0.0, 0.0, 0.0, 0.0, 0.0, 1.0, 0.0, 0.0, 0.0, 0.0]","Actually , the products are n't so terrible , but because of there too much desire and they wanted that by not big desire , they ca n't be satisfied by the products that on the advertisements ."
3023,"[0.0, 0.0, 0.0, 0.0, 0.0, 0.0, 1.0, 0.0, 0.0, 0.0, 0.0]","Of course , in some case , they can felt satisfied yet , it 's less than opposite situations ."
3024,"[0.0, 0.0, 0.0, 0.0, 0.0, 1.0, 0.0, 0.0, 0.0, 0.0, 0.0]","I agree with the statement , as the the most important thing for a student is to understand ideas and concepts in order to develop critical thinking and good judgement ."
3025,"[0.0, 0.0, 0.0, 0.0, 0.0, 1.0, 0.0, 0.0, 0.0, 0.0, 0.0]","First , only by understanding ideas and concepts students can use what they have learned in school and apply it to real life situations ."
3026,"[0.0, 0.0, 0.0, 0.0, 0.0, 1.0, 0.0, 0.0, 0.0, 0.0, 0.0]","By understanding concepts and ideas , a student can develop the so called `` critical thinking '' that is the capacity to judge a fact or an idea with maturity and good judgement ."
3027,"[0.0, 0.0, 0.0, 0.0, 0.0, 1.0, 0.0, 0.0, 0.0, 0.0, 0.0]","Without critical thinking , people woul n't be able possess everyday life situations maturely and make the right decisions ."
3028,"[0.0, 0.0, 0.0, 0.0, 0.0, 1.0, 0.0, 0.0, 0.0, 0.0, 0.0]","For instance , how good a lawyer would be if he could recall all the regulation in a certain area of law but could n't interpret the regulation itself ?"
3029,"[0.0, 0.0, 0.0, 0.0, 0.0, 1.0, 0.0, 0.0, 0.0, 0.0, 0.0]",He would certainly master the facts but he would n't understand the concept .
3030,"[0.0, 0.0, 0.0, 0.0, 0.0, 1.0, 0.0, 0.0, 0.0, 0.0, 0.0]","I am sure most lawyers would agree with me that in law , more often than no , knowing how to interpret a law is more valuable than knowing the written regulation ."
3031,"[0.0, 0.0, 0.0, 0.0, 0.0, 1.0, 0.0, 0.0, 0.0, 0.0, 0.0]","Second , by learning and memorizing facts , students only develop skills that are not as necessary for business or other professions ."
3032,"[0.0, 0.0, 0.0, 0.0, 0.0, 1.0, 0.0, 0.0, 0.0, 0.0, 0.0]","For instance , there is not much value in memorizing hundreds of pages of a marketing concepts if a student is not going to apply that specific knowledge in a financial analyst profession ."
3033,"[0.0, 0.0, 0.0, 0.0, 0.0, 1.0, 0.0, 0.0, 0.0, 0.0, 0.0]","Much batter would be , if the student understand and master marketing ideas and concepts that can be applied to his profession as well ."
3034,"[0.0, 0.0, 0.0, 0.0, 0.0, 1.0, 0.0, 0.0, 0.0, 0.0, 0.0]",The same applies for other subjects such as Math .
3035,"[0.0, 0.0, 0.0, 0.0, 0.0, 1.0, 0.0, 0.0, 0.0, 0.0, 0.0]","If a students knows only memorizes formulas but ca n't apply those , his knowledge of math will be probably unless ."
3036,"[0.0, 0.0, 0.0, 0.0, 0.0, 1.0, 0.0, 0.0, 0.0, 0.0, 0.0]","Third , when students learn and memorize facts they do it only for the purpose of taking a test and not for the purpose of learning something ."
3037,"[0.0, 0.0, 0.0, 0.0, 0.0, 1.0, 0.0, 0.0, 0.0, 0.0, 0.0]",The result that most of what the student learn will be lost few weeks later .
3038,"[0.0, 0.0, 0.0, 0.0, 0.0, 1.0, 0.0, 0.0, 0.0, 0.0, 0.0]",This is clearly an ineffective way of using the students time as memorizing requires a lot of time and energies that could be used to understand more ideas and concepts .
3039,"[0.0, 0.0, 0.0, 0.0, 0.0, 1.0, 0.0, 0.0, 0.0, 0.0, 0.0]","To sum up , I believe students should focus on learning concepts and general ideas instead of waiting time memorizing facts ."
3040,"[0.0, 0.0, 0.0, 1.0, 0.0, 0.0, 0.0, 0.0, 0.0, 0.0, 0.0]",In following text I 'm going to express my thoughts about the statement that successful people try new things and take risks rather than only doing what they already know .
3041,"[0.0, 0.0, 0.0, 1.0, 0.0, 0.0, 0.0, 0.0, 0.0, 0.0, 0.0]",There is a distinction of successful people that I want to make before answering the question .
3042,"[0.0, 0.0, 0.0, 1.0, 0.0, 0.0, 0.0, 0.0, 0.0, 0.0, 0.0]",There are two kinds of them .
3043,"[0.0, 0.0, 0.0, 1.0, 0.0, 0.0, 0.0, 0.0, 0.0, 0.0, 0.0]","First is the successful guy , who just happened to be in the right spot or have the right friend to come into a position where he is successful ."
3044,"[0.0, 0.0, 0.0, 1.0, 0.0, 0.0, 0.0, 0.0, 0.0, 0.0, 0.0]",Those people most do n't try new things at all or use new knowledge .
3045,"[0.0, 0.0, 0.0, 1.0, 0.0, 0.0, 0.0, 0.0, 0.0, 0.0, 0.0]",They 'll be interested in keeping the current status quo .
3046,"[0.0, 0.0, 0.0, 1.0, 0.0, 0.0, 0.0, 0.0, 0.0, 0.0, 0.0]",The second kind are the self - made successful people .
3047,"[0.0, 0.0, 0.0, 1.0, 0.0, 0.0, 0.0, 0.0, 0.0, 0.0, 0.0]",They do have to take risks and think new thoughts in order to be successful .
3048,"[0.0, 0.0, 0.0, 1.0, 0.0, 0.0, 0.0, 0.0, 0.0, 0.0, 0.0]","For example if you open a shop , you 'll have to get a loan from a bank , which is risky because you might ca n't pay it back ."
3049,"[0.0, 0.0, 0.0, 1.0, 0.0, 0.0, 0.0, 0.0, 0.0, 0.0, 0.0]","If you are not able to pay your rates you risk not only the new shop you 've opened , but your whole existence ."
3050,"[0.0, 0.0, 0.0, 1.0, 0.0, 0.0, 0.0, 0.0, 0.0, 0.0, 0.0]",Therefore you have to make sure that your bussings is going to work .
3051,"[0.0, 0.0, 0.0, 1.0, 0.0, 0.0, 0.0, 0.0, 0.0, 0.0, 0.0]",The best way to be successful is to differ from others .
3052,"[0.0, 0.0, 0.0, 1.0, 0.0, 0.0, 0.0, 0.0, 0.0, 0.0, 0.0]","You 'll have to think about new products to sell , new ways to advertise them ."
3053,"[0.0, 0.0, 0.0, 1.0, 0.0, 0.0, 0.0, 0.0, 0.0, 0.0, 0.0]",Maybe new locations and ways to build them .
3054,"[0.0, 0.0, 0.0, 1.0, 0.0, 0.0, 0.0, 0.0, 0.0, 0.0, 0.0]","Without innovation it wo n't take long until there is someone better coming into the field , to take your customers away ."
3055,"[0.0, 0.0, 0.0, 1.0, 0.0, 0.0, 0.0, 0.0, 0.0, 0.0, 0.0]","That 's why , as a self - made man , you always have to be on top of new developments ."
3056,"[0.0, 0.0, 0.0, 1.0, 0.0, 0.0, 0.0, 0.0, 0.0, 0.0, 0.0]",Whether in technical or in marketing issues .
3057,"[0.0, 0.0, 0.0, 1.0, 0.0, 0.0, 0.0, 0.0, 0.0, 0.0, 0.0]",That does n't mean that in order to be successful you 'll have to start something totally new .
3058,"[0.0, 0.0, 0.0, 1.0, 0.0, 0.0, 0.0, 0.0, 0.0, 0.0, 0.0]",It 's perfectly possible to start with something that you already know and are good at .
3059,"[0.0, 0.0, 0.0, 1.0, 0.0, 0.0, 0.0, 0.0, 0.0, 0.0, 0.0]",But it 's a must to always develop new skills and knowledge .
3060,"[0.0, 0.0, 0.0, 1.0, 0.0, 0.0, 0.0, 0.0, 0.0, 0.0, 0.0]",Customers always want the best service they can get so you have to improve your service .
3061,"[0.0, 0.0, 0.0, 1.0, 0.0, 0.0, 0.0, 0.0, 0.0, 0.0, 0.0]","Once you 're successful , the is no guaranty that it always stays like that ."
3062,"[0.0, 0.0, 0.0, 1.0, 0.0, 0.0, 0.0, 0.0, 0.0, 0.0, 0.0]",Successful people will always make efforts to improve further .
3063,"[0.0, 0.0, 0.0, 1.0, 0.0, 0.0, 0.0, 0.0, 0.0, 0.0, 0.0]",It 's necessary for them to take risks and think new thoughts .
3064,"[0.0, 1.0, 0.0, 0.0, 0.0, 0.0, 0.0, 0.0, 0.0, 0.0, 0.0]","Nowadays , one of the most intriguing issues is that whether the majority of the advertisements makes their merchandise look much better than they really are ."
3065,"[0.0, 1.0, 0.0, 0.0, 0.0, 0.0, 0.0, 0.0, 0.0, 0.0, 0.0]","As far as I am concerned , I agree with this opinion , with three following reasons ."
3066,"[0.0, 1.0, 0.0, 0.0, 0.0, 0.0, 0.0, 0.0, 0.0, 0.0, 0.0]","Firstly , the advertisers attracts the public attentions by making full use use of the `` clarity effect '' ."
3067,"[0.0, 1.0, 0.0, 0.0, 0.0, 0.0, 0.0, 0.0, 0.0, 0.0, 0.0]","Although the cost on the super stars is always unbelievably high , the producers can also gain profit by the advertisement acted by the clarity ."
3068,"[0.0, 1.0, 0.0, 0.0, 0.0, 0.0, 0.0, 0.0, 0.0, 0.0, 0.0]","It is true that since the super movie star or singer appeared in the advertisement on the screen , people have memorized the product because of their favorable clarity and are probably buy the product ."
3069,"[0.0, 1.0, 0.0, 0.0, 0.0, 0.0, 0.0, 0.0, 0.0, 0.0, 0.0]","But unfortunately , the public know little about what they have bought ."
3070,"[0.0, 1.0, 0.0, 0.0, 0.0, 0.0, 0.0, 0.0, 0.0, 0.0, 0.0]","Secondly , the advertiser aggrandizes the function of the products sometimes ."
3071,"[0.0, 1.0, 0.0, 0.0, 0.0, 0.0, 0.0, 0.0, 0.0, 0.0, 0.0]","For example , an advertisement mentions that you can keep all day long energetic by drinking an energy drink ."
3072,"[0.0, 1.0, 0.0, 0.0, 0.0, 0.0, 0.0, 0.0, 0.0, 0.0, 0.0]","In other words , you are still active even after you stay up for 24 hours ."
3073,"[0.0, 1.0, 0.0, 0.0, 0.0, 0.0, 0.0, 0.0, 0.0, 0.0, 0.0]","If so , why does the scientists always mention the importance of the 8 hours sleeping time ?"
3074,"[0.0, 1.0, 0.0, 0.0, 0.0, 0.0, 0.0, 0.0, 0.0, 0.0, 0.0]","Lastly , the advertiser sometimes emphasize one its benefit of the product but deliberately ignore the negative effect ."
3075,"[0.0, 1.0, 0.0, 0.0, 0.0, 0.0, 0.0, 0.0, 0.0, 0.0, 0.0]",A brand of medicine to keep fit points out in its advertisements how much weight you can lose after a couple of weeks .
3076,"[0.0, 1.0, 0.0, 0.0, 0.0, 0.0, 0.0, 0.0, 0.0, 0.0, 0.0]","However , the medicine has a bad effect on the nerves of the takers to prohibit their desire to take food ."
3077,"[0.0, 1.0, 0.0, 0.0, 0.0, 0.0, 0.0, 0.0, 0.0, 0.0, 0.0]","All in all , most advertisements make their products seem much better than the originals ."
3078,"[0.0, 1.0, 0.0, 0.0, 0.0, 0.0, 0.0, 0.0, 0.0, 0.0, 0.0]","Although it will add the profit for the producers , in the moral light , it is a deceiving behavior for the public ."
3079,"[1.0, 0.0, 0.0, 0.0, 0.0, 0.0, 0.0, 0.0, 0.0, 0.0, 0.0]",i agree that it is very important for students to understand ideas and concepts than it is for them to learn facts for many reasons .
3080,"[1.0, 0.0, 0.0, 0.0, 0.0, 0.0, 0.0, 0.0, 0.0, 0.0, 0.0]","first , when they are understanding what they told , it is easy for them to keep it in Thier mind and to memorised it ."
3081,"[1.0, 0.0, 0.0, 0.0, 0.0, 0.0, 0.0, 0.0, 0.0, 0.0, 0.0]","secondly , they can compare and contrast between things easily ."
