,label,sent
2067,"[0.0, 0.0, 0.0, 0.0, 0.0, 0.0, 0.0, 0.0, 1.0, 0.0, 0.0]","The population is growing on every country because of the improvement in the sanity , technologies . .."
2068,"[0.0, 0.0, 0.0, 0.0, 0.0, 0.0, 0.0, 0.0, 1.0, 0.0, 0.0]",That makes that the population growths also in the `` first world countries '' so more people will be able to reach a car .
2069,"[0.0, 0.0, 0.0, 0.0, 0.0, 0.0, 0.0, 0.0, 1.0, 0.0, 0.0]","Also , one of the main points is the improvement of the technology ."
2070,"[0.0, 0.0, 0.0, 0.0, 0.0, 0.0, 0.0, 0.0, 1.0, 0.0, 0.0]",Maybe it can be thought that because of the solution or the non pollutions plans that the governments are trying to impulse in some years most of the people will change their cars for the public transport .
2071,"[0.0, 0.0, 0.0, 0.0, 0.0, 0.0, 0.0, 0.0, 1.0, 0.0, 0.0]","Because of that the car companies are investing money in evolute new green technologies like hydrogen batteries that will make possible to use a car without putting , in fact you will creat just water instead of dioxide carbon that is really harmful for our enviroment ."
2072,"[0.0, 0.0, 0.0, 0.0, 0.0, 0.0, 0.0, 0.0, 1.0, 0.0, 0.0]","In deed , that improvement of the technology will make cheaper all the process of making a car , so there will be more people who will be able to obtain a car when before that improvement they could n't ."
2073,"[0.0, 0.0, 0.0, 0.0, 0.0, 0.0, 0.0, 0.0, 1.0, 0.0, 0.0]",And here is where the globalization get 's in .
2074,"[0.0, 0.0, 0.0, 0.0, 0.0, 0.0, 0.0, 0.0, 1.0, 0.0, 0.0]",All the old technologies that are not useful in the `` first world countries '' will be sold on sale to those countries that are not that rich .
2075,"[0.0, 0.0, 0.0, 0.0, 0.0, 0.0, 0.0, 0.0, 1.0, 0.0, 0.0]","In that way , countries where most of the people could n't afford a car , they will have cars reachable ."
2076,"[0.0, 0.0, 0.0, 0.0, 0.0, 0.0, 0.0, 0.0, 1.0, 0.0, 0.0]",And that means more cars being used on the world .
2077,"[0.0, 0.0, 0.0, 0.0, 0.0, 0.0, 0.0, 0.0, 1.0, 0.0, 0.0]","To sum up , I think that all the problems such as politics plans or environmental pollution because of the use of petrol , will be resolved by the improvement of technology that is already known , such as hydrogen batteries as I told before ."
2078,"[0.0, 0.0, 0.0, 0.0, 0.0, 0.0, 0.0, 0.0, 0.0, 1.0, 0.0]","I totally disagree with the statement , ` Young people nowadays do not give enough time to helping their communities ' ."
2079,"[0.0, 0.0, 0.0, 0.0, 0.0, 0.0, 0.0, 0.0, 0.0, 1.0, 0.0]","WE ARE , if the word community determines not a division on the Bacis of ` cast , colour or creed ' ."
2080,"[0.0, 0.0, 0.0, 0.0, 0.0, 0.0, 0.0, 0.0, 0.0, 1.0, 0.0]",The new generation young people are more social conscious than of those in the past .
2081,"[0.0, 0.0, 0.0, 0.0, 0.0, 0.0, 0.0, 0.0, 0.0, 1.0, 0.0]",They broke open many barriers that older generations same age group lived in .
2082,"[0.0, 0.0, 0.0, 0.0, 0.0, 0.0, 0.0, 0.0, 0.0, 1.0, 0.0]",The new ads in the TV would speak the extent of support even from their parents does young people receive for to participate in helping their communities .
2083,"[0.0, 0.0, 0.0, 0.0, 0.0, 0.0, 0.0, 0.0, 0.0, 1.0, 0.0]","In this case , the ad begins showing a distressed young guy sitting in a balcony watching at the streets he live in ."
2084,"[0.0, 0.0, 0.0, 0.0, 0.0, 0.0, 0.0, 0.0, 0.0, 1.0, 0.0]","He is shocked to see the state of living he is in , with roads filled with litter , nothing in place ."
2085,"[0.0, 0.0, 0.0, 0.0, 0.0, 0.0, 0.0, 0.0, 0.0, 1.0, 0.0]",He then gets shocked to see a little boy searching for food near a bin .
2086,"[0.0, 0.0, 0.0, 0.0, 0.0, 0.0, 0.0, 0.0, 0.0, 1.0, 0.0]",This little boy awakens to the plight of situations that can be altered .
2087,"[0.0, 0.0, 0.0, 0.0, 0.0, 0.0, 0.0, 0.0, 0.0, 1.0, 0.0]","He invites his friends not for an outing as like any other weekend , for to clean up the streets , not waiting for help from government ."
2088,"[0.0, 0.0, 0.0, 0.0, 0.0, 0.0, 0.0, 0.0, 0.0, 1.0, 0.0]","They also help the little boy with some food , they raise donations for to help the boy with education ."
2089,"[0.0, 0.0, 0.0, 0.0, 0.0, 0.0, 0.0, 0.0, 0.0, 1.0, 0.0]",Parents are shown not restricting to the moves of the boys . ..
2090,"[0.0, 0.0, 0.0, 0.0, 0.0, 0.0, 0.0, 0.0, 0.0, 1.0, 0.0]","That could just be an ad , but it depicts the state of mind the new generation has ."
2091,"[0.0, 0.0, 0.0, 0.0, 0.0, 0.0, 0.0, 0.0, 0.0, 1.0, 0.0]","We are feasible to bads , but if moulded , we can make the best out of worst ."
2092,"[0.0, 0.0, 0.0, 0.0, 0.0, 0.0, 0.0, 0.0, 0.0, 1.0, 0.0]","We are scheduling the time more perfect , devoting time for all ."
2093,"[0.0, 0.0, 0.0, 0.0, 0.0, 0.0, 0.0, 0.0, 0.0, 1.0, 0.0]","Our generation is ` Jack of all , and also MASTER of all ' ."
2094,"[0.0, 0.0, 0.0, 0.0, 0.0, 0.0, 0.0, 0.0, 0.0, 1.0, 0.0]",Gone are days when in education distinction is a very good grade .
2095,"[0.0, 0.0, 0.0, 0.0, 0.0, 0.0, 0.0, 0.0, 0.0, 1.0, 0.0]","Today , A grade is most common ."
2096,"[0.0, 0.0, 0.0, 0.0, 0.0, 0.0, 0.0, 0.0, 0.0, 1.0, 0.0]",This generation is balancing its time between work  -  play  -  study  -  and social work more perfect .
2097,"[0.0, 0.0, 0.0, 0.0, 0.0, 0.0, 0.0, 0.0, 0.0, 1.0, 0.0]",Many young people can be seen as volunteers in many social organisations .
2098,"[0.0, 0.0, 0.0, 0.0, 0.0, 0.0, 0.0, 0.0, 0.0, 1.0, 0.0]",They do not care the risks involved .
2099,"[0.0, 0.0, 0.0, 0.0, 0.0, 0.0, 0.0, 0.0, 0.0, 1.0, 0.0]","They are more swift , more easy grasping , more ONE for all than to ALL for one ."
2100,"[0.0, 0.0, 0.0, 0.0, 0.0, 0.0, 0.0, 0.0, 0.0, 1.0, 0.0]","Highest are young people in number in organisations like RED CROSS , Blue cross and other voluntary organisations"
2101,"[0.0, 0.0, 0.0, 0.0, 0.0, 0.0, 0.0, 0.0, 0.0, 0.0, 1.0]","I firmly believe that , in the twenty - first century , specializing in a specific subject is much more important than having broad knowledge of many academic subjects ."
2102,"[0.0, 0.0, 0.0, 0.0, 0.0, 0.0, 0.0, 0.0, 0.0, 0.0, 1.0]","This is for the reason that with developing technology and the accumulated knowledge of humankind through centuries , having broad knowledge on any subject is not sufficient to make researches , experiments or , consequently , any developments ."
2103,"[0.0, 0.0, 0.0, 0.0, 0.0, 0.0, 0.0, 0.0, 0.0, 0.0, 1.0]",It is known that Aristo worked on various branches of science from psychology to biology and physics .
2104,"[0.0, 0.0, 0.0, 0.0, 0.0, 0.0, 0.0, 0.0, 0.0, 0.0, 1.0]","However , when the circumstances of the Ancient Greek civilization is compared to those of 20th century it will be quite clear why Einstein did not follow the footsteps of Aristo and merely , specialized in Physics ."
2105,"[0.0, 0.0, 0.0, 0.0, 0.0, 0.0, 0.0, 0.0, 0.0, 0.0, 1.0]","In Aristo 's era , humanity had not developed at all and was living its early stages ."
2106,"[0.0, 0.0, 0.0, 0.0, 0.0, 0.0, 0.0, 0.0, 0.0, 0.0, 1.0]","In this context , Aristo had the opportunity to bringforth the most basic concepts which were valuable then , but are a part of our daily life , now ."
2107,"[0.0, 0.0, 0.0, 0.0, 0.0, 0.0, 0.0, 0.0, 0.0, 0.0, 1.0]","Considering the technological conditions and the level of the knowledge of humanity , Einstein conceived that in order to step up he should focus on a single subject ."
2108,"[0.0, 0.0, 0.0, 0.0, 0.0, 0.0, 0.0, 0.0, 0.0, 0.0, 1.0]","Because being a member of the 20 - century - old humanity he should learn a subject by heart , not only the main topics related to it but also the very details ."
2109,"[0.0, 0.0, 0.0, 0.0, 0.0, 0.0, 0.0, 0.0, 0.0, 0.0, 1.0]","That is , learning physics is a stepping stone to learn modern or quantum physics ."
2110,"[0.0, 0.0, 0.0, 0.0, 0.0, 0.0, 0.0, 0.0, 0.0, 0.0, 1.0]",The general behaviour of the disciplines of science is supporting this idea .
2111,"[0.0, 0.0, 0.0, 0.0, 0.0, 0.0, 0.0, 0.0, 0.0, 0.0, 1.0]",As the researchers continue and the developments are achieved new disciplines are born from an existing branch of science .
2112,"[0.0, 0.0, 0.0, 0.0, 0.0, 0.0, 0.0, 0.0, 0.0, 0.0, 1.0]","Physics was just physics at all , but as it is understood that there is something more to it , Electronics , Mechanics , Metallurgy etc. began to be considered as different branches ."
2113,"[0.0, 0.0, 0.0, 0.0, 0.0, 0.0, 0.0, 0.0, 0.0, 0.0, 1.0]","To sum up , I should say that I agree with the idea of knowing single subject but being the expert of that field , is far more better than having broad knowledge of many subjects which is identical to being able to talk of many subjects at first but is not able to keep pace with the real experts of that particular subject ."
2114,"[0.0, 0.0, 0.0, 0.0, 0.0, 0.0, 0.0, 0.0, 0.0, 0.0, 1.0]","It should not be disregarded that every effective person in today 's world , whether a politician , an academic person , soldier or a sportsman is specialized in single subject and that is why the people around the world know them ."
2115,"[0.0, 0.0, 1.0, 0.0, 0.0, 0.0, 0.0, 0.0, 0.0, 0.0, 0.0]","Fist , I want to say that I am agree with the idea to travel in group , but not to have a tour guide ."
2116,"[0.0, 0.0, 1.0, 0.0, 0.0, 0.0, 0.0, 0.0, 0.0, 0.0, 0.0]","I think that travel in group is a very good idea because , when you travel with some friends you can increase your ANG spirit ."
2117,"[0.0, 0.0, 1.0, 0.0, 0.0, 0.0, 0.0, 0.0, 0.0, 0.0, 0.0]","In fact , when you do a travel it always happen some bad thing that you do not hope ."
2118,"[0.0, 0.0, 1.0, 0.0, 0.0, 0.0, 0.0, 0.0, 0.0, 0.0, 0.0]",This bad things can increase the partnership of you and your friend .
2119,"[0.0, 0.0, 1.0, 0.0, 0.0, 0.0, 0.0, 0.0, 0.0, 0.0, 0.0]",I have in my head the example of the boys movie .
2120,"[0.0, 0.0, 1.0, 0.0, 0.0, 0.0, 0.0, 0.0, 0.0, 0.0, 0.0]",The boys hockey teams want to have a better team spirit before a big tournament so the team decide to go at < < La Pourvoirie > > and the team also decide to not drink alcohol in this trip .
2121,"[0.0, 0.0, 1.0, 0.0, 0.0, 0.0, 0.0, 0.0, 0.0, 0.0, 0.0]",The < < Pourvoirie > > it on a a very big forest not very far so they have to take a plane .
2122,"[0.0, 0.0, 1.0, 0.0, 0.0, 0.0, 0.0, 0.0, 0.0, 0.0, 0.0]",But the days when tha plane has to come for drop the team at the arena .
2123,"[0.0, 0.0, 1.0, 0.0, 0.0, 0.0, 0.0, 0.0, 0.0, 0.0, 0.0]",The planes is not there .
2124,"[0.0, 0.0, 1.0, 0.0, 0.0, 0.0, 0.0, 0.0, 0.0, 0.0, 0.0]",So the half of the team decide to wall in the forest toward the arena and the other half decide to wait for the plane .
2125,"[0.0, 0.0, 1.0, 0.0, 0.0, 0.0, 0.0, 0.0, 0.0, 0.0, 0.0]",But the guys that go on the forest do not has the good maps and they are lost so they have to work in team .
2126,"[0.0, 0.0, 1.0, 0.0, 0.0, 0.0, 0.0, 0.0, 0.0, 0.0, 0.0]",I think to travel with a tour guide is not a good idea .
2127,"[0.0, 0.0, 1.0, 0.0, 0.0, 0.0, 0.0, 0.0, 0.0, 0.0, 0.0]",Because with the tour guide you a have a very strict schedule .
2128,"[0.0, 0.0, 1.0, 0.0, 0.0, 0.0, 0.0, 0.0, 0.0, 0.0, 0.0]",So if you want to take more time for a thing you destruct all the schedule and after this the rest of the day it bad .
2129,"[0.0, 0.0, 1.0, 0.0, 0.0, 0.0, 0.0, 0.0, 0.0, 0.0, 0.0]","So when you do not have tour guide you can do all that you want , you do not have to respect a schedule ."
2130,"[0.0, 0.0, 1.0, 0.0, 0.0, 0.0, 0.0, 0.0, 0.0, 0.0, 0.0]",But when you do not have tour guide you can lose some good place to see and the tour guide can have an interest approached about he 's city or country .
2131,"[0.0, 0.0, 0.0, 0.0, 0.0, 0.0, 0.0, 0.0, 0.0, 0.0, 1.0]",Nowadays it is considered as a very popular topic that one should have knowledge of many academic subjects or specialize in one topic .
2132,"[0.0, 0.0, 0.0, 0.0, 0.0, 0.0, 0.0, 0.0, 0.0, 0.0, 1.0]",Many people ignores this topic but it is very important for the university students and ones who have an aim to have an academic career .
2133,"[0.0, 0.0, 0.0, 0.0, 0.0, 0.0, 0.0, 0.0, 0.0, 0.0, 1.0]","Opponents of the idea ` having one specific subject ' consider that one should have relative subjects like maths and physics , so when they see an Integral in the middle of a physics lesson , they should avoid the problems with ease ."
2134,"[0.0, 0.0, 0.0, 0.0, 0.0, 0.0, 0.0, 0.0, 0.0, 0.0, 1.0]",Moreover they think that one can earn much money when s/he has two or more subjects .
2135,"[0.0, 0.0, 0.0, 0.0, 0.0, 0.0, 0.0, 0.0, 0.0, 0.0, 1.0]","In addition to that it will ease the communication between student and teacher , when they have many things to talk about ."
2136,"[0.0, 0.0, 0.0, 0.0, 0.0, 0.0, 0.0, 0.0, 0.0, 0.0, 1.0]","Although in first sight it is seen that one should have many academic subjects , it is not like it is seen ."
2137,"[0.0, 0.0, 0.0, 0.0, 0.0, 0.0, 0.0, 0.0, 0.0, 0.0, 1.0]",First of all one should know a lot of things about Maths if she/he is a physician .
2138,"[0.0, 0.0, 0.0, 0.0, 0.0, 0.0, 0.0, 0.0, 0.0, 0.0, 1.0]",So s/he does n't have to make longer his/her study and be also an mathematician .
2139,"[0.0, 0.0, 0.0, 0.0, 0.0, 0.0, 0.0, 0.0, 0.0, 0.0, 1.0]",It will bore the teacher when s/he is young and a university student and s/he can change his/her plan being an academician .
2140,"[0.0, 0.0, 0.0, 0.0, 0.0, 0.0, 0.0, 0.0, 0.0, 0.0, 1.0]",In addition to that it is always considered that one can earn a lot of money when s/he has two or more subjects .
2141,"[0.0, 0.0, 0.0, 0.0, 0.0, 0.0, 0.0, 0.0, 0.0, 0.0, 1.0]",The answer is simple : No !
2142,"[0.0, 0.0, 0.0, 0.0, 0.0, 0.0, 0.0, 0.0, 0.0, 0.0, 1.0]",The academicians are paid by the hours that they teach .
2143,"[0.0, 0.0, 0.0, 0.0, 0.0, 0.0, 0.0, 0.0, 0.0, 0.0, 1.0]",No one pay you much money even if you have ten subjects or one .
2144,"[0.0, 0.0, 0.0, 0.0, 0.0, 0.0, 0.0, 0.0, 0.0, 0.0, 1.0]",The payment is always the same .
2145,"[0.0, 0.0, 0.0, 0.0, 0.0, 0.0, 0.0, 0.0, 0.0, 0.0, 1.0]",Thirdly physicians do n't have to know much about psychology .
2146,"[0.0, 0.0, 0.0, 0.0, 0.0, 0.0, 0.0, 0.0, 0.0, 0.0, 1.0]",Because Thay have no time to spend with another subject for just finding a topic with students to talk about .
2147,"[0.0, 0.0, 0.0, 0.0, 0.0, 0.0, 0.0, 0.0, 0.0, 0.0, 1.0]","If they want to talk about something they can talk about football matches , TV programs etc . ."
2148,"[0.0, 0.0, 0.0, 0.0, 0.0, 0.0, 0.0, 0.0, 0.0, 0.0, 1.0]",At last we should consider that academicians are busy people and they are being waited for the researches and new technologies .
2149,"[0.0, 0.0, 0.0, 0.0, 0.0, 0.0, 0.0, 0.0, 0.0, 0.0, 1.0]",The second subject will reduce the chance of discover the new part of the modern life because Thay wo n't have time and energy to focus on the new researches .
2150,"[0.0, 0.0, 0.0, 0.0, 0.0, 0.0, 0.0, 0.0, 0.0, 0.0, 1.0]","If everyone could do just his/her own job , the world would have been probably different and lovely . ."
2151,"[0.0, 0.0, 0.0, 0.0, 1.0, 0.0, 0.0, 0.0, 0.0, 0.0, 0.0]",`` The ideas and concept tends to create an intellectual '' This proverb held equally good when we talk about learing process involving proper understanding and concepts .
2152,"[0.0, 0.0, 0.0, 0.0, 1.0, 0.0, 0.0, 0.0, 0.0, 0.0, 0.0]","It is not only , holds good for the student alone , but also holds good for each and every individual who are in the process of learing ."
2153,"[0.0, 0.0, 0.0, 0.0, 1.0, 0.0, 0.0, 0.0, 0.0, 0.0, 0.0]","though since the students are building blocks of the future generation , more emphasis should be given to them ."
2154,"[0.0, 0.0, 0.0, 0.0, 1.0, 0.0, 0.0, 0.0, 0.0, 0.0, 0.0]","Besides , learing facts contributes very little in actual learning process ."
2155,"[0.0, 0.0, 0.0, 0.0, 1.0, 0.0, 0.0, 0.0, 0.0, 0.0, 0.0]","The very first point why the students should learn by understanding ideas and concept is that because once the students understand the concept , he/she can easily apply the concept in any field to solve the problem ."
2156,"[0.0, 0.0, 0.0, 0.0, 1.0, 0.0, 0.0, 0.0, 0.0, 0.0, 0.0]",No matter how difficult the problem is .
2157,"[0.0, 0.0, 0.0, 0.0, 1.0, 0.0, 0.0, 0.0, 0.0, 0.0, 0.0]","For instance , in the regular classes of maths and physics , where the subject is occupy with full of formula and facts , it is very difficult to memorise all the formulas and facts stated in the book ."
2158,"[0.0, 0.0, 0.0, 0.0, 1.0, 0.0, 0.0, 0.0, 0.0, 0.0, 0.0]","But if student understands the ideas and concept then he can probably derive many formula by a single standard formula , then , in this case he / she does not need to remember all difficult formulas which will be very exhaustive and time consuming ."
2159,"[0.0, 0.0, 0.0, 0.0, 1.0, 0.0, 0.0, 0.0, 0.0, 0.0, 0.0]","Moreover , if the students only try to know the facts then there is a possibility that their knowledge will be narrow ."
2160,"[0.0, 0.0, 0.0, 0.0, 1.0, 0.0, 0.0, 0.0, 0.0, 0.0, 0.0]",what i been is that when the problem comes which he/she is not aware then it will be very difficult for them to solve the problem because they only know the use of facts in one particular place .
2161,"[0.0, 0.0, 0.0, 0.0, 1.0, 0.0, 0.0, 0.0, 0.0, 0.0, 0.0]","Whereas , if the student has understood the concept and ideas then he / she can solve any of the problem by virtue of the underlying concept involved in that problem ."
2162,"[0.0, 0.0, 0.0, 0.0, 1.0, 0.0, 0.0, 0.0, 0.0, 0.0, 0.0]","On the other hand , learing facts also contributes in learing process unto certain extant ."
2163,"[0.0, 0.0, 0.0, 0.0, 1.0, 0.0, 0.0, 0.0, 0.0, 0.0, 0.0]","for example , in chemistry , until and unless students learn the periodic table , it will be very difficult for them to understand the rest of the inorganic chemistry , Hence , in this case it is imperative for students to learn the facts also ."
2164,"[0.0, 0.0, 0.0, 0.0, 1.0, 0.0, 0.0, 0.0, 0.0, 0.0, 0.0]","To sum up , in majority of the fields , learning ideas and concepts are more beneficial because it gives the solution of a problem all the time ."
2165,"[0.0, 0.0, 0.0, 0.0, 1.0, 0.0, 0.0, 0.0, 0.0, 0.0, 0.0]","Nevertheless , facts are important in fewer condition when compared to learing concept ."
2166,"[0.0, 0.0, 0.0, 0.0, 1.0, 0.0, 0.0, 0.0, 0.0, 0.0, 0.0]",But in general for the good knowledge and proper understanding combination of both would be better choice .
2167,"[0.0, 0.0, 0.0, 0.0, 0.0, 0.0, 0.0, 0.0, 1.0, 0.0, 0.0]","It is a fact that nowadays there are too many cars in developed countries , and they are causing the world 's overpollution , that leads to a worth - worrying greenhouse effect ."
2168,"[0.0, 0.0, 0.0, 0.0, 0.0, 0.0, 0.0, 0.0, 1.0, 0.0, 0.0]","On the one hand , people in north , western countries are getting more and more concerned with this pollution problem , and will try to find different ways to travel and move without the use of cars , such as public transport or walking ."
2169,"[0.0, 0.0, 0.0, 0.0, 0.0, 0.0, 0.0, 0.0, 1.0, 0.0, 0.0]","Besides , wells are running out of petrol , and alternative ethological energies are still expensive and not well developed ."
2170,"[0.0, 0.0, 0.0, 0.0, 0.0, 0.0, 0.0, 0.0, 1.0, 0.0, 0.0]","Scientists and experts have to find out a way to get rid of cars that use gasoline , but researches have not reached the answer yet ."
2171,"[0.0, 0.0, 0.0, 0.0, 0.0, 0.0, 0.0, 0.0, 1.0, 0.0, 0.0]","People need cars , and they will use them as much as th"
2172,"[0.0, 0.0, 0.0, 0.0, 0.0, 0.0, 0.0, 0.0, 1.0, 0.0, 0.0]","On the other hand , developing countries are becoming interested in cars ."
2173,"[0.0, 0.0, 0.0, 0.0, 0.0, 0.0, 0.0, 0.0, 1.0, 0.0, 0.0]","As their economy and technology levels rise , cars enter this formerly vehicle - free lands ."
2174,"[0.0, 0.0, 0.0, 0.0, 0.0, 0.0, 0.0, 0.0, 1.0, 0.0, 0.0]","The average citizen thinks of the need of getting a car , and because he can afford it , he buys one ."
2175,"[0.0, 0.0, 0.0, 0.0, 0.0, 0.0, 0.0, 0.0, 1.0, 0.0, 0.0]","And they do not pay attention to the environment , since they have not information about its problems and , even if they knew about it , they would not be able to have access to any other possibility , maybe because it is too expensive , or maybe because it is out of reach for them ."
2176,"[0.0, 0.0, 0.0, 0.0, 0.0, 0.0, 0.0, 0.0, 1.0, 0.0, 0.0]","All things considered , I do not agree with the statement ."
2177,"[0.0, 0.0, 0.0, 0.0, 0.0, 0.0, 0.0, 0.0, 1.0, 0.0, 0.0]","According to the above mentioned points , as long as no other alternatives are provided to substitute cars , people will keep on using them , for they are truly necessary for every day life ."
2178,"[1.0, 0.0, 0.0, 0.0, 0.0, 0.0, 0.0, 0.0, 0.0, 0.0, 0.0]","I 'm going to have to agree with that statement with most cases around the globe , but the attention that young people give to their communities relies mostly on their culture ."
2179,"[1.0, 0.0, 0.0, 0.0, 0.0, 0.0, 0.0, 0.0, 0.0, 0.0, 0.0]","In the western world , in countries in Europe and North America mostly , the notions of `` duty '' and `` honor '' have almost entirely disappeared from young peoples consciences , parents are not teaching their children to love and defend the communities they 've grow in and there is no mistery about why young people don'y contribute much time , that when children are going to turn into teenagers , then young adults they wo n't give much about what happens in their community ."
2180,"[1.0, 0.0, 0.0, 0.0, 0.0, 0.0, 0.0, 0.0, 0.0, 0.0, 0.0]","Today `` community service '' in the west is a form of punishment for the minors who draw on walls , sell drugs , steel or commit other violations of the law ."
2181,"[1.0, 0.0, 0.0, 0.0, 0.0, 0.0, 0.0, 0.0, 0.0, 0.0, 0.0]","Take for an example the number of young people who would go to a rap a concert where they are encouraged to consume drugs and told to sleep with prostitutes , and compare that number to that of the young volunteers who wanted to help the Catrina or 9/11 victims for example ."
2182,"[1.0, 0.0, 0.0, 0.0, 0.0, 0.0, 0.0, 0.0, 0.0, 0.0, 0.0]","In other parts of the world , or in `` the third world '' as the Westerns call them , young people still care about their communities and countries much more to dirty music , we can see a much different atmosphere ."
2183,"[1.0, 0.0, 0.0, 0.0, 0.0, 0.0, 0.0, 0.0, 0.0, 0.0, 0.0]",Take the last war Israel waged on Lebanon and the countless young men and women who volunteered to help the Red Cross or other humanitarian organisations in order to help the civilian victims who might 've survived the israeli raids .
2184,"[1.0, 0.0, 0.0, 0.0, 0.0, 0.0, 0.0, 0.0, 0.0, 0.0, 0.0]","When you see young ones still helpingthat much their communities , you ca n't say that every where young people do not give enough time to help their communities ."
2185,"[1.0, 0.0, 0.0, 0.0, 0.0, 0.0, 0.0, 0.0, 0.0, 0.0, 0.0]","To conclude , we can say that wether the young ones help their communities enough or not depends primarily on the culture of the concerned country or community ."
2186,"[0.0, 0.0, 0.0, 0.0, 1.0, 0.0, 0.0, 0.0, 0.0, 0.0, 0.0]",Method of studying is always different from student to student .
2187,"[0.0, 0.0, 0.0, 0.0, 1.0, 0.0, 0.0, 0.0, 0.0, 0.0, 0.0]",Many people hold their perspective to understand ideas and concept while other prefer to learn facts .
2188,"[0.0, 0.0, 0.0, 0.0, 1.0, 0.0, 0.0, 0.0, 0.0, 0.0, 0.0]",I too believe that it is more important for student to understand concept and ideas than to learn facts .
2189,"[0.0, 0.0, 0.0, 0.0, 1.0, 0.0, 0.0, 0.0, 0.0, 0.0, 0.0]","The reason , I think this way is because understanding ideas and concept clarity increase the creativity of student and it gives better knowledge for further growth ."
2190,"[0.0, 0.0, 0.0, 0.0, 1.0, 0.0, 0.0, 0.0, 0.0, 0.0, 0.0]",Concept clarity and clear ideas provide better foundation for future education of student .
2191,"[0.0, 0.0, 0.0, 0.0, 1.0, 0.0, 0.0, 0.0, 0.0, 0.0, 0.0]","One reason , I believe that concept clarity and clear ideas give better foundation to a student is because if we understand ideas and concept then we never forget the subject ."
2192,"[0.0, 0.0, 0.0, 0.0, 1.0, 0.0, 0.0, 0.0, 0.0, 0.0, 0.0]","Take my own example , When I was student I always preferred to concept clarity ."
2193,"[0.0, 0.0, 0.0, 0.0, 1.0, 0.0, 0.0, 0.0, 0.0, 0.0, 0.0]",I still remember the concept of Newton 's Laws ; because my physics teacher of grade 10 had my concept clear about this subject .
2194,"[0.0, 0.0, 0.0, 0.0, 1.0, 0.0, 0.0, 0.0, 0.0, 0.0, 0.0]",Therefore it is always better to clear the concept and ideas so that we will never forget the same .
2195,"[0.0, 0.0, 0.0, 0.0, 1.0, 0.0, 0.0, 0.0, 0.0, 0.0, 0.0]","Another reason , I believe that concept clarity and understanding ideas is important is that it increase the creativity of student ."
2196,"[0.0, 0.0, 0.0, 0.0, 1.0, 0.0, 0.0, 0.0, 0.0, 0.0, 0.0]",When we understand the concept of any theory then we feel more innovative to discover some more things .
2197,"[0.0, 0.0, 0.0, 0.0, 1.0, 0.0, 0.0, 0.0, 0.0, 0.0, 0.0]",In fact every scientific discovery was started from different ideas .
2198,"[0.0, 0.0, 0.0, 0.0, 1.0, 0.0, 0.0, 0.0, 0.0, 0.0, 0.0]","For example , When Addison had understand the concept of electron and atom then only he could concluded that electrons can be used to flow electricity ."
2199,"[0.0, 0.0, 0.0, 0.0, 1.0, 0.0, 0.0, 0.0, 0.0, 0.0, 0.0]",This is how understanding concept about atom lead to the discovery of electricity .
2200,"[0.0, 0.0, 0.0, 0.0, 1.0, 0.0, 0.0, 0.0, 0.0, 0.0, 0.0]",All these are not to say that to learn facts are all use less .
2201,"[0.0, 0.0, 0.0, 0.0, 1.0, 0.0, 0.0, 0.0, 0.0, 0.0, 0.0]",Facts are related to generally past which is also important .
2202,"[0.0, 0.0, 0.0, 0.0, 1.0, 0.0, 0.0, 0.0, 0.0, 0.0, 0.0]",But advantages of learning facts can not surpass the advantages of clearing concept and understanding ideas .
