,label,sent
895,"[0.0, 0.0, 0.0, 0.0, 0.0, 0.0, 0.0, 1.0, 0.0, 0.0, 0.0]","Thus , regarding about their worry which air pollution is worst , cars are not decrease in use ."
896,"[0.0, 0.0, 0.0, 0.0, 0.0, 0.0, 0.0, 1.0, 0.0, 0.0, 0.0]","For example , When I went to my grandmother 's home with my family ."
897,"[0.0, 0.0, 0.0, 0.0, 0.0, 0.0, 0.0, 1.0, 0.0, 0.0, 0.0]",My grandmother 's home
898,"[0.0, 0.0, 0.0, 0.0, 0.0, 0.0, 0.0, 1.0, 0.0, 0.0, 0.0]","Also , nowadays most cars use decorating because technology continue development more and more our country ."
899,"[0.0, 0.0, 0.0, 0.0, 0.0, 0.0, 0.0, 1.0, 0.0, 0.0, 0.0]","So , today 's cars have various types and are very pretty and wonderful ."
900,"[0.0, 0.0, 0.0, 0.0, 0.0, 0.0, 0.0, 1.0, 0.0, 0.0, 0.0]",Some people use beautiful cars use decoration .
901,"[0.0, 0.0, 0.0, 0.0, 0.0, 0.0, 0.0, 1.0, 0.0, 0.0, 0.0]","Before deciding which side I will stand , I would like to querry what is defined as successful people ."
902,"[0.0, 0.0, 0.0, 0.0, 0.0, 0.0, 0.0, 1.0, 0.0, 0.0, 0.0]","If successful people mean people who made a big advance in our life , I agree that successful people try new things and take risks ."
903,"[0.0, 0.0, 0.0, 0.0, 0.0, 0.0, 0.0, 1.0, 0.0, 0.0, 0.0]","However , if successful people mean people who live well doing their jobs well , I think successful people are those who only do what they already know how to do well ."
904,"[0.0, 0.0, 0.0, 0.0, 0.0, 0.0, 0.0, 1.0, 0.0, 0.0, 0.0]","First , you should know the history of human 's first exploration of the moon ."
905,"[0.0, 0.0, 0.0, 0.0, 0.0, 0.0, 0.0, 1.0, 0.0, 0.0, 0.0]",I think the people who were involved in that momentous event are those who are successful .
906,"[0.0, 0.0, 0.0, 0.0, 0.0, 0.0, 0.0, 1.0, 0.0, 0.0, 0.0]","Unless did they plan to travel to the moon and enact their plan , we could have made no progress in our knowledge of the universe and our technology in relation to aeronaut ."
907,"[0.0, 0.0, 0.0, 0.0, 0.0, 0.0, 0.0, 1.0, 0.0, 0.0, 0.0]","With respect to human knowledge advance , I believe that successful people are those who try to do what has not been done ."
908,"[0.0, 0.0, 0.0, 0.0, 0.0, 0.0, 0.0, 1.0, 0.0, 0.0, 0.0]","Second , I even can observe how people move towards what they want ."
909,"[0.0, 0.0, 0.0, 0.0, 0.0, 0.0, 0.0, 1.0, 0.0, 0.0, 0.0]","For example , my husband make seemingly unfeasible things possible ."
910,"[0.0, 0.0, 0.0, 0.0, 0.0, 0.0, 0.0, 1.0, 0.0, 0.0, 0.0]","When he faces a barrier , such as dealing , facility unavailities , and job opening , he tries Evey means ."
911,"[0.0, 0.0, 0.0, 0.0, 0.0, 0.0, 0.0, 1.0, 0.0, 0.0, 0.0]",He call to companies that do not announce any joy \ b opening .
912,"[0.0, 0.0, 0.0, 0.0, 0.0, 0.0, 0.0, 1.0, 0.0, 0.0, 0.0]","But , he advertise himself and get a position ."
913,"[0.0, 0.0, 0.0, 0.0, 0.0, 0.0, 0.0, 1.0, 0.0, 0.0, 0.0]","He enjoys his way of life , which seems to make him as a successful person ."
914,"[0.0, 0.0, 0.0, 0.0, 0.0, 0.0, 0.0, 1.0, 0.0, 0.0, 0.0]","However , I also can find people who lives well without a big challenge ."
915,"[0.0, 0.0, 0.0, 0.0, 0.0, 0.0, 0.0, 1.0, 0.0, 0.0, 0.0]","For example , medical doctors seem to live well following well - defined paths ."
916,"[0.0, 0.0, 0.0, 0.0, 0.0, 0.0, 0.0, 1.0, 0.0, 0.0, 0.0]","Although they have to study had in order to get into a medical school , I think they do not have to try new medical procedures ."
917,"[0.0, 0.0, 0.0, 0.0, 0.0, 0.0, 0.0, 1.0, 0.0, 0.0, 0.0]","On the ready - established path , they are considered as successful people ."
918,"[0.0, 0.0, 0.0, 0.0, 0.0, 0.0, 0.0, 1.0, 0.0, 0.0, 0.0]","In sum , it is difficult to devide people into successful and unsuccessful people according to whether they try new things and take risks or not ."
919,"[0.0, 0.0, 0.0, 0.0, 0.0, 0.0, 0.0, 1.0, 0.0, 0.0, 0.0]","Rather than , I think successful people could be defined according to whether individual lives the way of life they value ."
920,"[0.0, 0.0, 0.0, 0.0, 0.0, 0.0, 0.0, 1.0, 0.0, 0.0, 0.0]","If a person who pursues taking a risk lives by trying new opportunities , he would be a successful person ."
921,"[0.0, 0.0, 0.0, 0.0, 0.0, 0.0, 0.0, 1.0, 0.0, 0.0, 0.0]","If a person who pursue a challenge lives in a way that is already established , he would not be considered as a successful person ."
922,"[0.0, 0.0, 1.0, 0.0, 0.0, 0.0, 0.0, 0.0, 0.0, 0.0, 0.0]",I feel certain that it 's better to have broad knowledge of many academic subjects than to specialize in one specific subject .
923,"[0.0, 0.0, 1.0, 0.0, 0.0, 0.0, 0.0, 0.0, 0.0, 0.0, 0.0]","First of all , I consider having knowledges of various subjects could be a valuable advantage for general culture ."
924,"[0.0, 0.0, 1.0, 0.0, 0.0, 0.0, 0.0, 0.0, 0.0, 0.0, 0.0]",I really think that is important to be polyvalent and to be interested in different subjects .
925,"[0.0, 0.0, 1.0, 0.0, 0.0, 0.0, 0.0, 0.0, 0.0, 0.0, 0.0]","However , you should be aware that all informations are not right ."
926,"[0.0, 0.0, 1.0, 0.0, 0.0, 0.0, 0.0, 0.0, 0.0, 0.0, 0.0]",Consequently you should n't be lost in a ' `` vast ocean of information '' .
927,"[0.0, 0.0, 1.0, 0.0, 0.0, 0.0, 0.0, 0.0, 0.0, 0.0, 0.0]","Furthermore , you are not limited , that means you are able to talk with different persons about various subjects whereas a person who is specialized in one specific subject are not ."
928,"[0.0, 0.0, 1.0, 0.0, 0.0, 0.0, 0.0, 0.0, 0.0, 0.0, 0.0]","When you are speaking with friends for instance , you can take part at the conversation and express your opinion about the topic since you have studied several points about it ."
929,"[0.0, 0.0, 1.0, 0.0, 0.0, 0.0, 0.0, 0.0, 0.0, 0.0, 0.0]","In a nutshell , although being specialized in one particular subject do seem to offer certain advantages like depth knowledges , they are outweighed by the advantages of acquiring knowledge of several topics ."
930,"[0.0, 0.0, 0.0, 0.0, 1.0, 0.0, 0.0, 0.0, 0.0, 0.0, 0.0]",I think that the over the time period the number of cars being used today will surely decline .
931,"[0.0, 0.0, 0.0, 0.0, 1.0, 0.0, 0.0, 0.0, 0.0, 0.0, 0.0]","This is because of the increasing concerns over pollution , shrinking fossil fuel bases , availability of better ways to commute , cultural shift in dependency or association with cars and increased traffic ."
932,"[0.0, 0.0, 0.0, 0.0, 1.0, 0.0, 0.0, 0.0, 0.0, 0.0, 0.0]",All these factors are now evident to anyone who uses or sees cars everyday .
933,"[0.0, 0.0, 0.0, 0.0, 1.0, 0.0, 0.0, 0.0, 0.0, 0.0, 0.0]","Pollution has emerged to be a major concern over the period of time , and now , in comparison to older times when cars were considered to be a symbol of freedom , people have started to see them as major causes of pollution ."
934,"[0.0, 0.0, 0.0, 0.0, 1.0, 0.0, 0.0, 0.0, 0.0, 0.0, 0.0]","Air pollution is done because of the usage of the common fuel , gasoline , even though we have modified the structure of gasoline to do less harm , e.g. high octane fuel , and have even equipped the cars with better technology , multiple stroke engines etc , still the safety limits are being pressed to edge , and we have experienced the damage ."
935,"[0.0, 0.0, 0.0, 0.0, 1.0, 0.0, 0.0, 0.0, 0.0, 0.0, 0.0]",e.g. depletion of protective ozone layer and increased respiratory diseases among urban population .
936,"[0.0, 0.0, 0.0, 0.0, 1.0, 0.0, 0.0, 0.0, 0.0, 0.0, 0.0]","Next , the crude oil sources used to supply fuel for cars have been continuously decreasing and have reached at such an alarming low level that scientist have cautioned to start looking for alternative fuels , which are either not that efficient or are not economically as viable as gasoline ."
937,"[0.0, 0.0, 0.0, 0.0, 1.0, 0.0, 0.0, 0.0, 0.0, 0.0, 0.0]","Also , over the period of time , people have devised better ways to commute like bullet trains , people in Japan commute almost 500KM each day to work , which was not possible with cars ."
938,"[0.0, 0.0, 0.0, 0.0, 1.0, 0.0, 0.0, 0.0, 0.0, 0.0, 0.0]","Also , in other major cities alternatives means of transport such as metro rails and high capacity buses are experimented and are well received by people ."
939,"[0.0, 0.0, 0.0, 0.0, 1.0, 0.0, 0.0, 0.0, 0.0, 0.0, 0.0]","Moreover , these days we are moving away from the need that gave rise to this effective means of commutation such as going to work , companies are experimenting better ways like work from home options which do n't require employees to come to office , another example is reaching out to facilities such as convenient stores , now you can have everything delivered to your home on one phone call ."
940,"[0.0, 0.0, 0.0, 0.0, 1.0, 0.0, 0.0, 0.0, 0.0, 0.0, 0.0]",This will eventually wash away the need of cars .
941,"[0.0, 0.0, 0.0, 0.0, 1.0, 0.0, 0.0, 0.0, 0.0, 0.0, 0.0]",Increased traffic and its effects like accidents are bothering people so much these days .
942,"[0.0, 0.0, 0.0, 0.0, 1.0, 0.0, 0.0, 0.0, 0.0, 0.0, 0.0]","They are more concerned about the time lost in the traffic and their safety , after all who will want an everyday commutation to office or school to become an adventure ride ."
943,"[0.0, 0.0, 0.0, 0.0, 1.0, 0.0, 0.0, 0.0, 0.0, 0.0, 0.0]","So to summarize , with the increasing awareness and decrease in the causes that lead to the use of this means of transport , coupled with environmental and health factors the car will eventually become an old means of commutation ."
944,"[0.0, 0.0, 0.0, 0.0, 1.0, 0.0, 0.0, 0.0, 0.0, 0.0, 0.0]",I Totally disagree with the statement given .
945,"[0.0, 0.0, 0.0, 0.0, 1.0, 0.0, 0.0, 0.0, 0.0, 0.0, 0.0]","Rather would like to start the passage with a line rightly said that we have two childhood , one when we are born and the other when we are old ."
946,"[0.0, 0.0, 0.0, 0.0, 1.0, 0.0, 0.0, 0.0, 0.0, 0.0, 0.0]","In my opinion childhood is the best time of our life , which again pop up when we are old ."
947,"[0.0, 0.0, 0.0, 0.0, 1.0, 0.0, 0.0, 0.0, 0.0, 0.0, 0.0]","this is the association that i would like to make with this statement , as this is the first thing that came to my mind after reading the statement ."
948,"[0.0, 0.0, 0.0, 0.0, 1.0, 0.0, 0.0, 0.0, 0.0, 0.0, 0.0]","when a person is young , he is more active , adventurous , enthusiastic about life ."
949,"[0.0, 0.0, 0.0, 0.0, 1.0, 0.0, 0.0, 0.0, 0.0, 0.0, 0.0]",probably for the reason that he is physically fit and can take a walk in the nature without thinking twice about it .
950,"[0.0, 0.0, 0.0, 0.0, 1.0, 0.0, 0.0, 0.0, 0.0, 0.0, 0.0]",youngsters enjoy the late night party and can manage the cocktails .
951,"[0.0, 0.0, 0.0, 0.0, 1.0, 0.0, 0.0, 0.0, 0.0, 0.0, 0.0]","but what about the stress that they have to undergo , the stress related not only for there position in life but fight that they undergo for their ambition ."
952,"[0.0, 0.0, 0.0, 0.0, 1.0, 0.0, 0.0, 0.0, 0.0, 0.0, 0.0]",the fight to rise up .
953,"[0.0, 0.0, 0.0, 0.0, 1.0, 0.0, 0.0, 0.0, 0.0, 0.0, 0.0]",the fight for making correct decision 's in life .
954,"[0.0, 0.0, 0.0, 0.0, 1.0, 0.0, 0.0, 0.0, 0.0, 0.0, 0.0]",its a great responsibility for a young person to live a good and happy life In contrast the old people they are all through with the feeling of anxiety or the fight for thir own rights .
955,"[0.0, 0.0, 0.0, 0.0, 1.0, 0.0, 0.0, 0.0, 0.0, 0.0, 0.0]",they again are babies who are looked after for .
956,"[0.0, 0.0, 0.0, 0.0, 1.0, 0.0, 0.0, 0.0, 0.0, 0.0, 0.0]",they have almost done all the thing they wanted in life .
957,"[0.0, 0.0, 0.0, 0.0, 1.0, 0.0, 0.0, 0.0, 0.0, 0.0, 0.0]","they can travel , go to places or even feel free to express themself , and nobody would mind it ."
958,"[0.0, 0.0, 0.0, 0.0, 1.0, 0.0, 0.0, 0.0, 0.0, 0.0, 0.0]","though it happens that majority of old people suffer with health problems , but then no one is perfect ."
959,"[0.0, 0.0, 0.0, 0.0, 1.0, 0.0, 0.0, 0.0, 0.0, 0.0, 0.0]","both have there bad and good aspects but i would always prefer the one supporting the older generations because i have seen at my home - set  -  up , the way they have been treated and i kind off like it ."
960,"[0.0, 0.0, 0.0, 0.0, 1.0, 0.0, 0.0, 0.0, 0.0, 0.0, 0.0]","so like to conclude by saying that it is a very personal view unlikes and dislikes and i would support the latter , as it is the one which is more mentally stable ."
961,"[0.0, 0.0, 0.0, 1.0, 0.0, 0.0, 0.0, 0.0, 0.0, 0.0, 0.0]",I absolutely agree with the statement that advertisements promise more than they actually can .
962,"[0.0, 0.0, 0.0, 1.0, 0.0, 0.0, 0.0, 0.0, 0.0, 0.0, 0.0]","If you go to a store with having in mind what you are going to buy , you usually do not pay much attention to other things while you are going through the store ."
963,"[0.0, 0.0, 0.0, 1.0, 0.0, 0.0, 0.0, 0.0, 0.0, 0.0, 0.0]",You finally arrived in the section where your product is to be find and you are just about to grab it when a huge commercial sign for the same product but from a different company catches your eye .
964,"[0.0, 0.0, 0.0, 1.0, 0.0, 0.0, 0.0, 0.0, 0.0, 0.0, 0.0]","You buy it , try it and you come to the conclusion that it was not worth its money at all ."
965,"[0.0, 0.0, 0.0, 1.0, 0.0, 0.0, 0.0, 0.0, 0.0, 0.0, 0.0]",`` It looked so colorful and its positive references from other users convinced me . ''
966,"[0.0, 0.0, 0.0, 1.0, 0.0, 0.0, 0.0, 0.0, 0.0, 0.0, 0.0]",That is one of the answers people respond after they were asked why they did not stay with the product they are used to use .
967,"[0.0, 0.0, 0.0, 1.0, 0.0, 0.0, 0.0, 0.0, 0.0, 0.0, 0.0]",A lot of times companies try to provide their customers with as much fake information about a certain product as they can .
968,"[0.0, 0.0, 0.0, 1.0, 0.0, 0.0, 0.0, 0.0, 0.0, 0.0, 0.0]",That is just the way they get all the money .
969,"[0.0, 0.0, 0.0, 1.0, 0.0, 0.0, 0.0, 0.0, 0.0, 0.0, 0.0]",Imagine an advertisement of a microwave would list all its disadvantages next to its advantages .
970,"[0.0, 0.0, 0.0, 1.0, 0.0, 0.0, 0.0, 0.0, 0.0, 0.0, 0.0]",Would people buy it ?
971,"[0.0, 0.0, 0.0, 1.0, 0.0, 0.0, 0.0, 0.0, 0.0, 0.0, 0.0]",No !
972,"[0.0, 0.0, 0.0, 1.0, 0.0, 0.0, 0.0, 0.0, 0.0, 0.0, 0.0]","Companies want to make their product to look better next to all the others which are on the market but people are always looking for the perfect thing whatever it may be and that is why they , the customers will always do the mistake and buy things which are"
973,"[0.0, 0.0, 0.0, 1.0, 0.0, 0.0, 0.0, 0.0, 0.0, 0.0, 0.0]",It is often expressed either explicitly or implicitly that young people enjoy their life more than old people do .
974,"[0.0, 0.0, 0.0, 1.0, 0.0, 0.0, 0.0, 0.0, 0.0, 0.0, 0.0]","In my opinion , this is the wrong approach to this issue ."
975,"[0.0, 0.0, 0.0, 1.0, 0.0, 0.0, 0.0, 0.0, 0.0, 0.0, 0.0]",Let me first collect several similarities between those two groups .
976,"[0.0, 0.0, 0.0, 1.0, 0.0, 0.0, 0.0, 0.0, 0.0, 0.0, 0.0]",Both young people and retired people do usually not work or at least they do not have to work to make a living ( this if of course only valid for industrialized nations ) .
977,"[0.0, 0.0, 0.0, 1.0, 0.0, 0.0, 0.0, 0.0, 0.0, 0.0, 0.0]","Therefore , they are left with considerable amounts of leisure time at their disposal ."
978,"[0.0, 0.0, 0.0, 1.0, 0.0, 0.0, 0.0, 0.0, 0.0, 0.0, 0.0]",Why should older people not be able to enjoy this time to the same extent as young people ?
979,"[0.0, 0.0, 0.0, 1.0, 0.0, 0.0, 0.0, 0.0, 0.0, 0.0, 0.0]",They only choose to spend that time differently .
980,"[0.0, 0.0, 0.0, 1.0, 0.0, 0.0, 0.0, 0.0, 0.0, 0.0, 0.0]","Old people might not enjoy snowboarding , volleyball or going out as much as young people do ."
981,"[0.0, 0.0, 0.0, 1.0, 0.0, 0.0, 0.0, 0.0, 0.0, 0.0, 0.0]","But old people might enjoy going to the theater , make a sea cruise or just meet with friends as much or even a lot more than young people do ."
982,"[0.0, 0.0, 0.0, 1.0, 0.0, 0.0, 0.0, 0.0, 0.0, 0.0, 0.0]",Both groups enjoy their lives  -  but they tend to have differences concerning what they regard as enjoyable and worthwhile .
983,"[0.0, 0.0, 0.0, 1.0, 0.0, 0.0, 0.0, 0.0, 0.0, 0.0, 0.0]","Also , such a holistic approach does not dignify a human being 's existence as an individual ."
984,"[0.0, 0.0, 0.0, 1.0, 0.0, 0.0, 0.0, 0.0, 0.0, 0.0, 0.0]",Saying that `` young people '' or `` old people '' as a whole enjoy their lives much or less than the other group would be a crude generalization .
985,"[0.0, 0.0, 0.0, 1.0, 0.0, 0.0, 0.0, 0.0, 0.0, 0.0, 0.0]","Of course , there are miserable , complaining old people who obviously do not enjoy their lives ."
986,"[0.0, 0.0, 0.0, 1.0, 0.0, 0.0, 0.0, 0.0, 0.0, 0.0, 0.0]",But take a closer look and you will find that it is not hard to find very similar individuals among young people .
987,"[0.0, 0.0, 0.0, 1.0, 0.0, 0.0, 0.0, 0.0, 0.0, 0.0, 0.0]","The other way around : Of course , many young people like going out , having a good time with friends and enjoying themselves ."
988,"[0.0, 0.0, 0.0, 1.0, 0.0, 0.0, 0.0, 0.0, 0.0, 0.0, 0.0]",But you will have no difficulty finding a real party animal among old people if you really try to .
989,"[0.0, 0.0, 0.0, 1.0, 0.0, 0.0, 0.0, 0.0, 0.0, 0.0, 0.0]","Judging people by their outer appearance , and age is part of that , does not take their personality , their preferences and their attitude into consideration ."
990,"[0.0, 0.0, 0.0, 1.0, 0.0, 0.0, 0.0, 0.0, 0.0, 0.0, 0.0]","If you do so , you are ignoring an important part of a human being ."
991,"[0.0, 0.0, 0.0, 1.0, 0.0, 0.0, 0.0, 0.0, 0.0, 0.0, 0.0]","Because of the given reasons , I disagree with the statement and I think older people can enjoy their life as much as old people do ."
992,"[0.0, 0.0, 0.0, 1.0, 0.0, 0.0, 0.0, 0.0, 0.0, 0.0, 0.0]","Perhaps not in the same way , perhaps not always as visible ( and sometimes offensive ) as young people ."
993,"[0.0, 0.0, 0.0, 1.0, 0.0, 0.0, 0.0, 0.0, 0.0, 0.0, 0.0]",But they certainly do .
994,"[0.0, 0.0, 0.0, 0.0, 0.0, 0.0, 0.0, 0.0, 1.0, 0.0, 0.0]",LEARNING IDEAS FOR UNDERSTANDING FACTS
995,"[0.0, 0.0, 0.0, 0.0, 0.0, 0.0, 0.0, 0.0, 1.0, 0.0, 0.0]","When students first start a course , they want to know what the methodology of the class is going to be ."
996,"[0.0, 0.0, 0.0, 0.0, 0.0, 0.0, 0.0, 0.0, 1.0, 0.0, 0.0]",Students are interested in knowing the curriculum and the course description .
997,"[0.0, 0.0, 0.0, 0.0, 0.0, 0.0, 0.0, 0.0, 1.0, 0.0, 0.0]","Once they know all of these details , the teacher helps them reach the proposed goals ."
998,"[0.0, 0.0, 0.0, 0.0, 0.0, 0.0, 0.0, 0.0, 1.0, 0.0, 0.0]","Every course a student attends , exposes him/her to learn facts and to understand ideas and concepts ."
999,"[0.0, 0.0, 0.0, 0.0, 0.0, 0.0, 0.0, 0.0, 1.0, 0.0, 0.0]","However , for students is more important understanding ideas and concepts than learning a certain fact ."
1000,"[0.0, 0.0, 0.0, 0.0, 0.0, 0.0, 0.0, 0.0, 1.0, 0.0, 0.0]","Nowadays , there is an approach to teaching pedagogy called learning for understanding ."
1001,"[0.0, 0.0, 0.0, 0.0, 0.0, 0.0, 0.0, 0.0, 1.0, 0.0, 0.0]","This approach , consists in acquiring knowledge through internalizing ideas and concepts ."
1002,"[0.0, 0.0, 0.0, 0.0, 0.0, 0.0, 0.0, 0.0, 1.0, 0.0, 0.0]","In other words , the learning for understanding approach , stands that once a student is able to understand a concept or and idea , he will easily learn the facts that support it ."
1003,"[0.0, 0.0, 0.0, 0.0, 0.0, 0.0, 0.0, 0.0, 1.0, 0.0, 0.0]","Although this approach is not directly exposed to the students , they unconsciously prefer to learn facts by understanding the concepts and ideas on which it is founded ."
1004,"[0.0, 0.0, 0.0, 0.0, 0.0, 0.0, 0.0, 0.0, 1.0, 0.0, 0.0]","A student , finds it more interesting to discuss , to explore or simply to inquire on a theme ."
1005,"[0.0, 0.0, 0.0, 0.0, 0.0, 0.0, 0.0, 0.0, 1.0, 0.0, 0.0]","Therefore , once they have a reason to research , they start to inquire ."
1006,"[0.0, 0.0, 0.0, 0.0, 0.0, 0.0, 0.0, 0.0, 1.0, 0.0, 0.0]","In this way , students are able to learn from details , conjectures , opinions , concepts and ideas to be capable to reach the facts that support the investigation ."
1007,"[0.0, 0.0, 0.0, 0.0, 0.0, 0.0, 0.0, 0.0, 1.0, 0.0, 0.0]",This is a kind of inductive method to acquire knowledge .
1008,"[0.0, 0.0, 0.0, 0.0, 0.0, 0.0, 0.0, 0.0, 1.0, 0.0, 0.0]","It can be boring for a student to start with theoretical facts just to discover new ideas , because the student will be first exposed to a list of theoretical concepts that may demotivate his learning process ."
1009,"[0.0, 0.0, 0.0, 0.0, 0.0, 0.0, 0.0, 0.0, 1.0, 0.0, 0.0]","On the contrary , if the student is guided to an inquiry , he will be interested in questioning , exploring , debating and understanding facts ."
1010,"[0.0, 0.0, 0.0, 0.0, 0.0, 0.0, 0.0, 0.0, 1.0, 0.0, 0.0]","Finally , the process of learning should captures a students ' attention with any kind of motivation , and what really motivates students is to understand ideas and concepts rather than learn a list of facts ."
1011,"[0.0, 0.0, 0.0, 0.0, 0.0, 0.0, 0.0, 0.0, 1.0, 0.0, 0.0]",And this conclusion has to become a fact to keep in mind because this new approach can encourage teachers to change their pedagogic ass .
1012,"[0.0, 1.0, 0.0, 0.0, 0.0, 0.0, 0.0, 0.0, 0.0, 0.0, 0.0]",People always discuss that which one is more important between understanding ideas or concepts and learning fact .
1013,"[0.0, 1.0, 0.0, 0.0, 0.0, 0.0, 0.0, 0.0, 0.0, 0.0, 0.0]","In my opinion , make students learn fact is more useful and helpful than just make them understand the concepts and ideas ."
1014,"[0.0, 1.0, 0.0, 0.0, 0.0, 0.0, 0.0, 0.0, 0.0, 0.0, 0.0]","First of all , if students just understand the ideas and the concepts then when they face the problem in the real world they will not know how to solve it ."
1015,"[0.0, 1.0, 0.0, 0.0, 0.0, 0.0, 0.0, 0.0, 0.0, 0.0, 0.0]","The propose of people learn knowledge is they want to study how to use these information to solve the problem in the society , so master the skills to face and deal with the problem that they have is the most important Rask ."
1016,"[0.0, 1.0, 0.0, 0.0, 0.0, 0.0, 0.0, 0.0, 0.0, 0.0, 0.0]","Secondly , let the student learn facts through the practice can make them more clever and give them much important information ."
1017,"[0.0, 1.0, 0.0, 0.0, 0.0, 0.0, 0.0, 0.0, 0.0, 0.0, 0.0]",Through their experiences they can learn many thing that they can not study in the classroom .
1018,"[0.0, 1.0, 0.0, 0.0, 0.0, 0.0, 0.0, 0.0, 0.0, 0.0, 0.0]",These useful information and experiences can teach them us Thier own way to solve the difficult problem and make them become more wise .
1019,"[0.0, 1.0, 0.0, 0.0, 0.0, 0.0, 0.0, 0.0, 0.0, 0.0, 0.0]","Thirdly , if people can understand how to face the fact then they will have a better relationship with other people and the whole society ."
1020,"[0.0, 1.0, 0.0, 0.0, 0.0, 0.0, 0.0, 0.0, 0.0, 0.0, 0.0]","they will use a suitable way to consider their life , and do a better choice ."
1021,"[0.0, 1.0, 0.0, 0.0, 0.0, 0.0, 0.0, 0.0, 0.0, 0.0, 0.0]",The connection between single person and the whole society also will become better .
1022,"[0.0, 1.0, 0.0, 0.0, 0.0, 0.0, 0.0, 0.0, 0.0, 0.0, 0.0]","People live in a complex real world all the time , we will meet many different people and many difficult problem , but if we can understand the fact completely and know how to use the right way to solve them , then we can get a better life ."
1023,"[0.0, 1.0, 0.0, 0.0, 0.0, 0.0, 0.0, 0.0, 0.0, 0.0, 0.0]","Because of these reasons , learning how to face the facts become a so important thing in people 's lives , if we can learn and understand facts but not just know the concepts and ideas ."
1024,"[1.0, 0.0, 0.0, 0.0, 0.0, 0.0, 0.0, 0.0, 0.0, 0.0, 0.0]",The travel is in a group led by atour guideThat is good thing .
1025,"[1.0, 0.0, 0.0, 0.0, 0.0, 0.0, 0.0, 0.0, 0.0, 0.0, 0.0]","For many people and i , one of them it is good ."
1026,"[1.0, 0.0, 0.0, 0.0, 0.0, 0.0, 0.0, 0.0, 0.0, 0.0, 0.0]",In my opinion i have many reason to travel is in group by the atour guide .
1027,"[1.0, 0.0, 0.0, 0.0, 0.0, 0.0, 0.0, 0.0, 0.0, 0.0, 0.0]",One of these reason it if i travel with many people that means many different head to visit different places .
1028,"[1.0, 0.0, 0.0, 0.0, 0.0, 0.0, 0.0, 0.0, 0.0, 0.0, 0.0]",Second reason it is if i go with group we need somebody to explain for us about new things which we can see it .
1029,"[1.0, 0.0, 0.0, 0.0, 0.0, 0.0, 0.0, 0.0, 0.0, 0.0, 0.0]",Many times different opinion between people make big problem .
1030,"[1.0, 0.0, 0.0, 0.0, 0.0, 0.0, 0.0, 0.0, 0.0, 0.0, 0.0]",So for nice trip wonderful trit we need leader .
1031,"[1.0, 0.0, 0.0, 0.0, 0.0, 0.0, 0.0, 0.0, 0.0, 0.0, 0.0]","forexample , last summer i went to visit old city in my country ."
1032,"[1.0, 0.0, 0.0, 0.0, 0.0, 0.0, 0.0, 0.0, 0.0, 0.0, 0.0]",This city had long hostry .
1033,"[1.0, 0.0, 0.0, 0.0, 0.0, 0.0, 0.0, 0.0, 0.0, 0.0, 0.0]",It is amazing city .
1034,"[1.0, 0.0, 0.0, 0.0, 0.0, 0.0, 0.0, 0.0, 0.0, 0.0, 0.0]",I and my friend desand to get atour guide and it was perfect Eada .
1035,"[1.0, 0.0, 0.0, 0.0, 0.0, 0.0, 0.0, 0.0, 0.0, 0.0, 0.0]",We go to visit all the old places and we got clot of information about this city .
1036,"[1.0, 0.0, 0.0, 0.0, 0.0, 0.0, 0.0, 0.0, 0.0, 0.0, 0.0]",this city called Adall .
1037,"[1.0, 0.0, 0.0, 0.0, 0.0, 0.0, 0.0, 0.0, 0.0, 0.0, 0.0]",The atour guide who went with us is very friendly person .
1038,"[1.0, 0.0, 0.0, 0.0, 0.0, 0.0, 0.0, 0.0, 0.0, 0.0, 0.0]",He showed us many interesting thins .
1039,"[1.0, 0.0, 0.0, 0.0, 0.0, 0.0, 0.0, 0.0, 0.0, 0.0, 0.0]",He helped us to understand what the big picture about Adall .
1040,"[1.0, 0.0, 0.0, 0.0, 0.0, 0.0, 0.0, 0.0, 0.0, 0.0, 0.0]",We can consider the lost or the read from the lost strong reason to get atour guide .
1041,"[1.0, 0.0, 0.0, 0.0, 0.0, 0.0, 0.0, 0.0, 0.0, 0.0, 0.0]",He can make the trip easy and more save .
